q,ticker,dt,prep_remarks,QnA
2022-Q2,AMSWA,2021-11-18 17:00:00,"prepared remarks:
operator
good day, everyone, and welcome to today's second quarter fiscal year 2022 financial results. at this time, all participants are in a listen-only mode. later, you will have the opportunity to ask questions during the question-and-answer session. [operator instructions] please note this call may be recorded, and i will be standing by should you need any assistance.
it is now my pleasure to turn the conference over to your chief financial officer for american software, vincent klinges. please go ahead.
vince klinges -- chief financial officer
thank you, chloe, and good afternoon, everyone, and welcome to american software's second quarter of fiscal 2022 earnings call. on the call with me is allan dow, president and ceo of american software. allan will provide some opening remarks, and then i will review the numbers, but first, our safe harbor statement. this conference call may contain forward-looking statements, including statements regarding, among other things, our business strategy and growth strategy.
any such forward-looking statements speak only as of this date. these forward-looking statements are based largely on our expectations and are subject to a number of risks and uncertainties, some of which cannot be predicted or quantified and are beyond our control. future developments and actual results could differ materially from those set forth in, contemplated by or underlying the forward-looking statements. there are a number of factors that could cause actual results to differ materially from those anticipated by statements made on this call.
such factors include, but are not limited to, changes and uncertainty in general economic conditions, the growth rate of the market for our products and services, the timely availability and market acceptance of these products and services and the effect of competitive products and pricing and other competitive pressures and the irregular and unpredictable pattern of revenues. in light of these risks and uncertainties, there can be no assurance that the forward-looking information will prove to be accurate. at this time, i will turn the call over to allan for our opening remarks. 
allan dow -- president and chief executive officer
thank you, vince. with the first half of our fiscal year behind us, i'm pleased to report that we have achieved double-digit revenue growth in our supply chain management segment each of the past two quarters. and in the second quarter, our total revenue growth also returned to the double digits. our strong top-line performance was accompanied by significant expansion in our adjusted ebitda margin, which is now approaching the levels we last saw when we had more material contribution from license fees.
although our services revenue may cause some variation in any given quarter, we believe our recent growth and margin profile will increasingly be the norm, as we continue to scale our cloud business. looking back on this past quarter, we exited summer and with the pandemic starting to ease, the transition back to the in-person activities began to accelerate. however, with the fragmented work environments, business uncertainty and the frenzied activities our customers are engaged in to address their supply chain issues, especially with the holiday period upon us, we experienced delays in the completion of several contracts. we have since secured one of the more significant opportunities, and we remain actively engaged in several others, which should come to conclusion soon.
overall, our pipeline continues to increase, driven by the transformational projects required to enable enterprises to holistically manage their supply chains in a sustainable and economically resilient way. although the timing of closing these contracts is a little less predictable due to longer approval processes and the relative scarcity of customer resources required to initiate projects, we remain confident that between a larger opportunity set and improved execution, we are poised for a strong second half. in regard to our second quarter results, i'm pleased to announce that we extended our post pandemic year-over-year improvements on all measures. with increased rpo and lower churn than we were experiencing a year ago, we continued to build our acv and services backlogs.
we continue to focus on serving existing customers, delivering on our implementation commitments, and bringing new companies into our customer community, and we are doing it all more efficiently than ever before. with the post summer rebound in consulting services, we were on plan or slightly ahead across all revenue and margin areas. we are seeing a continued increase in our services backlog and are relying more and more on our si partners to assist in the delivery. the third quarter is always a challenge with extended downtime for the holidays.
however, we anticipate continued year-over-year growth and margin expansion in the supply chain consulting services business. we're also pleased to see the continued growth in our recurring revenue stream of cloud services and maintenance, which now represents approximately 63% of total revenues, compared to 62% in the same period last year. this was driven by the 43% increase in cloud services acv we saw in the second quarter when compared to last year's second quarter. with the increase in new subscription contracts and a return to the more traditional stability of our cloud and on-prem customer community, we expect to see the recurring revenue as a percent of total revenue continue to rise.
during the second quarter, we welcomed five new customers and completed subscription or license fee transactions in six countries, reflecting our strong global presence. in summary, we're pleased with the second quarter results and expect to extend the performance improvements of our financial model through the second half of the fiscal year. we remain intently focused on executing against our growing pipeline and look forward to reporting our progress next quarter. at this time, i'll turn the call over to vince, who will provide the details on our financial results.
vince klinges -- chief financial officer
thank you, allan. for the second quarter of fiscal '22, total revenues were $31.2 million, and that's an increase of 12% from 27.9% in the same period last year. the big driver of that is subscription fees, which increased 49% year over year to $10.4 million, while license revenue was $0.8 million, compared to $0.5 million the same period last year. our cloud services annual contract value, or acv, increased 44% to $42.5 million versus $29.6 million a year ago.
while we added $1.6 million in net new acv during the quarter, we were short of our internal target as a couple of large deals were expected to close -- that were expected to close were delayed. as allan mentioned, one of those has since closed, providing a nice start to q3. over 40% of our net new acv in the second quarter was from new customers. we added five new customers in the second quarter and bringing us to a total of 10 year to date.
looking at professional services, that increased 5% to $10.8 million from $10.2 million a year ago. our year-over-year increase reflects a 4% increase in the proven method, our it consulting business unit, and that was due to timing of project work and a 6% increase in our supply chain business unit. and our backlog of supply chain implementations increased significantly due to the increase in acv bookings in recent quarters. so, we anticipate continued year-over-year growth in our services during the remaining quarters of fiscal '22.
our maintenance revenues declined 9% year over year to $9.3 million, which includes a combination of cancellations and cloud conversions, reflecting a normal fall off rate this quarter. our total recurring revenues comprised of subscription and maintenance fees represented 63% of our total revenues in the second quarter, and that's up from 62% in the same period last year. our gross margin was 59% for the current period versus 53% in the same period last year. our subscription fee margin increased to 67%, compared to 58% in the prior-year period, and that's primarily due to increase in subscription revenue and lower amortization of cap software expense.
excluding the noncash amortization of cap software expense of $690,000 in the second quarter, our subscription gross margin would have been 74% versus 71% in the same period last year. and the amortization of cap software was $921,000 in the prior-year period. our license fee margin was 75%, compared to a negative 23% in the same period last year, and that's due to lower costs, such as amortization expense of $258,000 and amortization of cap software expense of $174,000 and var agent commissions of $61,000. services margin increased to 31% from 26% last year, and that's due to -- primarily due to a mix of revenue from higher-margin supply chain business unit and better utilization of the supply chain staff.
maintenance margin was 81% for both the current period and prior-year period. gross r&d expenses were 14% of total revenues for the current-year period, compared to 16% in the same period last year. we are in a transition period with our r&d in preparation for increasing the gross r&d spend in future periods to sustain spend as a percentage of supply chain revenue in this range. sales and marketing expenses were 19% for both the current and prior-year period.
g&a expenses were 18% of total revenues, compared to 16% last year, primarily due to higher variable compensation expense given our strong revenue and adjusted ebitda performance throughout the first half of the year. so, on a gaap basis, our operating income increased 326% to $2.7 million for this quarter, compared to $0.6 million in the same period a year ago. net income increased 379% to $3.3 million or earnings per diluted share of $0.10, compared to net income of $0.7 million or $0.02 earnings per diluted share last year. on an adjusted basis, which excludes noncash amortization of intangible expense related to acquisitions and stock-based compensation expense, adjusted operating income increased 137% to $3.8 million, compared to $1.6 million in the same period last year.
adjusted ebitda increased 70% to $4.8 million from $2.8 million in the same period last year, and adjusted net income increased 173% to $4.2 million or adjusted earnings per diluted share of $0.12 for the second quarter, and that compares to adjusted net income of $1.5 million or adjusted earnings diluted share of $0.05 in the same period last year. international revenues this quarter were approximately 15% of total revenues for the current and prior-year periods. taking a look at the numbers year to date, total revenues increased 10% year over year to $60.5 million, and that's primarily due to a 51% increase in subscription fees to $20.1 million, a 5% increase in license fees and a 1% increase in services, partially offset by a 9% decline in maintenance revenues. adjusted operating income year to date was $6.4 million, representing an operating margin of 11%, compared to $3.3 million or 6% margin for the same period last year.
adjusted ebitda was $8.4 million versus $5.9 million in the year-ago period, and adjusted net income totaled $7.8 million or $0.23 per diluted share, up from 4.3% or 13% diluted share in the same period last year. our remaining performance obligation, which we refer to as backlog was $123 million, representing a year-over-year increase of 58%. the strong growth in rpo reflects record bookings in recent quarters and an increase in the duration of the cloud agreements as customers continue to make long-term commitments to our platform. looking at our balance sheet, our overall financial position remains strong with cash and investments of approximately $111.4 million at the end of the quarter.
this is an increase of approximately $16.7 million, compared to the same time last year. our days sales outstanding as of october 31, 2021, was 65 days for the current period, and that compares to 69 days in the same period last year, and this decrease was primarily due to improved collections compared to last year. and also, during the quarter, we paid $3.7 million in dividends. at this time, i'd like to turn the call over to questions.
",":
operator
[operator instructions] and we'll take our first question from matt pfau. please go ahead.
matt pfau -- william blair & company -- analyst
hey, guys, thanks for taking my questions. first one, to start off with the deals that got pushed in the quarter. it would be helpful if you could just provide a little bit more detail on what exactly went on there. and then, i know you closed one, but the ones that haven't signed yet, what's your confidence level in getting those deals across and either your third or fourth quarter?
allan dow -- president and chief executive officer
matt, this is allan. i'll take that one. thank you for joining us this evening. it was a situation that i would describe as frustrating, but not necessarily disappointing.
personally got involved in many of those contracts and the evaluation. the team really did a phenomenal job of getting things ready and contracts got negotiated, and they were sitting ready for final approvals on more than the couple that we mentioned prior, so a handful, actually. and we just couldn't get the final approvals done, one of those have come through already and another one probably yet this evening or in the next couple of days and a few more next week, hopefully before thanksgiving even kicks in. so, we're hard at work at those.
again, i would describe it as frustrating, not so much disappointing only because of the hard work that went into it and on both sides, the customer side and with our team as well. so, a high degree of confidence, we feel good about those. we still got them in the works, not a lot of work to do on many of them because we're really waiting on the customer side. and just a couple of things that seem to really play out for us were around the work conditions, where people are not in the office, so it's not as easy to walk down the hallway and wrangle the group together and get the approvals necessary.
and then in a couple of cases, they're just really struggling with the resource requirements, but we figured out ways to get that behind us as well. so, feel really good, really good about getting those contracts wrapped up.
matt pfau -- william blair & company -- analyst
got it. that's helpful. and then maybe it'd be helpful if you could give us a little bit in terms of the magnitude. you said they were large deals.
if you would close those, at least the ones that you had planned on closing, would you have been sort of closer to somewhere around a $3 million sequential acv increase?
allan dow -- president and chief executive officer
plus, a little bit higher.
matt pfau -- william blair & company -- analyst
got it. good to hear. ok. and then on the press release, you commented, allan, on sustainability becoming a bigger factor in terms of customer, what they're demanding out there or where they're investing, maybe just some more detail on that would be helpful, as well as what you're seeing in your traceability solution?
allan dow -- president and chief executive officer
yeah, for sure. it's really become, from a dialogue standpoint, a frenzied one. there's a lot of challenges around capturing the appropriate data. we've got one of our team members, mark burstein, is well known in the circles around this area, really set the standards in working with the customs organization and others.
it's still hard at work on some of those standards, probably the biggest challenge is data validation and making sure that the information gathered, and the processes put in place are verifiable and that they'll be capable of still getting their products into both the u.s. and in the european union. so, a lot of collaborative work going on there, which has really been amazing to me to see how well competitive companies have come together to really work on this issue. so, it is a hot topic.
it's the front of everyone's mind. for all the right reasons, people are working hard at it, and we see that that's going to be a strong topic in the months and quarters and years to come, as people really get their arms around it, get it tackled. and as that starts to play out, i think the regulations are going to get tighter and tighter and consumer expectations are going to get even more demanding. so, i believe, matt, we're just at the beginning stages of that really playing out.
matt pfau -- william blair & company -- analyst
great. thanks a lot, guys, for taking my questions. i'll pass the line.
allan dow -- president and chief executive officer
for sure. thanks for joining us again.
operator
and we'll move next to zach cummins. please go ahead.
zach cummins -- b. riley financial -- analyst
yeah. hi. good afternoon, vince and allan. thanks for taking my questions, and congrats on the strong performance across the p&l in the quarter.
just digging a little further, allan, in terms of what's in the pipeline for you? how do you guys think about the opportunity for conversions with existing customers versus new customers coming into the fold in terms of an acv perspective?
allan dow -- president and chief executive officer
yeah. great question. historically, for many, many years, and it still exists today, where if you look at a trend over time, roughly 50% of our contract business comes from both, from the new customers and from the existing customers. the newer projects tend to be, in general, tend to be a little larger, because you're starting from scratch, and you're adding a handful of components into the mix there.
whereas, in general, the existing customer community, maybe adding a couple of things or one thing or expanding a division or something like that. but with that said, some of those larger transactions can be existing customers as well. in fact, the one that we've closed this quarter already is from an existing customer that was a holdover from last period. so, it's a mix.
but in general, you can say that the new customer projects are a little bigger. but overall revenue is -- or revenue that's driven by those contracts is about split on the long trend. does that answer the question, zach?
zach cummins -- b. riley financial -- analyst
yeah, that's extremely helpful. and in regards to the press release you had out this morning in terms of consolidating resources across logility, demand management and ngc. i mean, you can just talk about the decision and why you feel like now is the right time to do that and kind of what you're hoping to achieve by making this move?
allan dow -- president and chief executive officer
well, a good friend of mine always says, zach, that every once in a while, you want to be lucky. and sometimes, you got to be smart, and you got to be lucky. and when those two hit together, you really hit the mark. and i believe that we were smart and lucky on this one.
we started this transition three and a half, four years ago. we started by talking about what do we need to do with the collective capabilities we have in our software platform, and we began, in parallel with the transition to the cloud a number of years ago to say, when we do that, let's make this platform all one, because we had complementary capabilities across all of the business units we had -- four at that time with ngc, demand management, logility and the halo operation that we had acquired just prior to that. so, our team went hard to work at it. the pandemic over the last 18 months has really demonstrated why that was a brilliant decision.
it was in mind, so i'm not saying i'm brilliant. but as an organization, we've got some great people here that were thinking hard about the future supply chain and what we needed to do to help our customers be more successful. we didn't have any idea that the pandemic was coming. but the reality of the pandemic set in motion, the things that we knew were on the horizon, as the pace of supply chains continue to accelerate, the length of products in the marketplace, time in markets is getting shorter and shorter, thus the turnover and the number of new product introductions going faster and faster, the global enterprises.
and what it really meant was in order to be successful, our customers had to start breaking down the silos. so, we were structured around the silos of the past and the way our customers operate their supply chains, and we serve those markets very well. in today's marketplace, that's unacceptable. you got to break those barriers down.
we have our customers, who are rethinking the way they operate their supply chain. they're synchronizing their teams around product lines or customer experience or divisions. they no longer have forecasting teams and sourcing teams and procurement teams that operate in silos and independent of each other. so, our business today is aligned with the necessary needs of it.
and we were fortunate to not have to be tackling that today, where we already got it behind us. the last leg of that journey was to align our organization in such a way that we could really capitalize on that as well. and our demand management team is acutely focused on emerging markets and small to medium enterprises and our logility team is acutely focused on the needs of large enterprises. and that's how we set our business structure up to align with our product capabilities.
so, probably a heck of a longer answer than you wanted, zach, is when you asked that question, but that's the story. and hopefully, that was helpful.
zach cummins -- b. riley financial -- analyst
extremely helpful. i always appreciate the additional insight on that front. and just final question for me, geared toward vince. in terms of the subscription margin, it's remained pretty steady here in kind of the mid-70s.
i guess, how should we be thinking about that going forward, as the subscription piece of the business continues to scale?
vince klinges -- chief financial officer
yeah, zach. we're thinking it will trend slightly up toward the end of this -- back half of the year. it's roughly around 74% -- bouncing around 74%, 75%. it should tick up a couple of basis points, maybe toward like 76% and 77% toward the end of the year, but we're really targeting next year to get it to 80%.
so, that's kind of the way we're modeling it right now.
zach cummins -- b. riley financial -- analyst
understood. that's helpful. well, thanks again for taking my questions, and best of luck going forward.
allan dow -- president and chief executive officer
thank you. thanks for joining us, zach.
operator
[operator instructions] we'll move next to matthew galinko. please go ahead.
matthew galinko -- maxim group -- analyst
hey, good afternoon. thanks for taking my questions. maybe firstly, on the transformational type deals. can you take a stab at whether in the velocity, picking up on getting those across the finish line or given where we are in the pandemic and where we are in sort of the global macro environment, what are the kind of puts and takes there?
allan dow -- president and chief executive officer
yeah. matt, first of all, thank you again for joining us. good question. the nature of supply chain today is really driving these transformational projects.
it's much like we were chatting a few minutes ago when zach asked the question about our realignment of our business. but those are the needs of the customers, they need to think differently. they need a platform for managing the supply chain, where they can do the scenario analysis and span across the whole end-to-end supply chain operations that they have. so, what that brings about is not only a software application and implementation, but it's a change management practice as well.
so, that's one of the headlines that we've been hitting into, and we've really worked hard at helping our customers figure out how to do that to the tune of several projects we have up and running today, where we have some of our consultants sitting on the customer side, really operating on their behalf, helping them operate the day-to-day operations, so that they can free up some of the key resources to help on the project. so, we're thinking outside the box, we're doing some nontraditional work. it's starting to break those projects loose. we're serving that idea up to more of the prospects, as we go forward.
so, that, combined with the results we're getting, i believe we're going to see that break loose. now, the next couple of months are really tricky as we get into the holidays with thanksgiving here in the united states and christmas around the world. but that said, we're in a period that is traditionally strong for us, because we have three milestone moments. we have the end of the calendar year, where money needs to get spent, because that's the end of many of our customers' fiscal year, the start of a new year, people come out of the blocks with a fresh rest from christmas and new year's and a desire to get back to work and new fiscal budgets that can free up some cash.
and then, of course, 30 days later, we have the end of our quarter, and we've done a marvelous job over 40 years of training our customers at the end of the quarter is a good time to do work with us. so, we have those three milestone events that should be another breakthrough quarter for us, where we stand out in the third quarter.
matthew galinko -- maxim group -- analyst
got it. thanks. that's very helpful. maybe just one more on the competitive front, what you're seeing, given some of the consolidation that's played out in the space.
allan dow -- president and chief executive officer
yeah, it's been an interesting time in this space. i think there's a couple of consolidations that have just taken some folks out of the play. not all companies have been successfully gobbling up some of the things that they spend money on and really put into effective use. so, we've actually seen a few competitors to disappear from the horizon or solutions they would be, disappear from the horizon.
overall, the more prominent players that we peer up against blue yonder, who just went through a change in ownership structure with panasonic, taking them private under their umbrella. we've yet to see really that start to come about, although we've seen few more resumes hitting the street. so, we'll see what that means, as time plays out. we continue to see the erp players.
they get some business, where they lock up the cfo and the cio, and they want to have a single solution, but they're continuing to falter, and we're seeing more breakaway clients, who historically had been loyal to those brands, stepping away and reassessing what they need to manage their supply chain, and that's become more prominent than a brand loyalty. so, that's starting to break lose some projects for us. so, there's a handful of our -- the best-of-breed providers out there that stand side by side with us. we're all getting our fair share today and i think the collective of the top three or four were probably taking more business from some of the others, who are as strong and can't help the customers, as well as they have the desire and need to transform their business.
so, it's a healthy environment. we like the position we're in, and we can compete very effectively.
matthew galinko -- maxim group -- analyst
thanks, and congrats on the strong quarter.
allan dow -- president and chief executive officer
thank you, sir. appreciate you joining us this evening.
operator
[operator instructions] and it does appear there are no further questions at this time.
allan dow -- president and chief executive officer
so, chloe, thank you so much for helping us with the call this evening. i want to again thank everyone who joined us this evening for the call. we appreciate your attention and interest in american software and look forward to giving you an update again in three months ahead on our progress in the third quarter. thank you all.
bye-bye.
operator
[operator signoff]
duration: 36 minutes
call participants:
vince klinges -- chief financial officer
allan dow -- president and chief executive officer
matt pfau -- william blair & company -- analyst
zach cummins -- b. riley financial -- analyst
matthew galinko -- maxim group -- analyst
more amswa analysis
all earnings call transcripts"
