q,ticker,dt,prep_remarks,QnA
2022-Q3,AMSWA,2022-02-23 17:00:00,"prepared remarks:
operator
good day, everyone, and welcome to today's third quarter fiscal year 2022 financial results. [operator instructions] please note, today's call may be recorded, and i will be standing by should you need any assistance. it is now my pleasure to turn the conference over to the cfo of american software, vince klinges. please go ahead.
vince klinges -- chief financial officer
thank you, chloe, and good afternoon, everyone, and welcome to american software's third quarter fiscal 2022 earnings call. on the call with me is allan dow, president and ceo of american software. allan will provide some opening remarks, and then i will review the numbers. but first, our safe harbor statement.
this conference call may contain forward-looking statements, including statements regarding, among other things, our business strategy and growth strategy. any such forward-looking statements speak only as of this date. these forward-looking statements are based largely on our expectations and are subject to a number of risks and uncertainties, some of which cannot be predicted or quantified and are beyond our control. future developments and actual results could differ materially from those set forth in, contemplated by or underlying the forward-looking statements.
there are a number of factors that could cause actual results to differ materially from those anticipated by statements made on this call. such factors include, but are not limited to, changes and uncertainty in general economic conditions, the growth rate of the market for our products and services, the timely availability and market acceptance of these products and services, the effect of competitive products and pricing and other competitive pressures and the irregular and unpredictable pattern of revenues. in light of these risks and uncertainties, there could be no assurance that the forward-looking information will prove to be accurate. at this time, i'd like to turn the call over to allan for opening remarks. 
allan dow -- president and chief executive officer
thank you, vince. i'm pleased to report that, again, we achieved double-digit revenue growth in our supply chain segment. and for the company as a whole, it was the second quarter of double-digit growth with q3 accelerating well up into the teens. our strong top line performance was accompanied by significant expansion in our adjusted ebitda margin as we gained efficiency from the cloud growth and achieved very high utilization rates across all of our services segments including the it consultancy business which is very project and seasonally sensitive.
we anticipate continued strong revenue growth in the fourth quarter and fiscal year '23 with the additional scale in the cloud business and a healthy backlog of project work in hand. however, ebitda expansion will be tempered in the quarter and year ahead as we continue to invest in employee retention, expanding the team and with a higher level of in-person events and travel expected. in spite of a very competitive labor market especially in the supply chain and technical space we successfully onboarded about a dozen people so far this calendar year, filling the needs, hiring demands across sales, marketing, services, cloud operations and in r&d. we expect to repeat that pace of hiring in the next few months to fulfill the needs of expected growth in the year ahead.
and then we'll also need to keep that pace up in the first half of fiscal '23 to align to our business plan for next year. looking back on the past quarter, the lingering impact of the pandemic and world events have extended the fragmented working environments, business uncertainty and frenzied activities our customers are engaged in to address their supply chain issues. we continue to see delays in contract approvals as the supply chain and it organizations grapple with staffing shortages. we were able to secure the two larger projects that slipped from q2 early in q3.
however, in spite of some progress due to our prescriptive approach and staff augmentation efforts, we anticipate that some delays may persist for several more quarters. overall, our pipeline continues to increase, driven by the transformational projects required to enable enterprises to holistically manage their supply chains in a sustainable and economically resilient way. although the timing of closing these contracts is a little less predictable due to the longer approval processes, we remain confident that between a larger opportunity set and our improved execution, we're poised for a strong conclusion to the fiscal year and carry over into the first half of fiscal '23. due to sequential improvement in our closing rate and our ongoing efforts on customer retention, i'm pleased to announce that we increased our rpo and continue to build our acv and services backlog.
our team is focused on serving existing customers, delivering on our implementation commitments and bringing new companies into our customer community more efficiently than ever before. we're seeing a continued increase in our services backlog and are relying more and more on our si partners to assist in delivery. with the holiday period behind us, we anticipate continued high utilization rates across all services teams, which will deliver year-over-year growth and margin expansion in the supply chain consulting services business. we are also pleased to see the continued growth in our recurring revenue stream of cloud services and maintenance, which now represents approximately 63% of our total revenues year-to-date, compared to 62% in the same period last year.
this was driven by a 43% increase in the cloud services acv we saw in the third quarter when compared to last year's third quarter. with the increase in new subscription contracts and the continued stability of our cloud and on-prem customer community, we expect to see the recurring revenue as a percent of total revenue continue to rise. during the third quarter, we welcomed four new customers and completed subscription or license fee transactions in 10 countries, reflecting our strong global presence. in summary, we're pleased with the third quarter results and expect to extend the performance improvements of our financial model through the remainder of this fiscal year and into next year.
while q4 is shaping up to be the strongest quarter of net new acv addition of this year, it is not likely to be the standout quarter like we had fourth quarter last year, which benefited from the accumulation of four slow quarters through the initial pandemic period and culminated in the closure of two large acv contracts in excess of $1 million. we remain intently focused on executing against our growing pipeline and look forward to reporting our progress next quarter. so at this time, i'll turn the call back over to vince, who will provide the details on our financial results.
vince klinges -- chief financial officer
thanks allan. for the third quarter of fiscal '22 total revenues were $32.4 million at 17% increase from $27.7 million the same period last year. what's driving that is subscription fees which increased 45% year over year to $10.9 million, while the software license revenue also increased 87% to $1 million, compared to $0.5 million in the same period last year. our acv or annual contract value increased 43% to $45.3 million versus $31.6 million a year ago period.
we added $2.8 million of net new acv during the quarter. over 40% of our net new acv was from new customers. professional services and other revenues increased 21% to $11.4 million from $9.5 million a year ago. the year-over-year increase reflects a 29% increase in our it consulting business unit, a proven method.
and that's due to timing of project work and also, we had a 13% increase of our scm business unit also due to increase in project work. maintenance revenues declined 10% year over year to $9.1 million, reflecting our normal falloff rate this quarter. so total revenues -- recurring revenues comprised of subscription and maintenance fees represented 62% of total revenues. that compares to 64% in the same period last year.
our gross margin was 58% for the current period, and that's up from 55% in the same period last year. subscription fee margin increased to 68%, compared to 59% in the same period last year. and that's primarily due to increase in subscription revenue and lower amortization of cap software expense. excluding the noncash amortization of cap software expense of $628,000 for the third quarter, our gross -- our subscription gross margin would have been 74% versus 71% in the same period last year.
and the amortization of cap software last year was $866,000 in the prior year period. license fee margin increased to 76%, compared to 46% in the same period last year, and that's primarily due to higher revenues and lower amortization expenses. our services margin increased to 30%, compared to 24% last year due to strong growth in our -- both our it staffing business, the proven method, as well as a higher margin supply chain business unit. our maintenance margin was 80% for the third quarter, and that compares to 81% in the same period last year.
gross r&d expenses were 14% of total revenues for the current period, and that compares to 16% in the same period last year. our sales and marketing expenses were 16% of revenues for the current quarter, compared to 18% in the same period last year. and g&a expenses were 18% of total revenues for both periods. so on a gaap basis, our operating income increased 246% to $3.2 million this quarter, and that compares to $0.9 million in the same period last year.
so our net income increased 27% to $2.9 million or earnings per diluted share of $0.09, compared to net income of $2.3 million or $0.07 in earnings diluted share. on an adjusted basis, which excludes the noncash amortization of intangible expense-related acquisitions and stock-based compensation expense, adjusted operating income increased 153% to $4.4 million, compared to $1.7 million in the same period last year, and our adjusted ebitda increased 85% to $5.3 million from $2.9 million in the same period last year. adjusted net income was increased 28% to $3.8 million or adjusted earnings per diluted share of $0.11 for the third quarter, and that compares to adjusted net income of $3 million or adjusted earnings diluted share of $0.09 the same period last year. international revenues this quarter were approximately 16% of total revenues, and that compares to 15% in the same period last year.
for year-to-date, for the nine-month period ended january 31, 2022. our total revenues increased 12% year over year to $92.9 million and that's primarily due to a 49% increase in subscription fees to $31 million, and a 30% increase in license fees and a 7% increase in services, partially offset by a 9% decline in revenues. so our adjusted operating income year-to-date was $10.8 million and representing an operating margin of 12%, compared to $5.1 million or 6% in the same period last year. our adjusted ebitda increased 57% to $13.8 million, compared to $8.8 million in the year ago period.
and that represents an adjusted ebitda margin of 15%. adjusted net income totaled $11.7 million or $0.34 per diluted share, up from $7.3 million or $0.22 per diluted share in the same period last year. we're excited this quarter with our remaining performance obligation, or rpo, which is -- which we refer to as backlog of $129 million, and it's representing a year-over-year increase of 61%. the strong growth in rpo reflects record bookings over the past 12 months and an increase in the duration of our cloud agreements as customers continue to make longer-term commitments to our platform.
taking a look at our balance sheet, our financial position remains strong with cash and investments of approximately $114.8 million at the end of the quarter, this is an increase of approximately $14 million compared to the same period last year. during the quarter we paid $3.7 million in dividends and our days sales outstanding as of january 31, 2022 was 77 days and that compares to 65 days the same period last year and this increase is primarily due to timing of billing and some delays in collections when compared to last year. at this time, i'd like to turn the call over to questions.
",":
operator
[operator instructions] and we'll take our first question from matt pfau. please go ahead.
matt pfau
hey, guys, thanks for taking my question, and good quarter. i wanted to follow up on the commentary around the deal delays and perhaps it would just be helpful to get a little bit more detail on what's going on there in terms of what the drivers are and then what needs to happen to return to a more normal cadence from a deal closure perspective?
allan dow -- president and chief executive officer
yeah, matt. [inaudible] thanks for the question. it really is getting driven by the staffing concerns that we have experienced now for a couple of quarters in a row where folks just don't have the resources to really get a project going. they've got adequate funding, they've got budget, they've got the ability to spend, they've got the desire to spend but until you can put boots on the ground, so to speak, they don't want to get committed to the contract.
so they're waiting until they get critical roles filled, people in place, free up their calendar and get those project started. those are -- those delays are little bit unpredictable, sometimes it's involving hiring on their side and there is labor shortage market that we're in, the time frame to get people hired and onboarded is a little unpredictable. so we had a couple of -- that's what happened to us at the end of q2 and extended some of those projects into the beginning of q3. we didn't have nearly the order of magnitude this quarter, but there were some that we anticipated getting done that just didn't come to completion in the third quarter, but we're working hard at getting them done here in the fourth quarter, and a couple -- made progress on a couple of those already.
so it's a little unpredictable. i think people get back to their office, which we're anticipating we're going to do later in the spring. and when folks get back and they are sitting around the table and can work on some of these topics in person. i think that will help bring some stability to it.
so with a good eye to it, matt, maybe this summer, we'll get more predictable.
matt pfau
great. that's very helpful. and then wanted to ask the concerns around inflation and then potential resulting slowdown in the economy have been out there for a while now. but what are you hearing from your clients on that front? are there any sort of economic concerns that are holding deals up and then, obviously, more recently with some geopolitical concerns, is that impacting pipeline or deal closures at all?
allan dow -- president and chief executive officer
no, not yet. the geopolitical stuff, as we all know, is pretty fresh. but over three decades that we've been working on this stuff, the best time for supply chain projects is when we're in a state of change. and we went from one that was booming and pandemic ridden to one that maybe the pendulum swung the other way in an awfully quick fashion.
but times have change, whether it's on the downward spiral or an upward trend are good for projects like ours because people are grappling with how to deal with whatever is going on in the marketplace. so i don't think we'll see any impact on the short term. if the economy really slows down and people tighten up spending, then it may be a longer-term impact. but nothing yet, matt, we haven't seen that come in as a topic of discussion yet.
matt pfau
got it. and last one for me. in the press release, you guys talked about sustainability initiatives that you have and ai and machine learning becoming more important to companies achieving those sustainability goals. maybe you could just expand on what you were referencing in the press release and what you're seeing in terms of sustainability initiatives driving demand for your software?
allan dow -- president and chief executive officer
yeah. so forever, the supply chains have really been driven by economic delivery of goods, how to get the products to the right place at the lowest possible cost and make sure you get it there on time. that's been a long-term one. over the last five or six years it has been or maybe 10 years there has been a more focus on the environmental impact, which is one of the sustainability initiatives, what is the impact and as more and more visibility comes to that, it's been less economic driven and which is part of the environmental process, but more around just looking at the impact on the global environment.
so people are more adamant about that and then a more recent issue has really come up around the use of labor and proper labor standards around the world. so that's an important initiative. our traceability product that we announced and have deployed several times now. we announced it earlier in the year and has really been getting -- taking hold.
people are acting on it now. the regulations are coming into play. people get -- the customers are getting a handle on what they need to be able to do, and we're helping them overcome some of those challenges so that they can look back through the supply chain and make sure that their products are being sourced responsibly and with proper labor standards. so it's really come about.
it's driving some initiatives. there are a number of stand-alone opportunities that we're working on that are on this traceability component alone, and people are really trying to address those needs and be responsible providers of products to the marketplace.
matt pfau
great. thanks, guys. appreciate it.
allan dow -- president and chief executive officer
thank you, sir. appreciate it.
operator
and we'll take our next question from zach cummins. please go ahead.
zach cummins -- b. riley financial -- analyst
yeah. hi, good afternoon. congrats on the strong results here in q3. allan, i just wanted to touch a little bit more on some of the challenges you're seeing with getting deals across the finish line and through these approval processes.
it sounds like some of the ones that were delayed in q2 have now moved into q3, and we're able to close some of those. but i was curious what you've really seen so far in q4 and what's really kind of given you the confidence that you can still execute in this environment and put up the strongest acv quarter here to end the year?
allan dow -- president and chief executive officer
yeah. we've got several contracts already under our belt. we've got them executed. so we're not quite all the way through the first month, but we're getting there.
and then just the magnitude of pipeline and the number of transactions in the phase we're in with those folks, zach, relative to getting contracts negotiated and the timing and the sequence of events to get projects kicked off, a lot of movement going on there. so unless we get into something really crazy, which maybe will -- that always could happen. but it's just the momentum play that's out there, the deals that are already done, the momentum play that we have around the ones that are very, very active right now and timing fairly short term to get contracts completed give us strong confidence that we'll be able to hit that level of performance.
zach cummins -- b. riley financial -- analyst
understood. that's helpful. and just considering some of the staffing shortages you're seeing at some of your end customers and the delay of some of the project timelines here. is this really causing any sort of differentiated approach in how you go about trying to close some of these deals? is that more of a focus on the existing base and trying to expand upon those relationships? i'm just curious how you guys are really trying to navigate through this challenging deal closing environment.
allan dow -- president and chief executive officer
yeah. we've done a couple of things. i wouldn't say we haven't changed our focus to internal more predominantly, but our existing customers more predominantly but we have some great projects underway with existing customers. they're dealing with one or the same issues that others -- traceability is a great example that most of that work is with existing customers where they're expanding their footprint, trying to make sure that they've got good labor practices in place.
but -- so a couple of things we've done relative to the staffing challenges they're facing, we're putting forward proposals that we're offering up the labor to help backfill and support steps in the project that may otherwise historically been done by the customer. we're putting forward a statement of work that is very prescriptive and trying to minimize the impact on their labor internally so that we can get those projects moving relative to the burden that's on the customers to get that done. we can't do it stand-alone. we still need time from the client in order to really effectively deploy a solution.
but we're trying to minimize the impact on their existing staff and minimizing the amount of work that they have to put in any given week. so we're taking a couple of those actions to make sure we get there. and then the other thing we've done, and we've talked about this a couple of times, is really just breaking up the project into smaller bite-sized chunks. the customers feel better about taking a smaller project, if they're looking at something that's going to be 18 months or 12 to 18 months to deploy, they're a little more hesitant and there are lot more scrutiny going into launching those projects.
so we've taken a path to say, let's break it up, what's the most important thing that we can do first that will give you the biggest return on their investment and minimize the impact and get a project going. so we're going to see that play out in a few less million-plus transactions. that was my comment earlier. we had several of those in the fourth quarter of last year.
there's a chance that we won't have any of those or maybe one of those this quarter. but we're going to have a higher flow of deals by getting them broken loose and getting the commitments. so hopefully, i covered that point for you, zach.
zach cummins -- b. riley financial -- analyst
absolutely. i appreciate all the additional color on that front, so thank you for that. and final question from me, allan, is really around the planned investments that you talked about during the script, whether that be more in-person events that you're hosting, more travel from your internal team and even just hiring additional people. i mean can you talk about, is there any particular area that you're looking to bolster your headcount and kind of what are some of the ways you're looking to attract talent in what's been a pretty tough hiring environment?
allan dow -- president and chief executive officer
yeah. a couple of things. there are going to be more in-person events it appears. so marketing and customer conference events, those kinds of things are coming back.
people have flipped them to be in-person. a few of our investor and analyst conferences we've gone in-person. so did get me back on the airplane as well, looking forward to it by the way. but -- so that's going to happen.
we're not going to get back and i don't anticipate through the first half of next year, we'll go back to the level that we were prior to the pandemic. but certainly, they were almost nonexistent in the last two years, a very minimal travel, mostly internal travel. but people are back on site. they're welcoming us back on site.
so we're getting more and more engagements going on there. but the bigger impact is really going to be our investment in the organization. we have -- in order to support our business plan, we need to expand in every area. as we bring more subscription business in, we need -- we're getting scale out of the cloud business, but we still need more head count in our cloud business to support them.
we've got some strong plans in r&d that we really want to expand our footprint. we think there are some elements to invest in that requires people to go develop our applications a little deeper in some of these areas. so we're going to be expanding our r&d investment as well. we're going to keep that in line with our revenue growth as a percent of investment back in r&d, but that means we got to bring more headcount in in order to do that.
we're expanding our sales team globally. we're expanding in every region. we're adding some staff here in north america. we're expanding into asia.
we're expanding into europe, continuing there. so we've got headcount addition, we want to pull into that area. in order to support that, we got marketing investment we needed to make. and our backlog of services business, even though we can rely on our sis, -- even when the sis are doing a predominance of the work, there's individuals we need from our team to support them in their implementation process.
so we're going to be staffing up in our services business. so there's not an area of our business that's untouched from that investment standpoint. the second half of your question was why are we successfully able to compete? well, first of all, i think people love this space. the fact that supply chain is a thriving, growing business they want to be part of that.
supply chains have an impact on the world. we feel good. the people -- our team members feel good about what we do through our customers to impact the world we live in. traceability, sustainability, environmental impact by improving the efficiency through our customers.
those are all exciting things to do. we've got a great culture here at the company. longevity is -- of our staff is evidence of a good working environment. so -- and then we're very competitive on our compensation structure.
so we're able to attract people. they're coming in. they want to be part of our team. and so far, we've been successful at filling the open roles we have.
zach cummins -- b. riley financial -- analyst
understood. it's really helpful. i appreciate you taking my questions, and best of luck here in the coming quarter.
allan dow -- president and chief executive officer
all right, zach. thank you very much for joining us this afternoon.
operator
[operator instructions] we'll move next to anja soderstrom. please go ahead.
anja soderstrom -- sidoti and company -- analyst
hi, thank you for taking my questions, and congratulations for a great quarter. firstly, i'm curious, you're talking about a lot of hiring and you're successful in attracting talent. but how do you see the wage inflation playing in and how are you going to be able to offset that or absorb that?
allan dow -- president and chief executive officer
well, yeah, the inflation certainly is in there and well deserved. the right talent deserves to have a requisite compensation, anja, so good question in that. we have no choice but to make sure that people are fairly compensated. so we're going to step up to the plate, make sure that happens.
that's going to have an impact. but the bottom line is that as we grow the business, we get scale through our efficiency. our services team, for instance, is working really hard at trying to improve the efficiency of the work we do with our customers. this prescriptive methodology helps.
so even though on a dollar-for-dollar basis, we have to make sure we've got fair compensation out there. we can get a lot more work done through those efficiency factors. in our cloud business, we're getting scale just through the natural deployment. it's not a one-for-one on expanding our customer base on a cost basis.
so even though we have higher cost from inflation, on where we do spend the money, we get scale through our efficiencies in the cloud business. so we think it's a balanced budget. we can't, as i mentioned in my commentary earlier, we don't anticipate that we can grow ebitda at the same pace that we did last year because of some of these investments we're making. but not all of that's inflation, some of that is just getting out over in advance of the business model to get -- we get salespeople on board this -- in the next couple of quarters.
they're going to have an impact in the longer term. it takes six to nine months for them to be fully productive. so we want to make the investment now. we'll put the money down and we'll get a return on that investment.
anja soderstrom -- sidoti and company -- analyst
ok. thank you. that's a good color. and then also curious about the partnerships you mentioned in your press release.
can you just speak a little bit about what we can expect from those and give us more color on that?
allan dow -- president and chief executive officer
yeah, good follow up question. the partners we have are really getting close with us and working hard to getting customers success, we're very much aligned with them on the objectives of the project. they are seeing the world the same way we are. that efficiency and effectiveness of getting projects up and running and getting systems deployed is important.
so we have very good alignment with their objectives, our objectives and the prospect objectives. we've done some pretty good investments in getting education and onboarding process going so that consultants are getting trained and certified ready to go. so that's been exciting. they are willing to put the investment in there to get them -- to get them educated so that they can be very effective when they are on the job.
so nice synergies, they are introducing us to new opportunities as well that we weren't otherwise aware of, so that's a nice spin-off of that. but the primary effect is that we're successfully getting customers up and running and live. and that bodes well for tackling phase 2, which is really the objective for breaking up these projects that we get phase 1 up and running and do that efficiently and effectively. then phase 2 comes along much quicker and that's an exciting part of our growth model.
anja soderstrom -- sidoti and company -- analyst
thank you. that was all for me.
allan dow -- president and chief executive officer
all right. thank you, anja. have a good afternoon. evening for you, by the way.
anja soderstrom -- sidoti and company -- analyst
yeah. thank you, likewise.
operator
[operator instructions] and it does appear there are no further questions at this time.
allan dow -- president and chief executive officer
all right, chloe. thank you so much for helping us today, and thank you for all the participants on the call, especially with the follow-up questions, some very good ones. we appreciate your time in joining us this afternoon to discuss our earnings results and look forward to speaking to you again in the next quarter.
operator
[operator signoff]
duration: 37 minutes
call participants:
vince klinges -- chief financial officer
allan dow -- president and chief executive officer
matt pfau
zach cummins -- b. riley financial -- analyst
anja soderstrom -- sidoti and company -- analyst
more amswa analysis
all earnings call transcripts"
