q,ticker,dt,prep_remarks,QnA
2021-Q2,AUDC,2021-07-27 08:30:00,"prepared remarks:
operator
greetings and welcome to the audiocodes second quarter 2021 earnings call. [operator instructions] i would now like to turn the conference over to your host roger chuchen, vice president of investor relations. thank you, you may begin.
roger chuchen -- vice president, investor relations
thank you. hosting the call today are shabtai adlersberg, president and chief executive officer and niran baruch, vice president of finance and chief financial officer. before we begin, i'd like to remind you that the information provided during this call may contain forward-looking statements relating to audiocodes' business outlook, future economic performance, product introductions, plans and objectives related thereto, and statements concerning assumptions made or expectations as to any future events, conditions, performance, or other matters, are forward-looking statements as the term is defined under us federal securities law forward-looking statements are subject to various risks and uncertainties and other factors that could cause actual results to differ materially from those stated in such statements.
these risks, uncertainties, and factors include, but are not limited to, the effect of global economic conditions in general and conditions in audiocodes' industry and target markets in particular shifts in supply and demand, market acceptance of new products and the demand for existing products, the impact of competitive products and pricing of audiocodes and its customers' products and marketing, timely product and technology development, upgrades and the ability to manage changes in market conditions, as needed, possible need for additional financing, the ability just asked by covenants in the company's loan agreements, possible disruptions from acquisitions. the ability of audiocodes to successfully integrate the products and operations of acquired companies into audiocodes business, possible adverse impact of the covid 19 pandemic on our business and results of operations and other factors detailed in audiocodes' filings with the us securities and exchange commission.
audiocodes assumes no obligation to update this information. in addition, during the call, audiocodes will refer to non-gaap net income and net income per share. audiocodes has provided a full reconciliation of the non-gaap and income and net income per share, to its net income and net income per share according to gaap in the press release, that is posted on its website.
before i turn the call over to management, i would like to remind everyone that this call is being recorded and archived webcast will be made available on the investor relations section of the company's website at the conclusion of the call. with all that said, i would like to turn the call over to the shabtai. shabtai, please go ahead.
shabtai adlersberg -- president & chief executive officer
thank you, roger. good morning and good afternoon everybody. i would like to welcome all to our second quarter 2021 conference call. with me this morning is niran baruch, chief financial officer and vice president of finance of audiocodes. niran will start off by presenting a financial overview of the quarter. i will then review the business highlights and summary for the quarter and discuss trends and developments in our business in the industry. we will then turn it into the q&a session. niran?
niran baruch -- chief financial officer & vice president of finance
thank you shabtai, and hello everyone. as usual, on today's call, we will be referring to both gaap and non-gaap financial results. the earnings press release that we issued earlier this morning contains a reconciliation of the supplemental non-gaap financial information, that i will be discussing on this call. revenues for the second quarter were 60.6 million, an increase of 13.2% over the 53.5 million reported in the second quarter of last year. services revenues for the second quarter were 22.8 million, up 32.8% over the year-ago period. services revenues in the second quarter, accounting for 37.6% of total revenues. the amount of deferred revenues as of june 30, 2021, was 73.4 million up from 65.1 million as of june 30, 2020.
revenues by geographical region for the quarter were split as follows: north america, 40%, emea 30%, asia pacific 17%, and central and latin america 6%. our top 15 customers represented an aggregate of 62% of our revenues in the second quarter, of which 47% was attributed to our 11 largest distributors. gaap results are as follows. gross margin for the quarter was 69.4% compared to 66.7% in q2 2020, operating income for the second quarter was 10.1 million or 16.7% of revenues compared to 8.8 million or 16.5% of revenues in q2 2020. net income for the quarter was 8.2 million or $0.24 per diluted share, compared to 6.6 million or $0.21 per diluted share for q2 2020.
non-gaap results are as follows, non-gaap gross margin 69.7% compared to 66.9% in q2 2020. non-gaap operating income for the second quarter was 13.6 million or 22.4% of revenues compared to 10.7 million or 20.1% of revenues in q2 2020, an increase of 26.3%. non-gaap net income for the second quarter was 12.7 million or $0.37 per diluted share compared to 10.5 million or $0.32 per diluted share in q2 2020. as of june, at the end of june 2021, cash equivalents, bank deposits, and marketable securities totaled 191.9 million. net cash provided by operating activities was 17.1 million for the second quarter of 2021. days sales outstanding as of june 30, 2021 were 56 days.
during the quarter we acquired approximately 236000's of our ordinary shares for a total consideration of approximately 7.1 million. on july 2021 we have received court approval in israel to purchase up to an aggregate amount of $35 million of additional ordinary shares. the court approval also permits us to declare a dividend of any part of this amount. the approval is valid through january 3, 2022.
earlier this morning we declared a cash dividend of $0.17 per share. the aggregate amount of the dividend is approximately $5.5 million, the dividend will be paid on august, 26, to all of our shareholders of record at the close of the trading of august 11. now, to providing an update on our guidance we are raising our guidance for revenues to be in the range of 243 million to 250 million, compared to the previous range of 240 million to 250 million. we are reiterating our guidance for non-gaap diluted net income per share for 2021, to be in the range of $1.45 to $1.65. i will now turn the call back over to shabtai.
shabtai adlersberg -- president & chief executive officer
thank you niran, we are very pleased to report strong financial results and continued progress in our business in the second quarter of 2021. this is the second quarter in a row where our revenue grew 13% plus, year-over-year. as a comparison, growth in the second quarter of 2020 last year, was about 8.2%, so quite a leap in terms of revenue growth rate. now the majority of the growth came from the enterprise business, which has provided close to 85% of the company revenue in the second quarter. to remind us all enterprise business consists of our ucaas and contact center market operations. bottom line of this, is that while the company revenue grew 13.2%, enterprise-related revenue grew above 20% year-over-year, which clearly points to the potential of increasing our company annual revenue growth rate in coming years well beyond 13% a year.
during the quarter we continue to execute in all of our three strategic business areas in the enterprise space. first, microsoft teams, business grew well above 20%, year-over-year. i should add that in general, we saw robust demand in the us enterprise market much along the same trend we saw in the first quarter of 2021. this is a direct result of the decline in the pandemic in the us and in other markets. contact center operations grew nicely year-over-year. we'll touch that later on and we will talk about developments, new development that we've seen in certain areas, and in conversational ai we saw nice progress in several business line most important booking and revenue growth of more than 100% year-over-year.
in summary of the progress made in the ucaas and contact center and in view of similar such trends in several past quarters, second quarter industry dynamics further underscores the fact that collaboration hybrid work and work from home remain key industry trends, not only in 2021 but well beyond and thus they do present for us, long-term growth potential. also it's important to say that our decision made at the end of last year to increase our investment in r&d, sales and marketing and services on account of trading up for lower operational margin and profitability, proves to be working well and should fuel our success in the market in coming years. and much along the same line reported in the previous quarter, we experienced strong demand and performance in north america services operation and continued as we see business strength. and so, the outlook for 2021 in the second half of the year looks positive and promising.
going back to the various business line performance during the second quarter, here is a breakdown, ucaas and uc, which contribute about or above 70% of revenue, grew above 20% year-over-year. contact center, which provides for between 10% and 15% of revenue, grew above 25% year-over-year. so all in all, if we take enterprises as a whole, which provide close to 85% of revenue, we grew above 20% year-over-year. in view of that, we should have been growing faster, however, there's one business area, the service provider cpe business, which really suffered substantially from the pandemic, much along the same lines, that we've seen in previous quarters. so service provider cpe, which was top of 10 million in the quarter last year, was substantially below that in the second quarter and we have experienced decline. if you take service provider cpe, that's about between 10% and 15% of revenues. so basically the difference between the growth of 20% plus in the enterprise and the overall company growing only about 13%.
last i'll mention two other business plan, which are really minor at this stage, first is the voice ai business, which is just about 1.5% of business that grew year-over-year 100%. technology business continue to decline, it is now about 2% to 2.5% of overall revenues and has declined about 15%, but all in all, a very strong core in terms of our enterprise performance.
now getting to our long-term financial model that we presented in the last 2 quarters, generally, we are looking for the current three years, 21 to 23, to provide for revenue growth of 13% to 15% non-gaap gross margin, 67% to 70% opex, a percentage of revenues. we said it would be capped at 47% and then non-gaap operating margin to be in the range of 20% to 23%. if we look at second quarter performance, we seem to be well within those ranges except for opex. opex came at 47.3% and we believe that indeed going forward we will fix that range and i think we will probably target 47% to 49% or even 50%. it's all comes to investing more in areas where we feel that there is a lot of potential and we should increase our investment in this area.
now touching on several more important financial data points for the quarter, opex increased substantially more than 5% sequentially, mainly due to two key factors, one is, increase in headcount, has dodged debt immediately and then the impact of much lower new israeli shekel versus the us dollar's exchange rate. basically, i should say that we basically were edging that conversion rate up to the end of the first quarter of 2021 and we enjoyed a very good rate of 3.7 new israeli shekels per dollar. however, in the second quarter, we know which was available and therefore we were at 3.3%. so there is a big gap of about 11% between the exchange rate used up to the second quarter and in the second quarter that explains a surge of more than a $1 million in our opex expenses.
headcount increased 31%, i'm sorry, 31 positions to 821 full-time employees in the second quarter, 21, growing 9% year-over-year and triple 9% sequentially. obviously, adding more than 70 positions over the year-ago quarter, clearly demonstrate our confidence in our continued expansion of our business. cash flow from operating activities, we generated 17.1 million in the second quarter and more than 30 million in the first half of 2021. net comparison was just 17.5 million in first half of 2020. on an annual level, we can now plan on annual cash flow from any activity of 55 to 60 million in 2021, generating a lot of cash and allowing us to allocate capital for various targets that we see. deferred revenues continue to grow and mounted to 73.3 million versus 65.1 million a year ago, an increase of 12.6% over the second quarter last year.
now let's go to the key business area that present the most potential for us. let's talk first about microsoft, so microsoft business grew above 20% in the second quarter, we have seen accelerating mid-market opportunity, that we had access to. we have been leveraging audiocodes live services. i'll talk more of that later on, for microsoft teams. mostly around that [indecipherable] as a service, and at this stage live contracts, total contract value pipeline equal, several 10s of millions going forward. so, we have generated for us quite a potential going forward, within the microsoft team space ip phone business came back from 2020 and was stable in showing plenty of room for growth. that was a very nice comeback as compared to 2020 where you know we all suffered from the pandemic. and the fact that there were no purchases of devices for premises, though the magnitude of recovery is somewhat encouraging.
we all know about the ongoing supply constraints and therefore, we believe that we could be hurt in the 3rd quarter from a shortage of chips. we continue to certify our devices for video conferencing in the team's environment. i also invested quite a lot in the microsoft's teams environment. we have been investing in a new proprietary development for that ecosystem, invested substantial r&d to come up with an offering that's new to the market. we assume that we will talk more about it as we launch it, early 2022. about our live cloud operation, where we try to provision and help our service provider, provide a live service themselves, we saw some progress in that space. we are releasing a major release in the september timeframe and that will allow us to add multi-tier and reporting, make it more powerful for the go-to-market. we have one big oem at the sign up to live cloud and is now introducing it in their channels. another program that is very important to us is microsoft operator connect, microsoft introduced api for teams allowing operators to integrate to the teams marketplace and offers their plans and vads, that's cloud testing with operator connect api started already and we expect an introduction to the market in the first half of 2022.
in terms of growth we've seen definitely growth in the team space, since it's grown 90% year-over-year, compared to the second quarter in 2020. skype for business continues to decline. all in all, if you compare it to the second quarter of 2020, the decline was about 45% year-over-year. all in all, we continue just as mentioned before, to grow an overall microsoft business 20% year-over-year. at this stage skype for business really is down to a level where further decline will not contribute much to decline of skype for business. i'm sorry, microsoft. it was also a very successful quarter in terms of new business created. we have seen a lot of business created mainly in the teams' space. we have seen an increase of more than 100% year-over-year and more than 20% sequentially. so definitely quite active area for us.
in terms of some of the wins we enjoyed, i can talk about one big win in western europe, where we provided a managed services solution to administer minutes of the solution in that space. the significance is that managed services providers finding audiocodes live, is an easy way for them to accelerate time to service. we also enjoyed a large contract with a leading tier 1 operator in asia pacific, basically it's a large, we believe the cloud service providers continue to rollout teams to the smb and mid-market accounts, through those type of services. also we have seen large enterprises, which we acquired discussion in skype for business many years ago, they keep placing purchases and expansion as they migrate to teams and we've got such examples, both in japan and the us.
now to our live offering, which is really the key to our success, going forward. so let's talk about teams' voice as a service, this is where we focus teams' voice as a service, our best offering today in the market. in 2021 we have significantly stepped up our efforts and the accelerated the introduction of audiocodes live teams, voice-as-a-service, addressing critical challenges faced by mid-and large-sized businesses, as they adopt microsoft teams phone system. teams versus a service removes complexity from the integration of teams collaboration, unified communication, and enterprise telephony and provide a seamless, rapid and cost-effective migration to teams. in building this service, we have brought together our sbc network and user management products and complete set of automation and are delivering them on a, per user, per month, software as a service model. this allows our customers to quickly integrate sip trunk contracts, integrate with legacy solutions, and rollout globally, including on-premises devices such as phone video rooms in analog adapters.
our consulting services team can help address planning, design, and discovery, together with the partners or to complement the capability for some office through 65 fares[phonetic] who have expertise in the microsoft solution but lack telephony knowledge. since introducing the concept, this live mid last year we experienced good reception to the offering. we talk about this in the following and growth in our annual recurring revenues from this activity. it is important to know that using this software as a service offer, we are able to extend this offer to other markets. we have already won first accounts for siemens, such service with zoom phone customers, i'll talk about zoom in a minute. we are successful also in winning such offering in the context of the market. so audiocodes live is the key to our success going forward.
as we continue to grow very fast, our recurring revenues and made good progress in the second quarter, 21, we have exceeded by more than 10% or stated 10 million aor target for june 2021. as we now expect this type of business to go above the target to 15 million aor, by the end of the year growing 2.5 times above 2020 levels. our booking or total contract value of this business on end is already several 10s of millions dollars, by a large number of enterprises that have already started or about to start their ucaas deployments with us. also there is a nice pipeline that's growing steadily and building up. this fast-growing business is the tangible proof through our superior technology in the year as of connectivity, management, automation tools, services in adjacent application to the uc solution majority of it, for teams' voice as a service. i'm confident that this business will keep growing and represent a significant portion of audiocodes value in coming years.
now let's talk a bit about zoom, zoom starting to show up in our activities in 2021, we already reported in the first quarter of 2021 about the growth in the zoom phone area. second quarter was also a good one. we all know that zoom reported about two months ago that they've grown from one million zoom phone users to 1.5 million zoom phone, [indecipherable] and announce it. we had one, although we made quite a big leap over 2020, the quart would have been substantially higher except for one big deal that had slipped in the 3rd quarter. so all in all, we are building our presence in the zoom phone area, the amount of new opportunities developed in the second quarter, was substantially above anything we saw ever, in the zone phone area amounting to several millions just in the second quarter. just to remind you that also in the first quarter we had above one million of business created. so all in all, we start to see some enterprise zoom phone deals that are rolling out over a prolonged period. we also talking about introducing more of what we do in the microsoft voice space to be applicable to the zoom phone area. basically, we try to position our surface the best voice goes to partner for successful collaboration players, such as microsoft and now we start to see that with zoom too.
talking a bit about sbc business which was great in second quarter, we grew above 20%. actually, we at this stage, are well into our plan to reach 120 million of sbc revenues in 2021. side by side with our ability to deliver a good quarter, we've seen nice growth in booking going forward. both in life and non-life environment and also we have seen similar such phenomenon in the contact center and in the microsoft business. so all in all a very good quarter again from a geo split, i'll mention that, it's split almost 1/3 in north america and 1/3 in west europe, about 17% in apac and the rest in the carlisle in eastern europe. so all in all, we are well on plan to execute on our plan to grow this year by more than 20%. most important, our services business as we have mentioned before, we grew above 32% year-over-year, majority of the growth really comes from the professional services area and mostly from managed services. very strong, i would say that the complexity of launching a new voice service within an enterprise, usually our ability to provide those services, provide both the products and the accompanying services so that we can basically provide the enterprise with quick turn to deployments in operation, is much appreciated by our customers, already have a very nice pipeline of opportunities in this area. so professional services and managed services is becoming key all in all, it represents about 38% of our revenues in the second quarter.
just to touch on some of the developments in the contact center market, so we're starting to see webrtc as a key successful technology as we have mentioned before, when you start to place agents at arm or a lot of the communication goes from home, there is a need for good i-quality voice solution to be transported over internet clients, webrtc provides that. it's being used mostly in the contact center area and we have seen a record quarter in terms of our webrtc operations. also we focus in the contact center market mainly on collaborating with genesis, so we have invested quite heavily in transitioning some of our solution into the cloud environment. we have already registered for leading application in genesis up foundry solution in the cloud, namely voice, both connectivity, webrtc, teams integration, and advanced [indecipherable]. so all in all we starting to see some developments here already, so some first few projects with our webrtc and live operation in contact center.
last i'll touch on the development in the voice ai area or conversational ai. we have been able to grow revenues and booking by more than 100%, i would talk mainly about our voice.ai connect activities, which have shown great growth, that's debt [phonetic] immediately and also a lot of success for smarttap or compliance recording solution. the transition of communication and collaboration platforms into teams' really make it necessary to move all of the old compliance recording solution to teams' too. so we enjoyed a lot of business in that area. so smarttap has been growing fairly fast and basically, it is shown almost 100% year-over-year growth. touching on voiceai connect, this i've mentioned in the past, this is a solution that allows to connect the voice world, telephony, contact centers, sip trunks, pbxs to cognitive services, such as speech with text, text with speech and more. we made quite a progress in the second quarter, in terms of revenue we have more than doubled first quarter revenue, booking grew 10 times more than the first, i'm sorry, the same quarter in 2020.
we have created a lot of opportunities and roughly, we are above and beyond the plan we had at the beginning of the year. so at this stage, we are in a fairly accelerated more than that. out of all the different projects we have in that space, i'd like to touch on one very specific, which is key to our success going forward, i'll talk about vodafone. vodafone has a bot called tobi, is vodafone at the channel digital system, that is in use in multiple vodafone countries, many markets. it is used by vodafone to be constantly engaged with its customers, offering persistent assistance and customer experience. now vodafone has selected audiocodes voiceai connect to enable its customer to talk to tobi, their chatbot. voiceai connect not only facilitates of voice interaction with tobi, but also integrates with vodafone multi-vendor customer support system, including genesis, [indecipherable] and cisco. initial rollout started earlier this year in south africa, with positive feedback and plans for rapid expansion to additional countries and later also other use cases, including agent assist, speaker verification in outbound calls. the solution is provided estimated service vodafone datacenters in subscription-based model and it should be used all over the world.
with that, i have completed my introduction to this call and we would like to take the call into the q&a session, operator.
",":
operator
thank you. at this time, we'll be conducting a question-and-answer session. [operator instructions]
our first question comes from the line of samad samana with jefferies, please proceed with your question.
samad samana -- jefferies -- analyst
hi, good morning and thank you for taking my questions. maybe first shabtai, i appreciate all the detail that you gave in your prepared remarks, but just, it's added notable to me that you're seeing zoom phone more often, that felt like something incremental or new. can you maybe just help us understand how you get that partnership to work and are you seeing zoom customers decide between zoom phone and microsoft teams for telephony or just maybe, what are you seeing from those two, head to head?
shabtai adlersberg -- president & chief executive officer
so zoom as far as we know, right, much of what i'll tell you really comes from the market, zoom was very and will be successful, mostly in the lower end of the market. they're working their way up to the mid-market and the large enterprise. obviously, we have more value to offer when you come to enterprise. so if zoom steps into more and more deals with large enterprise and mid-market company's, collaboration with zoom will pick up, and that's really the so far, better performance in the first half of 2021.
samad samana -- jefferies -- analyst
great and then maybe just a follow-up question on the guidance, we saw the bump up in the revenue outlook but eps was held in the same range. i'm curious, how much of that is due to the fx weakness versus the ramping of actual growth investments? just can you help us bifurcate that end and if it hadn't been for fx, would you have raised that eps guidance?
shabtai adlersberg -- president & chief executive officer
yeah. so we had a step function in terms of the fxo all the impact of the us dollar exchange rate are going down from 0.7 to is now fully embedded. and therefore, we do not expect any further change in coming quarters. on the other end. i can tell you that we have pressure from both partners and some big customers to perform certain developments, some of our partners come to us with request to invest and develop new capabilities and are serving them says, yes, we will be evaluated and we will invest in it. so basically this is really what drives our investments that considered in most of the investment really well made in 3 different areas. its r&d developing those solutions it sales and marketing to attract and achieve more sales in the market and then service because once we focus more on in services, we need to increase personnel that helps customers deploy those managed services. beyond that, i think that we need to take again into consideration two phenomena, one is the shortage in components, which may hurt sales going forward 3rd quarter. we already know that some deals were pushed from the 3rd quarter because of shortage of components. and then there's also the pandemic, which you know, we all thought we were out of it and now we have the 4th wave. so trying to be a bit more conservative, i can tell you that we will keep pushing on all cylinders and growing revenues, but as far as, on our profitability, we need to be more conservative. that's where it is.
samad samana -- jefferies -- analyst
okay, great and then just one housekeeping question, i didn't hear if you said teams growth specifically for the quarter, can you just tell us what teams related growth, was please?
shabtai adlersberg -- president & chief executive officer
i'm sorry can you repeat the question please?
samad samana -- jefferies -- analyst
yeah. microsoft teams-related growth, i think you said overall, microsoft. [speech overlap]
shabtai adlersberg -- president & chief executive officer
yeah, yeah. we've. yes. yeah. i've mentioned the teams revenue grew 90% year-over-year. 9 zero.
samad samana -- jefferies -- analyst
okay, great. great, thank you. i'll turn it over to the next analyst, appreciate the questions this morning and congrats on the quarter.
shabtai adlersberg -- president & chief executive officer
thank you so much. thank you.
operator
thank you. [operator instructions] our next question comes from the line of greg burns with sidoti and company, please proceed with your question.
gregory burns -- sidoti & company -- analyst
good morning. is there any potential benefit for you from zoom's act pushing of five9?
shabtai adlersberg -- president & chief executive officer
good question, greg. so on the first glance, not sure. however, should zoom be successful in integrating with five9, in terms of their customer base with five9, zoom is the strong mid-market player. that may help may help zoom to win those mid-market players. now if that happens, the answer is yes. meaning that, if zoom is successful in acquiring more mid-market customers of five9, that would be good for us.
gregory burns -- sidoti & company -- analyst
okay and then just getting back to the opex and the increased investments you're making, i didn't quite catch it, did you raise your target for opex that cap from 47, above 47, how should we think about that going forward?
shabtai adlersberg -- president & chief executive officer
yeah, good question. okay. good question. originally when we have established a range for opex to be capped at 47% that was made end of the last year. we have not anticipated that us dollars will depreciate against the new israeli shekel that much. i'll tell you that the guiding line for us is really increasing investments where it needed, be it in services, be it in r&d, in other areas or adding sales positions. so in view of that we'd rather change what we have said that opex will be kept by 47% and basically we want to extend it to be kept by 50%, ok, and increase of 3%. that would mean that, if that happens, then operating margin will go down toward the 20%, rather than stay as they are today, above 22%. so that's the [indecipherable] we give priority to increasing investments over profitability.
gregory burns -- sidoti & company -- analyst
okay and then in terms of the decline you are seeing in the service provider, the cp area, it's pretty, i guess significant decline this quarter. what's the outlook for that, the term of the year. and do you expect to stabilize or to continue on the same downward trajectory?
shabtai adlersberg -- president & chief executive officer
second quarter, represented bottom[phonetic] into the stats, we have received some signs of a better market in 3rd quarter already, some of the customers, some of the service provider really did not place with us purchase order for a long time. we started to see toward the end of the quarter, some new po's, however with the rise of the 4th wave, hard for me to say. i will tell you that in our plans because enterprise market goes well, sulfur and services goes well. most of the company priority and strategy lies in that area and therefore at this stage, service provider is still a 10% to 15% revenue service for the company, but we place less importance to that. we'll have to live with what the market provides us.
gregory burns -- sidoti & company -- analyst
okay. thank you.
operator
thank you, ladies and gentlemen. [operator instructions] thank you.
our next question comes from the line of ethan etzioni with etzioni portfolio management, please proceed with your question.
ethan etzioni -- etzioni project management -- analyst
yes. i wanted to ask about the interest expense, why would you have an interest expense when you have so much cash and no debt?
shabtai adlersberg -- president & chief executive officer
you know, first, we are investing in market versus securities are mostly at the yield of 1% because we don't want to take any risk about our cash investments and there were some exchange rate differences, it come close to zero for this quarter and previous quarter. of course, if the interest rate, at the marketable securities or bonds will raise, we should expect more.
ethan etzioni -- etzioni project management -- analyst
but the negative, do you have ifrs 16, are you impacted by that or you're not subject to, is gaap subject to ifrs 16?
shabtai adlersberg -- president & chief executive officer
no, we are subject to us gaap, not to ifrs.
ethan etzioni -- etzioni project management -- analyst
okay. so this is nothing to do with leasing or something like that?
shabtai adlersberg -- president & chief executive officer
no leasing and we don't gaap, we take it out as a reconciliation. you can look at the reconciliation between the gaap and the non-gaap. so no impact from the leasing.
ethan etzioni -- etzioni project management -- analyst
so we should expect a positive, the finance income over the long term?
shabtai adlersberg -- president & chief executive officer
yes.
ethan etzioni -- etzioni project management -- analyst
yes. okay, thank you very much.
shabtai adlersberg -- president & chief executive officer
okay.
operator
thank you, ladies and gentlemen, that concludes our question-and-answer session. i'll turn the floor back to management for any final comments. thank you.
shabtai adlersberg -- president & chief executive officer
thank you, operator, i would like to thank everyone for attending our conference call today. with continued good business momentum and execution in the first half of 2021, we believe we are on track to achieve another strong year of growth and expansion in 2021. we look forward to your participation in our next quarterly conference call. thank you very much. have a nice day.
operator
[operator closing remarks]
duration: 48 minutes
call participants:
roger chuchen -- vice president, investor relations
shabtai adlersberg -- president & chief executive officer
niran baruch -- chief financial officer & vice president of finance
samad samana -- jefferies -- analyst
gregory burns -- sidoti & company -- analyst
ethan etzioni -- etzioni project management -- analyst
more audc analysis
all earnings call transcripts




"
