q,ticker,dt,prep_remarks,QnA
2020-Q1,AUDC,2020-04-27 08:30:00,"prepared remarks:
operator
greetings ladies and gentlemen, thank you for standing by. welcome to the audiocodes first quarter 2020 earnings conference call. at this time, all participants will be in listen-only mode and a question and answer session will follow the formal presentation. [operator instructions] please note this conference is being recorded. at this time, i'll hand the conference over to brett maas with hayden ir. brett, you may begin.
brett maas -- managing director, hayden ir
thank you. hosting the call today are shabtai adlersberg, president and chief executive officer and niran baruch, vice president of finance and chief financial officer. before we begin, i'd like to remind you that the information provided during this call may contain forward-looking statements relating to audiocodes' business outlook, future economic performance, product introductions, plans and objectives related thereto, and statements concerning assumptions made or expectations as to any future events, conditions, performance, or other matters are forward-looking statements as the term is defined under u.s. federal securities law.
forward-looking statements are subject to various risks and uncertainties and other factors that could cause actual results to differ materially from those stated in such statements. these risks, uncertainties, and factors include, but are not limited to, the effect of global economic conditions in general and conditions in audiocodes' industry and target markets in particular, shifts in supply and demand, market acceptance of new products and the demand for existing products, the impact of competitive products and pricing on audiocodes and its customers' products and markets, timely product and technology development upgrades and the ability to manage changes in the market conditions as needed, possible need for additional financing, the ability to satisfy covenants in the company's loan agreements, possible disruptions from acquisitions, the ability of audiocodes to successfully integrate the products and operations of acquired companies into audiocodes' business, possible adverse impact of the covid-19 pandemic on our business and results of operations and other factors detailed in audiocodes' filings with the u.s. securities and exchange commission. audiocodes assumes no obligation to update this information.
in addition, during the call, audiocodes will refer to non-gaap net income and net income per share. audiocodes has provided a full reconciliation of the non-gaap net income and net income per share to its net income and net income per share according to gaap in the press release that is posted on its website. before i turn the call over to management, i'd like to remind everyone, this call is being recorded. an archived webcast will be made available on the investor relations section of the company's website at the conclusion of the call. with all that said, i'd like to turn the call over to shabtai. shabtai, please go ahead.
shabtai adlersberg -- president and chief executive officer
thank you, brett. good morning and good afternoon everybody. i would like to welcome all to our first quarter conference call. with me this morning is niran baruch, chief financial officer and vice president of finance of audiocodes. niran will start off by presenting a financial overview of the quarter. i will then review the business highlights and summary for the quarter and then discuss trends and developments in our business in the industry. we will then turn it into the q&a session. niran?
niran baruch -- chief financial officer
thank you, shabtai and hello, everyone. as usual, on today's call we will be referring to both gaap and non-gaap financial results. the earnings press release that we issued earlier this morning contains a reconciliation of the supplemental non-gaap financial information that i will be discussing on this call.
revenues for the first quarter were $52 million, an increase of 11.7% compared to the first quarter last year. services revenues for the first quarter were $17.7 million, accounting for 34% of total revenues. the amount of deferred revenue as of march 31, 2020 was $64.2 million compared to $52 million as of march 31, 2019. revenues by geographical region for the quarter were split as follows; north america, 41%; central and latin america, 10%; emea, 34%; and asia-pacific 15%. our top-15 customers in aggregate represented 63% of revenues in the quarter, of which 50% are attributed to our 11 largest distributors.
gross margin for the quarter was 65.9% compared to 62.8% in q1, 2019. non-gaap gross margin for the quarter was 66.1% compared to 53% in q1 2019. operating income for the quarter was $6.2 million compared to an operating income of $4.5 million in q1, 2019. on a non-gaap basis, quarterly operating income was $7.9 million or 15.2% of revenues compared to an operating income of $5.5 million in q1, 2019.
net income for the quarter was $5.3 million or $0.17 per share compared to net income of $3 million or $0.10 per share in q1 2019. on a non-gaap basis, quarterly net income was $7.8 million or $0.25 per share compared to net income of $5.5 million or $0.18 per share in q1 2019.
our balance sheet remains strong at the end of march 2020. cash, cash equivalents and bank deposits totaled $74.2 million. day sales outstanding as of march 31, 2020 was 50 days. operating cash flow generated during the quarter was $6.8 million. on february 4, 2020, we declared a semi-annual dividend of $0.13 per share. the dividend, in aggregate amount of $3.9 million, was paid on march 4, 2020.
now, to providing an update on our guidance. we reiterate our guidance for revenues for 2020 to be in the range of $214 million to $222 million. we are now raising our guidance for non-gaap diluted earnings per share to be in the range of $1.09 to $1.13 compared to the original range of $1.08 to $1.12.
i will now turn the call over back to shabtai.
shabtai adlersberg -- president and chief executive officer
thank you, niran. we are pleased to report strong financial results for the first quarter 2020. as stated earlier in our financial release, we enjoyed good business momentum in the core, both in the enterprise space and the service provider space. we experienced growth in all of the major market segments in which we participate including the uc-as-a-service market, the contact center market and the service provider all-ip migration market. underlying our success in the first quarter of 2020 is the financial performance. let me touch on each of the main points.
revenue growth, we continued our double-digit growth of past two years and delivered 11.7% growth year-over-year. gross margin expansion, we kept the steady progress in improving gross margin. in the first quarter, gross margin was 66.1%, compared with 53% in the first quarter of 2019, and 65.1% in fourth quarter 2019.
operating margin improved substantially from 11.9% in the first quarter a year ago to 15.2% in the first quarter of 2020. we expect continued growth in gross margin in the second quarter in the second half of 2020 as a result of lower expenses anticipated in certain budget items resulting from the covid-19 pandemic impact.
net income growth, we saw nice increase in earnings in the first quarter 2020, delivering net income of $7.8 million compared to $5.5 million in first quarter 2019, an increase of 41.8%. cash flow, we kept producing cash from operating activities, delivering $6.8 million, in line with our plan for the whole year.
finally, deferred revenues continue to grow and amounted to $64.2 million an increase of 23.4% over first quarter 2019. i'd like to stress and note here that with revenue growing steadily in the past several quarters and deferred revenues growing in a similar trend all along, our ability to meet the top-line targets of every new quarter we're stepping in is improved, hence the momentum and the confidence in achieving the revenue target in coming quarters.
now, to an update as to the impact of the coronavirus pandemic in the first quarter of 2020 and projections for second quarter and the full year. around the middle of the first quarter, we experienced difficulties in the manufacturing for our hardware products in china. with china resuming business activity partially in the second half of february and more so in march, we were able to quickly recover from the associated delay and we were able to ship all of the products as planned during the quarter. then in compliance with the israeli regulation meant to cope with the covid-19 crisis, we have moved on march 16 the majority of our headquarter employees, about 85% of them, to a work-from-home basis. similar such transitions took place in our u.s. facilities and elsewhere in the world. the transition went smoothly including our research and development team, sales and marketing. only must-carry-on premise activities such as warehouse, final testing and qa, which have to use on-prem equipment continues to be carried in our facilities. i'm glad to report now that, so far, none of our employees was diagnosed positive with regards to the coronavirus.
now to a pleasant surprise related to working remotely using collaboration tools. as i've mentioned before, we moved to working from home on march 16. since then, i can report that productivity has substantially improved. the improved productivity was confirmed across the company's various teams. prior to the crisis, we were using skype for business on premise at office which did great for our next collaboration. however, now remotely, where communication and collaboration is your only savior, nothing gets done unless it is well communicated, documented, followed, etc. currently, communication and collaboration is much more crucial when you're not in the office. so, we see now great future for collaboration in our core activity, mainly with large enterprises. to a large extent and for certain use cases, work-from-home in a well managed and coordinated work environment seems to provide similar, if not superior, productivity compared to working on-prem. this phenomena deserves a longer discussion. i'll leave it at that. but this phenomenon also points to the ability of businesses to lower operating expenses in certain areas going forward.
now to some of the top highlights of the first quarter. our main market, as you see is the service and we all have seen use of uc-as-a-service exploded in the first quarter. as the world is going digital and its transformation to a digital and remote workplace is in full power these days. in recent years, we have channeled most of our investment and efforts toward the unified communication and collaboration market. in 2019, we derived above 55% of our $200 million annual revenue from this market. serving to the markets of skype for business and teams market provided around $80 million of this revenue. in previous calls, we highlighted the fact that the ucaas market is growing for the past 10 years and that we see it continuing this growth for the foreseeable future. according to a forecast from early 2019, this market has shown compound annual growth rate of about 18% and with growth constructions to about 25% in north america and 7% globally. obviously, this market offers a lot of room for expansion and growth for a voice infrastructure vendor like us.
in the first quarter of 2020, we saw acceleration in the transition to ucaas compared to previous year. this is attributed mainly to the explosive growth of several hundred percent to more than 600 million users worldwide using communication collaboration and web video conferencing as a result of the coronavirus pandemic and the associated move to working remotely in work-from-home. as reported by leading companies such as microsoft, cisco, and zoom, ucaas usage skyrocketed in the first quarter of 2020, a phenomena which contributed to increased sales across the board in this space. as a result, revenues related to uc-as-a-service in the first quarter grew to more than 60% of our business. this growth related mainly to service in the microsoft teams market. we will provide more details on this later on. this is not a passing trend. we saw continued strength in april and believe we will see continued substantial growth of uc-as-a-service in coming years. i believe that it is now realized by most leading businesses worldwide that an advanced and efficient communication and collaboration application is key to improved level of productivity across the enterprise and also key in the new emerging work-from-home trend.
now to review some of the business lines in which we are focused. our networking business kept growing 12% year-over-year and has reached a level of $49.9 million, accounting now for 96% of our business. our technology line remains at 4% only. the networking business comprises of two key business lines, the uc-sip and the gateway business line. the uc-sip business line grew nicely in the quarter but that's that in the moment. we saw decline in our gateway business. uc-sip business line grew substantially above 20% in the first quarter and provides now to above 60% of our business revenue in the quarter due to the growth where increased sales in three of our leading product lines, including the session border controller line, our centralized network management software, and our advanced routing management solution. noteworthy is the fact that revenue in the uc-sip business lines were substantially above this 15% to 20% annual rate in previous years. gross margin for this business line increased and is now above 65%, mainly due to the increased sales of software products, transition to cloud communication and nice level of service sales. all these combined contributed massively to the company overall gross margin of 66.1%.
so, in summary of the review and current trends so far, i would say that based on the momentum in our business activity during the first quarter of 2020, in recent few weeks, coupled with good productivity in our operations, we believe with our ability to meet the original target performance trend for the second quarter and full year is in place. also, i'd like to add that currently we have no plans for layoffs. also, as a matter of fact, the company expect to keep select hiring worldwide for new jobs this year.
we had capital for operations in the microsoft base, so revenues grew more than 20% compared to the year ago quarter. that was a very strong quarter revenue wise, also from the standpoint of creating new opportunities. newly created opportunities in the first quarter more than doubled compared to the year ago quarter. we see continued accelerated trend of new opportunities created in recent weeks in april. as for microsoft teams, microsoft reported massive demands for the cloud services and swift adoption as part of -- was often due to the corona crisis. they've reported 44 million daily active users before the end of march. so one can expect that would keep growing up in april. so they've reported in mid-march, 44 million compared to only 20 million in november. i will just say that those are business customers with the [indecipherable] consumer who use our video conferencing.
one major comment that i need to make here is that the majority of the teams deployment these days are mainly used for collaboration purposes, meaning the functionality of presence and chat are the key functionality being used. and most of the time, voice channels are not added. according to some estimates, we believe that only about 5% maybe less than 10% includes voice. that means a lot for us, understanding that since voice -- since daily active users will grow to 100 million and above. that leaves for us a huge area to grow once we will see more emphasis put on the voice side of things. and we believe that we should see that coming in the second half of 2020. we have seen in the quarter, accelerating number of opportunities with microsoft teams. we've seen, also in the space, a lot of activity in meeting devices. we've seen gradual progress developing in market awareness through our partnership with dolby and our conference room devices, the rx suite.
we have announced, few weeks ago, audiocodes live for microsoft teams. we have a plan to release the product toward the end of april. audiocodes live for microsoft teams provides a managed service to fully voice-enable teams. the core services include teams direct route, microsoft tenant management, user lifecycle management, moves, add and changes of personnel and saas integration with on-premise it and legacy voice communication. all in all, it allows businesses to move fast the team relying on audiocodes products and expertise in deploying projects in a very fast manner.
let me just mention -- give some color as to some notable deals. we have won a deal with one of the world largest chemical company with over 100,000 employees as they've selected microsoft teams and decided to work with audiocodes for our networking solution. we're primarily selected, thanks to our abilities to run on microsoft azure, and implementing microsoft's new local media optimization functionality. for their remote branches, they selected the audiocodes mediant 800 of managed applications -- client sessions, sorry. this means that audiocodes is monitoring and managing the mediant 800 from our network operations center. this account again demonstrates how audiocodes cloud and premise portfolio are working together to meet the needs of giant companies and when combined with our professional services, we have a very compelling solution.
another example is a huge energy company. our devices strategy continue to gain ground with large deal done with one of the world's largest oil and energy manufacturers. this company is rolling out microsoft teams and they've selected our flagship c450 color touchscreen phone for their office workers. over time, and as they grow their deployments, we expect about 1 million in desk phone devices and mixed room devices. we were awarded this project, thanks to our portfolio of devices and excellent sound quality, a centralized management that we demonstrated throughout the evaluation process.
in other accounts, in the unified communication market, zoom, we have -- growing the number of the zoom opportunities, which is the first quarter of such growth. we've seen trends of opportunity often within an amount potential of few millions. we have been -- those opportunities are mainly in north america but some come from emea and apac and in all opportunities, it's mainly the sbc and the ip phone, which was certified by zoom for our key offering. also, aws, we went live with a very efficient service of our session border controller, which is a pay-as-you-go sbc, in aws marketplace end of january, we have generated more than 30 customers in february and march. we have a first public case study, a company called emc insurance, 2400 employees, 19 u.s. location using aws chime sip trunk.
going to our session border controllers, with a record quarter, we grew more than 30% year-over-year. most of the revenue came from enterprise accounts, about 70% of revenue. in terms of geo split, it was mainly even between north america and europe. it's contributing about 36%. we also saw a stepping up in the new created opportunity number. to give you some perspective on the line, that line has been -- annually that line has been about $16 million in 2015. we should end up 2020 with more than $70 million, so nice grow. also on the quarterly basis, we keep growing both product and services, so all in all, one of our most important business. time has shown, it is very competitive. we're winning many wins against competitors, i mentioned previously, [indecipherable].
so i mentioned the products, the new products we have, so, i've mentioned the pay-as-you-go offering in aws market place. aligning with our aws -- aligned our offering with how aws charges, which are in both connector, as i've mentioned, we have more than 30 customers. also today, we've announced cooperation with google-the google one click program. this is a true software-as-a-service offering that connect google's dialogflow virtual agents to telephony, a new brand portal where our customers can purchase phone numbers in the u.s. and u.k. in a moment and connect them to dialogflow virtual agents. in the future, we intend to connect dialogflow to our voice.ai gateway, which will provide better status in the access.
coming to talk a bit about the work-at-home, the global covid-19 crisis is closing companies all over the world, to move all over a significant process of the workforce to remote working in order to ensure business continuity. this is what is driving teams and zoom usage. audiocodes announced three work-at-home offerings. we have announced audiocodes live for microsoft teams, i discussed that already. we also offer a connectivity solution for work-at-home contact center agents. this is an highly efficient web, rx50-based cellphone, which ensures high voice quality solution for work-at-home contact centers.
two examples, a large north american health benefits company, which is moving all of their agents who work from home, basically they have determined that agents working from home are more proactive, it is easier to find and retain talent, employee satisfaction is higher and improved -- provides business agility. audiocodes was selected to design and deploy our complete one voice solution, include opus-enabled session border controllers, ip phones in our management one voice operation center. this project is expected to gradually expand to support more than 15,000 agents who work at home. last, just to mention that another company from australia, another contact center company has adopted webrtc as their solution for agents at home. we think the rapid growth of different retail chains that -- which work at home, technology can help much. this company was, you know, just needed to expand their customer service capacity to take order via phone calls and work-at-home agents and leveraging our webrtc capability exposure for our session border controller.
we also won, and this is a very notable win, we won one of the leading uc market providers worldwide. they are expanding their service and operations to specific countries in apac and cala, in need for right and needed a high capacity session border controller platform due to regulatory requirements. we were selected out of seven sbc contenders, thanks to our flexible sbc capabilities alongside with our ovoc lifecycle management suite and primarily gross time voice quality monitoring. and with that i've basically came through the end of the review of our business line activity.
i'll just get back to few more words about guidance. based on the activity in the first quarter, we believe that we should be able to meet our original performance targets for the second quarter and full year. and so we do not change the guidance provided earlier for the revenue range of $214 million to $222 million. we are confident as to earnings. we are confident in our ability to continue the growth in our earnings. as a result of the success to grow on it in the first quarter above the original plan, we are now updating our earnings guidance and increased the earnings range to $1.09 to $1.13. with that i have completed my presentation and we can move the call to the q&a session. operator?
",":
operator
thank you. we'll now be conducting a question-and-answer session. [operator instructions] the first question is from the line of rich valera with needham. please proceed with your questions.
rich valera -- needham and company -- analyst
thank you. congratulations on the strong results in a challenging environment, shabtai and team.
shabtai adlersberg -- president and chief executive officer
thanks.
rich valera -- needham and company -- analyst
so you gave the growth for the microsoft related business and i think you said well over 20%. so i'm wondering if you could put a finer point on that in terms of how fast it grew. and then, i'm wondering if you could give us a sense of how fast you're expecting that business to grow for all of 2020. i know historically you've tended to bracket that in the range of 15% [phonetic] to 20% [phonetic], but it sounds like you're running ahead of that so far. and then obviously you reiterated your full year guidance and it sounds like, actually the microsoft piece is running ahead of plan. so wondering if anything is running below plan. i know you mentioned your gateway business was down for the quarter. is that what you expected and do you expect that business to be down for the year? so a lot there, but i'll let you answer those things, shabtai.
shabtai adlersberg -- president and chief executive officer
okay. as for microsoft, well, originally, as we all remember, 2019 has been a bit slow, but toward the end of 2019, i believe that many of the potential customer moved off the fence they were sitting on and decided to go with teams. so that has driven, initially in january and february, good portion of the business. then as we all know the corona crisis really caused dramatic growth in usage of uc-as-a-service, minutes of meetings calls, conferences. so that has definitely helped to raise up interest in the solution, which for business purposes seems to be, at that moment, probably the best cloud-based solution. then on top of that i would say that we were expecting voice to take part again in the second half of the year and i think, due to the fact that conferencing has been substantially more than initially planned, use of web conferencing drives the use of phones. i mean if you watch zoom play, which went out initially with a conferencing solution and then follow that with the zoom phone, you would see similar such focus here. conferencing function in teams is very successful, very good, but that drive the usage of phone calls, etc. so all in all, i will tell you that it's a bit premature for us to make a call for the full year. we definitely see higher new opportunities, you know, development rate. so at this stage, i would stay with our $15 million to $20 million projection by may [phonetic] as well be that when we come to our next conference call, we may up that. so we need to wait.
as to gateways, yes, gateways declined in the quarter more than 10%. actually we now can start to see that this is a trend. fortunately enough, gateways are being called sold these days to medical service providers and they are basically sold in two forms. one is, you know, stand-alone gateway, the other one is gateways which are embedding routing capability and dsl capability because of that type of product, msbr, which stands for multi-service business router. now, all our sales in the service provider to market for the all-ip were almost as planned. there was no meaningful decline there. but the portion of msbr sold was more than the gateways sold. so that's one explanation. i'll tell you one more very important point is that when talking about revenues, we usually -- we all know that we combine product revenues and sales revenues and while service revenues remain at the same level or even grow a bit, the decline was mainly in the product. so that gives you some color as to what happened in the gateway business.
rich valera -- needham and company -- analyst
got it. and then i didn't quite catch, you gave some numbers for sbc revenue for last year and i think projected this year. could you just reiterate those numbers? i didn't catch them. and then if you could say how much of that sbc revenue you think was software last year and how much you think might be software this year.
shabtai adlersberg -- president and chief executive officer
okay. so roughly, the numbers, because i don't have them here and we know those numbers are internal data, and not really are discussed, but i would say that session border controllers were sold for a bit above $60 million last year. this year we look to grow this above 20% annually. as i've mentioned, in the first quarter, we grew above that target, we grew 30%. that's roughly with regards to session border controllers. it's the mix -- by the way, the mix has been 25% software last year, i believe that we will see substantially higher growth this year in software simply because many of the new implementations are cloud-based both in aws and azure.
rich valera -- needham and company -- analyst
got it. that's helpful and then you mentioned your gross margin, you expected -- i think you said you expected it to be up in q2 and you referenced covid-related expenses or expenses you're not going to incur because of covid. i wasn't sure what that comment meant. but if you could just clarify on your expectations for gross margin trajectory i guess into q2.
shabtai adlersberg -- president and chief executive officer
right, so, as we know, business activity around the world kind of stalled from the middle of the first quarter and still continues for the second quarter, we did a new estimate of budget items going forward. obviously everybody understand that traveling is going down. so expense on travelling is going down, same for marketing, simply because events which -- some of which draw a lot of expense in terms of presents and sponsorship and participation. that is not happening yet in a major way. so we expect some of these items to come down in the second quarter and second half of 2020, and that would be the source of large expense and increase the operating margin, not gross margin but operating margin.
rich valera -- needham and company -- analyst
got it, ok. so that was more in reference to operating than gross margin. okay, that makes sense. and then could you just give us an update on the voice.ai business, kind of where that is in terms of scale growth and any updates there.
shabtai adlersberg -- president and chief executive officer
right. so we have two main activities there, the nlp asr activity and then the recruiting activity. the asr nlp activity, this is very -- grows very nicely in the first quarter. we were hit -- we plan to go major efforts in other countries, but now that has stalled due to the virus. on the other hand, we have very interesting activity developing around our two new products that we have delivered to market as mentioned one in our press release, meeting insights, that is a software productivity enhancement tool which allows you to basically process, analyze and derive actionable items for meetings in a very efficient way. and basically will allow meetings to become source of productivity again compared to what is growing today. we have more than 10 accounts right now in beta and we expect to grow in a larger way in the second quarter.
another very interesting product connected with the announcements we made with the google dialogflow, the voice ai gateway, which basically allow to connect telephony in those channels into how the overview of established world of virtual agents embark. so we provide -- we have today one of the best product that's allowed. if you take the corona crisis situation where people were trying to call institutions, health organization, etc, you had massive, lot of people, most of which do not really know to use text-based chat bots for which telephony can help much, take help from people equally in their stride. so we are providing right now a very efficient solution which allows to connect massive number of telephony channels into those bots. so those are two of the new developments we have in the voice.ai business.
rich valera -- needham and company -- analyst
great, thanks for taking the questions, shabtai. i appreciate it.
shabtai adlersberg -- president and chief executive officer
sure. you're welcome.
operator
thank you. our next question is from the line of tavy rosner with barclays. please proceed with your question.
tavy rosner -- barclays -- analyst
hi, thanks for taking my questions and congratulations on the solid results. as a follow-up to your comments on guidance, you talked about how the company managed to weather the impact of covid-19 on your supply chain, and you also talked about how the switch to working from home is having a positive impact on demand. so i guess, looking at your reiteration of guidance, are you guys being conservative or, put another way, if working from home was to last for a longer period, would that be very positive for your top-line?
shabtai adlersberg -- president and chief executive officer
yeah. i think, in one of my conversation with one of our investors, it became obvious that audiocodes sits right now on two of the main trends in communications. one, which is the collaborations team and second is the work-from-home team. and because we have huge investment made over the last years and actually, we are ready with those solution connected with the right partners in the market, yes, we definitely, you know, are very confident in our business to keep growing. i just mentioned that if you look on our bottom-line earnings, we've been able to grow earnings more than 25%, 30% every year in the past five years and definitely now in view of the new developments, there is no reason to be pessimistic about it. i think we will keep growing, we just need to do the right things. we need to execute.
tavy rosner -- barclays -- analyst
that's helpful. and i guess the last one for me, how do you guys view acquisitions as part of your growth strategy? i'm asking in the context of your growing cash balance.
shabtai adlersberg -- president and chief executive officer
right. so it's a matter of the regular business. we -- in each of the business line, we do monitor and study the environment, the other players, competition sometimes and once we will get into conclusion that you know a business would be necessary, or very good to help grow or if we feel, make it jump, we will definitely do that. so yes, we are always looking for opportunities.
tavy rosner -- barclays -- analyst
great, thank you. i'll get back in the queue.
shabtai adlersberg -- president and chief executive officer
sure.
operator
[operator instructions] the next question is from the line of greg burns with sidoti & company. please proceed with your question.
greg burns -- sidoti & company -- analyst
good morning. just want to follow-up maybe a little bit on the last question. just to get a better understanding of how the business may be negatively impacted by the actions taken to fight the virus, whether it be from a sales or deployment perspective and if we do see the economy is starting to open up a little bit more, is there potentially maybe a backlog of business that could provide even more of a tailwind as we go into the second half of the year? thanks.
shabtai adlersberg -- president and chief executive officer
sure. so i believe that the world moves these days much faster through cloud communications and our real challenge as a company would be to cope with the developments and, you know, if you look on names mentioned in this call, some of the worlds biggest, largest and quite fast ramping companies that are leading unified communication and collaboration market forward, for us, that would be a big challenge to keep pace with the need to support key partners and customers. so this is where most of our energy would -- will go for. due to the fact that businesses going cloud, there's less and less requirements for on-prem deployment. so that is coming down, that's a plus. and, all in all, i believe that, we kind of revealed the value of work remotely and be efficient and we think that will really help us to get more -- we will not get leaner, we will grow and hire people but i think we can definitely grow meaner, meaning we can now get access into good resources that we can find in other places. so all in all, it's very positive. we're not really concerned with -- if you want to touch the negative of this quarter, we're not really bothered by the decline in gateways. that was perceived to happen along the time and the fact that now uc-sip is more than 60% percent of the business and gateways really declined to a level where that very decline is immaterial. i think we are in good shape.
greg burns -- sidoti & company -- analyst
okay, great, thanks. and in terms of the the voice.ai, and what you're doing with google, how -- what's the business model there? is it a flat fee? is it transactional? and what kind of installed basis google have with that platform? thank you.
shabtai adlersberg -- president and chief executive officer
okay. so very simply, this is a software-as-a-service solution, meaning that every chat bot developer that wants to add phone access today in the u.s. and the u.k. and goes to the site and click on using our solution-the one-click telephony gateway, there is a price that's for the team. so, all in all, it's a software-as-a-service solution, very simple.
greg burns -- sidoti & company -- analyst
okay and just the installed base that maybe google has a number of bots or the number of transactions that they're transacting among, just to get a maybe a feel for the size of the market or maybe you could talk about the overall size of the bot market, the opportunity you see there for yourself. thanks.
shabtai adlersberg -- president and chief executive officer
right. actually, what we announced today is a very simple -- we worked hard on implementing it, it's not that trivial. but still, it's just the first step that you can think about a cpaas solution, a communication platform-as-a-service connected to the one-click telephonic gateway. so, we intend to connect some of our capabilities in voice processing to create a more advanced communication platform-as-a-service that will help dialogflow virtual agents to use mainly in terms of our voice channels. so definitely there's huge potential out there. the bot industry grows, there's the need for easy access and we're bringing the telephony access to it using just the same bots that are there.
greg burns -- sidoti & company -- analyst
okay. and lastly the -- i guess when you gave your initial guidance, the shekel to u.s. dollar was like i think like a $0.05 headwind or so, but it seems like the shekel has depreciated a little bit that you're kind of -- what you are embedding in your guidance change in terms of the fx impact?
shabtai adlersberg -- president and chief executive officer
yes. the fx change have very important point. yes, indeed, during the crisis, the u.s. dollar has appreciated against the new israeli shekel. we took advantage of that and basically, when compared to the original budget, we have -- we will now have, in each of the coming quarter, a better budget position because expenses in u.s. dollars are going to be lower.
greg burns -- sidoti & company -- analyst
okay, thank you.
shabtai adlersberg -- president and chief executive officer
sure.
brett maas -- managing director, hayden ir
shabtai, we have a question from a shareholder, came in via email. can you please go into the details about the transition from microsoft skype for business to teams, as well as in the past, you've indicated this migration might be headwinds to microsoft revenues. also could you go into more detail on the transition? how is microsoft doing? is teams as functional yet as skype? what was the growth in microsoft related sales? what is the difference in content for skype implementation as compared with teams for audiocodes?
shabtai adlersberg -- president and chief executive officer
okay, that's a long one. okay. i'll try to take it one at a time. basically we -- i have mentioned, i mean, we as a company used skype for business for many years. it's a great unified communication on-prem solution. when we moved to work-from-home, we started using it personally, as you said, and then, you know, the huge amount of traffic over the internet side, that is usage of teams. i was surprised to see much better performance of teams compared to the skype for business and also obviously microsoft putting all its weight behind teams, adding features really quickly. so in a matter of two, three weeks, it became apparent that we want to, at this stage, put skype for business behind us and move to teams. we actually had a project when we were all at home. the it team took the project to move all of the company, we're talking about more than 500 seats from skype for business to teams. glad to say that, basically, i was -- they were afraid to move me among the first one. so i moved as [indecipherable] before 100. anyway, if everything plays well and everybody is very happy with using teams, i can tell you that in all other people complain now that using teams really makes them work essentially harder than they are used to when they came to the office and [indecipherable] and small stuff.
so, yes, teams is very efficient. i believe that in view of our experience, we will definitely see other customers of microsoft using skype for business consider moving to teams really quick. all in all, we believe that we are on top of that. i think we are one of the leading company, if not the largest one, that supports that transition. and so far, we can see, skype for business revenues are not going down dramatically simply because there's lot of expansion of accounts that have been declining seven, five and three years ago, because they keep buying equipment for their other facilities. but we definitely see a growth up with teams and hopefully i've covered all of your questions, brett, i don't remember all of them now.
brett maas -- managing director, hayden ir
no, it's ok. two more, where should gross margins level off and why? and then also, can you explain what you can sell into enterprise accounts that use ucaas service like ringcentral?
shabtai adlersberg -- president and chief executive officer
okay. so that is exactly what audiocodes live is about. so we definitely have a lot of products associated with deployment of teams, our session border controllers for direct route, phones, management systems, conference devices, etc, but the real value is really in our ability to help the companies get fast on board and the closure service very fast. so we will provide them day zero service, provide them with the planning and the deployment and then day two service with bringing it up and monitoring and everything. so, all in all, i think we can expedite the deployment of teams account, definitely in the mid-market for smbs. and by the way, one of the products announced which is called audiocodes live cloud is exactly that. we target large channels, the companies could be service providers who will then deploy our own solutions to their customers.
operator
thank you. this concludes our question-and-answer session. i'll turn the call back to shabtai adlersberg for closing remarks.
shabtai adlersberg -- president and chief executive officer
okay. so thank you, operator. i would like to thank everyone who attended our conference call today. with continued good business momentum and execution in our markets in 2020, we believe we are on track to achieve another strong growth year in our business. we look forward to your participation in our next quarterly conference call. thank you very much. have a nice day, thank you.
operator
[operator closing remarks]
duration: 54 minutes
call participants:
brett maas -- managing director, hayden ir
shabtai adlersberg -- president and chief executive officer
niran baruch -- chief financial officer
rich valera -- needham and company -- analyst
tavy rosner -- barclays -- analyst
greg burns -- sidoti & company -- analyst
more audc analysis
all earnings call transcripts




"
