q,ticker,dt,prep_remarks,QnA
2019-Q4,AUDC,2020-01-28 08:30:00,"prepared remarks:
operator
greetings, and welcome to the audiocodes fourth quarter and year-end 2019 earnings conference call. [operator instructions] a question-and-answer session will follow the formal presentation. [operator instructions]
as a reminder, this conference is being recorded. i would now like to turn the conference over to your host, mr. brett maas, investor relations for audiocodes. thank you. you may begin.
brett maas -- investor relations
thank you. hosting the call today are shabtai adlersberg, president and chief executive officer; and niran baruch, vice president of finance and chief financial officer.
before beginning, i'd like to remind you that the information provided during this call may contain forward-looking statements relating to audiocodes' business outlook, future economic performance, product introduction, plans and objectives related thereto, and statements concerning assumptions made or expectations as to any future event, conditions, performance or other matters are forward-looking statements as the term is defined under us federal securities law.
forward-looking statements are subject to various risks, uncertainties and other factors that could cause actual results to differ materially from those stated in such statements. these risks, uncertainties and factors include, but are not limited to, the effect of the global economic conditions and conditions in general, and in audiocodes as an industry and target markets, in particular, shifts in supply and demand, market acceptance of new products and the demand for existing products; the impact of competitive markets and pricing on audiocodes and its customers, products and markets; timely product and technology developments; upgrades and the ability to manage changes in market conditions as needed; possible need for additional financing; the ability to satisfy covenants in the company's loan agreements; possible disruptions from acquisitions; the ability of audiocodes to successfully integrate the products and operations of acquired companies into audiocodes' business; and other factors detailed in audiocodes' filings with the sec, us securities and exchange commission. audiocodes assumes no obligation to update that information.
in addition, during the call, audiocodes will refer to non-gaap net income and net income per share. audiocodes has provided a full reconciliation of the non-gaap net income and net income per share to its net income and net income per share according to gaap in the press release that is posted on its website.
before i turn the call over to management, i'd like to remind everyone that this call is being recorded. an archived webcast will be made available on the investor relations section of the company's website at the conclusion of the call. and with all that said, i'd like to turn the call over to shabtai. shabtai, please go ahead.
shabtai adlersberg -- president and chief executive officer
thank you, brett. good morning and good afternoon, everybody. i would like to welcome all for our fourth quarter and full-year 2019 conference call. with me this morning is niran baruch, chief financial officer and vice president of finance of audiocodes. niran will start off by presenting a financial overview of the quarter. i will then review the business highlights and summary for the quarter, and then discuss trends and developments in our business and the industry.
we will then turn it into the q&a session. niran?
niran baruch -- chief financial officer
thank you, shabtai, and hello everyone. as usual on today's call, we will be referring to both gaap and non-gaap financial results. the earnings press release that we issued earlier this morning contains a reconciliation of the supplemental non-gaap financial information that i will be discussing on this call.
revenues for the fourth quarter were $52.8 million, an increase of 2.7% from the prior quarter, and a 15.3% increase compared to the fourth quarter last year. full year 2019 revenues increased by 13.7% to $200.3 million. services revenues for the fourth quarter were $17.5 million, accounting for 32.2% of total revenues. on an annual basis, services revenues increased by 14.7% compared to the previous year.
the amount of deferred revenues as of december 31, 2019 was $62.2 million compared to $49.2 million as of december 31, 2018. non-paid deferred revenues as of december 31, 2019, at the amount of $19 million was deducted from the trade receivables in the balance sheet.
revenues by geographical region for the quarter were split as follows. north america, 39%; central and latin america, 12%; emea, 36%; and asia-pacific, 13%. our top 15 customers in aggregate represented 63% of revenues in the quarter, of which 51% are attributed to our 11 largest distributors.
the variance between gaap and non-gaap is of particular importance this quarter because as announced in november 2019, we entered into a royalty buyout agreement with the iia, the israel national authority for technology and innovation relating to certain grants we had received.
the contingent net royalty liability to the iia with respect to this grant at the time of the royalty buyout agreement was approximately $49 million. as part of the royalty buyout agreement, we agreed to pay approximately $32.2 million to the iia to settle the $49 million debt in full, in three annual installments starting in 2019. the $32.2 million expense is included in the gaap cost of revenues for the fourth quarter of 2019, and impacts gaap results for the three months and full year ended december 31, 2019.
non-gaap results exclude this expense. in addition, during the fourth quarter of 2019, we recorded a deferred tax asset in the amount of $20.5 million, which represents the approximate amount of net operating losses and temporary tax differences we estimate to be utilized over the next few years. gaap net income for the fourth quarter and full 2019 year reflect the effect of the tax benefit associated with the certain of this deferred tax asset. non-gaap net income excludes this non-cash deferred tax benefit.
with that understanding, let me discuss the results. gaap gross margin for the quarter inclusive of this $32.2 million expense for the royalty buyout was 3.9% compared to 62.6% in q4 2018. gaap operating loss for the quarter was $26 million compared to an operating income of $5.1 million in q4 2018. full year 2019 gaap operating loss was $9.6 million; gaap net loss for the quarter was $8.2 million or $0.28 per share compared to net income of $4.5 million or $0.15 per share in q4 2018.
full year 2019 gaap net income was $4 million or $0.13 per share. as noted above, results for the quarter and full-year were impacted by the $32.2 million expense incurred in connection with the royalty buyout agreement. pursuant to the royalty buyout agreement, we eliminated all the royalty obligations related to our future revenues with respect to these grants. this will have a positive impact on gaap gross margin starting in the first quarter of 2020.
non-gaap results are as follows. non-gaap gross margin for the quarter was 65.1% compared to 63% in q4 2018. non-gaap quarterly operating income was $8.3 million or 15.7% of revenues compared to an operating income of $6.3 million in q4 2018. full year 2019 non-gaap operating income was $28.2 million. non-gaap quarterly net income was $8.1 million or $0.26 per share compared to $6.3 million or $0.20 per share in q4 2018.
full year 2019 non-gaap income was $27.8 million or $0.89 per share. our balance sheet remains strong at the end of december 2019, cash, cash equivalents and bank deposits totaled $71.9 million. net cash provided by operating activities was $2.4 million during the quarter and $23.2 million for the full year 2019. both numbers were impacted by the $10.7 million payments made in december 2019, which was the first installment pursuant to the royalty buyout agreement.
days sales outstanding as of december 31, 2019 were 48 days. in august 2019, we received court approval in israel to purchase up to an aggregate of $12 million of additional ordinary shares pursuant to our share repurchase program. the court approval also permitted us to declare a dividend of any part of the $12 million during the approved validity period. this court approval will expire on february 3, 2020. as of today, we have used an aggregate of $3.5 million of these authorized amounts to declare cash dividend.
in december 2019, we submitted a new application to the israeli court requesting approval of an additional repurchase program for $12 million of ordinary shares. the application also requested the court to permit us to declare cash dividends of any part of this amount. a decision on our application is expected during february 2020.
we continue to expect top line revenue growth and operating margin expansion in 2020. we expect revenues in the range of $214 million to $222 million, and non-gaap diluted earnings per share of $1.08 to $1.12.
i will now turn the call back over to shabtai.
shabtai adlersberg -- president and chief executive officer
thank you niran. we are pleased to report record financial results for the fourth quarter and the full year 2019. 2019 has been our best year ever and the fourth year in a row of continued growth in revenues and net income in every single year. and so, when discussing 2019, and looking forward to 2020 and beyond, it's clear that we are now reaping the fruits of success in our eye on investments we have been doing during the past five years, with the very focus on providing more comprehensive and larger scale solution and services to our partners and customers in the unified communication and all-ip markets.
underlying our success in 2019 is the progress we've made in several key financial indicators which best demonstrates our success since 2015. let me touch on each of them. revenue growth. we saw double-digit revenue growth for the second year in a row. we grew 13.7% in 2019. we grew 12.4% in 2018. margin expansion. let me talk first on the gross margins. we saw steady progress in improving gross margins from 60% in 2015 to 63.7% in 2019. planning for 2020, we expect further increase in gross margin. operational margin improved in more impressive manner. we ended 2019 with operating margin of 14.1% compared to the year-ago margin of 11.7% and compared to just 8.2% in 2017.
for 2020, we target again meaningful increase of operating margin to well above 15%. net income growth for four years in a row, we are delivering high double-digit net income growth in the range of 30% to 60% in every single year.
in 2019, we delivered 38.9% growth on the heels of delivering 54.9% growth in 2018. cash flow. we have demonstrated further consistent ability to deliver growing positive operating cash flow results in previous five years, generating $33.9 million in 2019, compared to the $25.6 million in 2018. out of the funds generated in the fourth quarter of '19, we've paid about $10.7 million to the israel innovation authority as part of the royalty buyout agreement signed in november in 2019.
finally, deferred revenues, we grew more than 25% in 2019 to a level of $62.2 million by the end of 2019 versus just $49.2 million in the fourth quarter of 2018. when we analyze what has driven the success in 2019, it is clear that the improved financial performance was achieved mainly due to the strong trend of pstn transition to all-ip in north america and in about three or four countries in western europe with a handful of major tier 1 service providers.
we expect this migration trend to ip to continue in coming years and we plan to engage with more service providers in countries, which have yet to start at all transforming their networks and services to businesses to all-ip in the coming decade. we're talking about five years to 10 years going forward. but on a more general level, if i have to highlight the key fundamental reasons for the success we enjoy, i'll say on a general level that the strength of our business is primarily related to the very strong and healthy markets we serve, and obviously our execution capability.
i have talked so far about the all-ip market. a bigger market that keeps growing for the past 10 years and we should keep growing for the next foreseeable future is the unified communication and unified communication-as-a-service market. this market exhibits compound annual growth rate of about 18% for several years now and with whole penetration only at about 25% in north america and only 7% globally, this market offer us a lot of room for expansion and growth for a voice infrastructure vendor like us. when you add to the mix, the leadership position we develop and the strong ties with our partners the picture gets rosier.
same growth trends apply to global digital transformation trends of businesses, gearing toward a digital workplace. and similarly such opportunity exist in the process of contact center migrating to the cloud into a saas model.
so as long as we keep executing as we did in 2019 and in previous years, we should see positive results in coming years. on top of this and in order to keep the business momentum and allow further expansion of our business in the future, we are investing substantial efforts and resources in new growth engine such as the voice.ai business announced two years ago and the new evolving meeting space market.
now to the business lines. key to the success in 2019 is the consistent progress in our networking business, which grew 17.7% year-over-year to $191.7 million accounting now to 96% of your overall business in 2019. the networking business comprises of two key business lines, the uc-sip business line and the gateway business line. the uc-sip business line grew above 20% in first quarter '19 and full year 2019, and provides now to about 55% of our business about $110 million in 2019.
while investments have stabilized in size in this business line over the past several years, revenues continue to grow with about 15% to 20% annually. as a result, the business line becomes quite profitable. it first achieved profitability in 2018 and now it has more than doubled in 2019. as such, we now enjoy growing profit margins, say results of the operation of leverage.
at this stage, we do not anticipate a change in this 15% to 20% annual growth in coming years for this business line. quite important to note is that the steady annual increase of sales of more softer products, and growing services in the uc-sip business line, we experienced substantial improvement in the gross margin of this business line. and please remember, at this stage this is $110 million line, 55% of our revenue in 2019.
now let's talk a bit about our gateway business, parallel to the growth in uc-sip, we enjoyed in 2019, a strong year in our gateway business, which grew above 10% compared to 2018 and reached a level of about $70 million. as mentioned before, this is substantially due to the ongoing strength in the multi-year continued migration of service providers pstn networks to all-ip. global services also demonstrated very solid growth and strength. i'll touch on that later on.
providing a quick snapshot into the first quarter of 2020. i'm glad to know that at this stage the trend in our business continues in january, the first month of the first quarter of 2020. touching on the highlights of sales in the fourth quarter in 2019, generally sales performed very well to and above the targets we set for them. so very good performance, remarkable performance primarily in north america, in the dach region, which is germany, switzerland and austria, in the uk, in cala, russia and asia pacific.
on an annual level, those were mainly in north america, the dach region and south europe, that provided most of the revenue. to mention some of the notable deals in the quarter, we won a huge multimillion project in cala, we are talking about project managed by telefonica, and which provide a solution to a large company, i'll refer to more details about that later.
also, on the business services side, we had very large purchase order with the north american service provider that's a buying customer for several years now. same since, i already mentioned the name deutsche telekom, deutsche telekom was a very strong for us overall 2019 and also in the quarter, a few hundreds of thousands of dollars. touching on the contact center space, i'll note two deals, one in brazil, one in canada both deals relied on using our sessions border controls and gateways with genesys and others.
to give you some examples to our customer wins. let me put more color and share a few examples of customer wins and expansions that we have secured part of this quarter. outlining several of the examples, you can get a sense for how is our business, our enterprise business, how it is evolving with large opportunities in large corporations, and how our strategy is aligned and growing with cloud adoption.
let me first start, touch on that south america multi-million project. last year, sorry last quarter, we presented a multi-million dollar win in the healthcare space in the us. this quarter, we were awarded an even bigger multi-million microsoft teams deal at the latin american government agency. this agency, which is a part of the local ministry of labor oversees a large national chain of schools for developing employees' skills. in this bid, we have positioned our entire portfolio of products and services including devices, networking, management tools and implementation services.
we are proud to win such deals as they demonstrate again that our strategy of single stop shop solutions holds tremendous value for the customers and end users. this deal validates our ability to offer a networking solution for over 100 branches together with over 10,000 of ip phones. it clearly sets us apart from competition and our ability to balance and offer a broad value proposition to the customer.
second, and staying on the microsoft teams program and exploring the dynamics of markets for very large enterprises, we started to rollout a teams deployment at one of the world largest consumer goods companies. this company was referred to us by microsoft at one of their internet shows. this was because we were highlighted at that show as the vendor empowering the rollout of hundreds of thousands of skype for business seats across four multinational enterprises.
this large consumer goods company has thoroughly vetted the microsoft solution, and it's just getting started with their global rollout. at first phase, we are providing our session border controllers, and professional services. this deal is representative of many such large enterprises globally that we work with on their microsoft teams' journey.
third and last, a very large project in the us related to our all-ip migration solution for service provider, a very important multi-million win came from a tier 1 service provider in the us where we were engaged to provide gear and services in a multi-million dollar deals, combining sd-wan and uc services to a nationwide healthcare company.
in this deal, our unique offering of universal cpe combining wireless and ethernet access with voice functionality was chosen as the sd-wan platform in order to reduce the number of several cpus down to only one product. this product combined with our gateways from centralized management and professional services were the deciding factor that got us this sizable deal.
now let me touch on microsoft. revenue was above 40% of the quarter revenue. in terms of growth, we saw 16% growth above the year-ago quarter. on an annual level, revenue in the microsoft ecosystem grew about 12% to over $80 million in 2019. key in the quarter was seemingly better environment for microsoft teams voice. while as we've planned during the first three quarters of 2019, we saw more large end users embracing teams in the fourth quarter of 2019, a trend we continue to see in january 2020. also, some customers are continuing in parallel with skype for business and teams.
for microsoft announcement, we all know that teams daily active users is growing rapidly in 2019, and so we expect the side-by-side with this dramatic growth in users -- number of users and with the expected completion of gaps on the voice side in teams, which are expected in this first half of 2020, we should see better overall market in 2020. gradual progress in developing market awareness to our meeting solution, rx suite of conferencing devices and dolby partnership is another positive development in the quarter, and we all look for 2020 to be the first year of our greater penetration in the conferencing space with our devices and solutions.
i'd like to mention also on our session border controllers line, which is the leading and most promising line at this stage within the uc-sip business line. in the fourth quarter, revenue grew 18.4% year-over-year, looking on overall 2019, we grew more than 20%. we also saw very strong booking. booking grew in the first quarter by 28%. this business line is characterized by extremely high gross margin that's above 85%, growing in comparison to the previous quarters. this is mainly to the fact that a quarter for our sales of product is now in software. so, we are being deployed generally substantially more in cloud, in software solution, in virtualized version, in data centers, all-in-all, very successful fast growing and high profit margin line.
on terms of geo split, we saw nice use, both almost equal between north america and western europe. also saw some 10% in asia pacific and less than that in cala. to mention the type of few customers that we serve in that business line. so we had one very large north american service provider using our sbc. we sold sbc for more than $1.5 million. we sold two large banks. one in brazil. one in russia, consuming our session border controllers for -- we're about to see in our solution for software device -- software-defined voice networks.
also, in the asia pacific large service provider is using our session border controllers within azure as a hosted solution for teams direct route sbc. all-in-all very successful quarter for sbc business line. last, let me touch on global services. in the press release, you saw the recognition side of the business. let me talk about the booking side of the business. so, on a quarterly basis, we saw the following, we saw an increase of 26.2% in the fourth quarter for total services.
we've seen 19.2% growth in maintenance contracts, but we have seen more than 60% growth in professional services, all that in the fourth quarter. when we go to the annual level and talking about what has changed. so, overall booking of services reached above $70 million in the year. we grew about 19% on an overall services level, close to 18% on the maintenance contracts, 24% on the professional services. so, all-in-all quite successful and rapid growth here. substantially, we saw -- to give some color on that we saw substantial growth in north america professional services mainly the team there is doing a fantastic job.
we keep winning new managed services contracts mainly in desire throughout sbc area. also, we see growing a number of requests to deploy and manage the teams voice on the office 365 side. now to our guidance for 2020. first, a general comment. we have not factored in any possible impact of the potential economic developments in 2020 as a result of the corona virus. it is simply too early for that for us.
now let me touch on revenue and earnings. revenue, based on current plans and data we have, we guide for another year of growth with revenue range set for $215 million to $222 million. the mid-range guidance is set at about $218 million and that represents a growth of about 9% compared to 2019. this is pretty much in line with the 10% growth we guided for year ago for 2019.
now let me touch on earnings. before i present our guidance for the year, i'd like to touch on a key factor affecting it for us as a company at core and based mostly in israel. i'm talking about the much different us dollar versus the new israeli shekel conversion rate environment, which is now expected for 2020 versus what we had in 2019.
based on current rates for budget and planning purposes, we assume a rate of ils3.45. in 2019, the average conversion rate has been about ils3.57. so we are talking about an increase of about 3.4% regarding all expenses nominated in new israeli shekel, which are about ils45 million a year, translating to an impact of about $1.6 million or $0.05 impact on our bottom-line compared to 2019.
now to the guidance. as a result of that, we now guide for continuing growth in the earnings of more than 20% in 2020, and we are setting the range to $1.08 to $1.12.
with that, i've basically completed my introduction for this session. thank you very much. operator, would you take us to the q&a session.
",":
operator
thank you. [operator instructions] our first question comes from the line of rich valera with needham & company. please proceed with your question.
rich valera -- needham and company -- analyst
thank you. i'd like to open with a question on the microsoft business. looks like you saw a nice pickup in the fourth quarter, the microsoft businesses, i guess, teams is starting to gain some momentum. can you talk about what is still in the pipeline for teams in terms of features that you see that could help further accelerate teams? and how you're thinking about the overall microsoft business in 2020 versus the 12% growth that you saw in 2019? thanks.
shabtai adlersberg -- president and chief executive officer
right. thank you, rich. first, you know, we know that there are several features missing for the voice implementation within teams. from our ongoing discussion with microsoft, we know that the plan is now to complete them in the first half of this year. so all-in-all, we know that much will start happening in the second half.
second, as i have mentioned before in the beginning of 2019, we've seen lot of potential end users, large corporation sitting on the fence. people were hesitant. the transition from skype for business to teams has just started. teams was not complete yet. and there was much delay. that gives some explanation to why we grew only 12% in 2019 versus more than 30% in 2018.
now, we do expect and we've seen that that's where we have a much more comprehensive portfolio and you can apply that to more phones that will be introduced during 2020. we can talk about the conferencing devices that we just -- end of the year, we just sent the first few 100 devices for evaluation by customers. so, a much more complete portfolio in 2020. also we are increasing the set of services we offer. and as i've mentioned or maybe it was not emphasized enough, we now start to deal substantially with more deployments where we not only deliver the products, but also provide services and in several cases, lately managed services, meaning large companies, a few hundreds and sometimes thousands of companies will rely on audiocodes to provide their ongoing daily microsoft teams operation.
so all-in-all, we're very optimistic regarding that could be a definite change in 2020 compared to 2019 and we will just have to wait and see for the next two quarters to see that indeed happening.
rich valera -- needham and company -- analyst
great. and i wanted to move on to voice.ai. this has been an area of significant investment for you. we just hoping you get a little -- put a little more color on kind of one, how much revenue contribution you've actually seen from that to-date? how much investment you've put into that on an annual basis? and how you're thinking about the potential growth of that business over the next couple of years?
shabtai adlersberg -- president and chief executive officer
right. so, first, let me put an overall framework on this. we have at this stage about 60 people employed in the voice.ai business, which we officially announced two years ago. the business is still growing. last year, we did above $2 million of sales in that line. we do expect an increase of at least 50% to 100% this year in 2020. the investment basically, we have two parts of the business. one is the recording services, the other one is more, the speech recognition and nlp services. so, in the recording side of the business, we have a compliance recording application, which is growing and starts to grow further and now the teams is a new market for them.
we've also discussed few months ago, launching meeting insights, which will allow us to record the interactions in the office. we're talking about meetings, which will be recorded, then we'll later on allow management and other people to analyze them and look for facts, automated -- automated action item taking, identify speakers, you'll have a great repository of voice interaction in the office that are searchable, pretty much compared to when you go for your outlook to look for a mail or a data message that was sent.
then we substantially improved our stack of technologies in the voice recognition area. we have developed a very strong deep neural network solution that's now deployed in two languages. at this stage, it's hebrew and german. also going to be deployed shortly with us english. nlp has been developed. we've been working substantially on opportunities in the customer engagement area, virtual assistant and we definitely start to pick up in the number of projects that we performed. so all-in-all, we're very -- while investing a lot, by the way, the expense on that business in 2019 was about $4.5 million, meaning that, it's quite a large investment, but we do feel that within the next three years this operation will become fully successful growing fast.
i'll mention also that, we did a very unique development that we call voice.ai gateway and that technology allows you to voice-enabled chatbots and with chatbots and both being used increasingly in the enterprise and in other places the ability to add voice channels to it both in the recognition side and then in the synthesizing side is a great solution. this solution is already being implemented with two or three large corporations. there are five or more in the pipeline. so all-in-all very encouraged by the progress we're making on the voice.ai.
rich valera -- needham and company -- analyst
got it, thank you for that. and then, i wanted to just talk about your -- the seasonality of your business into the first quarter. sounds like it's -- you are continuing to see pretty good momentum. in the last couple of years, you've actually seen a modest seasonal uptick q4 to q1. so just wondering how we should think about from a modeling perspective that the q1 revenue relative to the q4 revenue?
shabtai adlersberg -- president and chief executive officer
yeah, yeah. i've learned in the past not to rely on miracles, enjoy them. so, for planning purposes i usually plan on a down quarter that will be roughly around 2%. but you've mentioned, rightly, yes, in past years, we've been able to beat that and actually grow. so, we try to stay modest. i think we saw that in our guidance for the revenues and profits and we'll start a new year just as we did in 2019.
rich valera -- needham and company -- analyst
that's great. and then just wanted a clarification on the royalty agreement. understanding that will have a positive impact on the gross margin. i believe starting in first quarter of 2020, did it have any impact on the non-gaap gross margin in the fourth quarter of 2019?
shabtai adlersberg -- president and chief executive officer
yes, yes, definitely, you are so right. yes. already in the fourth quarter of 2019 we had a contribution of several hundreds of thousands of dollars in the quarter, but we do expect that in 2020 we will have close to a million contribution on each and every single quarter.
rich valera -- needham and company -- analyst
got it. and then just one more from me if i could. the non-gaap share count for the quarter, you have a gaap share count, but i couldn't find the non-gaap share count for fourth quarter of '19?
niran baruch -- chief financial officer
the non-gaap share count for diluted eps is 31.4 million shares.
analyst
31.4 million. okay, thank you very much.
niran baruch -- chief financial officer
you're welcome.
operator
thank you. our next question comes from the line of mike latimore with northland capital markets. please proceed with your question.
mike latimore -- northland capital markets -- analyst
great. yeah. thanks very much. i'm just curious on the cloud, ucaas, ccaas, that whole kind of market segments. how much of your revenue comes from kind of the cloud market today?
shabtai adlersberg -- president and chief executive officer
so, it's growing. it's not substantial as these days. it's growing. we are deployed with our session border controllers and the management, centralized managed suite and the routing application in both aws and azure. we grew, actually in fourth quarter, we grew very nicely with our sbc and azure and in teams that is related to the sbc direct route. we are basically putting all efforts toward that. so, it's a process, but it will take time.
mike latimore -- northland capital markets -- analyst
got it. and then, it sounds like obviously microsoft's sort of the biggest platform environment [indecipherable] who would be sort of number two and three in the list there after microsoft?
shabtai adlersberg -- president and chief executive officer
we have -- we have number of partners. we have mentioned in the past few names like ringcentral, amazon, zoom and a few others. so obviously, we had, in the past also broadsoft now cisco, so that's a partner. if i have to call number two in terms of volume of sales, it's genesys at this stage. all of the others are still not comparable in size to either microsoft, genesys and/or broadsoft cisco.
mike latimore -- northland capital markets -- analyst
okay, got it. and then teams obviously, the teams subscriber counts grown rapidly. i think it was over 20 million in the september quarter. do you know like what percent of those teams users are also using some form of microsoft voice and where might that go?
shabtai adlersberg -- president and chief executive officer
so, you touched on a interesting point. we do see actually, obviously, there's a large installed base skype for business users and some of we have seen fourth quarter a number of them starting to move some of their users to teams. so, i assume that going forward there will be pure new teams accounts. but at the same time, we will see some of our skype for business adding teams users.
mike latimore -- northland capital markets -- analyst
got it. and then you talked about a number of large teams win i believe in the quarter. i assume those deployments will be in a cloud delivery model?
shabtai adlersberg -- president and chief executive officer
yes, yes. when we're talking about teams, we're talking about cloud deployments. we're talking -- but then, some of the components maybe installed on-prem and session border controllers could be placed either in a cloud and/or on-premise. but all-in-all the majority or the whole implementation is meant to be cloud based. yes.
mike latimore -- northland capital markets -- analyst
great. and just last one. how important are acquisitions to your sort of medium-term strategy?
shabtai adlersberg -- president and chief executive officer
good question. well, we keep growing nicely on the top line, 13.7% this year, on the bottom line more than 30%. it's not crucial. we will -- if there's one area i'd like to look at, it would be more the voice.ai business where we would like to inject larger, bigger operation into that business unit than we would maybe look more for m&a. so it's not by all means, we have very nice organic growth and we'll keep doing that. it's not crucial. but we will definitely be helpful growing the new business.
mike latimore -- northland capital markets -- analyst
got it. great, thanks. good luck.
shabtai adlersberg -- president and chief executive officer
sure. thank you.
operator
thank you. [operator instructions] our next question comes from the line of greg burns with sidoti & company. please proceed with your question.
greg burns -- sidoti & company -- analyst
good morning. you had mentioned the expectation for uc-sip to continue growing at about 15% to 20%, based on the guidance, i think that's implying like a flattish year for gateways, but can you just maybe give your outlook for the gateway business in 2020 based on your revenue guidance? thanks.
shabtai adlersberg -- president and chief executive officer
yes. uc-sip will keep growing at the rate we have mentioned. gateways, we enjoyed a very unique year of up 10%. obviously, we have done our bottom-up analysis for 2020. it looks like we'll continue to grow on but on a more modest mode. whether the line will stay flat or grow and/or decline by you know several percent that is still to be seen throughout the year. so, we do bid on our growth on uc-sip mainly and in on gateways to hold the line for us, a very profitable business line. but we do not expect growth from that.
greg burns -- sidoti & company -- analyst
okay, thanks. and then in terms of your partnership with dolby and you're entering the meetings market. what's been the early reception, what are you hearing from customers and maybe what gives you confidence as we go into 2020, and your ability to gain share in that market.
shabtai adlersberg -- president and chief executive officer
okay. so this is a bit premature and we announced the launch in around september, october of last year. we did send the first product, that's a joint product by us and dolby to several large companies, at this stage some hundreds of units. we know this interest in those units. with the [technical issues] think probably expected around february or march this year.
greg burns -- sidoti & company -- analyst
okay thanks. can you just update us on your tax status in both the us and israel you know with the tax status [technical issues] what do you expect to be full tax payer in israel, i think you're paying in the us already, but [technical issues]
niran baruch -- chief financial officer
if you are referring to the expected tax payment in the next one or two years, we do not expect more than $1 million in terms of cash tax payment. we have nols and we created the deferred tax asset for that, and that will offset any future tax payment both in israel and in the us.
greg burns -- sidoti & company -- analyst
okay, great. thank you.
operator
thank you, ladies and gentlemen, that concludes our question-and-answer session. i'll turn the floor back to mr. adlersberg for any final comments.
shabtai adlersberg -- president and chief executive officer
thank you, operator, we would like to thank everyone who attended our conference call today. with continued good business momentum and execution in 2019, we believe we are on track to achieve another strong growth year in 2020 in our business. we look forward to your participation in our next quarterly conference call. thank you very much. have a nice day. bye-bye.
operator
[operator closing remarks]
duration: 52 minutes
call participants:
brett maas -- investor relations
shabtai adlersberg -- president and chief executive officer
niran baruch -- chief financial officer
rich valera -- needham and company -- analyst
analyst
mike latimore -- northland capital markets -- analyst
greg burns -- sidoti & company -- analyst
more audc analysis
all earnings call transcripts




"
