q,ticker,dt,prep_remarks,QnA
2021-Q3,AWH,2021-11-10 08:30:00,"prepared remarks:
operator
good morning, ladies and gentlemen, and welcome aspira women's health incorporated third quarter 2021 conference call. my name is paul and i will be your coordinator for the call today. at this time, all participants are in a listen-only mode. following management's prepared remarks, we will open the call for your questions.
as a reminder, this conference call is being recorded today. leading the call today are valerie palmieri, president and chief executive officer; rob beechey, chief financial officer; and dr. lesley northrop, chief scientific officer. after the prepared remarks, we'll open the call for q&a.
before we begin, i would like to remind everyone that statements made during this call, including the q&a session relating to aspira's expected future performance, future business prospects or future events or plans are forward-looking statements as defined under the private securities litigation reform act of 1995. although the company believes that the expectations reflected in such forward-looking statements are based upon reasonable assumptions, actual outcomes and results are subject to risks and uncertainties that could differ materially from those anticipated due to the impact of many factors beyond the control of aspira. the company assumes no obligation to update or supplement any forward-looking statements, whether as a result of new information, future events or otherwise except as required by law. participants are directed to the cautionary note set forth in today's press release, as well as the risk factors set forth in aspira's most recent annual report and second quarterly filed report with the sec for a description of factors that could cause actual results to differ materially from those anticipated in the forward-looking statements.
at this time, i would like to turn the call over to valerie palmieri, president and chief executive officer. valerie?
valerie palmieri -- president and chief executive officer
thank you, operator. good morning, everyone, and thank you for joining us today. this morning, we will review our third quarter 2021 accomplishments, financial performance, as well as provide an update on our core strategic developments. our end in mind is to truly transform women's health, starting with ovarian cancer.
our goal is to eradicate late-stage detection of ovarian cancer and ensure our solutions will meet the needs of women for all ages, races, ethnicities and stages of disease. we seek to develop a lifelong relationship with each patient from puberty to cure, ensuring each woman has access to the best-in-class diagnostics. this morning, i'd like to make comments on our core operations, provide an update on our pipeline, as well as an update on managed care progress and our government affairs initiative. first, i would like to address a recent departure from our board, dr.
sandra brooks. dr. brooks has resigned due to family reasons, which limits her time and availability. we wish dr.
brooks well as she deals with the family's situation. and thank her for the many insights and support she has provided our team. i am now going to begin with a review of our core business. we are reporting third quarter ova1 plus revenue of $1.6 million, an increase of 33% over the same period in 2020, and 6% decline sequentially from the second quarter of 2021.
this is a result of significant covid-related access restriction in july and august 2021 in key markets. our ova1 plus product volume was 4,281 tests, which represented in 90 -- an increase of 19% compared to the same period in 2020 and a 6% decrease sequentially compared to the second quarter of 2021. we believe our 2021 q3 product volume was significantly impacted by restricted access and customer office closures in the summer timeframe, and specifically in high-volume areas such as michigan, florida, new york and kentucky. in these areas, our team had an 18% reduction in volume and a 19% reduction in physician events as a result of covid.
in terms of covid access, we categorize each sales territory relative to access restrictions with a green, yellow and red designation. this represents over 90% access for green, between 55% to 75% access for yellow and under 50% access for red respectively. at the end of the third quarter, the green territories represented only 13% access, yellow was 66% access and red was 20% access overall. the total number of ordering physicians in the third quarter of 2021 was 2,914 an increase of 20% compared to the same period in the prior year, and essentially flat sequentially from q2 2021.
the total number of new physicians in the third quarter of 2021 was 444, an increase of 13% over the same period in the prior year and up slightly sequentially from q2 2021 or 1.6%. both total and new customers in q3 2021 were impacted due to decreased access due to covid. volumes are starting to pick up and are trending higher in september and october, with a volume on a units-per-day basis of 63.2 in july, 66 in august, 71.6% in september and 81.1 in october. we believe this recent growth is a combination of our commercial investment as well as increased patient visits.
for october, we also had a record number of new physicians of 214. as we have previously shared one of our strategic objectives is to increase awareness of our brand and product to drive adoption. our marketing function has implemented a series of new strategic digital initiatives, including paid search social and display media. some of the key statistics, we are tracking are as follows.
paid search has driven over 35,000 clicks to the website since the launch in may. this is a click-through rate of 2.67%, which is above average. social media engagement on media platforms such as facebook, instagram and linkedin have increased triple digits year to date and our followership has increased double digits on a year-to-date basis. our display media helped drive awareness and created a halo effect that made our paid search more effective.
as a result of these initiatives website traffic is up triple digits on a year-to-date basis, with a 239% increase in new users. in addition organic search is up 761% on a year-to-date basis. these stats indicate that our initiatives are growing our awareness. in addition, we are focusing on select geographies and have seen progress as a result of a multiple-front approach in some beta markets in q3.
this includes marketing support with commercial activation, kols, strategic partnerships, digital media and paid media. more to come on this front. i'm now moving on to review our decentralized software algorithm platform known as aspira synergy. we are making progress and now implementation phase for two of the largest gynecologic networks in the us.
we recently announced we have entered into additional technology transfer agreements which now include a total of four technology transfer agreements since the launch of aspira synergy. two of the agreements are with two of the nation's largest and leading independent women's healthcare groups incorporating more than 750 providers and more than 950,000 patients annually. the other two agreements which are in the implementation phase, are with two independent laboratories providing service across five states. dr.
northrop will share further comments shortly. i will now move on to provide an update on our core strategic developments regarding our pipeline, payer and evidence development as well as government affairs. first, i will start with our pipeline of products. our pipeline is built for aiding gynecologic health providers with personalized solutions during the entire patient lifecycle, starting with benign disease such as endometriosis, to ovarian cancer diagnostics, to suspected benign mass management and any which women who are planning for pelvic mass surgery.
i am now going to start with our endometriosis update as well as our endocheck breakthrough device program application. as we previously reported, we have two pharmaceutical company specimen contributions, which demonstrates the critical need for a diagnostic test. the collaboration between each of obseva s.a. and abbvie incorporated with aspira represents a mutual dedication to create solutions to help the 67 million women in the us suffering with endometriosis by radically improving the time to diagnosis as today it may take seven to nine years for a diagnosis.
we believe endocheck will allow patients to have their endometriosis detected earlier and potentially to be treated more effectively and perhaps without the need for unnecessary surgery. in late october, the fda centre for devices and radiological health issued an updated guidance for the content or pre market submission for software contained and medical devices specific to artificial intelligence, machine learning based software as a medical device action plan which will provide a much needed framework for such aspira future devices. we are currently working to ensure our endocheck development process is aligned to the proposed framework. we are still in communications with the fda regarding a breakthrough device program application.
importantly, the fda has acknowledged that there are many compelling reasons why this type of device is needed for both the treating physicians and for patients. as discussed previously, the fda indicated they're very interested in continuing to work with aspira and endocheck and we will be continuing our discussions with the agency on the breakthrough device designation. we believe endocheck will allow patients to have their endometriosis detected earlier, enable their physicians to further personalize their treatment plans and potentially enable more effective treatments without the need for unnecessary surgery. we expect to make a determination on our optimal regulatory path forward by the end of this year.
i am now moving on to our second technology i'd like to update you on which is our proof-of-concept study, which we've been working diligently with the teams at dana-farber, brigham and women's, and the university of lodz. the evaluation has met the acceptance criteria; and based on the outcome data, the aspira innovation team, along with the collaborators from the institutions, have begun the implementation of phase 2. i am now moving on to ovasight. we have determined that we will be branding the test as ovawatch, which we believe is more descriptive of the utility of the test.
the test was developed through a rigorous scientific and clinical-based process based on data from new york state ldt and from our fda regulatory processes in over 3,000 patients. as you know, we have estimated this product would launch in q4, 2021. as part of the process, we need to do additional scientific and market review. we are just wrapping up an analytical validation manuscript and we'll be submitting it to a peer-reviewed journal.
in fact, our goal is to have more than one peer-reviewed publication with robust data prior to launch. as this careful work progresses, we will adjust our scheduling accordingly. to that end, we are also continuing our perspective zero monitoring clinical study and ultimately plan to publish data demonstrating the clinical validity of ovawatch as a serial monitoring test by the end of 2020 to early 2023. we believe this product has the opportunity to have three times the total market opportunity as ova1 not including the serial monitoring option.
i am now moving on to an update regarding our payor and evidence development. and we have a number of updates. during this past year, we have been working on a large 12 month to 24 month outcome study of ova1 clinical utility. this study is specifically aggregating and analyzing data from the multiple sites that are participating in the study.
the data from the study sites will represent a broad section of the country in a diverse population of women. the company expects to submit a manuscript to a peer-reviewed journal with the results in q1 2022 and publish in q2 to q3 of 2022. the purpose of this study has demonstrated the impact ova1 testing has on patient outcomes compared to the broader ca125 single marker assay using 12 months to 24 month follow up data. it will measure the impact ova1 has on patient care, including both clinical and cost measures, which will be included in the published results. this manuscript will be supplementing our current peer-reviewed publications including the ova1 impact on the quality adjusted life care paper and our budget impact model paper for payers.
i am now moving on to our clinical benefits guidelines, as we discussed on our last earnings call. ova1 technology is now considered medically necessary according to aim specially health's clinical appropriateness guidelines. notably, they have not included a competitive product called roma and their guidelines. and consider it still to be investigational and experimental.
aim is a member of the anthem bluecross blueshield family of companies which promotes optimal care through the use of evidence based clinical guidelines and real time decision support for both providers and their patients. we have commenced a targeted program to obtain contractual coverage with all of the aim member plans. we have now increased our covered lives during the third quarter to a total of 194 million. this is an 8% increase from our prior reported base of 179 million covered lives.
in addition, we are making strong progress on the medicaid front as aspire has now credentialed in the top five states by medicaid populations, which are ranked in the order of medicaid beneficiaries. they include california, new york, texas, florida and pennsylvania, bringing the total credential national medicaid population for ova1 to nearly 61 million, which represents approximately 77% of the total us medicaid population. and it addition as an adjunct to the recently announced coverage of ova1 by the state of new york for its medicaid population, two of the largest managed medicaid plans in the state of new york have adopted a favorable policy for ova1 and are now under contract to provide access to ova to an additional 4 million covered lives throughout the state. specifically, we have entered into an agreement with health first, new york's largest not for profit health insurer offering medicaid plans, medicare advantage plans, qualified health plans in individual and small group plans.
health first serves 1.7 million members in new york city, long island, west chester, sullivan, orange and rockland counties. health first is a pioneer of the value-based healthcare model where hospitals and physicians are paid based on patient outcomes. we have also entered into an agreement with fidelis care, which is one of the largest managed medicaid plans in new york, with 2.3 million covered lives across the state. further aspira women's health is now contracted with highmark of delaware for the medicare advantage membership.
this will ensure that women in this plan will have access to the ova1 technology. overall, our market access strategy is making significant progress with our reaching 194 million covered lives, representing 59% of the lives in the u.s. and we believe inclusion in the aim and evercore guidelines, along with the increased access to both medicaid and medicare advantage plans, provides us with further validation and credibility in our discussions with all payers. we expect this momentum to continue as we prepare to submit the latest evidence on ova1 clinical utility with 12 to 24 month outcomes.
i am now moving on to our government affairs front. we are continuing to gain momentum following our congressional briefings in march and september of 2021. the company is actively engaged with members of congress and several advocacy organizations including healthywomen, the national ovarian cancer coalition, the ovarian cancer research alliance, and the black women's health imperative, in an effort to increase awareness about ova1 and ovarian cancer and encourage legislation that provides financial support for additional clinical trials, as well as our focus on diversity in trials. this also includes discussions on trial requirements for adding the company's ovarian cancer technology into guidelines, such as the u.s.
preventive services task force, which would support the company's objective to launch a product that is broadly applicable as a high risk screening tool in time. we are also engaged with multiple state legislators about medicaid in their states, as well as national coverage determination for medicare for ova as part of the expanding access. in addition, the company is also working on the medicare innovative technology initiative to obtain coverage and reimbursement immediately following any fda breakthrough approval for any of its products. in summary, we continue to work on our overall strategic goal, which was to emerge from the pandemic stronger, our team is now much stronger on all fronts with a solid financial position.
we believe we are well positioned to invest, to grow and to drive adoption, and most importantly save lives. i would now like to hand the call over to dr. lesley northrop to provide an update on our momentum to becoming the standard of care and driving the awareness of our technology. dr.
northrop? 
lesley northrop -- chief scientific officer
thank you, valerie. in support of our multi-omic approach to developing diagnostic tests in women's health, we have entered into a partnership with genoox, one of the world's largest community-driven genomic data platform, to develop solutions to advance women's health and rapid results, diagnosis and insight. genoox's global platform brings together all publicly available genomic information, allowing for the complete analysis of the data and better patient care. we plan to leverage this knowledge base to expand our proprietary algorithm development across multiple product lines.
further to valerie's comments on our high-risk early detection program, i would like to update you on is the proof-of-concept study. we have been working diligently with the teams at dana-farber, brigham and women's and university of lodz. this study included specimens from our enriched biobank. one-third were malignant across all stages, as well as benign and healthy controls.
we were able to quantify the microrna expression levels and confirm that the microrna biomarkers demonstrated the same performance in our independent sample set as previously published in the elife publication in 2017. the evaluation met the acceptance criteria and based on the outcome data, the aspira innovation team, along with the collaborators from the institutions have begun implementation of phase 2. with this initial stage day pack, the team is proceeding to evaluate the combined potential impact of our protein biomarker algorithms, coupled with this new microrna technology in the development of this assay on a new platform, which we believe will set the foundation for a non-invasive diagnostic in ovarian cancer. we plan to further validate the same technology as a high-risk of ovarian cancer application and genetically predisposed women which is currently in a clinical study for ovainherit.
we anticipate that we will have preliminary data in early 2022 to support the verification of a multiomics approach in detecting ovarian cancer. please keep in mind this is a long-term phase product. and we are delighted to be working with world class institutions in the development of this assay, which we believe will have a significant impact on women's health in ovarian cancer. we continue our utmost commitment to increasing provider awareness and education to our medical affairs team, this team has hosted multiple successful highly attended educational series and are currently launching gynecologic and gynecologic oncology advisory boards, directed at better management of pelvic masses and improvement ovarian cancer early detection.
regarding clinical studies, we are continuing to recruit more academic sites to support both the clinical validity and utility of our tests. we have also launched our physician initiated research program for healthcare systems i'm incredibly excited about the direction of our clinical studies. and we continue to build our study program to strengthen the data around our products. we have recently completed a study combining data from our philippine and u.s.
clinical studies of diverse race and ethnicity. preliminary data supports that use of single-biomarkers such as, ca-125, and he4 has varying average values across different ethnic groups, resulting in increased false positive and false negatives of ovarian cancer malignancies. these biomarkers were validated and caucasian population as were their standard cut off, which do not translate to non- caucasian women. the abstract is in the process of submission to achieves.
i would now like to hand over the call to bob, to provide our financial update. bob?
rob beechey -- chief financial officer
thank you, dr. northrop. first quarter 2021 ova1 revenue was $1.6 million, an increase of 33% over prior year and a 6% decline sequentially. the 33% product revenue increase is primarily due to lower number of tests performed in 2020 due to covid-19 as well as an increase in ova1 average revenue per test in the third quarter of 2021, compared to the prior year.
the revenue per ova1 plus test performed remains flat at $377 for the first quarter 2021, compared to the second quarter of 2021. the year-on-year price increase was 11% compared to the prior year, third quarter of $338, included in the overall average price per unit is 12% volume associated with medicaid at a unit price of $94, which we expect to increase overtime, as we increase credentialing and coverage. the average unit price excluding medicaid was $410 during the third quarter. excluding patient direct out-of-pocket and medicaid, we realized an average unit price of $486.
gross profit margin on ova1plus was 57% in the third quarter of 2021 compared to 44.9% in the prior year and 52% in the second quarter of 2021. the year-on-year increase was driven by volume improvement, while the second quarter gross profit included one-time costs related to a switch in kit centers that did not recur in the third quarter. research and development expenses for the three months ended september 30, 2021 were $1.5 million, an increase of $47,000 or 3% compared to the second quarter 2021. our r&d investment increased 155% year over year or $595,000.
this spending was focused primarily on product development costs related to ovawatch as well as investments in bioinformatics, investments in aspira synergy and consulting expenses associated with endocheck regulatory clearance. sales and marketing expenses were approximately $5.1 million for the three months ended september 30, 2021, increased by $1.1 million or 27%, compared to the second quarter in 2021. this increase was primarily due to increase personnel and consulting costs as we execute upon our commercial strategy. the prior year sales and marketing expense of $2.2 million was depressed due to lower travel and entertainment and commissions and did not reflect the current investments we were making in market awareness and the sales team additions.
general and administrative expenses were $3.8 million for the three months ended september 30, 2021, an increase of $560,000 or 17% compared to the second quarter in 2021. this increase was primarily due to an increase in headcount, personnel expenses, as well as stock compensation expenses. we incurred $2 million in general administrative expenses in the prior year quarter. included in the third quarter 2021 general administrative expenses is $645,000 of non-cash stock compensation expenses as compared to $343,000 in the prior year, driven primarily by the market value of our stock grants.
we ended the third quarter of 2021 with approximately $44.9 million in cash. cash used in operations in third quarter of 2021 was $7.9 million, which included a number of one time investments. included in the third quarter were investments in recruiting services of $550,000. consulting services, including approximately $243,000 associated with endocheck fda assistance; $264,000 for data that is being leveraged for managed care and commercial targeting; $128,000 for one time legal fees; $69,000 of it fees associated with the build out of the synergy platform; and $40,000 associated with season support a congressional briefing in government affairs activities.
i will now turn it back over to valerie.
valerie palmieri -- president and chief executive officer
thank you, bob. before we open up the call for q&a, let me restate our optimism for building the company for sustainable growth for the near-term and the long-term. in parallel, we are executing on our larger mission to serve the 20 million women in the us, starting with ovarian cancer risk assessment, pelvic mass monitoring, and eventually tackling the largest disease, endometriosis. keep in mind, our high-risk ovarian cancer application for genetically predisposed women ovainherit, which is currently in development would be incremental to this market, because it would be for women with and without a mass.
ovarian cancer accounts for more deaths than any other cancer of the female reproductive system and is the only gender-specific cancer with greater than a 50% mortality rate. our work and products are at the forefront of changing the standards of care and detection of ovarian cancer malignancies. we believe we are helping close the gap in detection and more importantly survival for women. in the near-term, we believe ova1plus with our diversity differentiation and genetics will become the standard of care in personalized pelvic mass risk assessment for ovarian cancer.
for the longer-term, we are moving forward with endocheck for endometriosis; and lastly ovainherit for high-risk genetic predisposition monitoring. our end in mind is the incorporation of proteins genes and other modalities to detect gynecologic disease, which cannot be detected via a traditional biopsy. in time our goal is to become the liquid biopsy standard for these diseases inclusive of all ages stages and most of all ethnicities. with our enhanced team financial position and robust portfolio in development we could not be more confident across the business.
it is now time that all women of every race and ethnicity receive the best possible care and we are proud and excited to make that happen. we are now happy to open up the call for q&a and answer any of your questions. operator?
",":
operator
[operator instructions] our first question is from brian weinstein with william blair. please proceed with your question.
brian weinstein -- william blair -- analyst
hey, good morning guys. thanks for taking my question.
valerie palmieri -- president and chief executive officer
good morning. brian.
brian weinstein -- william blair -- analyst
so i thought we'd start very near-term and then branch out through some a couple of questions here. so i really appreciate the commentary on green, yellow and red and some of the volume trends there. just wanted to get some idea on how you're thinking about the back half of the quarter. we've heard repeatedly from companies throughout the earnings season that there's a little bit of concern relative to potential increased vacation time and office closures regardless of a resurgence of covid if that happens or not.
so just trying to gauge whether or not you expect those positive trends to continue through the year. i know you're not giving formal guidance here, but as we try and tweak our model a little bit for q4 and then into early 2022 just trying to get a gauge on how you're thinking about the trajectory of the recovery.
valerie palmieri -- president and chief executive officer
yes. i think it's a really good question because in early summer we saw acceleration of covid, but we also saw acceleration in markets that didn't have covid. we saw acceleration of lack of physician events, right? so in terms of the holiday season coming up, i guess, it's hard to tell, but i have to say we're very pleased with october and you see it all over the news that people are finally able to get together for thanksgiving or christmas. so will there be more celebration and more time off from a physician office? it could be.
we did see it in the summer. and as i said in markets that were not as subjected with covid, we saw lower physician events. and what i mean by that is just lunches and face-to-face time. it's still happening but it definitely was lower in key markets.
so i do  right now it's all systems go but seeing what happened in the summertime, i would not doubt if clinicians are also going to be enjoying time with their families because of this long-haul with covid.
brian weinstein -- william blair -- analyst
ok. we've had some conversations you and i about obviously, all of the great things that you guys have done to build a very strong infrastructure. and as we sit here now with i think it's just under 200 million covered lives medicaid coverage that's fairly significant, a sales force that's more than doubled data that's built up here. i'm just curious about what else do you guys think you need to hit that inflection that you and i have talked about previously in cases at this point? it feels to me like the stage is really set.
so is it fair to say that 2022 is a year where we should see barring any kind of covid headwinds that return really a nice inflection in how we're thinking or how you guys are seeing volumes starting to roll through?
valerie palmieri -- president and chief executive officer
yes. i would say that really comes down to four levers. number one, is access, right in terms of covid increases but i think we're learning to live with covid. the second is our sales rep efficiency.
right now we have 11% of our sales force that has less than three months. we have 47% are in that four to six months. and we like to have two quarters of sales reps to have two quarters behind them till they get to full tilt. so sales rep efficiency is number two.
number three, we have price. number four is we have implemented what i call regional market plans where we're focusing on the commercial activation, kols, strategic partnerships and digital and paid media. so i see all four levers moving in unison. and i do think that with the sales team getting to be more mature and we're hiring a great team i do think that the upside in 2022, we will continue to build momentum and really make a stand from not only adoption but as you pointed out from a payer standpoint and i'm talking both commercial and government payers.
so no we're very excited about a very positive 2022.
brian weinstein -- william blair -- analyst
got it. and then the last one for me. the data talking about superiority of ova1 versus ca125 continues to build. and i think at some point that you guys were talking about formally submitting to acog and trying to get some sort of superiority designation, specifically in the guidelines.
and i might have missed this if you addressed this during the prepared remarks, but where does that stand? and how important would that be if something like that were to play out?
valerie palmieri -- president and chief executive officer
so a couple of things. yes, that is our ultimate goal is to get superiority over ca125, because right now we're equal in a sense. and it's a multi-front approach from -- i want to say the diversity data, which really initiated out of the philippines. we have a very exciting acog abstract that has been submitted.
so yeah, i think part of it's diversity. i think part of it is -- i want to say that it's government affairs. i think there's a time of congress now paying attention, not that they weren't paying attention to women's health, but i think there's some renewed interest in women's health. and i do think that taking this data on diversity to acog is one of the most important things.
in fact we have made this diversity program one of the number one initiatives of our company and having taking that to acog as well as using thought leaders behind that as well. so, that is the ultimate plan is to take it to acog and get the guidelines stating that ova1 is a product that can actually measure ovarian cancer risk in the top races and ethnicities and we're starting with the black population and also the filipino study that we'll be releasing shortly.
brian weinstein -- william blair -- analyst
ok. great. thanks guys. i appreciate it.
valerie palmieri -- president and chief executive officer
thank you, brian.
operator
thank you. there are no further questions at this time. i would like to turn the floor back over to valerie palmieri for any closing comments.
valerie palmieri -- president and chief executive officer
thank you, operator. in closing, we believe that our accomplishments during q3, set us up nicely for the remainder of 2021 and beyond. we are focusing on doing the right things to drive sustainability and profitability and growth. with our increased commercial footprint, a guideline-endorsed and differentiated test a portfolio of tests within the same call point and now over 59% of lives under coverage in the us, we believe we are in position to support continued growth and profitability.
q2 and q3 were investment quarters, with the addition of sales representatives in new territories as well as the design and development of marketing materials and content. we are confident these investments will result in meaningful returns and will be impactful to our success in driving the ova portfolio to become the standard of care. our end goal is to serve a large global public mass population and overall women's health market with a platform coupled with proprietary science and data tools, which will drive better health and well-being to each and every patient we serve. thank you for joining us today, and we appreciate your support and interest in aspira women's health.
operator
[operator signoff]
duration: 39 minutes
call participants:
valerie palmieri -- president and chief executive officer
lesley northrop -- chief scientific officer
rob beechey -- chief financial officer
brian weinstein -- william blair -- analyst
more awh analysis
all earnings call transcripts"
