q,ticker,dt,prep_remarks,QnA
2021-Q4,AWH,2022-03-23 08:30:00,"prepared remarks:
operator
good morning, ladies and gentlemen and welcome to aspira women's health inc.'s full year 2021 and fourth quarter 2021 conference call. my name is kyle and i will be your coordinator for the call today. [operator instructions] as a reminder, this conference call is being recorded today. leading the call today are valerie palmieri, executive chair of the board; nicole sandford, president and chief executive officer; and bob beechey, chief financial officer.
after the prepared remarks, we will open the call for q&a. before we begin, i would like to remind everyone that forward-looking statements defined under the private securities litigation reform act of 1995, will be made during this call, including statements relating to aspira's expected future performance, future business prospects, future events or plans. although the company believes that the expectations reflected in such forward-looking statements are based upon reasonable assumptions, actual outcomes and results are subject to risks and uncertainties and could differ materially from those anticipated due to the impact of many factors beyond the control of aspira. the company assumes no obligation to update or supplement any forward-looking statements, whether as a result of new information, future events or otherwise, except as required by law.
participants are directed to the cautionary note set forth in today's press release as well as the risk factors set forth in aspira's most recent form 10-k and our second quarter 2021 form 10-q filed with the sec for a description of factors that could cause actual results to differ materially from those anticipated in the forward-looking statements. at this time, i'd like to turn the call over to valerie palmieri, executive chair of the board. valerie?
valerie palmieri -- executive chair of the board
thank you, operator. good morning, everyone, and thank you for joining us today. as previously announced, i have been elevated to the role of executive chair of the board, i look forward to leading the company at a higher level and i'll be working side by side with our new president and chief executive officer, nicole sandford, who is joining me today to speak with each of you. as executive chair of the board, i intend to focus on specific strategic imperatives and enterprise value drivers, including the launch of critical new products, further development of aspira's thought leadership, including key strategic commercial, scientific and advocacy partnerships as well as our clinical and scientific leadership via our kol advisory boards.
as president and ceo, nicole will lead the business, execute strategic and operational plans and scale and transform operational and functional areas to support our planned growth. we have forged a strong and positive relationship working with one another over the past year, and it has only gotten stronger since we took our new, on our new responsibilities. we look forward to partnering with one another to drive strategic milestones while delivering growth, revenue and profitability to all of you, our shareholders. in addition to the executive level changes, we have recently announced the appointment of celeste fralick.
ph.d. to our board of directors. dr. fralick recently retired as chief data scientist at mcafee, where she was responsible for developing enterprise and consumer product analytics and data ecosystems for cardiomyopathy and neurostimulation.
dr. fralick is an accomplished executive who brings over four decades of data strategy experience to the board. she brings a broad background in technology and specifically healthcare in several markets with customer and industry-facing experience. she has been recognized globally for cross industry-leading analytics, ideation, strategic leadership and results-oriented competencies.
in addition, dr. fralick was named to forbes inaugural 2018 list of america's top 50 women in technology. i would now like to update you on some recent strategic developments, which we are very pleased with, before i move on to the 2021 review. as discussed in our march 2021 call, we entered into a strategic research collaboration agreement for the development and commercialization of a microrna high-risk ovarian cancer early detection test with harvard dana-farber cancer institute, brigham and women's hospital and the medical university of lodz.
they have published on a novel microrna panel, which we intend to use in combination with current technology. after completion of multiple experiments interrogating diverse sample sets and data sets, we have consistently found the technology to be complementary improving the accuracy compared to the microrna and protein biomarkers alone. based on this outcome data, we have met the success criteria together. this month, aspira has exercised the option for an exclusive worldwide license of its cutting-edge microrna technology and will continue development of a novel combined assay utilizing a new platform as well.
we believe the high specificity demonstrated by this technology, coupled with our strong sensitivity of our technology has the potential to be the base technology for a diagnostic, which will function as a test for women with a high genetic risk of ovarian cancer, the end goal for truly developing a personalized risk solution for patients who are genetically predisposed to ovarian cancer. the brand name for this study is ovainherit. there will be more to come as we move forward with publishing our early data. nicole will also discuss additional new pipeline updates in her remarks.
i am now moving on to our recap. we believe aspira women's health has effectively weathered the storm of the pandemic and is rapidly gaining momentum. we have delivered solid test volume recovery, improved price year-over-year considerably, added to our covered lives and lastly, made significant additions to our board and executive team. we continue to advance our product pipeline and strengthen our financial position in 2021.
we accomplished five major milestones. number one, our ova1 and platform adoption. in terms of full year 2021 metrics, volume grew 28% year over year. for q4 2021, we performed 4,750 ova1plus tests, which represented an increase of 23% compared to the same period in 2020 and an 11% increase sequentially compared to the third quarter of 2021.
looking forward, we experienced headwinds in january due to the surge in the covid-19 variant, which resulted in a slower-than-expected start to the first quarter of 2022. however, ova1plus volumes recovered quickly and are trending higher in february and march. our units per day increased from about 65 in the first few weeks of january to about 91 in the first week of march, which is a new average record per day. october was our prior record of 81 tests per day.
we believe this recent growth is a result of our ongoing commercial investments and increased patient visits as well as improved covid access. in addition to unit adoption, we also successfully entered into four synergy contracts, of which two are with two of the largest independent women's healthcare groups in the u.s. with access to approximately 750 providers and 950,000 patients annually. the last contract we announced in january 2022 is a five-year contract with axia women's health.
the goal of these relationships is to allow our clients to offer our best-in-class clinical diagnostic testing services directly to their patients via our universal platform. we believe this will provide a significant growth as we gain the ability to touch more providers through the larger provider bases that are associated with larger aspira's synergy customers. our platform strategy is key to mass adoption, coupled with our direct-to-provider strategy. the number of base ordering physicians increased to approximately 3,216 for the fourth quarter of 2021, representing a year-over-year increase of 23% and a sequential increase of 10% for the quarter.
the total number of new physicians in the fourth quarter of 2021 was 584, an increase of 25% over the same period in the prior year. and we noted significant new customer increase of 32% sequentially versus the third quarter of 2021. i am now moving on to our second major milestone, which is payer and price improvement. full year for 2021 in comparison to full year 2020 grew by 45%, while total price per unit, including medicaid, improved 13%, without medicaid, the price improved to $414, which is a 15% improvement year over year.
we also reached 194 million covered lives, representing 59% of the lives in the u.s. we believe inclusion in the aim and evercore guidelines provides us with further validation and credibility in our discussions with all payers. we expect this momentum to continue as we prepare to submit the latest evidence on ova1 clinical utility with 12 to 24-month outcomes. we plan to share more on this in 2022.
on the medicaid front, we added a total of 6.9 million lives with the addition of new york state, new hampshire and washington, d.c. having this coverage in place is critical to managing the underserved population as we believe ova1 is the only technology available today that has adequate sensitivity for early stage ovarian cancer risk detection, specifically in black women. with new york state, this brings our total credentialed medicaid population to 61 million medicaid lives, which is over 80% of the u.s. medicaid population.
i'm now moving on to our third milestone, which is government support and momentum following our two congressional briefings in 2021. we actively engage with members of congress and several noteworthy advocacy organizations, including healthy women, the national ovarian cancer coalition, the ovarian cancer research alliance and the black women's health imperative in an effort to increase awareness about ova1 and ovarian cancer. our goal was to encourage legislation to provide financial support for additional clinical trials as we focus on diversity in trials. we also started the discussions on the trial requirements for adding the company's ovarian cancer technology into guidelines, such as the u.s.
preventive services task force, which will support the company's objective to launch a product that is broadly applicable for women with a high genetic risk for ovarian cancer. in addition we're laying the ground work for a bill for national coverage determination for medicare for ova1 as part of expanding access. our work with these representatives, our congressional briefings and other advocacy work including with members of the appropriations committee has supported the nih's recent funding increase of 25% for ovarian cancer research and the department of defense's congressionally directed medical research programs increase in funding for ovarian cancer of 29%. we are very pleased with these recent results and the speed with which the government took action.
further, in response to president biden's recent outreach to industry for suggestions on how we can better identify cancer early as part of the cancer moonshot 2.0 initiative, the companies had correspondence with the biden administration to support the inclusion of early detection technologies for ovarian cancer among its key priorities. i am now moving on to the fourth milestone, which is our publication progress. we completed a paper, which has been published in the special edition of diagnostics entitled salvaging detection of early stage ovarian cancer malignancies, when ca125 is not informative. in a retrospective study of 2,305 patients, ova1 detected over 50% of the ovarian malignancies in premenopausal women that ca125 would have missed.
ova1 also correctly identified 63% of the early stage cancers missed by ca125. this paper further validates and supports the superior early stage detection of ovarian cancer versus ca125, the most common test used today in a large population. in addition, we have several other key manuscripts in submission more to come on this front. our last milestone is our strategic partnerships and study collaborations, which finished the year with three major ones in addition to the harvard dana-farber cancer institute.
the first one centers around endocheck products. we executed an agreement with opdivo assay whereby they provided us a sizable specimen and data bank from their therapeutic trials. we now have trial specimens from two of the three pharmaceutical companies, and these specimens will support our development of our endocheck product. our second is our platform partnership with genoox.
this partnership will enhance our data and biobank platform. genoox and aspira seek to tackle the most difficult diseases in women's health, and this platform should allow us to reduce the development time for potentially groundbreaking data solutions. and third is our key partnership with northwell health. this study will enroll over 600 prospective women with adnexal masses.
the study will also enroll 2,000 women at high-risk ovarian cancer, either due to personal or family risk of cancer or carriers of a germline variant associated with hereditary breast and ovarian cancer syndrome. northwell is the largest healthcare provider in new york state and treats over 2 million patients annually and employs over 16,000 credential physicians. as you can see, our overall goal was to emerge from the three phases of pandemic operationally stronger, and we believe we did just that. we believe we are well positioned to grow, scale, drive adoption and most importantly, save lives.
i am now pleased to introduce our new president and ceo, nicole sandford. nicole? 
nicole sandford -- president and chief executive officer
thank you, valerie. before i start, i'd like to say that it has been an honor to assume the role of chief executive officer and to continue working closely with you to achieve our mission. as i've transitioned from board member to leader, my respect for the team of talented professionals that you have assembled has only grown. your leadership has certainly set the stage for an outstanding future for the company.
i'm now going to spend a few minutes providing an update on our strategic priorities and the path forward for 2022. our theme this year is focused execution. we've made a number of critical investments and now is the time to capitalize on those efforts. i intend to do that through focused execution in three areas: growth, innovation and operational excellence.
starting with growth. you've already heard from valerie about the increases in new physicians and volume from our existing physicians in 2021 despite several distinct covid surges that challenged our field sales team throughout the year. we're learning to live with covid and intend to improve our response and recovery to flatten the volume curve should additional variance cause disruption in 2022. i intend to work with the team to mine our learnings and ensure that we continue to see improvements in our sales related metrics regardless of covid disruptions.
staying with growth for a minute, you'll recall that we brought on michael newton as our head of, our new head of commercial. and i'm happy to report that he's already making a big impact. drawing on his over 20 years of diagnostic healthcare sales experience, mike will help to execute a commercial strategic refresh and reorganization in february of 2022 to enhance our national sales force and drive the accelerated adoption of ova1plus as the standard of care for early risk detection of ovarian cancer in women who have been identified for surgery. this strategic refresh is aimed at positioning us to take full advantage of our commercial scale-up over the past 18 months focusing on the most promising territories and rationalizing sales reporting structures.
early indications are that it was the right approach to achieve our growth plans for ova1plus and has set us up for the successful launch of ovawatch, which we expect to occur in the second half of the year 2022 and it is already working. daily volumes in q1 2022 have surpassed daily highs from 2021, as valerie mentioned in her remarks. let's shift gears to innovation. as you know, we've invested in building a pipeline of products that provides women's healthcare providers with a broad set of solutions for patients with a range of gynecological diseases.
as a reminder, many of the products in our pipeline are expected to be launched as ldts or lab developed tests, and it may be helpful to provide some additional background context on ldts before going into specific products. ldts are a class of in vitro diagnostic device that is designed, manufactured and used within a single laboratory. currently, the majority of novel technology and genetic tests are ldts. estimates for the number of ldts in the u.s.
range from 60,000 to 100,000 plus with between 15,000 and 20,000 of those falling under moderate or high risk for fda classification. in comparison, there are less than 500 fda-cleared moderate to high risk test on the market. ldts are often used to test for conditions or diseases that are either rapidly changing or that are the subject of quickly advancing scientific research. so the ldt approach might be the best approach in an evolving technology situation, and it allows for ongoing improvement in machine learning algorithms.
with that as background, i will provide an update on ovawatch, our next-generation ovarian cancer test. an ovarian cancer risk assessment test for women who present with an adnexal mass, ovawatch will be launched as an ldt in two stages. phase i is a single-use point in time test and phase ii will allow for serial monitoring. we will focus on advancing to the commercial phase of the ovawatch launch plan including driving provider adoption during the second half of 2022.
we believe the single-use product has the potential to triple the addressable market over ova1plus our current ovarian cancer test. the launch of the serial monitoring test remains targeted for 2023 upon publication of data from the ongoing prospective serial monitoring clinical study. now, let's move on to endocheck, our noninvasive aid in the detection of endometriosis. as we previously reported, we have received two pharmaceutical companies investment contributions, which we believe demonstrate the critical need for a diagnostic test.
the collaboration between each of opdivo assay and abbvie inc. with aspira represents a mutual dedication to create solutions to help the 6 million to 7 million women in the u.s. suffering from endometriosis by radically improving the time to diagnosis, as today, it may take 7 to 10 years for a diagnosis. we believe endocheck, our in-development diagnostic test for endometriosis will enable earlier detection, more effective treatment and perhaps avoid unnecessary surgery.
we previously announced the dual-track approach for the launch of endocheck as either an ldt or as an fda-designated breakthrough device and we continue to pursue both paths at this time. accelerating endocheck is a top priority for the company in 2022. in summary, our pipeline is advancing and is a priority for me and the entire company which will be aided significantly by the expansion of our relationship with the harvard dana-farber cancer institute. with respect to operational excellence, the entire company is focused on building the infrastructure we need to sustain our growth through 2022 and into the future.
we are also very focused on the stewardship of our resources on behalf of our shareholders, including the appropriate allocation of cash to those activities that are most likely to drive our immediate and longer-term growth and, as importantly, shorten the distance to positive cash flow. we are a fast-growing company that is developing complex women's health products. and as you might expect, there are opportunities to enhance the efficiency of our operations. it is important to note, however, that we are facing the same tight labor conditions as the rest of the industry.
we are working hard to retain our top talent and avoid costly turnover but we expect that to be a challenge for most of the coming year. before i hand off to bob to provide a financial update, i want to take a moment to acknowledge kaile zagger, our chief operating officer, who has decided to leave the company to pursue another opportunity. we are grateful to kaile for her dedication to aspira and wish her the best in her future endeavors. and now over to you, bob.
bob beechey -- chief financial officer
thank you, nicole. fourth quarter 2021 ova1plus revenue was $1.8 million, an increase of 29% over prior year and a 12% increase sequentially. this 29% ova1 revenue increase is primarily due to an increase in the number of tests performed in 2021 as well as an increase in the ova1 average revenue per test in the fourth quarter of 2021 compared to the prior year. prior to covid, in 2019, the third quarter versus fourth quarter growth was 7% quarter over quarter.
despite covid headwinds, we grew 12% sequentially and achieved a quarterly record number of tests performed in the fourth quarter of 2021. on a full year basis, 2021 ova1 revenue was $6.6 million, an increase of 45% over prior year. this 45% increase is driven by both the lower number of tests performed in 2020 due to the covid-19 and an increase in the ova1 average revenue per test. the revenue per ova1plus test performed was $382 for the fourth quarter of 2021 compared to $377 during the third quarter of 2021.
this year-on-year price increase was 5% compared to the prior-year fourth quarter of $364. our full year revenue per ova1 test perform was $378, a 13% increase compared to the full year 2020 price of $334. our full year revenue per ova1 test in u.s. medicaid perform was $414, a 15% increase compared to the full year 2020 price, excluding medicaid.
gross profit margin on ova1plus was 56% in the fourth quarter of 2021 compared to 50% in the prior year and 57% in the third quarter of 2021. the year-on-year price increase was driven by volume improvements, while the third quarter gross profit included slightly less kits and postage rate. research and development expenses for the three months ended december 31, 2021, were $1.5 million, a decrease of $100,000 or 4% compared to the third quarter of 2021. our r&d investment increased $700,000 or 98% year over year.
this spending was primarily focused on product development costs related to ovawatch, investments in aspire synergy and consulting expenses associated with endocheck regulatory clearance. sales and marketing expenses were $4.9 million for the three months ended december 31, 2021, and a decrease of $200,000 or 4% compared to the third quarter. this decrease was primarily due to less recruiting and promotional support costs as we execute upon our commercial strategy. the prior-year sales and marketing expense of $2.8 million was depressed as it did not reflect the current investments we are making in market awareness and the sales team additions.
general and administrative expenses were $3.6 million for the three months ended december 31, 2021, a decrease of $200,000 or 5% compared to the third quarter of 2021. we incurred $2.7 million in general and administrative expenses in the prior-year quarter. the year-over-year variance is attributable to headcount and personnel expenses. we ended the fourth quarter of 2021 with approximately $37.4 million in cash, cash equivalents and restricted cash.
cash used in operations in the fourth quarter of 2021 was $7.6 million, which was a decrease from the third quarter, which was $7.9 million. this decrease sequentially was primarily due to reduced consulting costs as well as recruiting costs from our sales team investments. our short-term focus is to continue execution on a key catalysts. key catalysts include acceleration of ova1 adoption and price, accelerated adoption of our aspire synergy platform and successful launch of new products.
the organizational changes nicole referred to will result in onetime severance separation and settlement payments as well as legal costs of approximately $1.3 million in the first quarter of 2022. i would now like to hand the call back to valerie to wrap up.
valerie palmieri -- executive chair of the board
thank you, bob. before we open up the call for q&a, let me restate our optimism for building the company for sustainable growth for the near term and long term. 2022 will mark the first year with our second-generation technology being offered in a full access environment. it will be the first year with our first aspira synergy customer ramping up adoption as well.
ovarian cancer accounts for more deaths than any other cancer of the female reproductive system and is the only gender-specific cancer with greater than a 50% mortality rate. our work in products are at the forefront of changing the standards of care and the detection of ovarian malignancies. we believe we are helping close the gap in detection and, most importantly, survival for women. in the near term, we believe ova1plus, with our diversity differentiation will become the standard of care and personalized pelvic mass risk assessment for ovarian cancer.
our long-term goal is to become the personalized liquid biopsy standard, inclusive of all ages, stages and race and ethnicities. we are now happy to open up the call for q&a and answer any of your questions. operator?
",":
operator
[operator instructions] our first question is from brian weinstein with william blair. please proceed with your question.
unknown speaker
hi. good morning. thank you. this is dustin on for brian.
bob, maybe this one is for you. i know you called out the severance cost for the personnel rationalization. we're just trying to get a better detail on some more specifics around the sales force rationalization. what are the expected cost savings from this? and maybe more importantly, what are your expected benefits from this and how is that factored into your outlook for 2022?
bob beechey -- chief financial officer
i think it was largely realignment and reinvestment. so while there will be some savings, it was largely a change relative to skill sets and coverage. there were also some management changes associated with that. so i think the other factor relative to looking at spend in 2022 is that we are anticipating launch costs associated with ovawatch this year.
so in terms of absolute numbers, we're not seeing -- we're not planning a significant decline relative to overall sales and marketing expenses during the year. so it's really about effectiveness and productivity. so i think it's consistent with our intentions to drive productivity up during the year. and then also the other factor in terms of spend is a significant expectation around the ovawatch launch this year.
unknown speaker
got it. great. thank you. and i know as of last quarter, i think you ended with around 40 reps.
i just wanted to confirm that number is still right around there and maybe what your intentions are for that number for the rest of 2022?
valerie palmieri -- executive chair of the board
hi, dustin. this is valerie. last year, we ended about 26 reps and our goal is to be in that 30 to 35 zone.
unknown speaker
got it. sorry about that.
valerie palmieri -- executive chair of the board
no problem.
unknown speaker
great. thank you. and then regarding the licensing deal on the rna technology, we just want to get a better understanding of how that option was exercised? was it a cash payment? was it stock? does it entail future royalties? and then maybe some further detail on the time lines when you expect that tech to be developed for that new assay.
nicole sandford -- president and chief executive officer
so in terms of the -- hi. it's nicole. thanks for the question. in terms of the cost, it was a relatively nominal cash payment, and we are actually still working on the terms of the agreement going forward.
is that right, bob?
bob beechey -- chief financial officer
yeah. no, we have a royalty arrangement with them that we previously disclosed that that's in the same zip code as our -- it's low single digits percentages. so i think that's consistent with our margin profile currently with the additional technology. what we will do, and it's largely reflected in our current run rate, but the exercise of the option basically commits us to support the codevelopment of what will be an ldt likely.
so i think it's really not a big onetime spend. it's really a confirmation that we're moving forward with the next phase of development. and we're very pleased with the economics of the royalty arrangement.
unknown speaker
got it. understood. thank you. and then in terms of trends, i know you talked about the first quarter hitting some records.
that's great. it looks like the recovery is going well. but maybe just trying to get some of your assumptions for the rest of the year in terms of access and asps, if there's any outlook that you have maybe for next month and beyond then that would be appreciated?
bob beechey -- chief financial officer
well, we referenced the fact we're working clinical utility on ova, and i think that the big factor we think that will ultimately -- so relative to price and asp, think in terms of incremental growth in the short term, absent a significant publication. one of the factors that we anticipate helping to drive adoption in general is our synergy platform expanded use case. so i think when you look at the outlook, while we haven't given guidance, we're all optimistic given the recent trends we're seeing in customer conversion as well as volume that access is opening up. so as nicole mentioned, we're all over if we have a resurgence that we don't -- we want to minimize any impact to that.
but we're moving full steam ahead. valerie mentioned we're at 30. we anticipate leading up to the launch, which we anticipate being this year of the ovawatch that will build on synergy and incrementally increase the sales force from 30 to -- in the mid-30s, 35 is really the number we've said publicly. so i think the optimism -- we're back in our office now and our sales force is jazzed up with the momentum that michael is bringing to the table as well.
so we're very bullish that our strategy of building out availability with synergy with the two super groups and then launching the ovawatch is going to provide us very strong momentum going into the second half of the year.
unknown speaker
got it. thank you. and then a last one on cash burn. it's been focused for a lot of investors.
i think this earnings season in regards to other companies in the diagnostic space. bob, incorporating your comments about operating expenses with the restructuring and all the moving pieces there. how should we think about what that means for cash burn this year?
bob beechey -- chief financial officer
well, i think i signaled that q1 has the one-off cost. so that's really onetime. and then i think we're thinking about a marginal reduction and then compression of cash burn as we launch and further grow adoption as the synergy platform starts to kick in with volume as our sales force productivity. recall, we've said in the past, while we did make some changes relative to the sales force, we've got a lot of salespeople that are getting better tenured.
so i think we're going to start to get to a full access, fully trained, fully up to speed stride. so i think -- and then our big optimism is related to dropping in ovawatch during the year, which was a much wider indication that we think is going to fuel adoption because the toolkit relative to ovawatch becomes a lot more clinically useful. the ova1plus is much more acute in terms of life or death and the implication for patient care, but the ability to use ovawatch to really determine if surgery is necessary is very -- our voice of customer on clinicians leads us to believe that there's just a gap in the toolkit that we think ovawatch is going to significantly impact. so those are the factors that will provide the uplift for utilization on the revenue side and think in terms of cash burn being most influenced by that and less so by the restructuring.
so i think we're on the current trajectory. we built out and essentially think about the q1 or it's more than a tweak, but it's really an optimization move as opposed to a cutback.
unknown speaker
got it. great. thanks for taking our questions.
operator
our next question is from ross osborn with cantor fitzgerald. please proceed with your question.
ross osborn -- cantor fitzgerald -- analyst
hi. good morning, everyone and congrats on the progress. so starting off, can you discuss ovawatch? would you be able to provide some more color around the commercialization plan for single-use? how should we think about the ramp exiting this year and early next?
valerie palmieri -- executive chair of the board
yeah. so as we mentioned, we submitted our paper last year and we actually have some really positive signals that we may be seeing publication of that soon, so stay tuned. and the ramp-up will be in the second half on that commercialization plan. we have a lot of work to do, but we have a really solid plan in place.
so we should be fully in the market in the second half of the year, and we expect to see -- i think in our remarks, we talked about there being a significant exponential driver to our volume as a result of ovawatch. but of course, that's not all going to happen this year. it will really start ramping up in the second half, and we'll see broader adoption next year. and then as we bring on the serial monitoring, it will grow from there.
ross osborn -- cantor fitzgerald -- analyst
ok, great. and then are you able to discuss pricing at this point or at least how it compares to the company's asp?
bob beechey -- chief financial officer
there's a couple of factors there. we are optimistic that there'll be the ability to cross walk the medicare pricing from the ova1, it's similar technology with a different algorithm. and i think that baseline medicare reimbursement, while we don't have final approval, we're in discussion, and we're optimistic that we'll essentially equate to the medicare pricing, then we have to go through the grind of working through -- working with all the individual insurers. so that won't happen overnight.
but we think that the technology is similar such that it's a broader indication. so we'll have a different pla, cpt code for ovawatch. but our intention is to migrate it to similar to ova1 pricing but there will be a little bit of a lag.
ross osborn -- cantor fitzgerald -- analyst
ok. got it. thank you for the color. and then on endo, i think i may have missed it, but is the company still targeting a launch in the first half of next year?
bob beechey -- chief financial officer
we've said 2023 and we're not trying to be cute on the timing. but there's still some -- a lot of work to be done. so we've certainly committed to 2023, and we're not backing off of that.
ross osborn -- cantor fitzgerald -- analyst
ok. great. and then moving on to gross margin. can you just provide a little bit more clarity on some of the headwinds and tailwinds seen during the fourth quarter? and how we should think about that for calendar '22 looks like genetix may have looked at margin during the quarter?
bob beechey -- chief financial officer
no. genetix, i think it's really volume-driven primarily. we had some -- we're sorting out the scaling and we were doing a lot of resupply of kits, and that's what gave rise to q3. that's the dynamic, there is kit build and resupply and the timing of that.
so i think -- when we scale over the year, we view margin to have upside largely based on volume ramp. we will have, as i mentioned earlier, more -- i think in terms of incremental price increase over the course of the year, which goes straight to margin and then the volume -- the scaling of the fixed costs relative to volume and we're not anticipating any one-offs, but the kit as we scale and build out kits and go to new customers, that's where it gets slightly lumpy. but as the numbers grow, i think the significance of that will smooth out.
ross osborn -- cantor fitzgerald -- analyst
ok. got it. and then lastly for me, i guess congrats on the higher selling price in the quarter. have you seen the willingness for payers to meet the increase? can you provide any color on the pipeline in terms of coverage?
bob beechey -- chief financial officer
well, we've gotten very positive indications, primarily with medicare on payer coverage for ovawatch. it's obviously premature relative to anything with endocheck to approach them. as i mentioned -- the step functionality that we're trying to drive, we previously discussed a clinical utility study, which has been somewhat hampered from a time line perspective relative to covid. we try not to use that as an excuse, but that's why it's been somewhat delayed.
that's been the issue with some of the larger nationals. but the other factor in the strategy in particular, relative to the large super groups as we think that they're very helpful in influencing payers as their customer base gets adoption because i think the voice of those providers actually counts a lot more than we as a device manufacturer and vendor. so i think that's the other element is as we get adoption and, in particular, get some major provider partners, we think that's going to help with reimbursement. but the new news relative to our dialogue needs to be the clinical utility, which we expect to be able to publish something this year.
but then obviously, there's a lag relative to the cycle of the payers in terms of getting their agreement and when they implement. so we're not -- we don't have our plans anything other than the incremental -- hitting the singles, picking up payers over the course of the year, we've been doing that over time, but we don't operationally plan on a big step function.
valerie palmieri -- executive chair of the board
let me say something on that, too. this is valerie. also the other piece is just having full access. this is our first year with having full access on the cigna in a sense of assuming omicron variant is shutting things down.
but we got the cigna contract, the cigna pricing and a lot of the pricing we got during covid. so the hope is that a new sales force, additional feet on the street, additional tenured feet on the street, we should be seeing more of those contract prices come through, as bob said, but the clinical utility is the big step function.
ross osborn -- cantor fitzgerald -- analyst
ok, great. thanks for the additional color.
operator
our next question is from kumar raja with brookline. please proceed with your question.
unknown speaker
france hudendu for kumar from brookline. appreciate the business update. thank you. for the ongoing endocheck trial, could you please talk about the type of samples that are being shared by the two companies? and just to get an idea of how you are thinking about the test, confirmation of endometriosis, is it still require tissue biopsy and histology? or do you expect that the other test may potentially replace it all together?
valerie palmieri -- executive chair of the board
good morning, kumar. it's valerie palmieri. thank you for the question. let me answer in two parts.
so in terms of specimens, we have a specimen collaboration with abbvie and a specimen collaboration with opdivo, two of the three pharma companies. these specimens are retrospective specimens. and we also have our own retrospective specimens as well, as well as additional study specimens where we've been working with collaborators. so in aggregation, we have a large retrospective specimen bank, which is the heart of the validation of the endocheck product.
we also -- in parallel, we are running -- we are initiating a prospective trial as well. so we have retrospective specimens and we are initiating a prospective trial as well. and the end goal in terms of comparing it to laparoscopic biopsy. laparoscopic biopsy is invasive.
this will be a noninvasive aid in detection and our goal is to have strong enough sensitivity and specificity, whereby a doctor and the patient would have indication of the endometriosis detection, and at that point, could initiate either medical management or could initiate surgery if that is specific treatment. so the goal is that this is for women, the initial product out of the gates will be women that are moderate to severe pain, and this will be a noninvasive endometriosis aid and detection product.
unknown speaker
got you. thank you. and also with regards to the breakthrough designation decision for endocheck, i was just curious if you've seen any further guidance from the fda? and is there any timelines that you could share with us? and also, could you talk a little bit about what kind of benefits this designation offer, especially in terms of regulatory issues or the commercial launch? thank you.
valerie palmieri -- executive chair of the board
ok. so in terms of that question, there's a couple of parts there. so the breakthrough designation is a brand new program. i'm not sure how familiar you are with it.
the benefits of it are that when you have a product that is truly breakthrough and you meet three criteria, which is number one, are you solving for a disease that's irreversibly debilitating; number two, is there a predicate device; and number three, is there an improved patient well-being. and we believe in our discussions with the fda, we have supported those three, but we are still continuing discussions with them. in addition, we are running a parallel process via ldt. as nicole alluded to in her section, the majority of novel diagnostics are ldts.
and we are running a parallel process, and that is something that we have informed as well the fda. your last question in terms of uptake on the product and also the sensitivity and specificity, again, we're looking to be the noninvasive solution versus laparoscopic biopsy.
unknown speaker
sounds great. thank you. thank you for taking the questions.
valerie palmieri -- executive chair of the board
you're welcome.
operator
we have reached the end of the question-and-answer session. and i will now turn the call over to management for closing remarks.
valerie palmieri -- executive chair of the board
in closing, we believe that our accomplishments during 2021 set us up for a strong 2022 and beyond. with myself leading the board and nicole leading the growth and scaling of the business, we are focused on doing the right things to drive profitability and growth. our end goal is to serve the women's health market with a platform coupled with proprietary science and data tools, which will drive better health and well-being to each and every patient we serve. thank you for joining us today, and we appreciate your support and interest in aspira women's health.
operator
this concludes today's conference, and you may disconnect your lines at this time. thank you for your participation.
duration: 49 minutes
call participants:
valerie palmieri -- executive chair of the board
nicole sandford -- president and chief executive officer
bob beechey -- chief financial officer
unknown speaker
ross osborn -- cantor fitzgerald -- analyst
more awh analysis
all earnings call transcripts"
