q,ticker,dt,prep_remarks,QnA
2020-Q4,AWH,2021-03-25 16:30:00,"prepared remarks:
operator
good afternoon, ladies and gentlemen, and welcome to aspira women's health fourth-quarter 2020 conference call. my name is laura, and i will be your coordinator for the call today. [operator instructions] as a reminder, this conference is being recorded. leading the call today are valerie palmieri, president and chief executive officer; bob beechey, chief financial officer; and kaile zagger, chief operating officer; dr.
lesley northrop, chief scientific officer; and dr. elena ratner, global chief medical advisor and clinical and translational medicine. after the prepared remarks, we will open the call for q&a. before we begin, i would like to remind everyone that statements made during this call, including the q&a session relating to aspira's expected future performance, future business prospects or future events or plans are forward-looking statements as defined under the private securities litigation reform act of 1995.
although the company believes that the expectations reflected in such forward-looking statements are based upon reasonable assumptions, actual outcomes and results are subject to risks and uncertainties and could differ materially from those anticipated due to the impact of many factors beyond the control of aspira. the company assumes no obligation to update or supplement any forward-looking statements, whether as a result of new information, future events or otherwise. participants are directed to the cautionary note set forth in today's press release as well as the risk factors set forth in aspira's annual report and third quarter 10-q filed with the sec, for factors that could cause actual results to differ materially from those anticipated in the forward-looking statements. at this time, i would like to turn the call over to valerie palmieri, president and chief executive officer.
valerie, thank you. you may begin.
valerie palmieri -- president and chief executive officer
thank you, operator. good afternoon, everyone, and thank you for joining us today. this afternoon, we will review our fourth quarter and full-year 2020 accomplishments, our financial performance, as well as an update on our q1 developments in terms of an acceleration of a product launch, a strategic agreement and payer coverage. in addition, i will be introducing two of our newest members of our executive team.
dr. elena ratner, global chief medical advisor of clinical and translational medicine; and kaile zagger, our chief operating officer. in addition to our executive team additions, we also recently appointed two new board members as well, dr. sandra brooks, md; and nicole sandford.
dr. brooks is the senior vice president and chief medical officer of tomas jefferson university hospitals, and is regarding her field as a thought leader in healthequity. ms. stanford a cpa is currently the executive vice president and global board services leader at the eli group.
and prior to this role, she was a national managing partner for deloitte's regulatory and operational risk practice. both appointees bring tremendous expertise to our board to help us take our company to the next level. i would also like to note that the majority of our board is now comprised of female directors at 71%, which we feel is important as a women's health company. i would now like to update you on 5 recent developments in the first quarter before i move into the 2020 review.
today, we are announcing the acceleration of the target launch date of ovasight to the fourth quarter of 2021. this technology was originally planned to launch in the first half of 2022. but based on the unmet market need, especially during the pandemic, we have made some additional investments and advancements in our algorithm, so we were able to launch ahead of schedule. this test, which was previously named ovanext will allow physicians to monitor a pelvic mass in patients who are not planned for surgery.
this is specifically designed for a population with a low prevalence of disease and has a total available market, which is three times that of ova1plus or 1.2 million patients per year. second, i am very happy to announce we've entered into a significant strategic research collaboration agreement for the development and commercialization of an ovarian cancer detection test for high-risk women. the collaboration is with dana-farber cancer institute, brigham women's hospital and the medical university of lodz. they have collectively published a novel microrna panel, which we intend to use in combination with our current technology.
we believe the high specificity demonstrated by this technology coupled with our strong sensitivity, has the potential to be the base technology for diagnostics, which will function as an early stage high-risk screening test. dr. northrup will cover more details in her section. number three, we announced coverage by new york state medicaid, one of the largest medicaid populations in the u.s., covering 29% of the population in the state.
this is a significant add to serve the underserved population in new york, and this brings our total covered lives to 179 million or 54% of the u.s. population as of april 1, 2021. number four, last month, we completed a public offering for $45 million, which was oversubscribed, and this significantly strengthened our financial position. and finally, in march, we presented at the congressional briefing titled advancing health outcomes for women and minorities.
we delivered a call to action for ova1 as the standard of care for ovarian cancer risk assessment for caucasian and non-caucasian women and the need to fund large race and ethnicity based trials. i am now moving on to a recap of our 2020 performance. last year was unlike anything we could have ever imagined, but i am so from our employees and how we effectively weathered the pandemic storm. we delivered solid test volume growth; improved price; added to our covered lives; and lastly, made significant key additions to our board, medical and executive teams.
we also continue to advance our product pipeline and strengthen our financial position as well during 2020. highlights of 2020 included seven major ones: number one, adding to our payer network with the addition of the cigna contract agreement. this is our first national payer, and we received very favorable rates. this in-network agreement added an additional 16 million lives to our contracted plans and includes ova1, in addition to our ovarian and cancer genetic testing panels, known as aspira genetics.
number two, we added to our medicaid coverage with 13 new state plans. major states added last year were georgia, new jersey and south carolina. with the addition of new york, our total credential medicaid population now stands at 60 million lives, which is 78% of the u.s. medicaid population.
having this coverage in place is so critical to managing the underserved population as we believe ova1 is the only technology available today that has adequate sensitivity for ovarian cancer detection and specifically black women. number three, through our digital and media campaign, we continue to increase the awareness of our technology and its superior performance relative to ca125, involves early detection of ovarian cancer and the detection of ovarian cancer risk in the black population. our campaign had a total of 133 media placements with a total of 139 million total media impressions. number four, we entered into a specimen collaboration agreement with abbvie.
abbvie agreed to provide us serum specimens, data and clinical metrics from the trial. these samples will support the development of endo check. in the first quarter of 2021, we also submitted an application to the fda for a breakthrough device designation and expect to have a dialogue with the fda in the second quarter of 2021. number five, as a patient-centric organization, we formed our own internal patient advisory board, led by chief spokeswoman, dr.
diane. this board includes ovarian cancer patients and survivors whose mission is to lead how we serve and educate patients. number six, we also successfully rebranded the company from vermillion to aspira women's health. the successor rebranding centered on our commitment to focus on women's health.
in addition, we rebranded two products, ovanext to ovasight and aspira genetics technology transfer to aspira synergy as well. and finally, we executed this year during an extraordinary and unprecedented times. before i turn the call over to kaile, who will cover aspira's commercial momentum in detail, i want to summarize the impact of our investment in commercialization and the progress we had. our fourth quarter volume grew sequentially over third quarter by 7%.
our ova1 revenue was up 15% due to volume growth, as well as an 8% price expansion on a per unit basis. bob will cover that in detail. in summary, we continue to work toward our overall strategic goal, which was to emerge stronger from the pandemic, and we believe we have accomplished this with our stronger team, our stronger financial position and our stronger pipeline. we are well positioned to invest, to grow and to drive adoption and most importantly, save lives.
it is now my pleasure to turn the call over to kaile zagger, a seasoned healthcare transformation executive whose experience spans across multiple healthcare industry disciplines. she brings extraordinary talent and abilities in building white business verticals, disrupting standard of care with net new technologies and elevating senior leadership teams to optimize performance. in a short period of time, kaile has launched a commercial strategy that is preparing us to significantly scale our commercial operations for standard of care adoption. we are thrilled to welcome her to the executive ranks of aspira women's health.
i'd like to introduce kaile. 
kaile zagger -- chief operating officer
thank you, valerie. i'm unequivocally excited to be a part of this leadership team. and this company, which represents a very important and personal mission to me, early detection of gynecological disease, beginning with ovarian cancer. undoubtedly, we have a robust pipeline of products that are positioned to disrupt the standard of care in the healthcare community, and will subsequently and exponentially save the lives of women by intercepting these diseases prior to late-stage diagnosis.
at the commencement of my tenure, deep analysis was performed with the intention of understanding the patient life cycle of our products and overall value they bring to the patient. in order to maximize and optimize our commercial position, we have enhanced our strategic plan in the following ways. number one, the repositioning and investment in core sales to capture 100% coverage of north america and strategically focused significant practitioners that can and will impact the standard of care conversion. we are markedly focused on our racial disparities within the core sales team.
and with our increase in medicaid coverage, we are diligently focused on accelerating access to care for these patients. we will be increasing our sales team investment by 38% in q2 to prepare for continued growth as well as the q4 ovasight launch. number two, we have launched the health systems team that will integrate our technology into pathways across various ologies that intersect ovarian cancer patients and integrate into the complex workflow environment of these systems. with over 80% of physicians scheduled to be owned by health systems by 2023, we are confident that this strategy is critical and timely for our organization.
number three, we have set in motion and integrated team comprised of highly experienced clinicians with informatics expertise. this team will work in a matrix to drive informatics integrations within the health system and create seamless workflows for adoption of our products. number four, we are creating a world-class customer experience for all customers, both small and large. we are expanding the size of this organization with the intention of providing optimal communication, white glove service and create an impeccable health systems, providers and patients alike.
we believe it will be a strong differentiator and contributor to the top line growth. number five, we have redeployed a synergy sales force to drive rapid adoption and penetration of our cutting-edge technology transfer platform. this is our decentralized platform, which is focused on healthcare systems, physician labs and clinics. synergy will also expand access for all aspira commercialized products and future pipeline innovations will be blended into the synergy platform.
all commercial verticals are horizontally connected with sharp focus on penetration, ease of use of our products and reacceleration of our growth across the continuum of care. we are now poised for growth to allow standard of care adoption of both ova1plus and genetics as a solution offering. and finally, the glue to our strategy is commercial activation of the market and awareness to the greater population. they are critical cornerstones and will be the fuel for growth behind the sales organization.
we have built our marketing organization in the past 90 days, and have amplified the focus around driving strong call to action campaigns across multiple channels. at the center of this strategy, we have placed the patient advisory board, led by dr. diane powis, our chief spokeswoman. this board is working to bring the patient experience and journey to life, while simultaneously magnify the horrific nature of ovarian cancer, across the health continuum and with key constituents such as the fda and the insurance community.
now i would like to pivot q4 performance and offer an insight into how the teams are performing in q1. as valerie mentioned, we delivered 7% sequential volume growth in the fourth quarter in the context of continued covid-19 restrictions. these restrictions continued in the first quarter and our sales territories. in february, we also experienced some patients and delivery disruptions due to inclement weather.
we are seeing a pickup in volume in march as the transformation strategies are gaining traction and the impact of the pandemic received. we believe q1 will track very similar to q4 in terms of volume due to these compounding factors and expect momentum to begin to build at a strong pace. in terms of ordering physicians for the quarter, 2,605 physicians ordered ova1plus, with 82% of the providers being repeat providers, consistent with our prior run rate. this clearly illustrates the impact that technology has on patient care, stickiness of the technology and the overall retention and growth opportunity we have with our expanded portfolio.
the number of ordering physicians increased 6% from the third quarter and flat year over year, signaling we are back to pre-covid levels in q4. i would now like to hand the call over to dr. northrop to provide an update on our innovation pipeline.
lesley northrop -- chief scientific officer
thank you, kaile. good afternoon, everyone. i would like to provide a brief update on our upcoming products and enhancements. as previously discussed with over 10 years of expertise in ovarian cancer risk assessment, we are creating a portfolio, which is comprised of products that impact a women's entire life cycle, starting with young adults with endocheck; to our hereditary risk for cancer genetix; including high-risk diagnostic screening, ovainherit; to benign mass monitoring, ovasight.
and lastly, our ovarian cancer risk assessment prior to surgery, ova1plus. we are continuing to increase our investment in r&d, and one of our key investments is our efforts on closing the disparity gap in women's healthcare, specific to the diagnostic accuracy of ovarian cancer detection. we have five active sites enrolled in our disparity clinical study the most recent addition was wayne state university in detroit, michigan as our first national cancer institute site. our time line for completing the study is still on track for the end of this year.
the goal is to put the manuscript by the first half of 2022. in parallel, we are continuing to recruit additional ethnic populations such as hispanic, black, asian into our oversight clinical studies as well as our international ova1 and overa study sites in the philippines and israel. both of these study sites are ending soon, and we are actively working on the data for multiple publication efforts. it is imperative.
we continue to capture an enriched population of women so that all of our current products and future products are pan ethnic focused. our second key investment is on our third-generation ovarian cancer risk assessment test, which is now branded as ovasight. we are pleased to announce today that we are accelerating the launch date to the fourth quarter of this year, with full national availability in 2022. this was driven by our belief in the clinical need to offer a risk assessment test for all women who present with a suspected pelvic mass.
during the pandemic, it became clear that assessment of masses not requiring surgery is a critical need. this test allows physicians to clearly classify masses as low or high-risk for malignancy to help guide clinical management. we submitted an abstract to the american society for clinical oncology for their early june conference of this year, and we'll be publishing both the analytical and clinical validation findings in q3 of 2021. we have received well over 500 prospectively collected specimens from our clinical studies that will provide real-world evidence data on the performance of the test.
this is an exciting time for the innovation team, as this will be our third product launched under my leadership as cso. first, being the genetix platform, and second being the aspire synergy genetix. i will now review our aid and diagnosis of endometriosis tests, known as endocheck. we believe there is market demand for a nonsurgical blood-based test to confirm the cause of the chronic pelvic pain of endometriosis early and help guide clinical management.
currently, endometriosis is treated based on symptoms and is diagnosed by surgical visualization and/or biopsy. though check will address the patient population of women who are experiencing chronic pelvic pain and want to afford to surgery by providing reassurance that their symptoms are indicative of endometriosis. the goal of this test is to allow for early diagnosis to direct appropriate clinical management that potentially reduces the portion of this disease. the early validation of an intended use population from the elagolix trial was submitted as part of the breakthrough device designation in january, and we are in dialogue with the fda.
in addition, we receive access to another valuable specimen bank from a consortium of six academic centers entitled endo marker study. this study was funded by nichd in support of the reproductive medicine network on endometriosis research. these specimens will support additional validation efforts of endocheck. additionally, we are in an early proof-of-concept of our ovainherit test, a diagnostic test specific to high-risk population of women, predisposed to ovarian cancer, either due to family history, personal history or genetic inheritance.
as mentioned earlier by valerie, we are evaluating de farber cancer institute, brigham and women's hospital and the medical university of lodz, microrna technology with diagnostic specificity in conjunction with our ovasight proteomic panel, which has high sensitivity as a potential diagnostic measurement of ovarian cancer. currently, clinicians can order ca125 with suboptimal sensitivity and specificity in conjunction with ultrasound to access risk in this patient population. we feel the combination of proteins and transcriptomics will outperform the current standard of care and better early detection of ovarian cancer. we are very excited about the innovation product pipeline.
with these products, we are circling the ovarian cancer disease state in a 360-degree view, ensuring that we understand the patient's hereditary risk for gynecologic cancers with our genetix product to help prevent disease. evaluating the acute risk for cancer and women with masses planned for surgery with ova1plus. and those where a monitoring strategy may be more appropriate with ovasight. and moving toward a diagnostic test for women at high-risk with ovainherit.
but our greater goal as a company is to improve women's overall health. to do so, we must add other gynecologic disease states like endometriosis that effect up to one in 10 women worldwide. this is the core goal of endocheck as an aid in diagnosis of endometriosis. we believe endocheck will provide a life-changing disease modification by enabling early diagnosis and treatment for women starting as early as young adults.
i would like to now turn the call back to valerie. valerie?
valerie palmieri -- president and chief executive officer
thank you, lesley. before we have bob provide an update on our financials, i would like to introduce dr. elena ratner. dr.
ratner recently joined our team as global chief medical advisor of clinical and translational medicine. she is currently the clinical division chief of gynecologic oncology at yale university school of medicine. she also serves as a director of the ovarian cancer early detection program that is part of the discovery to cure, yale medicines initiative focused on combating women's reproductive cancers. this initiative resonates greatly with aspire's mission and vision.
dr. ratner?
elena ratner -- global chief medical adviser and clinical and translational medicine
thank you, valerie. i'm delighted to join the call this afternoon. aspira's mission is to provide women with truly personalized ovarian cancer risk assessment and to enable early ovarian a detection for women of all ages, ethnicities and races, which is the core of my research and clinical practice. as the strive for improving survival of ovarian cancer patients and changing the narrative of this disease.
today, survival of ovarian cancer patient remains dismal and unacceptable. this is due in great part due to the challenges of early cancer actions as well as considerable ratio health equities in management of the disease. women of color, especially african-american women continue to have significantly lower five-year survival rates than caucasian women. there are many factors which drive this.
but having access to the best risk assessment technology in order to improve early stage cancer detection is critical. for generations, great amount of funds is being invested, and a great deal of research is being done in the field of surgery and chemotherapy in the disease. and yet, great majority of ovarian cancer patients will die from this cancer. this is due in great part to the delay in early stage diagnosis, making it clear and urgent that the bases come for better ovarian cancer early detection test, bedded technology, the supplement of all ages at messages and races for our best chance of changing the future of disease.
our end goal is to implement our technology as part of the care pathway at the institutional level, so that our care providers and every patient has equal access to the best personalized risk assessment solutions. i would like to turn the call back over to bob for a review of our financial results. bob?
bob beechey -- chief financial officer
thank you, dr. ratner. good afternoon, everyone. i'm delighted to be here, and i welcome our new team members.
as discussed, we've had continued volume growth in the fourth quarter. and now i'd like to make some high-level comments on the financials. product revenue was $1.4 million for the three months ended december 31, 2020, compared to $1.2 million for the third quarter. the 17% sequent increase is primarily due to an increase in of 1 test volume compared to the prior quarter and a sequential price improvement per ova1plus tests performed to $364 compared to $338 in the third quarter.
the number of ova1plus tests performed increased 7% to 3,849 ova1plus tests during the three months ended december 31, 2020, compared to 3,596 ova1plus tests performed for the third quarter. the volume increase was primarily due to our commercialization investment and further increase in patient doctor visits as patients have adjusted to the covid environment. gross profit margin on ova1plus was 50% in the fourth quarter, as compared to 45% in the third quarter, driven by improved volume and improved price realization. research and development expenses for the three-month ended december 31, 2020, were $735,000, a 24% increase from the third-quarter level of $594,000.
this increase was primarily due to product development costs related to ovasight as well as investments in bioinformatics and aspira synergy. sales and marketing expenses for the three months ended december 31, 2020, were $2.8 million compared to $2.2 million in the third quarter, a 32% increase. this increase was primarily due to increased expenditures on marketing to improve awareness, as well as slightly higher travel and entertainment as covid-19 pandemic restrictions slightly eased and investments in the commercial team. general and administrative expenses for the three-month period ended december 31, 2020, were $2.7 million compared to $2 million in the third quarter, a $0.39 increase.
this increase was primarily due to an increase in legal expenditures, as well as board of director fees as we settled the fourth-quarter installment of board restricted stock units in cash to defray tax liabilities, which arose in connection with rsu grants earlier in the year. our total cash utilization in the fourth quarter was $4.2 million compared to $3.1 million in the prior quarter. the fourth quarter included $428,000 related to the onetime cash settlement of restricted stock units. the remaining sequential increase in cash utilization was due to the increased investment in marketing and awareness as well as the investment in commercial and r&d.
we ended the year with approximately $16.6 million in cash. on february 8, 2021, the company completed a secondary stock offering, resulting in net proceeds of approximately $48.4 million, after giving effect to underwriting discounts but before expenses. we believe the strength of our balance sheet enables us to properly fund both the commercial and innovation opportunities facing the company. i'll now turn it back to valerie.
valerie palmieri -- president and chief executive officer
thank you, bob. before we open the call for q&a, let me restate our focus on building the company for sustainable growth for the near-term and the long term. in a year dominated by the pandemic, we delivered record enterprise value, growth, financial stability as well as we strengthen our team and our board. i am proud of what we have achieved and optimistic for a strong 2021.
we firmly believe that our strategy is the right one and that our technology and pipeline will be vital to lowering the overall healthcare burden and reducing significant inefficiencies in this care pathway. it's all about getting the right patient to the right doctor and finding the cancer at its earliest stage in all women. this mission is the core of our company. ovarian cancer accounts for more deaths than any other cancer of the female reproductive system and is the only gender-specific cancer with greater than a 50% mortality rate.
our work in products are at the forefront of changing the standards of care and the detection of ovarian malignancies. we believe we are helping close the gap in detection and, more importantly, survival for women. in the near term, we believe ova1plus, coupled with our disparity differentiation and genetic testing will become the standard of care and pelvic mass risk assessment for ovarian cancer. for the longer term, we are moving ahead with our planned launches of ovasight, endocheck; and lastly, ovainherit.
we also believe in this new covid error that racial and ethnic disparities and the importance of diagnostic information might actually be further elevated to reduce the aspira care and ensure that all women of every socioeconomic background, we see the best care possible. we are now happy to open the call for q&a and answer any of your questions. operator?
",":
operator
[operator instructions] our first question comes from the line of brian weinstein with william blair. you may proceed with your questions.
andrew brackmann -- william blair & company -- analyst
hi. good afternoon. this is andrew on today. maybe to start on the partnership announced today.
valerie, could you maybe just talk about sort of your level of confidence in bringing a product like this market you this technology? and i guess related to that, is there anything that you might be able to share with us around the development work that's been done so far to date? and when we should be thinking about any additional development normalization updates from here?
valerie palmieri -- president and chief executive officer
hi andrew, good afternoon. thank you for joining. your line was going in and out a little bit. so i don't know if it's your line or our line.
i'm hoping it was our line. so a couple of things. there's been two papers published. this is a partnership that we started a couple of years ago in terms of evaluating their technology.
and as you hear from the earnings script that is focused on microrna panel. so it's a collection of a panel, harvard, as well as dana-farber and brigham and the university of spent a number of years really studying the high-risk population. so this is technology looking at a specific panel for those high-risk patients. and as i said, they published two papers with significant ppv.
we haven't saved the ppv in public domain, but we can sell you the papers. and it's very significant ppv and very high specificity. the study that was initially done is about 454 patients. and of that study, about 34% of it was early stage.
andrew brackmann -- william blair & company -- analyst
great. and then maybe just following up here and recognizing it's still pretty early in that development work. could you just maybe provide some context around sort of levels of test performance that you think are needed for a commercially viable product? i guess really sort of what levels of sensitivity and specificity at that early stage should we be thinking about for broader uptick here?
valerie palmieri -- president and chief executive officer
so i would say that two things is that the colorectal screening guidelines just came out, right? and honestly, i thought that the performance metrics are on the lower side. we are aiming something in that 95%, 95% range. ideally, we'd like to get our specificity up to that 99%, but i want to say 95%, 95% is kind of what we are aiming for.
andrew brackmann -- william blair & company -- analyst
perfect. and then, bob, just one for you. i didn't forget about you here. one, with the number of initiatives ongoing, how should we be thinking about the opex and cash burn for 2021 and pacing of that throughout the year?
bob beechey -- chief financial officer
thanks for taking the question. i think that kaile referenced the fact that we're expanding on. i think q2 is the area where we're going to have a little bit of cost investment that's not offset by the revenue. that's not going to be dramatic, if you will.
i think when we phase those new hires out. but it's really this hospital group that we view as the driver to drive standard of care. and i think the ads phased over q1 in that team will be in the high single digits. and we're also looking at some it investment as well as the spending on the r&d.
so i think in those terms that we'll be phasing over time. and as the hospital group starts to turn revenue in the third quarter, a lot of those investments will start to pay for themselves. so i think it's really a relatively short-term bubble and fairly modest. i mean our objective this recent raise, we did.
we want to be very measured in terms of having that bridge us to positive. that was our stated intention when we did the deal, and we'll stay with that.
andrew brackmann -- william blair & company -- analyst
great. thanks.
bob beechey -- chief financial officer
thank you andrew.
operator
[operator instructions] our next question comes from the line of kyle mikson with canter fitzgerald. you may proceed with your questions.
kyle mikson -- cantor fitzgerald -- analyst
congrats on great update. so i want to start on the oversight acceleration. so i guess will the training the sales force be any different for ovasight versus ova1plus? and i guess, genetix, could just talk about that. and then i really would love it if you could help me understand how to think about the market size here.
so i could get it monitoring that. so that would be a few times a year, i think two to four as we've said in the past. but in terms of pricing, like asp, how much lower than the typical, like 330 could that could that be ultimately? and i'll leave it there.
valerie palmieri -- president and chief executive officer
no problem. so kyle, i'm going to start, and then i'll let kaile fill in as well. so in terms of training of the sales force, it's the same call point. so number one, same call point, and we've been selling a product in terms of a risk assessment where a woman to understand which doctor to do the surgery.
what doctors are really looking for is they really want to test for those patients that actually do not go to surgery. and we saw that during the conservative management through covid. and we actually are seeing that with a paper that we recently published in october, where we had a large percentage of our low-risk patients who did not move forward surgery. keep in mind, pre-menopausal women had the largest number of pelvic masses, and a lot of those on are fertile.
so surgery is something that is of top of mind. so that's number one. number two, in terms of asp. the asp initially that we will be rolling out be more of a stacked code version initially, but we will be going for an ama code just like we did with ova.
so it will be crosswalk to a similar ova. i do think that there will be some pricing discounts on this because it's going to be a test that we envision will be two to four times per year. keep in mind, the product that we are initially rolling out will be an initial product that is not for serial monitoring. i just want to make that clear.
so we had three cohorts on the oversight trial. the first cohort is a assessment of the risk of malignancy for benign masses. those, the patients are not planned for surgery. so it's a onetime use.
if the doctor elects to use it more than once they can do so. but our next revision of this will be a serial monitoring use of the product. so going back to the tam, i would say that the tam that we have is 1.2 million to 1.5 million women in terms of the use of the product that we'll be rolling out initially, that will be, again, subjective to the doctor. and then we'll be rolling out the two to four times per patient per year.
so just kaile wants to comment on the training that she's going to be putting in place for this new product.
kaile zagger -- chief operating officer
hi. thank you so much. yes, we have a robust go-to-market in place right now over the next six months, we'll be constructing not only the marketing strategy. but the field training strategy, and we will be actively getting the field team involved in this as of june.
so we have a three-month lead time of getting everyone integrated, getting up to speed on the products, understanding the new market segmentations that we are approaching and how to do this, so that we can rapidly penetrate and drive toward standard of care adoption as quickly as possible.
valerie palmieri -- president and chief executive officer
does that answer your question, kyle?
kyle mikson -- cantor fitzgerald -- analyst
yes, valerie. and kaile, thanks a lot for answering that. that was great. and just thinking about the on sales force a little bit further, actually.
so i guess currently, could you just kind of talk about like where you stand? and then when you increase 30%, i think i heard in the second quarter, that would be like 27, 28 reps. where will those take the typical six months to train? and then where will they be prioritized come early on because either you're rolling out the new product and synergy, there's a lot of different things to kind of think about if you're are --
valerie palmieri -- president and chief executive officer
[inaudible] so what we have is we have a team that's calling on the same call point. so number one, it's the gyn. we have the hospital team because there's a lot of women that actually come in at the gi level, the urology, orthopedic and then these women have their initial ultrasound and then go to a gyn. so we want to do a horizontal care pathway in the hospital.
i'll let kaile actually go into that. so in terms of the sales team, we see us evolving from, let's say, a team of and this is hospital and core, a team of, say, 20 in the core and in the 10 in the hospital. and over time, it's not initially going to be all this year, but over time, i see that team going to closer to 60. so we're going to methodically add in the markets that we have not been served where we haven't served right now.
we are going to double down in states like new york, where now we've got this medicaid contract, and we are going to be really having a very efficient relay team between the community swell that we've built for the last year. and also now that we have a bowl of physicians in the community, those physicians now are advocates at the hospital level, we're turning on the hospital system. so bringing on kaile, dr. ratner, who has the section chief at yale, these two individuals have the discipline and the know-how to convert healthcare institutions.
so that is really the core, and we feel that we've got to run a parallel path a well synchronized team, but a parallel path to actually get the hospitals in place in addition to additional market share and adoption at the community-based level. so let kaile also comment on the hospital strategy to give you more details.
kaile zagger -- chief operating officer
thank you, valerie. so i can add some specifics around the strategy and the tactical structure. so it essentially is a five pillar approach to creating standard of care. we have the core team of valerie first spoke about.
that is the approach to the gyn offices. and then there is the net new health systems team that will be working to integrate and rapidly adopt into the hospital system disrupting the standard of care there, which is currently 125. the third pillar of that is our integration leader team. so this is a team comprised of clinicians, background in the clinicians and expertise in informatics.
so they understand how to dive into workflow, how to assess process and how to integrate into the informatic overlays such as emrs. fourth pillar is the synergy sales force. so that will be our decentralized platform, which will be applicable into certain healthcare environments as well as super groups. and the fifth pillar of this is the marketing commercial activation pillar, all working together in a matrix environment to disrupt the standard of care.
the targeted approach that we've deployed is a three-pronged approach, and it's heavily data-driven around icd-10 codes, ca125 and covered live contracts that we have. so we've really structured north america to approach the places that were strongest first and the territories eventually will be comprised of one core sales rep, one hospital sales rep and integration lead and then coupled with the synergy counterpart that covers a few territories, all working in a collective matrix.
valerie palmieri -- president and chief executive officer
so hope that in terms of the overall plan.
kyle mikson -- cantor fitzgerald -- analyst
yes, that was fantastic. and i wanted to touch on the dana-farber brigham and blood partnership as well. so i know the research collaboration makes sense. but could you possibly talk about the economics at all? i mean, just thinking about like the role that those groups will play in the regulatory process, the ulta commercialization.
i think about the cash over the next couple of years. and then any color there would be great. and then can you just confirm if the new product, that kind of results of that partnership, if that is going be part of ovainherit? because it sounded like the mirna technology from that plus the ovasight panel will be ultimately open are? thank you.
valerie palmieri -- president and chief executive officer
yes. kyle, i would say you're pretty is do. so let me start, and i'll let dr. northrup fill in.
so this is a research collaboration with experts in, i want to say, high-risk early ovarian cancer detection. so they have spent a number of years honing this panel. they've published two papers as i said, an end of about 454 patients, 34% early stage. our goal is to take this microrna and couple it with our protein component to actually have a combined algorithm.
and so we are now going to be starting additional, i call proof-of-concept of the combination. and then we will, at that point, but we've already negotiated in terms of just the economics. getting back to your question. so we will be the commercialization engine we will be paying them a royalty similar to likely page and we will have exclusivity to the product.
and also, that will be a product that combines our technology and their technology. so this is a way of us instead of us developing on our own and spending, i want to say, years, plus the specimens are so rare. we are jump-starting our ovainherit with taking on their technology and then folding in with our technology. i'll let dr.
northrop also comment on this as well.
lesley northrop -- chief scientific officer
thank you, valerie. i think one of the exciting things that's so unique about coupling the transcriptome with the proteomics is that we can use the same sample type. so we can use the same term sample from the patient and be able to identify both the unique microrna expression profile that's indicative of the ovarian cancer as well as the protein profile. and in combination by doing this, this is where we're going to get that diagnostic accuracy of the disease and really be able to capture the early stage, so that we're getting the patients before and they have a higher survival rate.
the other beauty of it is that since it's from the same sample type, we can combine these two targets on the same technology platform. and so this way, we're not using two separate technology platforms, so we can create a high throughput technology process in our laboratory. and then at the last unique point about this is being able to combine this on the same technology, we can optimize the technology so that we can use smaller blood sample volume, so we can use what's called like micro sampling. so eventually, what we could do is actually launch this test in a dtc like model so that we could actually access patient sampling directly to their home versus having to go to the clinic, and utilize clinic consent opportunity for the patient.
so this way, it really harnesses on the disease and really is able for us to broaden the patient population so that we can test all women at risk for ovarian cancer.
kyle mikson -- cantor fitzgerald -- analyst
got it. that was great. just if i may, just one last question for me. with all these updates and initiatives, i just was wondering if the emphasis on payer coverage are expanding the covered lives, i guess, from 179 will be a priority in the near-term or if you're ok with that kind of $180 million live number?
valerie palmieri -- president and chief executive officer
so kyle, i would say that we're actually looking to put more resources on it, not only for ova, but these products that are coming to market in a, what i call a fast fashion. so the work that needs to go into ovasight reimbursement strategy, ovainherit, as well as endocheck, that begins now. so yes, we are, first and foremost, designing our trials or reimbursement in mind. if we don't change practice, we don't get paid.
and that is the spinal cord of our study protocols. so absolutely super critical, absolutely super critical even with our ova products. there are studies that we're initiating on clinical utility and looking at 12- and 24-month outcomes. plus we have studies that have long outcome data that are coming out of the philippines and israel.
so those studies will be published within this year, we believe.
kyle mikson -- cantor fitzgerald -- analyst
sounds promising. thanks for taking time and congrats again.
valerie palmieri -- president and chief executive officer
thank you kyle.
operator
ladies and gentlemen, we have reached the end of today's question-and-answer session. i would like to turn this call back over to ms. valerie palmieri for closing remarks.
valerie palmieri -- president and chief executive officer
in closing, as we see progress in covid vaccinations and believe the restrictions will subside, we believe our organization is poised for strong growth and we will continue to do the right things to drive long-term sustainability and value. with our increased commercial footprint, a guideline endorsed and differentiated test, a differentiated portfolio of test within the same call point, of which three will be in place by q4 of 2021. and now 54% of the lives under coverage, we believe we are in a position to support continued growth and profitability. our end goal is to serve a large global pelvic mass population and overall women's health market, with a platform coupled with proprietary science and data tools, which will drive better health and well-being to each patient we serve.
thank you for joining us today. and we appreciate your support and the interest in aspira women's health.
operator
[operator signoff]
duration: 43 minutes
call participants:
valerie palmieri -- president and chief executive officer
kaile zagger -- chief operating officer
lesley northrop -- chief scientific officer
elena ratner -- global chief medical adviser and clinical and translational medicine
bob beechey -- chief financial officer
andrew brackmann -- william blair & company -- analyst
kyle mikson -- cantor fitzgerald -- analyst
more awh analysis
all earnings call transcripts"
