Environmental_prep_remarks,Governance_prep_remarks,QnA,Social_prep_remarks,dt,prep_remarks,q,ticker,Environmental_QnA,Social_QnA,Governance_QnA
0.99995,,":
operator
thank you. [operator instructions] today's first question comes from tyler brown with raymond james. please go ahead.
tyler brown -- raymond james -- analyst
hey. good morning, guys. jeff, so you know that you completed some 1,700 decons, i think, year to date. but i'm just curious, was that maybe $10 million to $15 million in revenue? or just any thoughts about the remainder of the year there.
jeff feeler -- chairman, president, and chief executive officer
yes. so year to date, which goes through basically july, we're about 1,700 completed jobs. there's a lot more in the queue that we've seen a lot of acceleration there. from a revenue perspective, i'm going to give you through just june, or i should say, second quarter's number.
it was about $12 million.
tyler brown -- raymond james -- analyst
second quarter specifically?
jeff feeler -- chairman, president, and chief executive officer
yes. year to date, we're running at about $14 million revenue trend.
tyler brown -- raymond james -- analyst
ok. perfect. so i know you're not giving guidance. i completely get it, things are fluid, but i am hoping for at least a little bit of help, so kind of here i go.
but in the original $240 million guide pre-covid, i think it was comprised of, say, $90 million from nrc. and i think that included, say, $40 million from energy disposal and about $150 million in the legacy ecol. so as we sit here today, it feels like maybe there's a little bit, not a lot, but some friction in the legacy ecol. the energy business has been crushed by softness factors, and that's probably no ebitda.
and then the other $50 million of nrc also feels down, but then you also have some positives from the decon work. so if i'm following the bread crumbs, my logic is leading me on a path to somewhere in the high 100s for ebitda this year. i know you're not giving guidance, but am i crazy off with my logic?
jeff feeler -- chairman, president, and chief executive officer
yes. so i'll give you a little bit of color around here. and the reality is what we see today may not be what we are seeing tomorrow, and i'm just going to caveat it that way. but you're directionally correct.
on the energy waste business, we thought that was going to deliver around $40 million of ebitda this year. that definitely is going to be close or near breakeven on that. so that's taken right off the top of that. the legacy us ecology business is holding up very well.
if you really â and this is a key thing eric covered in there is that if you look at year-to-date results, we're up year-over-year on revenue as well as ebitda. and it's holding well. we're seeing some positive signs. we would have probably been at a point of exceeding what we thought if covid didn't happen.
shifting to some of the nrc business, the ones that are tied to industrial activities are actually holding up well, and the er services are holding up fairly well with the addition of the covid work. what's been absent is industrial activity. that is what we're expecting to improve, come back in the second half of the year. so all in, we're not giving guidance.
and one of the things that we kind of looked at is, we've actually looked at what street estimates are out there and we think that's a fairly reasonable estimate that's out there right now, and probably would be in line with what we would have given if we were to have given guidance. so that's where we're at now. we need a little bit more time and space, seeing what happens in q3, potentially even in q4 and how the pandemic progresses until we're ready to reestablish official guidance.
tyler brown -- raymond james -- analyst
ok. that was extremely, extremely helpful. real quick, eric, you proactively amended the credit agreement, i think, in late june. you ended the quarter at 3.8.
and by the way, does your credit agreement use some sort of pro forma ebitda for nrc in the calculation? because it just doesn't seem â the math doesn't line up. it feels north of 3.8.
eric gerratt -- chief financial officer
yes. so within the agreement and the way the covenant calculation works, there is â it's an adjusted â it takes our ebitda, and then there are some adjustments. we get to take credit for things like some estimated synergies or assumed synergies for the next 24 months. we're able to take credit for some certain restructuring items that are considered those things.
so it's not just straight ebitda that we report, there are adjustments to it in the covenant.
tyler brown -- raymond james -- analyst
ok. ok. yes, that's helpful. but as ebitda kind of snakes through over the next couple of quarters, i mean, do you think that, that leverage ratio is going to remain somewhat steady? or do you think it's going to kind of crest over the next couple of quarters?
eric gerratt -- chief financial officer
yes. as we look at it, and again, not giving guidance, but as we look at our models and various sensitivities, what it currently shows for 2020 is that we will probably crest at the end of the third quarter and then come back down a bit in the fourth quarter based on what we see today. we haven't done a lot of work on 2021. we've done some high-level work.
but as you look at it, and we put, i put a slide in the presentation today, i think it's page 16, that kind of shows you the step-up in the amendment that we did and it shows that the credit agreement with the new amendment gives us the highest level at the end of q1 in the 2021, which i think is where we probably crest because typically, q1 is where we write-up the highest. but that trend, and as you look at that slide and how that flows up, that's kind of in line with, again, what we expect right now at a high level with a fair bit of cushion built into that covenant level.
jeff feeler -- chairman, president, and chief executive officer
i'll just add, tyler. we negotiated cushion.
eric gerratt -- chief financial officer
we definitely did.
tyler brown -- raymond james -- analyst
yes. no, it definitely seems like it. but real quickly on the capex, so do you have kind of a good number there? is it $60 million to 65 million? or maybe my math is way off, i'm not sure.
eric gerratt -- chief financial officer
yes, yes. yes, tyler, we still think it's in that range, $60 million to $65 million, which is which is around 30 million less than what our initial guidance for the year was.
tyler brown -- raymond james -- analyst
ok. and just one last one. so you mentioned it upfront, but where exactly is grand view? so i think in the original guide, you guys were budgeting something like $7.5 million for that build. but to date, you've only spent like, call it, $2 million.
i don't â maybe it was back-end weighted, it always has been back-end weighted, but did it get pushed out? or are you not going to spend that money? i'm just curious what's kind of going on there?
jeff feeler -- chairman, president, and chief executive officer
yes, we started the construction of the stabilization building in the second quarter. we expect it to be done november, december timeframe. range is about what you said. there's still some additional insurance recoveries on that building in there.
and so that's in the $60 million to $65 million of cap spend this year. we had originally thought we were going to push that off into 2021, but the reality is, is that we wanted to get that up and operational and really take a long-term focus, and i credit simon to really pushing that forward.
tyler brown -- raymond james -- analyst
ok. great. but that is in the $60 million to $65 million?
jeff feeler -- chairman, president, and chief executive officer
it is, yes.
tyler brown -- raymond james -- analyst
ok. all right, guys. i appreciate the time. thank you.
jeff feeler -- chairman, president, and chief executive officer
thanks, tyler.
operator
and our next question today comes from michael hoffman with stifel. please go ahead.
michael hoffman -- stifel financial corp. -- analyst
hey, jeff, eric. thanks for taking the questions. hope you guys are doing well. so cost cuts that were achieved in the second quarter, given the trends you're seeing, what should we expect that reverses in maybe like bonus accruals, stuff like that? and what do you think you get to keep? and another way to sort of word that is, do you think you've permanently moved up at least the low end of your incremental margins?
jeff feeler -- chairman, president, and chief executive officer
so yes, michael, i think so. i mean it's â certainly a lot of our â the cost savings that we've experienced so far are going to be temporary, things like travel. obviously another big component is the financial component of our incentive plans which are going to be a fair bit of savings this year. but we have done some structural things, the largest of which are obviously in the energy waste disposal business, the former sprint business.
if you look at what we've done there in terms of rightsizing the labor force, in terms of returning a lot of equipment that's been on rental and things like that, if you look at that annualized savings number kind of going forward, that number is in the $20 million, $25 million a year range. and so pretty meaningful, pretty significant that, that would be structural pending the market completely turning around, us needing to rehire people, get cranked back up. but in the meantime, that's probably the area of the most meaningful structural reductions.
michael hoffman -- stifel financial corp. -- analyst
ok. and you don't anticipate a reversal of any of the incentive comp accruals by the end of the year based on what you have as line of sight in the no-guidance guidance?
jeff feeler -- chairman, president, and chief executive officer
that's correct.
michael hoffman -- stifel financial corp. -- analyst
ok. what would it take for those to come back? like as a percent of the 240 original, where would you have to land for you to have the incentive comp come back on?
eric gerratt -- chief financial officer
so for the lowest level on most of our incentive comp plans for the financial component, they start to pay out in the 80% to 85% of the target range. so we'd have to be in the 80%, 85% of that, call it, 240 ebitda, which puts you right around 200.
michael hoffman -- stifel financial corp. -- analyst
got it. and then within the free cash flow backstop, which we appreciate, sort of round number, $50 million. should we assume we take 100% of that and pay down debt with it?
jeff feeler -- chairman, president, and chief executive officer
yes. michael, our capital priorities are going to be â we're going to continue to invest the capex that's in there, but then we will be delevering the business.
michael hoffman -- stifel financial corp. -- analyst
ok. and is there any timing related to the flow of that cash for the rest of the year? or are there some oddities around cash tax payments, cycles or interest payments so we don't find ourselves on a negative in the third quarter going, ""oh my goodness, you're not going to be able to do the 50,"" because of the timing of stuff like that?
jeff feeler -- chairman, president, and chief executive officer
yes. as we kind of look at it for the year, i think third quarter will likely â free cash flow for the third quarter will likely be down quite a bit from the second quarter. i don't think it will be negative, but it will be a lot lower than the second quarter and then a really strong fourth quarter is what i'm expecting.
michael hoffman -- stifel financial corp. -- analyst
ok. if you can talk about you shouldn't do anything less than the f'19 free cash, does that put us in a situation where we're basically finishing the year at no less than overall business, f'19? and then whatever the state of the world is, there's â we're back to 3% to 5% base growth? event business is pretty regulated-driven so it's not a lot of discretionary and your industrial business is finding a leveling off, and i'm back in that 3% to 5% kind of zone plus whatever is happening in retail growth. is that the right way to think about it conceptually?
jeff feeler -- chairman, president, and chief executive officer
yes, barring the pandemic and its impact there. i mean, i think that is a reasonable way to think about it. that's the challenges i think most businesses are having today is that we're battling something that is unknowable and is outside anybody's core expertise on here and its impact to the overall economy. but that's probably a good way to think about it.
michael hoffman -- stifel financial corp. -- analyst
and in the field and industrial services and the industrial weakness, it was in 2q, are there particular â like i'm assuming auto was â exposure in 2q. so that gets â they're back online, maybe not at high levels of production, but they're back online, and that's one of the comebacks. but are there better end markets that stood out particularly that were disrupted as either nonessential or made decisions to close and now are back online?
jeff feeler -- chairman, president, and chief executive officer
yes. actually, i think it's more across-the-board. i mean you call out autos. yes, we had a forced shutdown, and we almost had 100-plus people furloughed on there.
all of them are back to work, all the plants are up and operational. and so that was a comeback in june, and it's continuing to be good in those business lines. when you start talking about where we saw a lot of â on the field services side is where, say, lab pack, where you didn't â you had customers that didn't want us on site. i mean they had their own protections in place, so they weren't doing business.
and so those are starting to come back in there. and that's where on the field services side in the second quarter we saw most of the most of the drag.
eric gerratt -- chief financial officer
the other one, michael, we saw a pretty significant drag in the second quarter was â and again, this is for field and industrial services, on the transportation and logistics. just a lot less or fewer opportunities as things were shut down on the transportation side from the services perspective in the second quarter.
michael hoffman -- stifel financial corp. -- analyst
ok. and then the emergency response piece of nrc, it's typical, business has been 15,000, 20,000 of these small little spills. it's outbreaks, to tank leaks or truck leaks, things like that. how do you see the pattern of that trend sequentially? is it consistent with the onboarding again of the customer broadly? or is it more â is it a big customer exposure? small customer exposure? i'm just trying to understand how to think about influences.
jeff feeler -- chairman, president, and chief executive officer
it's really miles driven. i mean if you really get to it, most of those accidents and occurrences on the er side is from transportation mishaps. and we have seen recovery in all of that. it's nowhere near pre-covid levels.
and so the positive sign is that we are seeing a recovery. but, i mean, i don't know where you're at in the world, but our transportation levels are a lot down from a traffic pattern perspective in almost all of our markets that we've seen.
michael hoffman -- stifel financial corp. -- analyst
so this is the total country vehicle miles traveled and lots of cars on the road and they â results in accidents? because vehicle miles traveled are off the bottom. there's a 70% recovery off the bottom, but we're still well below historic levels in rush hour, things like that or nowhere near back. that's what you're referring to?
jeff feeler -- chairman, president, and chief executive officer
that is what i'm referring to, and we actually started seeing all of that, and that started recovering in june, and we started seeing our â what i call industrial activity er services, that's been consistently going up, and we continue to see that in july as well.
michael hoffman -- stifel financial corp. -- analyst
ok. and then lastly for me. remediation in that field and industrial line has got to be highly discretionary. so it kind of is a canary in a coal mine.
what's happening with that?
jeff feeler -- chairman, president, and chief executive officer
it's actually trending up. this kind of correlates a lot to our event business on the waste side. remediation is very similar. we are not seeing customers pulling projects.
we're actually seeing a lot of customers bringing bid proposals and things to the table. so second half of the year for our remediation group is trending really positive right now with a number of contracts that we've won and are planned to go. so that's the irony in all this is call it, manufacturing down slightly just from the shelter-in-place and things like that, things that are on construction sites, remedial activities, things like that. it continues to move.
michael hoffman -- stifel financial corp. -- analyst
all right. and then last for me. on the retail side, are there any major bids outstanding that could lead to ongoing incremental growth here at this healthy double-digit pace?
jeff feeler -- chairman, president, and chief executive officer
sure. steve, do you want to address that for michael?
steve welling -- executive vice president of sales and marketing
sure, michael. we actually have four new awards that are kicking in. they started in second quarter, but should benefit second half, probably more than $9 million to $10 million just in ramping over the next few months. so yes, we are having success there, and we see future growth over the next couple of years.
michael hoffman -- stifel financial corp. -- analyst
thanks. thanks for taking questions.
operator
[operator instructions] today's next question comes from jeff silber with bmo capital markets. please go ahead.
jeff silber -- bmo capital markets -- analyst
thanks so much. in your prepared remarks, when you talked about the event business, you mentioned the strong pipeline. can we get a little bit more color in terms of the type of projects in that pipeline and what you're expecting? thanks.
jeff feeler -- chairman, president, and chief executive officer
yes, jeff. i'm going to let steve address the event side.
steve welling -- executive vice president of sales and marketing
yes. so there's a combination of things. we have multiple radioactive projects going to our sites in idaho and michigan. we have some court-ordered cleanups with waste streams like mercury and lead and chromium.
so it's a combination of things, but we're not seeing any slowing there. the pipeline remains strong and we continued on quite a few of these projects over the last six months without much delay.
jeff silber -- bmo capital markets -- analyst
and when you have those court-ordered projects, those are considered essential even if it's in areas that are locked on, that's still something that you're be able to do?
steve welling -- executive vice president of sales and marketing
remediation in a lot of areas is considered essential when you're cleaning up the environment. one of the reasons that some of these companies have continued to handle the work is if you think about other parts of the economy being shut down, there's not as much traffic. you can get in and do the remediation without all the same concerns. you can actually go faster, which means the remediation company is making more money.
they're able to move trucks without all the controls because there's not the same level of traffic or concern as if things were moving at full pace.
jeff silber -- bmo capital markets -- analyst
ok. that's actually very interesting. and then just a quick numbers question. your free cash flow is really strong.
were there any specific items to call out in the second quarter? like i'm assuming there was a payroll tax deferral. anything else like that would be great.
jeff feeler -- chairman, president, and chief executive officer
yes, jeff. we did and are taking advantage of the payroll tax deferral, which we think for the full year in 2020 is going to contribute about $8 million of free cash. and so a portion of that, obviously, is in there. the other piece that we saw â or one of the big drivers that we saw is we've actually â from a working capital perspective, we had a pretty strong quarter in the second quarter.
really good collections. we're monitoring collections very closely as is everyone and fingers crossed, things are still going very well from that perspective. and so you've seen some working capital pickups around our receivables and going the other way around the payables as well. so i would say that was one of the biggest drivers is just working capital and focusing and really getting â doing a great job from a collections perspective.
jeff silber -- bmo capital markets -- analyst
ok. great. thanks for the call appreciate it.
operator
and our next question today is a follow-up from tyler brown at raymond james. please go ahead.
tyler brown -- raymond james -- analyst
hey. reat. thanks for the call appreciate it.i'm not sure if simon is on, but i have an operating question. so pretty much all of your rail partners have implemented precision scheduled railroading.
i know you're a heavy rail user. i'm just curious what you're seeing from a rail service perspective. are you seeing better turn cycles? is that driving costs down? or are you guys rethinking your gondola needs?
steve welling -- executive vice president of sales and marketing
i would say it's really been steady as she goes. i mean thinking back on our projects that we've seen improvement, i can say i haven't heard many issues, and i think they've been moving projects. they've been moving at pace. so i'd say it's really been very consistent.
tyler brown -- raymond james -- analyst
i appreciate. i just was curious. thank you.
operator
and ladies and gentlemen, this concludes the question-and-answer session. i'd like to turn the conference back over to the management team for any final remarks.
jeff feeler -- chairman, president, and chief executive officer
i'd just like to end the conference by thanking those who are attending and hopeful that you all stay safe during the pandemic. and looking forward to updating you next quarter.
operator
[operator signoff]
duration: 53 minutes
call participants:
eric gerratt -- chief financial officer
jeff feeler -- chairman, president, and chief executive officer
tyler brown -- raymond james -- analyst
michael hoffman -- stifel financial corp. -- analyst
steve welling -- executive vice president of sales and marketing
jeff silber -- bmo capital markets -- analyst
more ecol analysis
all earnings call transcripts",1.0,2020-08-07 10:00:00,"prepared remarks:
operator
good day, and welcome to the us ecology, inc. second-quarter 2020 earnings conference call. [operator instructions] please note, today's event is being recorded. i would now like to turn the conference over to eric gerratt, chief financial officer.
please go ahead, sir.
eric gerratt -- chief financial officer
good morning, and thank you for joining us today. joining me on the call this morning are chairman, president, and chief executive officer, jeff feeler; executive vice president and chief operating officer, simon bell; and executive vice president of sales and marketing, steve welling. before we begin, please note that certain statements contained in this conference call that do not describe historical facts are forward-looking statements as defined in the private securities litigation reform act of 1995. since forward-looking statements include risks and uncertainties, actual results may differ materially from those expressed or implied by such statements.
factors that could cause results to differ materially from those expressed include, but are not limited to, those discussed in the company's filings with the securities and exchange commission. these risks and uncertainties also include, but are not limited to, statements regarding the continued impact of the covid-19 pandemic on our business, the microeconomic impact of specific end markets in which we operate and our expectations for the financial results for 2020. management cannot control or predict many factors that determine future results. listeners should not place undue reliance on forward-looking statements, which reflect management's views only on the date such statements are made.
we undertake no obligation to revise or update any forward-looking statements or to make any other forward-looking statements, whether as a result of new information, future events or otherwise. for those joining by webcast, you can follow along with today's presentation. for those listening by phone, you can access today's presentation on our website at www.usecology.com. throughout yesterday's earnings release and our call and presentation today, we refer to adjusted ebitda, adjusted earnings per diluted share, cash earnings per diluted share and adjusted free cash flow.
these metrics are not determined in accordance with generally accepted accounting principles, and therefore susceptible to varying calculations. a definition, calculation and reconciliation to the financial statements of adjusted earnings per diluted share, cash earnings per diluted share, adjusted ebitda and adjusted free cash flow can be found in exhibit a of our earnings release. we believe these non-gaap metrics are useful in evaluating our reported results. we'd also like to point out that our second-quarter results include contribution from the nrc group holdings acquisition that closed on november 1, 2019.
throughout this presentation, we often refer to nrc group holdings as nrc. we have also provided data on a stand-alone basis for us ecology, which is referred to as legacy us ecology. similarly, for stand-alone nrc data, we refer to that group as legacy nrc. this disaggregation is an attempt to provide increased transparency and understanding of the underlying business.
with that, i'd like to turn the call over to jeff. 
jeff feeler -- chairman, president, and chief executive officer
thank you, eric, and good morning, everyone. i hope you and your families have remained safe during these uncertain times. before i have eric review the second-quarter results, i'd like to update everyone on how us ecology is managing through the last few months, given the impact of covid-19 to the economy and our customers. for those that are following on our webcast presentation, please direct your attention to slide 6.
during the second quarter, in response to the covid-19 pandemic, we took swift action to deploy safety protocols throughout our organization, mobilized 30% of our workforce to work from home. using our established networks and expanding our procurement channels, we were able to secure valuable ppe to ensure that our teams and customers were properly protected. with our services deemed essential by the u.s. government, we implemented our business continuity plans and i am pleased to report that we have been able to remain operational during the entire pandemic thus far with no lost days.
this focus on safety, process and protecting our team members was critical in mitigating the spread of the disease, particularly in hot zones, where many of our team members are deployed. to safeguard the financial strength of the company, we implemented proactive and prudent measures to our operating plan, reducing costs and capital spending. our capital preservation initiatives included a reduction of approximately 30% to our planned 2020 capital expenditures, the suspension of our quarterly cash dividend, cost controls including deferment of noncritical activities, elimination of discretionary spending and rightsizing the organization where needed. these actions are anticipated to generate up to $70 million of annual cash savings, providing the flexibility to preserve our talented workforce and position us to take advantage of the opportunities as the market rebounds.
these actions also supplement our strong operational cash flow generation, providing added financial flexibility as we navigate these unprecedented times. in fact, our free cash flow during the quarter almost tripled to prior year levels, allowing us to strengthen our balance sheet and improve our net debt position since the first quarter. during the second quarter, we amended our credit agreement to temporarily increase our leverage covenant through march 31, 2022, allowing for further financial flexibility. i continue to be thoroughly impressed with the dedication, execution and adaptability of our 3,500 team members who have continued to service our customers despite these unparalleled and stressful conditions.
they continue to provide safe and compliant solutions to protect human health and the environment, which is exactly what is needed today. this includes our covid-19 safe operations program, a new proactive cleaning and decontamination solutions package for commercial and government customers. this multifaceted program supports a full range of business needs to safely reopen and resume operations, including onetime or ongoing decontamination, preventative cleaning, and waste disposal services, all from one trusted partner. through the end of july, we completed 1,700 covid-19 responses which accelerated in late june and july as infection rates increased on reopening.
looking at the quarter, we saw revenue declines across most business units compared with our budgeted 2020 expectations. as expected, the month of may was the low point, slightly below april levels. we saw a noticeable pickup in june as businesses started to reopen. looking ahead, we are cautiously optimistic that we will continue to see sequential monthly improvement, barring any major pockets of the united states or eastern canada shutting down again.
despite the external challenges caused by the pandemic, our teams continue to move the company forward through the execution of long-term strategic initiatives. specifically, during the quarter, we completed the construction and expansion of our enhanced drum handling capabilities at our nevada operation, which will allow for more efficient treatment; implemented five new retail account programs; implemented our smarter sorting retail technology pilot program in three key markets; deployed $4 million of capital on new high roi growth projects; launched a new customer interface technology that we believe will be best-in-class for our customers to use our services, obtain data and manage their waste management needs; opened up our global emergency response operations center; commenced the reconstruction of our grand view stabilization building; focused on a number of environmental, social and governance initiatives, including advancing our diversity and inclusion program; and starting the operation of our aerosol recycling technology. and these significant accomplishments were carried out while making material progress on the nrc integration efforts. this is just a small sample of what we've been doing during the pandemic.
shifting to the highlights on the quarter from a financial side on slide 8. my big takeaway for the quarter is the resiliency of our business model. despite the headwinds and turbulence in many of the markets that we serve, including energy, the diversification of our services and collection of irreplaceable assets allowed us to continue to generate strong cash and produce solid financial results. during the quarter, total revenue was $213.9 million up 37% over the same quarter last year.
nrc contributed $70.4 million in the second quarter of 2020 and was down 19% sequentially from the first quarter of 2020. legacy us ecology saw a revenue decline of 8% compared to the second quarter last year and 7% decline sequentially from the first quarter of 2020. during the quarter, total company adjusted ebitda was $38.7 million. legacy us ecology's adjusted ebitda was down 6% when excluding over $2 million of insurance proceeds for business interruption claims recognized in the second quarter of 2019.
sequentially, legacy us ecology's adjusted ebitda was up 8% from the first quarter of 2020. nrc contributed $5.2 million of adjusted ebitda during the quarter, which included a $2.1 million adjusted ebitda loss from our energy waste disposal services business which was hardest hit of all of our business lines. we reported an adjusted loss of $0.08 per diluted share, which included a higher than expected effective income tax rate due to the near breakeven results and included approximately $0.14 per diluted share of noncash amortization of intangibles related to nrc. as i mentioned earlier on, despite these softer results, we were able to increase our free cash flow to $18.7 million during the quarter, up from $6.5 million in the same quarter last year.
diving into some more details on slide 9. legacy us ecology's environmental services segment revenue declined 9%. base business was the primary contributor of that decline, down 10% from the second quarter last year and down 8% sequentially from the first quarter of 2020. we continue to see growth in our event business, which was up 12% year-over-year and up 2% sequentially from the first quarter of 2020, helping to offset some of the impact of the shutdown had on our base business.
we also were able to expand our environmental services segment ebitda margin in the second quarter of 2020 by over 240 basis points to 44.1% compared to the same quarter last year. in our legacy field and industrial services segment business, revenue declined 6% in the second quarter from the same quarter last year. most of the service lines were negatively impacted by the pandemic shelter-in-place orders and related business shutdowns, especially those service lines that required our field teams to be on site. this led to an ebitda margin contraction during the quarter.
a bright spot continues to be our strong growth in our small quantity generation services led by our retail services. strong year-over-year growth in our retail services more than offset double-digit declines in other small quantity services like lab pack, ltl and household hazardous waste, which were more impacted by the shelter-in-place orders. our emergency response business line also saw year-over-year increases as our legacy us ecology operations responded to covid-19 decontamination services, benefiting from the cross-selling efforts of nrc services, offsetting the lower industrial based emergency response activities. despite positive developments in our business in june and into july, the evolving health crisis and its impact on local and regional business activity levels is resulting in a continued level of unprecedented uncertainty in the industrial economy.
as such, it continues to be difficult to provide 2020 guidance with any degree of accuracy. we do expect our second quarter will be the lowest quarter in 2020 with a healthy recovery anticipated in the second half of the year. despite the second half recovery, operating results will remain below our original expectations we established pre-covid. many of our field services that were hit the hardest by the economic shutdown are expected to resume at an accelerated pace, but are not expected to recover to pre-covid levels in 2020.
we expect our base business to continue its rebound at a slower pace, mirroring industrial activity. partially offsetting expected base business softness will be continued growth in our event business on active shipments and a strong pipeline of projects expected to commence in the third and fourth quarters of this year. we expect industrial based emergency response services to increase as business activity level increases. this will be in addition to responding to the high demand covid-19 decontamination events that have continued to accelerate as the infection rates rise as well as other weather and natural disaster responses.
we experienced in the second quarter â as we experienced in the second quarter, our energy exposed businesses that were the most severely impacted, and we expect them to be operating at near breakeven from an adjusted ebitda basis for the full year in 2020. despite the overall lower levels of business activities, we do not â we do expect to deliver strong year-over-year free cash flow generation in 2020 over 2019 levels. in summary, the financial flexibility of our business model, continued free cash flow generation, strong financial liquidity provided by cash on hand and available capacity on the company's lines of credit and the dedicated workforce will allow us to navigate these challenging times and position the company to quickly capitalize on opportunities for growth as business conditions begin to recover. with that, i'll turn it over to eric for some more details.
eric gerratt -- chief financial officer
thanks, jeff. as i cover the detailed financial review, i'll be discussing consolidated results that include nrc before i dive into the legacy us ecology stand-alone results for the quarter and the full year. starting with consolidated results on slide 12. revenue for the second quarter of 2020 was $213.9 million.
revenue for the environmental services segment was $110.4 million for the second quarter of 2020 compared to $112.8 million in the second quarter of 2019. nrc contributed $7.3 million of environmental services segment revenue in the second quarter of 2020. the field and industrial services segment delivered revenue of $103.5 million in the second quarter of 2020 compared to $43 million in the second quarter last year. nrc contributed $63.1 million of fis segment revenue in the second quarter of 2020.
total gross margin was 25% in the second quarter, down from 32% in the second quarter of 2019. treatment and disposal margins for our environmental services segment were 39% in the second quarter of 2020 and reflected a loss of $2 million from nrc's energy disposal and services business. gross margin for our field and industrial services segment was 13% in the second quarter of 2020 compared to 15% in the second quarter of 2019. selling, general and administrative spending, or sg&a, was $48.5 million and included $17.5 million for nrc as well as $3 million in consolidated business development and integration expenses.
this compared to sg&a of $26 million in the second quarter last year when excluding $2.5 million of business development expenses and the $4.5 million favorable property insurance recovery that was not repeated in the second quarter of 2020. adjusted loss per diluted share was $0.08 in the second quarter of 2020 compared to adjusted earnings per diluted share of $0.66 in the same quarter last year. cash earnings per diluted share, which adds back the per share impact of the amortization of intangible assets to adjusted earnings per share was $0.13 in the second quarter of 2020 compared to $0.75 per share in the second quarter of 2019. consolidated adjusted ebitda was $38.7 million in the second quarter of 2020, up 2% from the same quarter last year, reflecting $5.2 million from nrc.
this was partially offset by a 6% decline from the legacy us ecology business when excluding $2.2 million of business interruption insurance recoveries in the second quarter of 2019. shifting to legacy us ecology results on slide 13, revenues were $143.5 million in the second quarter of 2020 down 8% from $155.8 million in the second quarter last year. our environmental services segment revenues were down 9% to $103.1 million on a 25% decrease in transportation revenue and a 4% decrease in treatment and disposal revenue. as jeff mentioned, the primary decline in our treatment and disposal revenue was a 10% decrease in base business, partially offset by a 12% increase in event business in the second quarter of 2020 compared to the second quarter last year.
legacy us ecology field and industrial services revenue was $40.4 million in the second quarter of 2020 down 6% driven primarily by lower revenues in our transportation and logistics and industrial services business lines, partially offset by strong growth in our emergency response and small quantity generation service lines. gross margin for the legacy us ecology business was 33% in the second quarter up slightly from 32% in the second quarter last year. our environmental services segment treatment and disposal margin was 45% for both the second quarters of 2020 and 2019. treatment and disposal margin for the second quarter of 2019 benefited by approximately $2.2 million in business interruption insurance recoveries that were not repeated in the second quarter of 2020.
excluding this insurance recovery in the second quarter of 2019, we saw a 290 basis point improvement in the second quarter of 2020 on a more favorable service mix. gross margin for the legacy us ecology field and industrial services segment declined to 11% in the second quarter of 2020 compared to 15% in the second quarter of 2019 on a less favorable service mix and lower revenues resulting from the shutdown. sg&a for legacy us ecology was $29 million compared to $24 million in the second quarter last year. sg&a for the second quarter of 2019 reflected the favorable $4.5 million property insurance recovery that was not repeated in the second quarter this year.
the increase in sg&a for the second quarter of 2020 was also partially due to higher insurance costs and higher labor and benefits related costs compared to the second quarter of 2019. legacy us ecology adjusted ebitda was down 12% to $33.5 million for the second quarter of 2020. this compares to $37.9 million in the second quarter last year. looking at the first six months of 2020 for legacy us ecology, despite the shutdown, we delivered strong results with year-over-year growth.
revenue for the first six months of 2020 was up 4% to $297.6 million. this was driven by 4% growth in our environmental services segment and 4% growth in our field and industrial services segment compared to the first six months of 2019. in addition to revenue growth, we were able to expand our gross margin by 68 basis points, which drove adjusted ebitda to $64.4 million for the first six months of 2020 which was up 5% over the same period last year. turning to slide 15.
we exited the quarter with a strong balance sheet and strong liquidity. we had cash of $122.5 million and net borrowings of $739 million at june 30, 2020. this was an improvement over our balance sheet at march 31, 2020. our operating cash flow increased to $59.5 million in the first six months of 2020, up 53% from $38.9 million in the first six months of 2019, driving our adjusted free cash flow up 86% to $34.6 million compared to $18.6 million in the first six months of 2019.
looking at our overall debt position at june 30, 2020, we had approximately $69 million of available capacity on our revolving line of credit in addition to the cash on hand. our total outstanding debt is $861.5 million which includes $448 million for our term loan b facility that matures in 2026 with only 1% required amortization or $4.5 million per year. the overall current average cash interest rate on our debt is approximately 3%. our $500 million revolving credit facility has two financial covenants, a leverage ratio of our total outstanding debt and capital leases to our trailing 12-month bank calculated adjusted ebitda and an interest coverage ratio.
as jeff mentioned, in june 2020, we entered into an amendment of our credit agreement to temporarily increase the leverage ratio from 4 times to up to 5.5 times, depending on the quarter, before returning back to the 4 times level by the end of the first quarter of 2022. our leverage ratio per the bank calculation at june 30, 2020, was approximately 3.8 times under the original 4 times level. overall, despite the current market conditions and the covid-19 pandemic, our solid liquidity and strong balance sheet will allow us to continue to operate the business with a long-term focus and position us for a strong exit from the pandemic. with that, i'll turn the call back to jeff.
jeff feeler -- chairman, president, and chief executive officer
thank you, eric. in summary, i am very pleased with the quarterly results given the unprecedented conditions facing us ecology and the world. the core legacy us ecology business really demonstrates the resiliency of its collection of assets and services. nrc's businesses that are tied to the industrial markets held up well, and their emergency response expertise opened up new decontamination services that are in high demand today.
the nrc businesses that service the customers in the energy sector, frankly, got dealt a tough hand, one that goes beyond normal market cycles. i am pleased to see how our teams have rapidly redirected those business lines, taking costs out and prepare for the long term recovery which will occur. the quarter also showed strong cash flow generation potential of the combined company despite the lower anticipated results. the resiliency truly highlights the intrinsic value of the collection of businesses we have today.
today, we are in excellent shape to navigate these turbulent conditions and create a sustainable future for us ecology's team members and stockholders. in closing, i'd like to thank our team members throughout the organization, from the critical frontline workers to our leadership team, for their extraordinary efforts and their unwavering commitment to servicing our customers in these most trying of times. we remain focused on those things we can control so we can respond to the improving economic conditions and seize the growth opportunities that will ensue. with that, operator, we are ready to open up the call for questions.
",2020-Q2,ECOL,-0.006750000000000034,-0.5241,
