q,ticker,dt,prep_remarks,QnA
2021-Q3,JRVR,2021-11-03 09:00:00,"prepared remarks:
operator
thank you for standing by, and welcome to the james river group holdings third quarter 2021 earnings call. [operator instructions]
and now i'd like to introduce your host for today's program, brett sheriffs, head of investor relations. please go ahead, sir.
brett shirreffs -- senior vice president, finance, investments and investor relations
thank you, jonathan. good morning, everyone, and welcome to the james river group third quarter 2021 earnings conference call. during the call, we will be making forward-looking statements. these statements are based on current beliefs, intentions, expectations and assumptions that are subject to various risks and uncertainties, which may cause actual results to differ materially.
for a discussion of such risks and uncertainties, please see the cautionary language regarding forward-looking statements in yesterday's earnings release and the risk factors of most -- of our most recent form 10-k, form 10-qs and other reports and filings we have made with the securities and exchange commission. we do not undertake any duty to update any forward-looking statements.
i'll now turn the call over to frank d'orazio, chief executive officer of james river group.
frank n. d'orazio -- chief executive officer
thank you for that introduction, brett. good morning, and welcome to everyone on the call. it's a pleasure to join you again having just yesterday completed my first year at james river as ceo. i certainly plan to cover the results of the quarter in a moment. but given the timing of this call, if i'd first reflect on some of the goals i originally set for the organization and review the progress we've achieved in my first 12 months.
as i said on my first call with you last february, my primary objectives were to ensure that the company remain laser-focused on the market opportunity that we have in front of us to strengthen our position as a best-in-class e&s carrier with an expanded fronting and fee income business and to eliminate the overhang surrounding our commercial auto runoff portfolio. i believe we've been very successful in executing on these two priorities. having put a loss portfolio transfer agreement in place in late september, with coverage provided highlighted without an aggregate limit and fully collateralized, priced very close to our held reserves.
and secondly, by driving strong growth and attractive rate increases throughout our two very strong insurance franchises. our e&s unit, which has long been an industry leader and our specialty admitted unit, which we emphasize our fronting capabilities and fee income generation. at the same time, i've also significantly added to my senior management team with the addition of highly experienced leadership in our new chief actuary and new chief claims officer, who each joined us this past quarter and are playing pivotal roles in the risk framework of the organization as we invest in and bolster our enterprise risk program.
james river has also added to its board of directors, adding two very strong independent directors with deep industry experience who will undoubtedly provide valuable guidance to the management team. when i took the reign here as ceo, i told the board i would emphasize growing our highly profitable core businesses. the core e&s business was approximately $615 million in gross written premiums on a trailing 12-month basis by the time i joined the organization. over the subsequent four quarters, we've taken advantage of dislocation in the market as well as rate increases to grow the core e&s book by 25%. with the opportunities available to us today, the core e&s business should soon be exceeding $800 million in gwp. rates in this segment have increased by more than 13% over the last four quarters, meaningfully in excess of loss trend.
accounts continue to stay in the e&s marketplace for longer as we've been able to provide renewal quotes on nearly our entire in force portfolio, each of the last few quarters. while our policy count has grown over 24% during the last year. our e&s segment grew 21.3% in this most recent quarter, which is a significant acceleration from q2 and a validation that we remain a preferred destination for our valued wholesale market partners. i mentioned on our last earnings call that we saw a brief slowdown in new business volume during the month of may, around the time of our equity offering. new business volume returned to normal during june and july, and that momentum has continued during q3.
just as importantly, the macroeconomic conditions that have created this market hardening still exist today. concerns of social inflation, the impact of climate change, a continued low-interest rate environment and the hangover effect associated with soft market era underwriting, lead me to believe that the market's current pricing and underwriting discipline should continue well into 2022. given our capabilities as an expert in the e&s casualty arena, the relationships of our experience and dynamic underwriting team and what we see in terms of market opportunities in front of us, i have no doubt that our franchise will continue to be a leader and will continue to benefit from the robust market opportunities in the sector.
in the specialty admitted segment, our fronting business has grown by almost $100 million of gross written premium on a trailing 12-month basis or approximately 27% since i joined james river. and in the most recent quarter, fee income was up more than 20% relative to the third quarter of 2020. we have another very experienced and capable team running this business that has deep relationships with both our underwriting partners and the strong panel of reinsurers that support the programs. growth in our fronting and program business slowed a bit during the third quarter as new programs added in 2020 have begun to complete 12-month renewal cycles, but our growth was still up double digits from the prior-year quarter, which was largely due to newer fronting relationships.
i would note that the deal-driven nature of the fronting and program business can produce large swings and premium results from quarter to quarter. it can take months, if not more, to bind a program. and so top-line results for this segment can be lumpy. i would expect our long-term growth over the next few years is not likely to be in an absolute straight-line for this segment. i would also dismiss any suggestion that our prospects for this segment are hampered by our recent ratings change. most of our competitors in this space carry the same a stable rating as we do, but i believe our team and level of experience set us apart as we've been in this business now for nearly a decade.
we've renewed all of our programs that have been up for renewal since our downgrade and submission activity for new program opportunities was up more than 30% during the third quarter. we continue to have a healthy pipeline of new deals, and my optimism and outlook for this business remain intact. although i'm pleased with the growth in our proven key segments, i want to make it clear that we remain a bottom-line focused company. our e&s business continues to report very attractive margins with underlying combined ratios in the low 80s, while our specialty admitted segment is growing fee income at double-digit rates and driving underwriting income in that segment.
now, turning to my second priority that i referenced earlier. as you know, finding a legacy solution for our runoff commercial auto portfolio that provided economic finality was a key priority for james river. after a month-long process to evaluate options related to our legacy reserves, we were able to execute a transaction to bring economic finality to substantially all of our run-off portfolio. this exposure has been transferred on a fully collateralized basis to a counterparty that is well-known to us.
and i believe the ultimate cost of the transaction further supports the change in actuarial methodology that was introduced in q1. the entire leadership team worked very hard to make this happen, and we're very pleased with the outcome. the transaction removed a significant distraction and helped to strengthen our balance sheet meaningfully. we have benefited from a return to a stable ratings outlook as a result of the executed transaction. moving forward, in addition to focusing on the fabulous market opportunity that remains in front of our insurance businesses, my priority now is to stabilize our casualty re segment. this is a business that we've been in for over a decade.
and quite frankly, the results have not met our standards. before i joined the organization, the decision was made to shrink the business substantially, and it's down more than 35% from its recent peak a few years ago. while we do feel much better about the prospects for performance of the recent accident years, the persistence of our emergence from older underwriting years is not acceptable, and the scale of the segment does not warrant increased investment in the coming year.
the most immediate action that we can take is to continue to meaningfully reduce our exposure by exiting treaties that have proven to be unprofitable and reacting quickly to reserve indications while we continue to analyze our options for the segment. the focus of the organization is on our insurance and fronting businesses. that is our future. we'll begin to significantly shrink top-line writings of our casualty re segment over the course of the next year as we focus the growth of our organization on our higher returning u.s. insurance businesses.
casualty re's q4 activity is largely already underwritten and bound at this point in the calendar, but i'm committed to putting a significantly greater focus on our u.s. businesses going forward, and that will become more obvious in q1 2022. the $15.1 million of reserve strengthening in the quarter was extremely disappointing and largely reflects the increased loss emergence we saw during q3. nearly 3/4 of the development was related to general liability treaties and primarily came from the 2014 to 2017 accident years. more than half of the reserve development came from treaties that we no longer write.
since i arrived at james river, we've consistently booked to the actuarial indication or higher when booking our reserves for this segment. our reserves for casualty re are reviewed by third-party actuaries on an annual basis, and our held reserves at the beginning of 2021 were consistent with the external estimate we received. i'll close now with just a few comments on market conditions and the quarter itself. our headline e&s rate increase was 8.7% in the third quarter and stands at 14.5% on a year-to-date basis. the rate moderation relative to the second quarter reflected a slowdown in some of our larger units.
for example, rates in excess casualty were up 12% in the third quarter, a very attractive level, particularly given the amount of rate already achieved in that line of business and ahead of our view of loss trend, but this is down from nearly 30% in the second quarter. excluding the excess casualty line, rate increases were stable compared to the second quarter. i would also point out that we saw similar overall rate moderation in q3 and q4 of 2020 before experiencing significant rate acceleration in the first half of 2021.
in total, the third quarter represented the 19th consecutive quarter of renewal rate increases in the e&s segment, compounding to 46% over that period. this jump in rate, combined with significant improvements in terms and additions over this period, has given us confidence to pursue our growth objectives. as i mentioned earlier, absent what would be nonrecurring events for the quarter, the underlying e&s business is producing combined ratios in the low 80s, and we continue to see margin expansion across the company.
going forward, the strength of our core e&s business should no longer be burdened by our commercial auto runoff results. after completing the lpt transaction, our ibnr as a percentage of our reserves has increased meaningfully to 65.7% in e&s and 62.9% across the company, increases of eight and five points, respectively, from june 30. overall, we feel very good about the current market in which we're operating and our ability to take advantage of these very favorable conditions. there is ample opportunity for us to continue to grow profitably in both e&s and specialty admitted. our ratings are strong and stable. our underwriting teams remain embraced by our distribution partners, and we remain focused on effectively deploying our capital and generating attractive returns on equity.
and with that, let me turn the call over to sarah.
sarah casey doran -- chief financial officer
thanks, frank. good morning, everyone. given frank's extensive comments on the current quarter as well as the past 12 months, i'm going to focus my comments on a few discrete parts of the quarter as well as some other key financial items. last night, we reported a net loss of $23.9 million for the quarter and had a $26.8 million operating loss. this loss was impacted by the aforementioned commercial auto lpt that we executed at the end of september, bringing economic finality to substantially all of our commercial auto runoff portfolio.
we also had two other unique impacts on the quarter, which i will further explain in a moment. frank has already commented on the adverse development in the casualty reinsurance segment. so, to sum the unique impact of the quarter in e&s. first, as we mentioned in conjunction with our 8-k filing and the signing of the commercial auto lpt, there is the impact of the transaction, of which the majority is related to claims expense. second, there is the $5 million net impact of the ida cat losses.
we have a small, geographically diversified excess property portfolio that the company has written for many years, which is heavily reinsured. our reinsurance incepts at $5 million of losses and provides for $40 million of limit. we also benefit from a substantial surplus share treaty. for that reason, the $5 million of net losses should not grow. last, this quarter was unique in that we had $8.1 million of reinstatement premiums for casualty treaties in different years, caused by losses we experienced in those accident years.
reinstatement premiums are a function of excess of loss reinsurance, which is what these treaties are. generally, our casualty treaties works such that the first reinstatement premium is due on first loss of the treaty. but thereafter, we have a few free reinstatement premiums to provide coverage should further losses arise. as these treaties protect losses in prior accident years, the $8.1 million is a straight reduction to net written and net earned premium in the current quarter.
absent these three impacts, as frank mentioned, the combined ratio for the e&s segment would have been 83.4%, which has improved by about two points as compared to the 85.2% in the comparable quarter last year. the e&s ex-cat accident year loss ratio, adjusted for the casualty related reinstatement premiums and the commercial auto lpt would have been 64.6%, consistent with our performance year-to-date and in excess of our historical fully developed loss ratios for prior years in core e&s.
absent the casualty related reinstatement premiums, which again, served to reduce net written and net earned premium and e&f by $8.1 million, net written and net earned premium and e&s would have grown 25% and 22%, respectively, over the prior year quarter, a meaningful acceleration from the growth rate of last quarter. moving on to our groupwide expenses. our group expense ratio was 24.8% this quarter as compared to 24.8% in the third quarter of last year and 26% last quarter.
we had favorable adjustments to bad debt expense and certain accruals for taxes, licenses and fees within the specialty admitted segment this quarter, which served to lower the segment expense ratio by about five points. this was partially offset by a higher expense ratio in casualty re due to lower sliding scale commission reductions and less premium earned. it also benefited meaningfully from the scale we continue to build in our e&s and specialty admitted segments. finally, on to investments.
net investment income for the third quarter was $15.3 million, an increase of 2% from the third quarter of last year and about 7% from the prior quarter. the increase is due to increased returns from both our renewable energy portfolio and some other private investments. we ended the quarter well within our target operating and leverage ratios of 1.2 times and 29% respectively.
so with that, i will hand it back to frank.
frank n. d'orazio -- chief executive officer
thank you, sarah. operator, please open the lines for questions from our listeners.
",":
operator
certainly. [operator instructions] our first question comes from the line of mark hughes from truist. your question, please.
mark hughes -- truist -- analyst
yes, thank you. good morning. is there any impact? you mentioned the new chief actuary and chief claims officer, did that influence in any way, the approach to the casualty re reserve development?
frank n. d'orazio -- chief executive officer
no, not necessarily. dave joined the organization just this quarter, as you know, joined in august, and our prior -- our chief actuary retired at the end of september. so while he was a key part of the q3 review, he's not been with us for a full quarter, not completely finished his initial review. in essence, what you saw relative to the quarter and casualty re was no change relative to methodology.
mark hughes -- truist -- analyst
okay. and then the reinstatement premium, could you talk a little bit more about that in particular circumstances that drove that, that, at least in my experience, seems unusual that you would have that magnitude of a loss that would trigger the reinstatement premium. just a little more detail on that would be helpful.okay. and then the reinstatement premium, could you talk a little bit more about that in particular circumstances that drove that, that, at least in my experience, seems unusual that you would have that magnitude of a loss that would trigger the reinstatement premium. just a little more detail on that would be helpful.
sarah casey doran -- chief financial officer
sure, mark. it's sarah. i can help to conceptualize that a bit more. as i mentioned, they're both casualty, xol treaties that we have in e&s that we've had in e&s for many, many years, the same structure etc. and if i think about those, the -- for lack of a better term, the ran of them this year is that we had losses from two different years on the treaties. so we triggered two different reinstatement premiums. as i mentioned, typically, you pay for the first reinstatement premium, and then you get a number of free reinstatements. so to the extent, we had further losses on those particular accident years. there would likely be a 0% financial impact from any future reinstatement premium. but what that does is conceptually net down our losses to, call it, a $1 million to $2 million range on anything we're writing, which obviously protects our balance sheet, kind of plays through the low volatility focus of our e&s business. this cover largely helps with, i would say, four or five divisions within e&s. and one of the things to consider here with regard to xol treaties and the way these are priced is there is going to be a factor for our growth but a different way. we have grown a fair amount, which point effect, makes the restatement premiums relatively large compared to where the -- they have been a few years ago when we weren't growing as much. but i think the import here is there is some randomness in that they both came through in the same quarter. and i would not expect to see those triggered for the foreseeable future.
mark hughes -- truist -- analyst
anything on the nature of the loss, what sort of end market, what industry perhaps? is this social inflation? just a little more characterization of the underlying issue?
frank n. d'orazio -- chief executive officer
yes, sure. so the two reinstatement losses that you're referencing came out of the energy segment. i'm not sure how familiar you are with our energy underwriting unit there, but it's not a large unit. i think we did roughly about $15 million in premium last year, primarily focused on oilfield services. we are not a big e&p or coal underground mining type of underwriting shop. certainly, there has been a push within that underwriting department to cut our limits to take some of the volatility out of the underwriting segment. it has historically been very profitable line of business for us. but we have pushed policy limits down. so now i would say roughly a little more than half of the policies that we write out of that unit have limits under $5 million, $5 million or less, i should say.
mark hughes -- truist -- analyst
okay. and then any commentary in terms of business flow activity early in the fourth quarter?
frank n. d'orazio -- chief executive officer
so, sure. i mean i would say that -- and we referenced this, i guess, in q2, right? so we saw some slowdown in terms of growth in ends in may. but it picked right back up in june and july, and that really continued through the rest of the quarter and into the fourth quarter as well. so policies in force, that count is up about 24%. numbers of binders on our small business initiative is up 11%. we continue to see the benefit of strong support from our wholesalers with a negative outlook removed. so it's all been quite positive, particularly since the outlook will stabilize.
mark hughes -- truist -- analyst
thank you very much.
frank n. d'orazio -- chief executive officer
thanks, mark.
operator
our next question comes from the line of matt carletti from jmp. your question, please.
matt carletti -- jmp -- analyst
hi. thanks, good morning. frank, i was hoping to circle back to your commentary on casualty re. i caught what you said about you expect the top line to significantly shrink, particularly starting in q1. what i was hoping you could give us some more color on is what you plan to do to address the back book because shrinking it forward isn't going to take care of prior reserve issues. i know it's reinsurance. is it adc or an lpt a possibility or something that's being considered? is there -- you commented that you've always kept it at or above actuarial indications. but i mean, if we look back over many quarters and years like those actuarial indications have consistently been short. is there a deeper reserve study? or are you considering kind of changing the actuarial approach? i'm just trying to get out, are you willing to make a commitment to kind of as you brought economic finality to the uber issue, is there a commitment to bring economic finality to the back book here in casualty re?
frank n. d'orazio -- chief executive officer
no, matt, it's a good question. so you're right. it's a two step process relative to the strategic action, relative to underwriting operations, but then also to use your terminology to back book. so we're going to finish our actuarial review for the segment. so again, this is dave's first full quarter working with the casualty re portfolio. but to your point, i'm going to be open to exploring our options fairly thoughtfully. some more complex than others, but i'm going to be open options, particularly if we can improve the certainty associated with that portfolio, especially after what we were able to accomplish on the commercial auto runoff block and the value that it added to our organization. and we're doing that now.
matt carletti -- jmp -- analyst
okay. great. and on the -- sounds like the deeper dive that's taking place. any sense on timing? is that something we could expect alongside or with q4 reporting? or do you suspect it would take longer than that to get through the numbers?
frank n. d'orazio -- chief executive officer
we're expecting to complete our review of the reserves in the fourth quarter.
matt carletti -- jmp -- analyst
yes, great. thank you.
frank n. d'orazio -- chief executive officer
this is underway.
matt carletti -- jmp -- analyst
understood. thank you.
operator
our next question comes from the line of brian meredith from ubs.
brian meredith -- ubs -- analyst
yes, thanks. a couple of ones here. just quickly, sara, the wind-down of the reinsurance sort of taking it down, any tax implications that you need to be aware of will have any effect on tax rate going forward? is that at all limiting factor to doing some type of a transaction?
sarah casey doran -- chief financial officer
no. we want to do what's right for the business, brian. and i wouldn't think that we're not going to drive the business based on tax implications. i think there's many different things we can think about here, and that's what the team is committed to doing. i wouldn't hold tax out as a reason not to be a full force on kind of looking at the segment going forward.
brian meredith -- ubs -- analyst
great. understood. but will it have an implication for your tax rate here going forward?
sarah casey doran -- chief financial officer
yes. again, i don't see it, brian. we're early days in this, but i'm not seeing a meaningful implication, right?
brian meredith -- ubs -- analyst
okay. great. and then second question, i'm just curious, the cat loss you had in the quarter on, i guess, what you said in excess property, maybe you can kind of -- it's something that obviously unfamiliar with cat losses with james river. and i understand you've got a lot of great reinsurance protection. can you maybe describe kind of what it was, what happened, why it was so unusual?
frank n. d'orazio -- chief executive officer
sure, brian. so as you know, our excess property book, it's always been fairly small, less than $50 million in gwp, about 5% to 7% of our core e&s business. it's a pretty well-diversified book geographically, heavily reinsured, as you mentioned, to the one on 1,000 level on no ep basis. it's engineered to perform very well. and our loss here was really driven by the fact that this was a $30 billion event. i think that's how we think about this underwriting unit is it's -- it performs very well. when you have a very noteworthy or large event, we're going to have some loss. and i think that we were fairly conservative in terms of how we evaluated our potential loss from this event. we are into -- based on where our protections attached from a property standpoint, this event can't get worse for us.
brian meredith -- ubs -- analyst
great. thank you.
frank n. d'orazio -- chief executive officer
thanks, brian.
operator
thank you. our next question comes from the line of cullen johnson from b. riley. your question, please.
cullen johnson -- b. riley -- analyst
hey. good morning and thanks for taking my questions. sticking at the higher retention ratio in the fronting book. was that just a pretty standard fluctuation quarter-to-quarter, do you think? or was that more of an intentional move there?
sarah casey doran -- chief financial officer
yes. that's a great question, cullen. there was not an intentional move. as frank said, as we've characterized, that book is just lumpy depending on when certain deals come on and when they don't. and i think, on average, as we've said, our retention there is probably going to be 10% to 20% over the whole book. but you're going to feel that at different points in time. obviously, there'd be some that might go up to 30, but that should be our average overall, as i've stated.
cullen johnson -- b. riley -- analyst
okay. great. thank you. and then i think last quarter, we kind of talked about loss cost trends at roughly mid-single digits broadly across the entire portfolio. is that still a reasonable way to think about that figure here?
frank n. d'orazio -- chief executive officer
yes. no, i think so. i don't think anything's changed. when we think about the portfolio at a high level, mid-single digits is a good way to think about it, maybe slightly above that on excess casualty and kind of right there for the primary million dollar limits. again, if you take a look at the rate that we've experienced over the last '19 quarters, 46% over that period of time, we feel very good about where we are versus our view of trend.
cullen johnson -- b. riley -- analyst
okay. great thank you. that's all of my questions.
frank n. d'orazio -- chief executive officer
thanks, cullen.
operator
our next question comes from the line of derek han from kbw. your question, please.
derek han -- kbw -- analyst
good morning, thanks. i know you talked a lot about the consistent adverse development in casualty re in detail. but i was hoping that you could provide some color on what that implies for social inflation within the e&s lines? and how do your accident year loss picks kind of reflect that? i know you're still kind of doing the reserve study, but i was hoping if there are some details on that.
frank n. d'orazio -- chief executive officer
yes. sure. so listen, i think all insurance companies have some exposure to social inflation. we've certainly seen some aspects of it. i think overall if you're talking about the e&s book, based on our focus on sme business, i think we're probably a little bit more insulated than most. i also think that the industry talks about social inflation, like i said, 2020, 2021 phenomenon. i think something that has been kind of ticking up over the last five to seven years. and so to some extent, you've got a little bit of this exposure baked into your loss history. but i think we're fine. we obviously take a look at it on a pretty close basis, and that's factored into our overall views relative to the loss picks.
derek han -- kbw -- analyst
got it. that's helpful. and then my second question is on the fronting business. i know you've had pretty good growth there in the past year or so. but are you seeing any increased competition from peers? i know there were some recent launches of start-ups and other carriers kind of getting to the space?
frank n. d'orazio -- chief executive officer
yes. no, i think you're right. there have been some new entrants in the space, particularly over the last 18 months. i would say falls lake is considered a leader in the space. i would suggest our fronting pipeline is very strong. commission growth has been strong and is up 30% for the quarter. at any given point in time, we've got as many as three to six programs in various stages of diligence. and like i said during my prepared comments, it oftentimes takes several months to actually onboard a program. but right now, we're very bullish about the prospects for the segment. q4 activity is good. we've actually bound a new program. we expect to onboard two more over the quarter, and we're just giving another notice on a fourth that i think has got a little bit more of a lead time because it's a book role and there's a notice of cancellation provision to the incumbent. so again, i'm very excited about the prospects for growth in the segment.
derek han -- kbw -- analyst
got it. thanks for all the color.
frank n. d'orazio -- chief executive officer
sure. thank you for the question.
operator
thank you. this does conclude the question-and-answer session of today's program. i'd like to hand the program back to frank for any further remarks.
frank n. d'orazio -- chief executive officer
okay. thank you, operator. i want to thank everyone listening on the call for their time today and for the questions we received this morning. i'll wrap up the call by reiterating my appreciation for the staff of james river and our ability to continue to grow our u.s. insurance segments profitably while continuing to deliver on our corporate objectives to make this a stronger and more profitable company. i look forward to speaking with you again early next year to discuss our q4 results. thank you, and enjoy your day.
operator
[operator closing remarks]
duration: 34 minutes
call participants:
brett shirreffs -- senior vice president, finance, investments and investor relations
frank n. d'orazio -- chief executive officer
sarah casey doran -- chief financial officer
mark hughes -- truist -- analyst
matt carletti -- jmp -- analyst
brian meredith -- ubs -- analyst
cullen johnson -- b. riley -- analyst
derek han -- kbw -- analyst
more jrvr analysis
all earnings call transcripts




"
