q,ticker,dt,prep_remarks,QnA
2019-Q1,JRVR,2019-05-02 08:00:00,"prepared remarks:
operator
good day, ladies and gentlemen, and welcome to the james river q1 2019 results call. [operator instructions] and as a reminder, today's conference call is being recorded. i'd now like to turn the conference over to kevin copeland, head of investor relations. please, go ahead.
kevin copeland -- head of investor relations
thank you, candice. good morning, everyone, and welcome to the james river group first-quarter 2019 earnings conference call. during the call, we will be making forward-looking statements. these statements are based on current beliefs, intentions, expectations, and assumptions that are subject to various risks and uncertainties, which may cause actual results to differ materially.
for a discussion of such risks and uncertainties, please see the cautionary language regarding forward-looking statements in yesterday's earnings release and the risk factors section of our most recent form 10-k, form 10-qs and other reports and filings we make with the securities and exchange commission. we do not undertake any duty to update any forward-looking statements. i will now turn the call over to bob myron, chief executive officer of james river group.
bob myron -- chief executive officer
thank you, kevin, and good morning, everyone, and welcome to our investor call. i'm bob myron, ceo, and with me today are sarah doran, our cfo; and kevin copeland, our chief investment officer and head of investor relations. i'll spend some time today talking about our overall results for the quarter and also some specifics on each one of our segments, both results, as well as operations. i'll then turn the call over to sarah, and then we'll get to your questions.
we are off to a great start for the year. the $21.7 million of after-tax operating income and the 16.9% annualized return on tangible equity is one of the best quarters we've had in our 17-year history. our underwriting results were strong with underwriting profits at all three of our segments in a 92.6% combined ratio overall. we had good growth in our two u.s.
primary insurance segments, which is where we are focusing our growth efforts. there are many items of note that bode well for the rest of the year. our expense ratio of 22.6% is market-leading as we continue to carefully manage expenses and get great leverage out of our franchise. i am particularly pleased about growing tangible book value per share from $16.34 to $17.74 in the last three months, while at the same time producing a great return on tangible equity, continuing to pay a nearly 3% dividend.
let me now talk about each of our three segments individually. in our largest segment, e&s submissions were up 17% in the quarter year over year, the highest quarterly percentage increase in submissions we have had in the last 11.5 years. in the quarter, we received over 68,000 new and renewal submissions. this reflects the continued strong and growing u.s.
economy, the excellent relationships we have with our wholesale brokers and meaningful amounts of business flowing from the admitted market into the e&s market. pricing on renewals was up about 3% in the quarter on our core e&s business, but the renewal pricing doesn't tell the whole story. i'll give an example of a couple of habitational risks that we wrote in the quarter, which is a class where we are seeing strong flow in our general casualty division from business being nonrenewed in the admitted market. the first one we wrote in the quarter, we received a 100% increase on the expiring premium, wrote it on a tighter coverage form and for the same $25,000 deductible of the expiring policy.
the second one we wrote with a 68% price increase relative to the expiring premium on a tighter coverage form with a $5,000 deductible, where previously the account had no deductible. in our e&s segment, our underwriting staff are in three offices: richmond, virginia; alpharetta, georgia; and scottsdale, arizona, as well as a few people in remote locations. we have a total of 172 persons currently working in underwriting in this segment. this is the highest underwriting headcount number we have had in our history, and we are continually looking to find additional staff in this area to help us work through the strong and growing submission flow.
under our segment president, richard schmitzer, we have a strong and deep bench of talent with great subject matter expertise at the division manager level, as well as at levels below that. we have had the same group of division managers that we have when i came to the company nine years ago, so the continuity is fantastic. of note, our core e&s segment, which excludes commercial auto, represented $334 million of gross written premiums last year in 2018, which substantially exceeds our previous cyclical high from back in 2006 when we wrote a little less than $250 million. it's the largest book of business that we have at our whole group.
as of last year, our commercial auto division was $322 million of gross written premiums. with this strong submission flow and the strength of our franchise, we are going to continue to see great opportunities for profitable growth going forward in core e&s. with respect to growth in core e&s, gross written premiums were up 5% in the quarter, which was fine, but ex our allied health division, our growth -- our core gross written premium was up 23%. you may recall that we had significant growth in allied health business a year ago in q1 equipment driven by flow from the admitted market and substantial rate increases.
but we got strong growth elsewhere, in particular, in our three largest core e&s divisions, namely: manufacturers and contractors, which was up 34% in the quarter; general casualty, which was up 46%; and excess casualty, which was up 55%. this bodes well for the future. we feel that we are extremely well poised for the ongoing hardening market and small account e&s casualty business that we have been seeing in the last six quarters or so continuing. richard schmitzer has done a great job managing this segment for us over the last 10 years.
now a few comments about our commercial auto division within e&s, the majority of which is with one client. in the quarter, commercial auto grew 19%. this was principally from growth in written premiums in january and february of 2019 over the previous year's contract with our largest client. as we have said before, this contract renews on march 1st of any given year.
from march 1st forward, we will have growth in gross written premiums but not much growth in net written premiums. the approximate written premiums for the 12-month policy term incepting march 1, 2019 is projected to be $400 million gross and $300 million net. the reason for the $100 million difference is that we place the $100 million quota share reinsurance contract behind us on this risk. we are very happy to have received from the client a larger share of the risk in the 20 states and the two territories that we are insuring.
the flexibility of our e&s paper has been very important to our relationship and opportunity with the client. our relationship with this largest client continues to be strong, but that doesn't cause us to rest on our laurels. we work hard to service this account to the best of our ability every day and seek to make constant improvements to service levels and technology. claim servicing is one of the most important parts of the relationship as our ability to service the account is central to the six years of history we have had with this client.
we handle all of the claims for this account using our own staff who are based in three offices: richmond, scottsdale and raleigh. and our claims headcount dedicated to servicing this account is over 300 people. we are making appropriate use of leading-edge claims technology in handling these claims. we also have access to all of the client's telematics when it comes to claims handling.
we don't use third-party administrators to handle claims or tpas. this has been a key tenet of our relationship with the client from the beginning going all the way back to 2013. also as we probably said before, this account is priced on a per mile basis by state. in our specialty admitted segment, we grew 18%.
submissions were up 52% in our individual risk workers' compensation business, which reflects strong agency relationships, continued economic growth and continued modest expansion into a few other states. rates were down about 3% in individual risk workers' comp, but margins were down only about half that and remain strong as we continue to see benign loss activity. you may remember that we buy 50% quota share reinsurance treaty on this business behind us, which has helped to support our modest and calculated expansion and the resulting increase in submission flow and opportunity. in our fronting division, we grew gross written premiums by 15%.
this was because of new fronted deals that were not on the books a year ago. a few comments on our largest fronted transaction, which is produced by atlas, a california-based mga. we reinsure in excess of 90% of this business to quota share and excess reinsurers. the contract continues to perform well from a loss perspective and produces -- and production continues to be in line with expectations.
our group has had a long and successful relationship with atlas. while we take a small slice of risk, we watch this closely like we do with all fronted transactions and mga relationships and work collaboratively with the mga through our own underwriting staff and underwriting guidelines employed, which include oversight and frequent audits of both claims and underwriting operations. this contract renews on june 1st of each year, and at this time, we expect it to renew again. otherwise, we are continuing to grow in both count and premium other fronting transactions.
of note, in april, we wrote two new transactions that we expect to deliver between $40 million and $45 million of gross written premium per annum. we are pleased to report that both of these deals are for property business, which is a first for this division, and will be 100% reinsured without any property tail risk whatsoever. while these transactions will represent a modest amount of premium growth, we are also seeing opportunities which may show up as fee income rather than premium, so the segment growth likely will all register through the top line. otherwise, terry mccafferty, our specialty admitted segment president, has a strong pipeline of new prospective deals that we are optimistic about.
in our casualty re segment, while we did have a modest amount of adverse development in the quarter, sliding scale ceding commissions absorbed much of this so that the net result was still a 99.1% combined ratio and an underwriting profit. we shrunk the top line in this segment in line with our expectations. for the full-year 2019, gross written premiums will be between flat to up 10% as our underlying cedings get rate and positive exposure increases. the book is expected to be over 90% e&s business in 2019.
in terms of pricing for casualty re, the underlying business saw rate increases of about 3%, and we got 1% increase in reinsurance pricing upon renewals. with that, let me turn the call over to sarah doran, our cfo.
sarah doran -- chief financial officer
thanks, bob, and good morning, everyone. for the first-quarter of 2019, we made strong underwriting profits of $7.1 million. we generated an operating profit of $21.7 million, and we're reporting net income of $22.7 million. our expense ratio of 22.6% is an improvement of 2.3 points from the prior-year quarter.
while slightly elevated from the sequential quarter, the improvement is largely due to mix. our e&s segment, which has the lowest expense ratio of the operating segment, now represents about 75% of our earned premium, up from about 65% in the first quarter of last year. we also saw expense ratio improvement in both the specialty admitted and casualty re segments and as always, continue to be focused on managing our expenses throughout the organization. the 22.6% is an extremely meaningful 10-point advantage to our competitors.
we continue to enjoy strong cash flow from our businesses as operating cash flow was $35.4 million this quarter, down slightly due to some timing difference of our casualty re segment. net investment income was the highest in the company's history this quarter. our investment performance this quarter is a credit to our growth over these past few years, as well as thoughtful strategy around the portfolio, and we have the benefit of a market rebound. we are at $19.4 million of nii, an increase of almost 50% from the first quarter of 2018, reversing much of the underperformance we experienced last quarter.
cash and investment assets were up about 15% from the first quarter of 2018, although i believe this growth will likely be slower going forward. this quarter, in particular, our small other private investment portfolio delivered exceptional returns. we construct the entire portfolio to have a few pockets for outperformance that represents a small portion of invested assets, take moderate risk in our well-performing floating bank loan portfolio, and to a lesser degree, in our high-grade portfolio. our balance sheet continues to be a key focus.
in this quarter, our prior-year reserve development was stable with e&s, benefited from continued positive margin in specialty admitted, in our individual workers' compensation book and has a small amount of prior-year development in casualty re. as mentioned in february, our external reserve processes, which include -- which conclude in the fourth quarter, had showed us as having some redundancy across the group. we are focused on making prudent and conservative current accident year loss picks, so our current accident year loss ratio increased from both the prior and sequential quarter. but perhaps our strongest highlight this quarter is that we grew tangible equity per share 10.4% from one quarter ago while also delivering annualized adjusted net operating return on average tangible equity of 16.9%.
we ended the quarter with tangible shareholders' equity of 531 -- $535.1 million, an increase over the $489.9 million at the end of 2018. operating leverage were 12 months, net premiums written to tangible equity was 1.4 times to one. our ability to generate strong tangible book value growth and a high rote is very important to us and shows we have great opportunities to put our capital to work. and finally, on taxes.
our effective tax rate for the quarter was 10.8%. and while there are many points of impact to our tax rate, we continue to believe that going forward, our tax rate will be similar to historical averages, ticking up slightly as more of our assets move over time from a nontaxable jurisdiction. that said, it's worth noting that our bermuda domicile continues to be a strong advantage of ours as the majority of our invested assets remain offshore, and we have an efficient capital management framework in place, which among other things yield strong relationships with our regulators and rating agencies. and with that, i'll turn it back to bob.
bob myron -- chief executive officer
thank you, sarah. operator, that concludes our prepared remarks. would you please open the line for questions?
",":
operator
[operator instructions] and our first question comes from mark hughes of suntrust. your line is now open.
mark hughes -- suntrust robinson humphrey -- analyst
yeah. thank you very much. good morning.
bob myron -- chief executive officer
good morning.
mark hughes -- suntrust robinson humphrey -- analyst
could you talk about -- on the quota share presumably you'll be getting a ceding commission. any sense of what the impact of that will be? i assume that will be an offset to operating expenses. but could you give us a little insight what that could do to the margin?
bob myron -- chief executive officer
yeah. so we will be getting a ceding commission. there is -- it will be an offset to operating expenses, but we don't want to get into the terms of -- and conditions of it because it's a private transaction principally with one party. and so i think it's best to just make mention of the fact that we have it.
we're happy to have it and how it's going to be accounted for. but don't want to get into the terms and conditions on it, mark.
mark hughes -- suntrust robinson humphrey -- analyst
ok. the share of the risk you're taking now with your large client, are you taking the majority of the risk? or is it still a less than half?
bob myron -- chief executive officer
well, as i know you know, we haven't gotten into the forever sort of talking about the share of the risk that we actually take. i mean this is obviously increased than it's more than it's been -- more than it's been in the past on a gross basis. but there still is meaningful risk sharing between us and the client.
mark hughes -- suntrust robinson humphrey -- analyst
understood. the current accident year loss in specialty admitted, i'm not sure if you touched on that in your prepared remarks, but that was up a bit year over year. would you expect that to stay at that level or that kind of return to perhaps where it has been last year or the year before?
sarah doran -- chief financial officer
sure. and that -- thanks for the question, mark. that talk is around a fair amount, we don't have count -- premium in that segment. so 74.5% this quarter is improved from the 77.5% in the fourth quarter of last year, but up versus the first quarter.
so i think the point is there's not a great trend there, but i would think about the 74.5% or kind of 74.5% area for this year. that's just the thesis of us taking a conservative look at everything that we're putting on the books right now, in this year, in particular. not seeing any reason to move things up other than just trying to be conservative where we can, as we're doing throughout the group.
mark hughes -- suntrust robinson humphrey -- analyst
thank you.
bob myron -- chief executive officer
thank you.
operator
and our next question comes from matthew carletti of jmp securities. your line is now open.
matthew carletti -- jmp securities -- analyst
hey, thanks. good morning. sarah, maybe first question for you. just you mentioned some color on the reserves and largely the lack of movement in the quarter.
i was hoping you could maybe tease apart the e&s movement a little bit. i think it was pretty small. let's call it nil overall. were there any notable movements on one side or the other kind of core e&s versus commercial auto.
and likewise within commercial auto by accident year, was there any movement of note? or was it kind of just rounding errors across the board?
sarah doran -- chief financial officer
yeah. i appreciate the question. thanks for asking. we know this is going to be a big focus.
so clearly, we're pretty happy to come out the quarter as we were hoping at the end of last quarter with a very stable reserve in that segment in particular. i would say, there's -- they were small movements in a lot of different directions. they were not big movements on one side or the other, in one line, in one year, matt. so really it was kind of -- it netted out to the 10,000, but it was small pieces within that.
both within commercial autos and core over the years, nothing of note to report there.
matthew carletti -- jmp securities -- analyst
ok. great. and then shifting to core e&s pricing. you mentioned how the growth -- because allied health had a really good quarter a year ago, and so you gave kind of the corresponding growth figures.
would the story on kind of top-line pricing be similar, that if you excluded allied health, that i think it was a 3% number, would have been materially higher just because allied health had a head start?
bob myron -- chief executive officer
yeah. a little bit higher, matt, when you exclude it. although it sort of moves from like 3% to 3.5% when you look at the rest of the divisions. i guess a couple of things come to mind here.
first, we've been getting meaningful rate increases now for six quarters, and we are up 13% i think it was q1 a year ago, right? so we're now getting rate increases on top of rate increases. and i think we feel really good about the rate environment overall where the pricing is with the cumulative changes that we've got in the last six quarters. and to be specific around allied healthcare and the like, as you say, we have that difficult compare of the year ago, but in the subsequent quarters, in the rest of this year, for example, in allied healthcare, we don't really have that situation. so i think we're very optimistic about rate.
we're very optimistic about the growth prospects in terms of percentage-wise what that can be. and the submission flow, obviously, gives us tremendous amount of optimism as well.
matthew carletti -- jmp securities -- analyst
great. and then one last question if i can, just around capital. kind of what's your current thinking on capital and operating leverage? i mean we've kind of shifted from what was a capital return story for many years to an environment where you're seeing some nice growth. and so just hoping you could update us on your views.
sarah doran -- chief financial officer
yeah. thanks for the question on that, too. i think for right now, we're very happy with having moved away from the special dividend in the third quarter of last year. we're seeing great opportunities to put our capital to work.
so i think we continue with our above-peer 3% dividend yield and look to put as much of that to work as we can. i would expect that operating leverage might tick up a little bit from 1.42. we certainly have room to. but we're able to get to that 16.9% with that leverage, too.
so i think it's taking advantage of all the opportunities we're seeing come over the trends and especially in e&s right now.
matthew carletti -- jmp securities -- analyst
great. great. thanks a lot for the answers.
bob myron -- chief executive officer
ok. thank you.
sarah doran -- chief financial officer
thank you.
operator
thank you. and our next question comes from sean reitenbach of kbw. your line is now open.
sean reitenbach -- kbw -- analyst
good morning. going to the allied health division, was -- the drag on the growth, was it completely just a tough comparable? or was there any nonrenewal activity there or anything?
bob myron -- chief executive officer
well, it was a really tough comparable. that was a market that got really hard at the -- in q1 of last year and a substantial amount of flow from business come out of the admitted market. and that has sort of moderated as the year went on, i would guess, i would say, both in terms of flow and pricing, and the like. so that's really the reason and the answer.
sean reitenbach -- kbw -- analyst
ok. thank you. and then overall, on core e&s, do you guys feel comfortable with where rates are versus loss trend? or do you need another point or a couple of points to really feel comfortable or where's that at?
bob myron -- chief executive officer
yeah. so you know, the rates that we've gotten over the last six quarters are definitely outpacing the loss trend. i think that we -- it's a good question. we certainly do think about it that way, but i also think that we have been out seeking rate increases and achieving that for over that six-quarter period of time.
so it's also, you know, just what the market dynamic is and what the market will accept from a rate increase perspective. so i guess we're not specifically thinking about needing to get a certain rate to get over loss trend. we're thinking about optimizing the portfolio between putting nonprofitable business and getting compelling rates. and so we're going to continue to do that.
and i think we are optimistic that there is so much discussion in the marketplace from other carriers that are both in the e&s space and then the commercial line space as well that many lines of business, of course, excluding workers' compensation, there is a -- there's pretty strong momentum for continued price increases.
sean reitenbach -- kbw -- analyst
all right. thank you very much. and for the casualty reinsurance, is there anything that's driving the lower accident year loss pick? it looks like it's been consistently improving over the last five months at least, if not longer.
bob myron -- chief executive officer
yeah. another great question and the biggest thing is really just mix. when we pared the book down, for example, from '17 to '18 and now into '19, we really moved from -- a fair amount of what was not renewed was nonstandard auto business, which had a higher loss pick and a lower expense ratio or ceding commission associated with it. and this book going forward is almost all excess and surplus lines liability type of business, which has a lower loss pick and perhaps a slightly higher ceding commission.
one thing to remember about that loss pick is that the -- a piece of the lae expenses are included in the ceding commissions. so we don't -- we're not necessarily having to book a loss ratio that includes all of the lae. so -- but that's really the reason. it's mix.
it's moving to almost entire e&s -- entirely e&s liability business, and away from some other lines of business that had carried higher loss picks.
sean reitenbach -- kbw -- analyst
ok. thank you. that's helpful. and then finally, on the growing portfolio.
sarah, i know you said that it should slow down. but in terms of the growth of the portfolio, and it has been growing pretty -- at a good pace, and if that were -- happen to persist at all, would that change the trajectory of the tax rate movement as more investments come onshore at a faster pace maybe than what you guys are expecting?
sarah doran -- chief financial officer
yeah. i don't know if the growth rate is going to necessarily impact the tax ratio -- tax rate. i think there are lot of things that play in the tax rate. the movement of assets onshore is one, but we still have the majority of our assets offshore.
so i don't think that's going to cause a change to that existing trajectory, if that makes sense. because i just wanted to make the point that our growth in operating cash flow is a down a little bit but will continue to grow clearly, just perhaps not at the prior rates, on that cash invested assets.
sean reitenbach -- kbw -- analyst
ok. thank you very much guys.
bob myron -- chief executive officer
thank you.
sarah doran -- chief financial officer
thank you.
operator
thank you. and our next question comes from brian meredith of ubs. your line is now open.
seth rosenberg -- ubs -- analyst
hey, guys. seth here jumping in for brian. really appreciate the color on habitation. i thought the two examples are really interesting.
but it's a line that you certainly heard a lot of other companies talk about as challenging. and one of the large e&s wholesale brokers kind of highlighted it as the most problematic line and particularly with apartments. could you maybe give your perspective on why it's been a difficult line, and why you feel comfortable about writing it?
bob myron -- chief executive officer
yeah. i mean, i think, we wouldn't put anything on the books without feeling like it's going to be profitable when we do. it's so -- and some of these are larger accounts, and so they're not necessarily decisions that are made based upon the individual underwriter at the desk. when they start to get larger, we start to look at individually pricing them using our actuarial staff and then involving segment leadership as well.
so i think we're looking at those really, really carefully. and i think it's an area that has -- more broadly has been written. i think the best answer i can give you, it's a high-level answer, you know, it's been written pretty broadly by the admitted market for a reasonably significant period of time. there hasn't been a lot of rate change with respect to it.
and i think you've just got meaningful loss creep there without a lot of rate change through the years. and now i think you're in a situation whereby it can't really be profitably written in the admitted market with a filed rate and form. whereas i think we have the ability to exclude certain perils, so to speak, and obviously write it with sort of full open market flexibility on how we price that. so we feel good about those risks when we're putting them on.
and so it's a typical thing that i think -- we're seeing a lot of flow here, and it doesn't seem -- seen any signs of abating. but i would just want to make sure you know that we very carefully underwrite these accounts in particular when they're larger. sarah, is there anything you'd like to add?
sarah doran -- chief financial officer
no. i would just emphasize the point that you made before, when you're able to -- you want to take a hard look at something, you've got 100% opportunity for 100% price increase in a tighter form or a 68% price increase with client risk than it was when it was in the admitted market, that degree in a pricing perspective.
bob myron -- chief executive officer
yeah. and i think we saw a similar thing and have seen a similar thing. for example, something we talked about before in the chain restaurant area, so to speak, which is this is business that very typically and for long periods of time had been in the admitted market. but i think the nature of the risk changed somewhat in terms of the types of claims that were occurring when a lot of the restaurants move to more drive-through business and less sort of park and walk-in type of business.
and you had a lot more hot coffee spills on the lap and burns and sort of people getting hit walking through drive-through areas. so accidents in the parking lots so to speak. and that also was an area that admitted market has been challenged to write for certain accounts with filed rate and form. and we were receiving -- have received price increases per location for primary general liability policy that could be to two to three times what the expiring price was in the admitted market.
and now we've got a year's worth of claims activity underneath us, and we've renewed some of those businesses and have a good sense for how that's running and how we feel about the pricing.
seth rosenberg -- ubs -- analyst
got it. ok. that's a really -- that's a great answer. and then maybe this is too simplistic, but is there a way to think about terms and conditions sort of as a renewal pricing benefit? i mean, are tighter terms and conditions sort of like an additional point of value when you think about rate versus loss trend? or is that not a fair way to think about things?
bob myron -- chief executive officer
well, you know, there is -- i'm not going to be able to give an example -- perfect example. but one clear example obviously is a higher deductible or a deductible or a self-insured retention that didn't -- wasn't in place in the expiring policy and our underwriters look at from an increased limit factor perspective. even a small deductible on a primary insurance policy can have up -- if you will translate into that what would that mean from a rate increase perspective, those are substantial, those -- having those deductibles in place have to be able to have the insured in effect have to pay the small nuisance claims, so to speak. and so those are powerful as well.
sub limits on certain things are powerful as well. exclusions on certain types of risks. we're just talking to our claims person the other day, excluding things like high hazard type of activities in bars, restaurants and taverns, like mechanical bull machines and axe throwing areas and things like that. just coverage restrictions that -- we have the ability to basically manuscript that that can be really powerful.
and sometimes it is difficult to translate exactly into a rate change. probably the easiest thing, which is -- which would be done really by our underwriters is when you have a higher deductible and how that -- how you think about that from a rate perspective.
seth rosenberg -- ubs -- analyst
got it. ok. great. and then i think you said, six -- quoting -- or sorry, submissions were up 68,000.
how much of that business do you guys on quoting? is that -- and is that sort of limited by just your underwriting capacity? or is there a lot of business that you just pass on?
bob myron -- chief executive officer
well, so to be clear, we got 68 -- over 68,000 new and renewal submissions in the quarter, and that was up 17% year over year. so that wasn't the growth number. that was the actual number of submissions. and then i think the second part of your question was around, do we have the capacity to handle that? is that what you were getting at?
seth rosenberg -- ubs -- analyst
yeah. i mean, i mean when you think about submissions, how much of that business do you guys actually go after?
bob myron -- chief executive officer
well, yeah. so we go after a lot of it. i mean when you look at our -- generally, when you look at our statistics, these numbers float around a little bit. but you generally end up -- in excess and surplus lines, you generally end up writing plus or minus 60% of your renewal submissions.
and you generally end up quoting 30-some-odd-percent of the new submissions that come in. and then you end up ultimately -- for new business, you end up ultimately writing sort of 3% to 4% of those new submissions, right? so i mean those are kind of the statistics around it. i guess maybe the point that you're getting at is -- or maybe i should make a statement. all other things being equal, if our historical quote and hit rate stay the same, submission growth should turn into premium growth, which is perhaps where you're going with that.
seth rosenberg -- ubs -- analyst
yeah. it was, exactly. ok. great, guys.
thanks. appreciate all the answers.
bob myron -- chief executive officer
ok.
operator
thank you. [operator instructions] and our next question comes from randy binner of b. riley fbr. your line is open.
randy binner -- b. riley fbr, inc. -- analyst
hey, good morning. so i mostly asked and answered. but i guess back to the commercial auto book. understanding kind of the claims discussion you've gone through and reserves more.
but from a -- i guess, from kind of like a real loss perspective and from a loss mitigation perspective, how is claims management going in that over book? there certainly was a concentration in florida in the '16 accident year. and there was issues there. but generally speaking, i know that that organization has called the number of drivers. they've introduced basic safety standards.
i think you all have been kind of investing more in claims. and so can you kind of dimension for us how the real loss activity in those vehicles has changed over the last kind of 12 to 18 months?
bob myron -- chief executive officer
yeah. so good question, randy. i would say that, yes, there's been a significant number of safety initiatives implemented by the insured, and part of that is definitely working to improve the driver pool based upon driver scoring, commentary that they get from riders, accidents and so on and so forth. so they have worked to improve the driver pool and in some instance, has been calling the driver pool in certain states in a number -- in all those ways i mentioned, and more, right? so that has resulted in some decreased level of frequency of claims.
and i think the other big thing really for us is we've talked a lot about florida for the year, that is a tough jurisdiction in particular with certain types of liability claims, um, uim and the like. and there are some other jurisdictions throughout the u.s. that had some tough point bar in the legal environment with respect to that. and we are -- we don't have as many of those states anymore.
and where we do, i think they're a very small percentage of the mileage. so i -- we feel like in terms of the 20 states and two territories that we have, there's a lot more stability in sort of the legal and litigation environment where we have liability claims in those states. so those are a couple of things. and then you made an allusion to something else as well in our claims staffing.
yes, this was a rapid growth -- a rapidly growing account with a rapid growth in mileage. and we still have the largest share of the mileage for uberx in the u.s. but we feel like we've got our feet on the ground in terms of claims headcount and claims resources, in terms of handling these claims well for the mileage that we've been allocated.
randy binner -- b. riley fbr, inc. -- analyst
all right. that's great. thank you.
operator
thank you, and that concludes our question-and-answer session for today. i'd like to turn the conference back over to bob myron for closing comments.
bob myron -- chief executive officer
thank you, operator, and thank you, everyone, for joining our call today. we look forward to talking to you again next quarter.
duration: 41 minutes
call participants:
kevin copeland -- head of investor relations
bob myron -- chief executive officer
sarah doran -- chief financial officer
mark hughes -- suntrust robinson humphrey -- analyst
matthew carletti -- jmp securities -- analyst
sean reitenbach -- kbw -- analyst
seth rosenberg -- ubs -- analyst
randy binner -- b. riley fbr, inc. -- analyst
more jrvr analysis
all earnings call transcripts"
