q,ticker,dt,prep_remarks,QnA
2019-Q3,JRVR,2019-11-07 08:00:00,"prepared remarks:
operator
ladies and gentlemen, thank you for standing by, and welcome to the james river third-quarter 2019 results conference call. [operator instructions] please be advised that today's conference is being recorded. [operator instructions] i would now like to hand the conference over to your speakers today, kevin copeland, head of investor relations. please go ahead.
kevin copeland -- head of investor relations
thank you, danielle. good morning, everyone, and welcome to the james river group third-quarter 2019 earnings conference call. during the call, we will be making forward-looking statements. these statements are based on current beliefs, intentions, expectations and assumptions that are subject to various risks and uncertainties, which may cause actual results to differ materially.
for a discussion of such risks and uncertainties, please see the cautionary language regarding forward-looking statements in yesterday's earnings release and the risk factors section of our most recent form 10-k, form 10-qs and other reports and filings we make with the securities and exchange commission. we do not undertake any duty to update any forward-looking statements. i will now turn the call over to adam abram, chief executive officer of james river group.
adam abram -- chief executive officer
thanks so much, kevin, and good morning, everybody. sarah doran, bob myron and i are all here together. and before i turn the call to sarah, i have a few comments about the loss we reported this quarter and our decision to walk away from our largest account. i think those of you who have followed us for a while know that we pride ourselves in our underwriting standards, and this loss, which is driven by the lack of profitability on the uber account is not acceptable to us.
we decided that it is not in the long-term interest of our company and our stakeholders to continue our contract with uber. in 17 years, since we founded james river, we've made underwriting profits in all but two years, and we've never reported a loss of this magnitude before. we've canceled the account and after taking a reserve charge, we expect to resume producing low double-digit annual returns on tangible equity in 2020. in uber, we wrote a new type of risk that initially seem to be highly profitable based on the data available to us, but uber's business and the underlying risk evolved very quickly.
our underwriting assumptions and the related pricing did not keep pace with changes in uber's business. uber created a new transportation model that altered the american transport and presented new challenges and opportunities for the insurance industries. the risk associated with this model shifted as the company expanded into new regions, added tens of thousands of drivers and evolved beyond just ride hailing. all of these factors created a situation where the risk became too large in absolute terms given the size of our company.
and candidly, in some years, we mispriced the risk. having said that, we're comfortable with our pricing for the 2018 and 2019 years. in response to poor results in 2016 and 2017, we negotiated substantial pricing increase for the contract on the 2018 renewal and renewed at similar rates for the 2019 renewal. we also purchased a quota share reinsurance contract for the third -- for a third of the account for the first time in 2019.
however, profits we anticipate earning in these last two years will not fully offset losses from prior years. we decided to cancel this year, even though we believe the risk is well-priced because of further complications related to the passage of assembly bill 5, or ab 5, as it's known, in the state of california. we believe ab 5 will adversely alter the claims profile for rideshare companies. in 2019, our pricing had not anticipated ab 5, hence our concern.
the legislation becomes effective two months before our policies would have naturally expired. when we canceled the account, we also drew upon the collateral established to pay the portion of claims costs retained by our client. the $1.2 billion in that trust account is now on our balance sheet and may be used to pay our former clients share of any claims as they arise. the funds are invested in short-term treasuries and the interest earned will accrue to our benefit.
while that does not reduce our loss ratio, the investment earnings will somewhat mitigate the effect of the losses we have reported. last night, after we released earnings, uber sent a note asking the collateral be redeposited within the trust. we're confident that we've handled the trust appropriately and do not intend to redeposit the funds. we expect to process approximately 18,500 claims during the runoff of this book of business.
we're well staffed to handle these claims and are committed to handling them expeditiously and properly. in the end, i'd say the uber account was a diversion from the steady engine that is always propelled our company, highly profitable underwriting of small and middle market risk, and that business is performing very, very well, in line with or ahead of our expectations. we decided to reset our focus on the many positives in our core e&s business and attractive growth opportunities we continue to see there and in our specialty admitted segment and to start the new year, focused on those opportunities. during the past quarter, our core e&s, our excess and surplus lines business, meaning our james river e&s business other than commercial auto, grew by 72% compared to the same period a year ago.
rates in this segment have gone up for 10 quarters in a row and increased 3.2% in the third quarter and were up 6.5% if we exclude one large renewal of a profitable account. we wrote $133 million in core e&s this quarter and are on a pace to write approximately $500 million in core e&s this year. the growth in our core e&s business is very, very strong. submissions through the first 3 quarters of this year are up by 22% compared to the first three quarters of last 2018.
the pace is accelerating. submissions in the third quarter were up 29%. we're continuing to book the current year at or above a 70% loss in lae ratio, and long-term observers of our company know, our e&s book has historically developed at significantly lower loss ratios than 70%. pricing is excellent.
a couple of anecdotes will give you a flavor for parts of our market. liability for habitational risks have seen very large rate increases. we recently wrote an e&s liability, excess liability policy, on a california apartment complex, where we reduced the limit by 50% from the expiring limit and increased the rate by over 500%. a similar example from the east coast, where we write the primary layer.
our premium was almost 400% of expiring premium with substantial supplements for assault and battery, water damage and even an absolute dog bite exclusion. this illustrates that, right now, in truing the e&s business, there is an opportunity for improved pricing and more favorable terms and conditions. and because these are new accounts to us and not in the renewal, these increases aren't incorporated in our rate increase information that i was quoting to you before. in our allied health division, we're seeing real strength in the smaller nursing home assisted living area.
larger facilities have not yet seen rate increases, but in september, we wrote multiple smaller accounts and increases exceeding 50%. we have not yet seen significant increases in construction-related accounts. our specialty admitted business, turning to that, also had a very good quarter, growing slightly compared to a year ago and reporting a 94.1% combined ratio. we believe our fronting business in this segment has great potential to deliver high returns on equity, while taking only moderate underwriting risk.
underwriting profits from the specialty admitted unit were $837,000 for the quarter, and we're just starting there. new leadership in our specialty admitted segment has signed four new fronting deals we anticipate will bring in over $50 million in gross premiums annually. so because of the fundamental strengths of our company, i expect going forward that we will deliver a low double-digit return on tangible -- average tangible equity. and before we get into your questions, i know we'd benefit from having additional insight from sarah doran, our chief financial officer.
sarah?
sarah doran -- chief financial officer
thanks, adam. let me highlight a few of the financial points from the quarter. net earned premium grew over 16% in our e&s segment this quarter and 30% in our core e&s business alone. year to date, core e&s premium is up 20%.
core e&s earned premium is up 20%. this quarter, the e&s segment represented over 77% of our total group net earned premiums. starting in january of 2020, core e&s will be the majority of our group's earned premium as the large commercial auto account will roll-off by the end of this year. thinking about core e&s on its own, as adam mentioned, we're booking loss ratios at above a 70% loss in lae ratio.
the expense and commission ratio for this business is in the mid- to high 20s. as we've mentioned previously, we are getting strong rate in our core e&s lines. given our strong pricing and our historical results in core e&s, we expect this business will generate very attractive returns. let me take a moment to provide some additional color on the adverse development we experienced this quarter.
we had adverse development of $57 million overall. we had $50 million of adverse development in the uber book, most of which was focused on the 2017 underwriting year, with the balance in the 2016 underwriting year. this recent quarter, we had losses in excess of expected for the 2016 and 2017 years, but we did not see this for the more recent 2018 and 2019 years, so we took no action there. and as adam mentioned earlier, and we've mentioned before, in 2018, we raised rates on this account significantly.
we also had adverse development of about $8 million in our casualty reinsurance book, driven by much higher-than-average claims volumes in the quarter related to several accident years. we had $1 million of favorable development from our individual risk workers' compensation book. turning back to cash flow. we continue to enjoy strong cash flow from our businesses as operating cash flow was $145.7 million in the quarter alone and $213.8 million year to date.
third quarter cash flow is up materially over that of the first two quarters of this year, given the strong growth in core e&s, gross written premium, which is up 51% year to date on its own. the investment portfolio performed as we expected this quarter, as we earned $17.9 million in net investment income, an increase of 9% from the prior year quarter, largely in line with the growth of our portfolio. more notably, as adam mentioned, subsequent to delivering the early cancellation to our clients on october 9, we brought approximately $1.2 billion of assets on to our balance sheet from a collateralized trust, which uber has posted for our benefit. these funds are invested in short-term government securities and now will earn additional net investment income for us.
the collateral secured claims payments for the portion of the risk that we effectively fronted for our now former client, not for our own booked reserves. we are entitled to ask for additional collateral should that prove necessary. so through the first 6 months of the year, we've grown our book value by about $82 million or over 16%. while the loss this quarter is a setback, we still increased tangible equity over 12% year to date despite paying almost $30 million in dividends through the first three quarters of the year, given our healthy 3.6% yield.
our balance sheet and capital position are well able to support the attractive growth that we continue to see in our core e&s business and additional opportunities for growth we are realizing in the specialty admitted segment. we expect that our casualty reinsurance business will largely remain at similar premium volumes to what it has over the last year or so. so while it's too early for us to provide guidance on 2020, i will echo what adam said and that our opportunities to put capital to work at attractive returns for our shareholders are plentiful. while our top line will likely be down modestly from 2020 -- in 2020 from where we end 2019, our core e&s business has typically produced a lower developed combined ratio then as our commercial auto book, building a case for a compelling groupwide combined ratio.
we will actively and carefully manage expenses over the next few quarters as we work to runoff the bulk of the commercial auto book. and with that, i'll turn the call back to adam.
adam abram -- chief executive officer
thank you, sarah. operator, do we have questions?
",":
operator
thank you. [operator instructions] and our first question comes from matt carletti from jmp securities. your line is now open. please go ahead.
matt carletti -- jmp securities -- analyst
hey, thanks. good morning. if i could maybe just a couple questions to start on the commercial auto reserve charge. for starters, can you give us a little bit of color behind the scenes in terms of what changed with the reserve charge this quarter? are you at a different point in terms of kind of your confidence level in the reserving numbers? have you gone higher toward the top end of kind of the actuarial range as a percentage of ibnr increased? can you help us understand how the reserve picture sits today versus a quarter or two ago?
sarah doran -- chief financial officer
sure, matt. this is sarah. i think i would say, first of all, we have fairly standard practices and procedures around this, and we follow the same that we do every quarter and that we're looking at this book with monthly actuarial data and then we're doing a deep dive every single quarter. and what we reacted to was losses in excess of expected in this quarter.
we put up the number that i think was demanding of that. and we're certainly watching it very carefully and very closely, especially around claims and further development and behavior of that, but we feel that we have put up a number that is in response well and response to the data that we saw that we were presented with, and that's where we got to this quarter. as i mentioned, more of that was concentrated on the '17 year, then on the '16 year. we're clearly closer to the end of the '16 year, just from a timing perspective than we would have been at the beginning of the year.
matt carletti -- jmp securities -- analyst
ok. and then maybe can you remind us a little bit of some of the -- either the broad pricing changes or underlying exposure, state footprint changes, how '17 might be different than '16 on a underlying basis?
sarah doran -- chief financial officer
sure. i mean, i think -- and that's a great question. a big piece of moving from '16 to '17 was that we took a smaller share. i think we've mentioned this publicly before of florida, and we mentioned florida as being an outsized contributor from an underinsured and uninsured motorist perspective, and that causing some issues with regard to '16.
now clearly, we, in retrospect, have underpriced '17 from the reserve additions that we're making this quarter. but we have less exposure to that state in '17 than we did in '16. we did have a pricing increase from '16 to '17, but as adam mentioned, much more material pricing increase from '17 into '18, and i think that really provides a significant amount of the basis for our comfort in '18 and then '19.
matt carletti -- jmp securities -- analyst
ok. great. and then i'll stop beating the reserve question here, just one more. have you considered, would you consider, are you considering an adc on that book or some other form of reinsurance protection or transaction that would kind of put it out of investors minds for good?
sarah doran -- chief financial officer
we certainly realize the value that something like that could provide for exactly as you said it, for putting it to the side from an investor, and certainly from our perspective. and those are options that we look at every day in our business with regard to this business, with regard to other options. soft capital options that could make sense. i think they need to make sense economically for us, and they're not simple transactions, but they're absolutely things that we would and should be considering, for sure.
matt carletti -- jmp securities -- analyst
great. and one last one, if i can, on the reserves. you mentioned -- can you help us understand kind of how that e&s segment maybe will look different in -- and i know 2020 will be bit of a transition year and then longer term in terms of loss ratio expense ratio mix. i heard you mention kind of mid- to high 20s expense ratio, historically, where the core e&s has run.
but i would imagine maybe it runs a little higher initially as you still have the commercial auto tpa business, all the 18,500 claims kind of in runoff. so can you help us at least directionally understand kind of how that split will look as we move forward?
sarah doran -- chief financial officer
that's a great question. and we are still working through -- i'll maybe take a stab at it and then let adam come in at the end. we're still working through kind of the fine point on our 2020 plan. but what i would say is that we'll probably carry a little bit of additional expense into the beginning of the year, but we'll have worked our way out of that, certainly, by the end of the year.
so i'm comfortable with that mid- to high 20s expense ratio on the core e&s business for all of 2020. i would say it would be at the low end of that once we work our way out of all of the additional expense related to the business and managing that -- those runoff claims because we -- just to reinforce, we do not expect to have any premiums coming in from that large account in 2020. but i think what's most important there is that we work our way out of the claims, and we come to a good reserve results, then we're ok to carry a little bit of additional expense in the beginning with the big picture to come to a good landing. adam, is there more you'd add to that?
adam abram -- chief executive officer
no. it's just that -- i think you can get a good feel for how this book will look if you go back and look prior to our taking on the uber account at our e&s business. for years, that business has run at a loss in ale ratio hovering around 60. and we've been able to run that business, as sarah said, well below 30 in the mid-25% to 28% expense ratio.
so that's where i would expect this book to settle out once we move through all the other, what i will now call, noise, i mean because it's stuff we're rolling off.
matt carletti -- jmp securities -- analyst
great. well, thank you for the answers, and best of luck going forward.
operator
thank you. your next question comes from mark hughes from suntrust. your line is now open. please go ahead.
mark hughes -- suntrust robinson humphrey -- analyst
yeah. thank you very much. good morning. adam, the underwriting expenses in e&s kind of the mid- to high 20s, what sort of corporate expense would you have on top of that? i think you break that out in your earnings report.
if i'm looking at it properly, the other operating expenses, corporate and other $7 million last quarter. do we have the kind of mid- to 20 -- mid- to high 20s e&s expense load and then the corporate on top of that?
sarah doran -- chief financial officer
yeah. we -- yeah, so excuse me, matt. when i say mid- to high 20s, that's just the e&s -- the core e&s expense ratio. we do have the ongoing corporate expense, which is roughly $7 million and change a quarter, and then we've got the expense ratios in the other segments that we wouldn't expect to change materially.
mark hughes -- suntrust robinson humphrey -- analyst
very good. and then the -- when you think about the core e&s, and if you point out how you usually book it at 70, and then it develops favorably over time. as we think about 2020, the pace of development, i think it's all been -- you're kind of caught up in the issues with uber this last year or two, and so it's been harder to get a look at what's going on in the core e&s. can you say anything about either the pace of development in the core e&s as it's been recently? or is it likely to be -- at least in the near term, i know that's something that's difficult to predict or provide guidance on, but just sort of -- probably think how the model looks at least in the near term with respect to those moving pieces?
adam abram -- chief executive officer
we were booking. and sarah, you'll correct me, i hope here, but we started booking the e&s business at a 70 in '18. and so we have the benefit of the '18 year, which is already developing some maturity and we get more insight into that as it goes on. but typically, i mean, we don't have a script here about how we bring them reserves.
we look at the actual case reserves and we look at on our ibnr and measure the pace of claims and make a judgment that's historically well informed judgment. and it starts a couple years after we write the business, you'll start to see those reserves rolling to earnings as appropriate.
mark hughes -- suntrust robinson humphrey -- analyst
very good. and then just two others, if i may. the $1.2 billion, why -- if it was available and you could begin generating investment income. why -- just economically speaking, why wouldn't you have done it sooner than you did here? what was the kind of the dynamic on the -- timing on the decision process?
sarah doran -- chief financial officer
it's just -- it's a standard trustmark, and we felt that we were making a change and by canceling the account, we just -- we felt like we wanted to be as secure as we could be in the moment. and we made the decision to draw on the funds commensurate with the early cancellation of the account, just out of an abundance of caution.
mark hughes -- suntrust robinson humphrey -- analyst
is there -- is that what triggers if this is some sort of -- you have to make a case that there is a reason to take the assets, and then it becomes -- yeah, go ahead.
adam abram -- chief executive officer
mark, no, there is no case that needs to be made. but i don't -- look, this is an account with the client we had for quite some time. and i don't really want to get us into a lot of specifics about the account, but this is a very standard arrangement across the industry, any insurer who enters into one of these standard agreements can at any time typically draw down that trust. our policy was, we have canceled the policy, we're putting this book into runoff.
we thought carefully about our situation and made the choice that we thought was the appropriate choice.
mark hughes -- suntrust robinson humphrey -- analyst
and then the ab 5, you say that -- you think that may adversely alter the claims profile for ridesharing. could you expand on that a little bit?
adam abram -- chief executive officer
well, look, there's been an awful lot written about that by a lot of experts, but obviously, it's something that we did not price for. nobody -- we didn't price for ab 5, and it was a change, and we think it's a material change. and so having experienced many different changes in the course of this relationship that affected losses, we thought this was the right thing for us to do. this was not incorporated in our pricing.
mark hughes -- suntrust robinson humphrey -- analyst
thank you.
operator
thank you. and your next question comes from meyer shields from kbw. your line is now open. please go ahead.
meyer shields -- kbw -- analyst
great. thanks so much. so just a few, hopefully, quick questions. i'm trying to understand -- or let me ask this as a question.
given the significant rate increases embedded in both new and renewal core e&s, should we assume that 2020 could be booked to something below 70% initially? or is that roughly a good initial guide with favorable experience we reported later?
sarah doran -- chief financial officer
we're not far along there, meyer, to have a materially different view on the market. so in the absence of new data in the beginning of november, i do think about that loss ratio, that 70% accident year as being a reasonable assumption.
meyer shields -- kbw -- analyst
ok. that is perfect. is this -- can you give us a sense of the time line for paying down the $1.2 billion of claims related collateral? in other words, how long that will be augmenting investment income?
sarah doran -- chief financial officer
yeah. that's very hard to tell because there are a lot of assumptions around claims payments and kind of future, i guess, interaction as well. so i think in the absence of that, i would just assume that it's $1.2 billion over the next year.
meyer shields -- kbw -- analyst
ok. perfect. does the fronting arrangement in casualty reinsurance provide ceding commissions to be earned in coming quarters? was that all booked in the third quarter?
sarah doran -- chief financial officer
no. that will come over the next few quarters. good question.
meyer shields -- kbw -- analyst
ok. and then one last question, if i can, on the uber reserves. i guess the one question that i'm hearing is that since you've had sort of late adverse experience on accident year '16 and '17, how do you have comfort that that won't materialize later on in the more recent accident years, even in the context of the current improved underwriting performance?
adam abram -- chief executive officer
i think the biggest buffer against that is a very, very substantial price increase that we got in the '18-'19 year.
meyer shields -- kbw -- analyst
does that preclude later development of claims for later emerging information?
adam abram -- chief executive officer
no. it doesn't preclude later emergence of things, but we are -- we just aren't seeing that right now. look, we're not seeing that kind of emergence right now.
sarah doran -- chief financial officer
where is it? i think we were at earlier points of prior years.
adam abram -- chief executive officer
yes.
meyer shields -- kbw -- analyst
ok. understood. ok. thank you so much.
operator
thank you. [operator instructions] and your next question comes from brian meredith from ubs. your line is now open. please go ahead.
brian meredith -- ubs -- analyst
yes. thanks. one quick one and one maybe a little bit longer. the first one, sarah, what kind of yield should we assume on those short-term funds?
sarah doran -- chief financial officer
it's a money market treasury -- t-bill-type yield there, brian. [inaudible]
brian meredith -- ubs -- analyst
immaterial. ok. great. and then my second question, adam, i'm just curious, with the substantial growth you're putting on, on your e&s, core e&s business, do you have kind of the platform or infrastructure to absorb that type of growth right now? and then i want to tie that in with what's going on right now with uber, and just how integrated was that in the rest of your platform? and just to avoid disruptions that could potentially cause some cost and issues toward claims management, underwriting all sorts of other things?
adam abram -- chief executive officer
absolutely. we've got the infrastructure to manage the growth in the e&s business and our throughput right now is growing without -- because of good hard work and very capable management and organization by our teams in the e&s unit, our throughput has grown. that is the number of quotes that we've been able to put out. we put some technology behind that that assist us in quoting faster and better.
and so we're not strained at all in terms of our ability to handle this growth. we've added new people in the underwriting division. right now, the uber account is really strictly, obviously, a claims operation, and we have sufficient people to handle those claims easily, efficiently, consistently and within the 4 corners of the contract. and we'll engage in a orderly runoff of that book, and the uber claims segment is separated from our e&s claims segment.
they're under a common management, but the people handling uber claims are different than the people handling the liability claims in our e&s segment. now as uber runs off, by the way, there may be opportunities for us to move people over from -- some people over from uber claims into the liability group as that grows. and in fact, that's kind of an advantage that we have right now in terms of this expanding book. and as you think about the growth in claims -- just in numerical claims that will inevitably come, we've got a lot of talented people handling uber claims who may eventually come over and be part of the e&s claims handling.
so it's actually a fortuitous and good arrangement.
brian meredith -- ubs -- analyst
great. thank you.
operator
thank you. you have a follow-up question from mark hughes from suntrust. your line is now open. please go ahead.
mark hughes -- suntrust robinson humphrey -- analyst
yes. on claims development, there's been some commentary, obviously, around the commercial auto that the development pattern has been lengthening and you're seeing -- not you, but others are seeing higher losses in the tail, but then even on noncommercial auto risks or losses there perhaps have been developing less favorably than expected. have you seen that? has the whole point about social inflation, just kind of broadening up the conversation in one of your notable competitors that talked about it? are you seeing anything like that in your core e&s business where some of the development patterns are a little different?
adam abram -- chief executive officer
we're not. we're looking hard at it. we certainly are aware of all the commentary around that. we've not seen what people are referring to is the social inflation in our core e&s book, middle market, basically small and middle market e&s book to date, but we are alert to it.
i will say we've enjoyed 10 quarters in a row of significant rate increases. and then, as i was pointing out before, the renewal book, those rate increases that we report to you, i think, are -- they're part of the story, but there's another part of the story where you can't quite capture the flavor of it, except to explain to you what the expiring premium from another insurer was compared to the premium we've got, and i gave you a couple of examples of several hundred percent here. and i didn't just cherry pick those examples, that's a phenomena that's going on in parts of the e&s market. and at the same time, i'm not seeing yet the social inflation that people are talking about.
but if you look at our long-term history in this business, which is, as i pointed out earlier, 17 years, we've got a long history through many cycles of looking at fully developed loss and lae ratios. and those typically have been hovering right around 60% over time. i think the price increases that we're getting are really good. and i think that this book will perform in line with our long-term history in good years because i think we're really in good position in these years in the current environment.
mark hughes -- suntrust robinson humphrey -- analyst
understood. then one final quick question. do you even have the written and earned for the commercial auto piece in the third quarter? i think, historically, that maybe gets broken out later. but own review, you have them there in front of you, again, the written and earned in commercial auto within e&s?
sarah doran -- chief financial officer
yeah. it was about $80 million there.
mark hughes -- suntrust robinson humphrey -- analyst
that was the -- those earnings.
sarah doran -- chief financial officer
they're about -- yes. that's the written and the net earned, they're about the same, right? because we basically earn the premium as we write it.
mark hughes -- suntrust robinson humphrey -- analyst
i guess -- i probably guess, yeah, net written would be the same. do you have gross written by any chance?
sarah doran -- chief financial officer
well, gross would be the additional amount given the large reinsurance contracts that's a little over $100 million.
brian meredith -- ubs -- analyst
yes. ok. very good. thank you.
operator
thank you. i'm showing no further questions in queue at this time. i would like to turn the call back to adam abram for closing remarks.
adam abram -- chief executive officer
well, thank you, everybody, for your interest in our company, and we look forward to reporting to you next quarter and to visiting with you from time to time, and we appreciate -- deeply appreciate your interest and speak to you soon.
operator
[operator signoff]
duration: 39 minutes
call participants:
kevin copeland -- head of investor relations
adam abram -- chief executive officer
sarah doran -- chief financial officer
matt carletti -- jmp securities -- analyst
mark hughes -- suntrust robinson humphrey -- analyst
meyer shields -- kbw -- analyst
brian meredith -- ubs -- analyst
more jrvr analysis
all earnings call transcripts"
