q,ticker,dt,prep_remarks,QnA
2022-Q2,MO,2022-07-28 09:00:00,"prepared remarks:
operator
good day, and welcome to the altria group 2022 second quarter and first half earnings conference call. today's call is scheduled to last about one hour, including remarks by altria's management and a question-and-answer session. [operator instructions] i would now like to turn the call over to mac livingston, vice president of investor relations for altria client services. please go ahead, sir.
mac livingston -- vice president of investor relations
thanks, ashley. good morning, and thank you for joining us. this morning, billy gifford, altria's ceo; and sal mancuso, our cfo, will discuss altria's second quarter and first half business results. earlier today, we issued a press release providing our results.
the release, presentation, quarterly metrics and our latest corporate responsibility reports are all available at altria.com. during our call today, unless otherwise stated, we're comparing results to the same period in 2021. our remarks contain forward-looking and cautionary statements and projections of future results. please review the forward-looking and cautionary statements section at the end of today's earnings release for various factors that could cause actual results to differ materially from projections.
future dividend payments and share repurchases remain subject to the discretion of altria's board. altria reports its financial results in accordance with u.s. generally accepted accounting principles. today's call will contain various operating results on both a reported and adjusted basis.
adjusted results exclude special items that affect comparisons with reported results. descriptions of these non-gaap financial measures and reconciliations are included in today's earnings release and on our website at altria.com. finally, all references in today's remarks to tobacco consumers or consumers within a specific tobacco category or segment refer to existing adult tobacco consumers 21 years of age or older. with that, i'll turn the call over to billy. 
billy gifford -- chief executive officer
thanks, mac. good morning, and thank you for joining us. altria's tobacco businesses performed well in a challenging macroeconomic environment for the first half of the year. the smokeable products segment delivered solid operating company's income growth behind the resilience of marlboro, and our moist smokeless tobacco brands continued to drive profitability.
we also continue to make progress toward our vision through the investments we laid out in january, which included supporting the expansion of on!. we are encouraged by on!'s retail momentum and significant share growth since achieving unconstrained capacity last summer. we believe this is a pivotal point in the u.s. tobacco industry.
the fda has the opportunity to create a mature, regulated marketplace of smoke-free products that can successfully realize tobacco harm-reduction and improve the lives of millions of smokers. we share the fda's goal, to transition smokers away from cigarettes, but we continue to believe that harm-reduction, not prohibition is the best path forward. my remarks this morning will focus on three topics: our core tobacco businesses, including the macroeconomic backdrop and potential combustible tobacco product regulation; the smoke-free opportunity in the u.s. and our smoke-free product portfolio; and our continued confidence in our vision.
i'll then turn it over to sal, who will provide further detail on our business and financial results. let's begin with a review of the macroeconomic backdrop and its impact on u.s. tobacco consumers. in the second quarter, rising gas prices and inflation continue to pressure tobacco consumers' disposable income, resulting in volume declines across the tobacco space.
however, we believe that tobacco consumers adapted their purchasing patterns across a variety of goods and services to compensate for the increases in prices. some of the tactics used by consumers to manage their spending included only partially filling the gas tank and shifting their tobacco purchases from multipack toward single-pack purchases particularly among discount smokers. we also saw signs of continued brand loyalty in the tobacco space. in may, we conducted research to understand how tobacco consumers were managing their spending in several categories, including tobacco, alcohol, groceries and household items.
our research indicates that tobacco consumers are more likely to stick to their preferred brand regardless of price in the tobacco category compared to other categories. additionally, tobacco consumers saw price relief in other categories before doing so within the tobacco category. we believe that this prioritization is reflected in the sequential stability of marlboro retail share despite greater economic pressures on consumers. we believe inflation and the rising gas prices was partially offset for some consumers by a strong job market and wage growth.
overall, average wages increased 5.2% in the second quarter compared to an average of 8.6% increase in cpi. and for some occupations including the service industry, wage growth outpaced inflation. we continue to monitor tobacco consumer behaviors and changes in marketplace conditions, such as the declining gas price that we have observed in recent weeks, and we will continue to provide our insights as the year progresses. these macroeconomic factors contributed to accelerated cigarette volume declines in the second quarter and first half, which sal will discuss in his remarks.
in combustible regulatory news, the fda proposed rules that would ban menthol in cigarettes and characterizing flavors in cigars. the fda has already received over 200,000 comments on the proposals, and we expect to submit our comments by the august 2 deadline. the fda will need to address all of these comments before advancing to the next step in the rule-making process. as our comments will make clear, we believe that there are compelling reasons for the fda to reconsider its proposed rules relating to menthol and cigars.
additionally, the biden administration announced plans for future fda rule-making to develop a product standard that would set a maximum nicotine level for cigarettes. if and when the fda proceeds with rule-making, we expect to be fully engaged in the multiyear process. we believe harm-reduction is the best approach toward reducing smoking and improving public health. and according to a nationwide survey, others agree.
based on our research, a majority of the survey public policy professionals, smokers and general population adults support the concept of tobacco harm-reduction and prefer this policy approach over tobacco prohibition. but to achieve harm-reduction, we believe manufacturers must develop and the fda must authorized an array of potentially reduced harm products that can appeal to and transition smokers. this brings me to my next topic, the smoke-free opportunity in the u.s. and our smoke-free product portfolio.
today, over 20 million u.s. smokers seek less harmful alternatives to cigarettes. our strategy is to deliver a compelling portfolio of smoke-free products that offers a range of satisfying product choices for smokers and to responsibly lead them to these alternatives. our approach spans three of the most promising smoke-free categories with the potential to reduce harm: oral tobacco, e-vapor and heated tobacco.
in oral tobacco, we're encouraged by the growth of the novel oral products, which comprise more than a fifth of total industry oral tobacco volume in the second quarter. the category grew 6.8 share points year over year, with on! representing more than 40% of this growth. in the second quarter, on! reported shipment volume increased nearly 60% versus the year ago period. and on! retail share of oral tobacco increased eight-tenths sequentially, reaching 4.9 share points in the second quarter.
this represents a growth rate of almost 150% year over year. these strong results were driven by increased adoption of on!, increased brand awareness and higher levels of investment. helix achieved unconstrained on! manufacturing for the current u.s. market in the second quarter of 2021.
over the four quarters since then, helix enhanced the retail visibility and awareness of on!, leading to an over 70% increase in consumer awareness, tripled on! repurchases and continue to increase trial using transition marketing and data-driven strategies. and grew on! retail share to be a top five u.s. oral tobacco brand and solidified its position as the second largest oral nicotine pouch brand in each region of the u.s. more recently, helix launched the new carry on equity campaign, which encourages smokers to make progress in their transition journey.
the campaign highlights that by converting to on!, smokers can have nicotine satisfaction without having to step away from their daily routines, which addresses the social friction they experience with smoking. looking ahead, helix expects to use its understanding of the smoker journey, the smoke-free products to drive repeat purchases and adoption among smokers. we are excited about the performance of on! and the opportunity for future growth. i'll now move to the e-vapor category, which we continue to believe will be significantly influenced by regulatory actions.
in the second quarter, total estimated e-vapor volumes declined 2% versus a year ago and 7% sequentially as a result of decreased volume in the vape store channel, a reversal of the trend we observed in the first quarter. currently, slightly over half of the category's volume is comprised of pod-based products such as juul and vuse alto. within e-vapor, disposables represent the fastest growth segment since january 2020, which corresponds to when the fda issued in its guidance banning flavors only in pod-based e-vapor products. many of these disposable brands, including puff bar contain synthetic nicotine.
recent legislation, which we strongly supported, clarified the fda's authority to regulate tobacco products containing nicotine from any source. manufacturers of synthetic nicotine products were required to obtain fda authorization by july 13 to continue legally marketing their products. so far, no synthetic nicotine product has been granted authorization. and the fda has committed to pursuing compliance and enforcement action against companies found to be marketing, selling or distributing illegal synthetic nicotine products.
thus far, the fda has authorized only 23 total e-vapor applications, accounting for only eight products and approximately 1% of estimated e-vapor category volume. further, the fda has only authorized tobacco-flavored e-vapor products, most of which were for cigalike-style products, which we believe generally do not meet smoker expectations or deliver a satisfying product experience. given the limited number of authorizations today, we believe that the e-vapor category is still in its early phases. but with the support of reasonable regulations, we believe it could play in important role in harm-reduction.
moving forward, we hope to see timely science and evidence-based determinations from pending pmta application and further enforcement or noncompliant manufacturers. in the second quarter, juul products received marketing denial orders, or mdos. earlier this month, the fda administratively stayed the juul mdos citing unique scientific issues that warrant additional fda review. the administrative stay temporarily suspend the mdos during the additional review, but does not rescind them.
regarding our investment in juul, we recorded for the second quarter a noncash pre-tax unrealized loss of $1.2 billion as a result of a decrease in the estimated fair value of our investment. the decrease in fair value was driven by several factors including uncertainty created by the fda's action related to juul and uncertainty relating to juul's ability to maintain adequate liquidity. as of june 30, our estimated valuation is $450 million, which reflects a range of regulatory, liquidity and market outcomes. under the terms of our relationship agreement with juul, we have the option to be released from our non-compete obligation under several conditions including the fair value of our investments, if the fair value of our investment is not more than 10% of the initial carrying value of $12.8 billion.
however, if we elect to be released from our noncompete obligations, we would lose many of our investment rights, including our consent rights, our pre-emptive rights, and most of our board designation rights. at this time, we continue to believe that these investment rights are beneficial to us. therefore, we have not opted to be released from our non-compete obligations at this time, but retain the option to do so in the future in accordance with our agreement with juul. we continue to believe that e-vapor products, including juul, can play an important role in tobacco harm-reduction.
in heated tobacco, our teams remain in discussions with pmi related to iqos. we continue to believe in the potential of the heated tobacco category in the u.s. our plans remain on track to finalize designs by year-end for two product platforms within heated and oral tobacco and then begin regulatory preparations. our journey toward responsibly transition adult smokers to a smoke-free future continues.
and while we may face near-term challenges, we believe that the tobacco harm-reduction opportunity remains in front of us. as the leader in the u.s. tobacco industry, we have continued confidence in our ability to achieve our vision for several reasons, including our robust manufacturing, sales and distribution system and understanding of u.s. tobacco consumers.
our science-based approach to tobacco harm reduction, which we believe is aligned with tobacco consumers, society and the fda. our portfolio of products and investments across the most promising smoke-free categories and our significant cash flows and flexible balance sheet, which support our investments and shareholder returns. with these in mind and the resiliency of our organization, we believe we can lead the u.s. in moving beyond smoking.
i'll now turn it over to sal to provide more detail on the business environment and our results.
sal mancuso -- chief financial officer
thanks, billy. altria grew adjusted diluted earnings per share by 2.4% in the second quarter and by 3.5% in the first half across the challenging macroeconomic environment that billy described. the smokeable product segment continue to deliver on its strategy of maximizing profitability in combustibles while appropriately balancing investments in marlboro with funding the growth of smoke-free products. the segment grew its adjusted operating company's income by 0.6% in the second quarter, and 2.9% first half.
adjusted oci margins expanded by 0.7 percentage points to 59.1% for the second quarter and by 1.33 percentage points to 59.3% for the first half. this performance was supported by robust net price realization of 11.5% in the second quarter and 10.4% for the first half. i'll remind you that manufacturer price realization does not reflect retail price change for smokers. for example, marlboro net retail pack price increased 5.6% in the second quarter compared to last year.
smokeable products segment reported domestic cigarette volumes declined by 11.1% in the second quarter and 8.9% in the first half, primarily due to changes in consumer purchasing behavior as a result of increased gas prices and inflation. when adjusted for trade inventory movements and factors, second quarter and first half domestic cigarette volumes declined by an estimated 10% and 9%, respectively. at the industry level, we estimate that adjusted domestic cigarette volumes declined by 8.5% in the second quarter and 7.5% in the first half. as billy mentioned marlboro displayed resiliency during a period of continued uncertainty for consumers.
in the second quarter, marlboro's retail share of the cigarette category grew a tenth sequentially to 42.7% while declining four-tenths versus the year ago period. additionally, marlboro grew its share within the premium segment to 58.1%, an increase of three-tenths sequentially and five-tenths versus a year ago. moving to the total discount segment. total share was flat sequentially even as gas prices rose significantly from the first to second quarter.
discount increased 1.3 percentage points year over year to 26.4% as we lapped the period when the discount segment contracted from smokers having higher disposable income. additionally, we observed increased churn between the branded and deep discount segments as a result of a deep discount manufacturer's exit from the marketplace earlier this year. in cigars, reported cigar shipment volume decreased by 5% in the second quarter due to macroeconomic pressures on consumer, disposable income, trade inventory movements and other factors. however middleton continue to provide a strong contribution to smokeable segment financial results.
in the oral tobacco product segment, adjusted oci and adjusted oci margins contracted in the second quarter and first half due to several factors, including declines in mst volumes, increased investments behind on! and unfavorable mix. we remain pleased with the strong overall margins for the segment as we made progress with on!. at the industry level, tobacco oral tobacco volume declined 0.5% over the past six months. we continue to observe steady growth from the oral nicotine pouch category, but this has been offset by declining mst volumes due to the challenging macroeconomic environment and its effect on consumer behavior, consumer movement to oral nicotine pouches and other factors.
total segment reported shipment volume decreased by 4.4% for the second quarter and by 3.2% for the first half. the segment's volume was -- volume decline was driven by declines in mst volumes, partially offset by the growth of on!. when adjusted for trade inventory movements, segment volume declined by an estimated 2.5% for the second quarter and 1% for the first half. the total oral tobacco product segment's retail share for the second quarter contracted two-tenths sequentially and 1 share point versus the prior year to 46.7%.
copenhagen is celebrating its 200th anniversary this year. we're extremely proud of copenhagen's long history and the fantastic employees who have supported the brand over the years. to them, we say thank you. after 200 years, copenhagen remains the no.
1 dip brand because of your hard work, dedication and passion. to honor this impressive milestone, the team introduced cop rewards, the first and only national rewards program for an mst brand. under the program, dippers can earn points by entering codes from their copenhagen cans and can redeem them for coupons or rewards. we're excited about cop rewards and its potential contributions to copenhagen's sustained leadership in mst.
turning to our investment in abi. we recorded $124 million of adjusted equity earnings in the second quarter. this was an increase of approximately 9.7% from the year ago period and represent altria's share of abi's first quarter 2022 results. we committed to creating long-term shareholder value through the pursuit of our vision and our focus on significant capital returns.
we demonstrated this commitment in the first half by acquiring intellectual property and other assets for a multi substrate heated capsule technology from poda. paying approximately $3.3 billion in dividends and repurchasing 21.4 million shares, totaling $1.1 billion. we have approximately $750 million remaining under the currently authorized $3.5 billion share repurchase program, which we expect to complete by the end of this year. our balance sheet remains strong.
and as of the end of the second quarter, our debt-to-ebitda ratio was 2.3 times. in august, we expect to retire $1.1 billion of notes coming due with available cash. and lastly, our financial plans for the year remain on track and we reaffirm our guidance to deliver 2022 full year adjusted diluted eps in the range of $4.79 to $4.93. this range represents an adjusted diluted eps growth rate of 4% to 7% from a $4.61 base in 2021.
with that, we'll wrap up and billy and i will be happy to take your questions. while the calls are being compiled, i'll remind you that today's earnings release and our non-gaap reconciliations are available all on altria.com we've also posted our usual quarterly metrics, which include pricing, inventory and other items. let's open the question-and-answer period. operator, do we have any questions?
",":
operator
thank you. [operator instructions] our first question comes from chris growe with stifel. please go ahead. your line is open.
chris growe -- stifel financial corp. -- analyst
thank you. good morning. billy, i have a question for you, and you made a good point about -- it's clear we're at a very pivotal moment for this category. i was hoping to get just a better perspective from you and how you're investing today to be able to internally develop rrp, reduced risk products.
you've got some uncertainty around your positions in juul and iqos, and there's risk. those are no longer in your portfolio, certainly just a risk at this point. but i guess i just want to get a sense of what you're doing internally. and you talked about having a product already this -- at the end of this year.
and then to what degree maybe m&a could play a bigger role in giving you a better position in rrps going forward?
billy gifford -- chief executive officer
hey, thanks for the question, chris. i think when you think about where we're investing, certainly, we invested in our innovation process. we have the internal development going on. and i've spoken previously about changing that innovation process so that it's laser-focused on the consumer.
it monitors the marketplace. but i think before we were -- i would characterize it as almost chasing the market versus sitting side-by-side with the consumer. and so there's a lot of consumer interaction, almost to the point of co-developing with the consumer in those categories that we can develop in. to your point, we can't develop, per agreement with juul, in the e-vapor category.
but it's something -- we continue to monitor the marketplace and understand consumer satisfaction with the various products in the marketplace. we monitor the entire globe as far as alternative products to both influence -- how we think about internal development, but looking for products that could be emerging in the other markets as well.
chris growe -- stifel financial corp. -- analyst
and so would m&a be an important contributor, do you think, going forward for altria's position in this category?
billy gifford -- chief executive officer
it certainly won't be off the table, chris. but i think for the investments we're making in our internal development, we feel good about the pipeline of products that we have.
chris growe -- stifel financial corp. -- analyst
ok. and just one other question in relation to pricing in the cigarette category. it's been larger than expected, and it's occurred sooner than i expected, at least this year. and i guess in this environment where there's obviously a more burdensome kind of macroeconomic factor that's weighing on your volume, are you seeing a greater shift to some of the lower-priced or more highly promoted marlboro varieties? and do you see a need to have to increase promotional investments in light of the heavy pricing coming through in this environment?
billy gifford -- chief executive officer
yeah. chris, its a good question and it's something we monitor. but i think when you look at the sequential performance of marlboro, and even the discount category, you saw sequential stability. marlboro actually grew a tenth and the discount category stayed flat.
so that were experienced first quarter to the second quarter. from a standpoint of the tools that we put in place with advanced analytics, we feel good about the position. sal raised an important point. when you think about the impact to the consumer and you think about industrywide, call it a 5% to 6% price increase, that's well below the inflation they're experiencing in other categories.
and you saw the results and their remarks of the -- where we went to the consumer and talked about how they think about the tobacco categories and other categories, and you see they continue to prioritize the tobacco category at the top of their list. and i think that's telling. and you it -- we get a lot of questions about the -- i think you have to step back and think longer term on this. if you think about marlboro's share, we're right where we were prepandemic, certainly during the pandemic as they received additional funds, whether that be from government or unemployment or things of that nature, it reinforced that marlboro's the aspirational brand.
so marlboro benefited during that period. certainly, we've given a little bit of that share back and feel satisfied with where marlboro is. we've really -- the teams in advanced analytics, as well as the marlboro team putting those into the marketplace, the stability of marlboro is incredible.
chris growe -- stifel financial corp. -- analyst
ok. thank you for all the color. i appreciate it.
billy gifford -- chief executive officer
thank you, chris.
operator
and we'll take our next question from pamela kaufman with morgan stanley. please go ahead. your line is open.
pam kaufman -- morgan stanley -- analyst
hi. good morning. so industry cigarette volumes have weakened considerably during the second quarter. you highlighted the headwinds facing smokers and how they're adjusting their purchasing behavior.
i guess how are you thinking about the outlook for cigarette volumes over the remainder of the year? and then related to that, how much more pricing do you think that consumers can tolerate just given so far, we really haven't seen a meaningful acceleration in trade down to the discount segment, it's been consistent over the last couple of quarters. do you see an accelerated risk of trade down within the category?
billy gifford -- chief executive officer
yeah. let me see if i can unpack that a little bit, pamela, if i miss anything, please follow up. i think when you think about the cigarette volume declines that we saw to the first half, you look historically and when you see the environment, the macroeconomic environment changed for our consumer. you see that they make short-term adjustments and then they adopt to it through time.
i think, certainly through the first half, and we saw a little bit of a downshift in gas prices as we entered the third quarter, i think we've seen a correlation in gas prices just because our consumer is usually filling up their vehicle and then going in and making those purchases. but again, i think the research that we did is telling that the consumer is adjusting those behaviors to be able to prioritize their tobacco choices in the -- mostly in the c-store or gas stores. i think from a standpoint of pricing, and pamela, we've shared with you this before. if you look at minutes worked in the u.s.
and benchmark that around -- with other countries around the world that have mature tobacco categories. when you look at that, you still see that the u.s. is at the low end of that scale. so certainly, we feel like there's room to price, but that's something that we monitor.
you remember that the factors that we think about when pricing is the strength of the brand. certainly, corporate objectives play a part in that. but then we think about the economic health of the consumer and what those competitive activities do. and i think it's important to mention here again, the tools that we put in place.
we put out the price gap, we put out kind of national metrics. but with the advanced analytics, we're able to use those tools and be very specific. so it to be different in cleveland, ohio than in dallas/texas. because these tools allow us to adapt the retail promotions we put in the marketplace depending on what the individual consumers are feeling in that local area.
pam kaufman -- morgan stanley -- analyst
thanks. that's helpful. definitely, i just wanted to ask about how you're thinking about the implications to your relationship with philip morris in the heat-not-burn category, given their planned acquisition of swedish match? and how are you preparing for changes in the competitive in the u.s.?
billy gifford -- chief executive officer
well, pamela, you know this, as well as i do that it's always been a competitive marketplace. we always had major players. certainly, this brings a new major player to the marketplace, but we feel like we have the tools in place. so we're going to evaluate everything, make sure that we understand or at least game plan how, pam, i would approach, the marketplace using the products of swedish match and adapt accordingly.
i don't want to go much further than that for competitive reasons. i think from a standpoint of heat-not-burn, i shared in my remarks that we're continuing discussions with them about iqos.
pam kaufman -- morgan stanley -- analyst
thank you.
billy gifford -- chief executive officer
thank you.
operator
and we'll take our next question from azer vivien with cowen. please go ahead. your line is open.
vivien azer -- cowen and company -- analyst
hi. good morning. i wanted to touch on -- billy, so your commentary around the improved trial through the expanded helix manufacturing capacity was interesting. i was curious if you could just expand and touch on repeat and how you're measuring that, given the promotional and the category.
thank you.
billy gifford -- chief executive officer
yeah. vivien, it's a great question. i think when you think about on! our research teams are really looking repeat purchases versus a trial offers. and we want to have increases in both.
if you think about repeat purchases, we're very pleased with where we're at. certainly, to your point, as we're investing, you have those repeat purchases that take place and you want to see the concreteness of that. and we feel very pleased and enjoy the repeat purchases that we have. but we felt like there was still opportunity to drive awareness and you've seen the increase in awareness we've been able to drive.
and it's specific to the adult consumer that the product is product is very satisfying to the adult cigarette consumer, and we feel like there's still opportunity for trial there.
vivien azer -- cowen and company -- analyst
understood. thank you. and then my other question is just on the industry outlook. i know you guys have shied away from offering industry volume guidance for a while now, and i fully appreciate why.
but if we look at the supplemental disclosures, estimated industry volume declines have nearly doubled over the course of the last 12 months, against a very challenging macrobackdrop. and that does account for it in the table that you've disclosed. i'm just curious so, has your thinking around the underlying macrodrivers changed at all?
billy gifford -- chief executive officer
it has not, vivien. when you think about it -- and can take those quarters that we provide and stretch them back, and you thought -- and you saw macroeconomic was a benefit not that many quarters ago. so you certainly see the swing. it's no different than the swings we see through history.
you have the -- macroeconomic economic can be a benefit at times. we saw gas prices in 2015 were a huge benefit. and so i think the only thing i would point out is we're seeing a higher correlation with gas prices and purchasing behavior. that would be the only -- because historically, we tried to correlate gas prices to it.
and they were moving nickels and dimes at a time. i think you're seeing faster swings in gas prices so there's a correlation the consumer behavior as they adapt to the short-term nature of those changes.
vivien azer -- cowen and company -- analyst
understood. that's helpful. thank you so much.
billy gifford -- chief executive officer
thank you.
operator
and we'll take next question from bonnie herzog with goldman sachs. please go ahead. your line is open.
bonnie herzog -- goldman sachs -- analyst
all right. thank you. good morning, everyone. i just have a question on your guidance.
you maintained your full year mid-single digit eps growth guidance, but that does imply the second half eps growth will need to accelerate versus the first half to hit the midpoint of your full year guide? so i just want to hear from you, what gives you the confidence this is going to happen, especially during an economic slowdown. i mean are your expectations that this will be driven from greater net price realization, assuming volumes remain pretty pressured or decelerate further? are there any expected cost savings that you're hoping to realize in the second half that you could share with us? and then just finally, how do we think about stepped up investments that you might be making toward your smoke-free vision. is that something that's factored into your guidance?
sal mancuso -- chief financial officer
yeah. so bonnie, first, thank you for the question, and good morning.. i'll take you through how we think about guidance. so throughout the year, we have communicated that we expected the second half to really drive the growth of our eps on a year-over-year basis.
and just to remind you of a couple of factors that we are seeing in the back half of the year. one is, we begin to lap quarters where we had unconstrained manufacturing in the nicotine pouch category. also, in the fourth quarter we're, for the first time, going to be lapping a quarter without line income, right? that will happen in the fourth quarter. and then in the back half of the year, as inflation accelerated and we adjusted our msa inflation assumptions, you start to lap that in the back half of the year as well.
so there's some comparative factors that are part of the first half versus second half eps growth. as far as investments, spending isn't linear necessarily throughout the year, especially when you were making investments in infrastructure and things like that. so i definitely wouldn't look at one quarter spending when it comes to that and read into it. it is something that ebbs and flows throughout the year.
bonnie herzog -- goldman sachs -- analyst
all right. thank you. and then i did just want to ask about the -- i guess the uncertainty around your smoke-free future, given everything going on from juul to philip morris entering in the u.s. via swedish match, i guess, the dispute you have with philip morris as it relates to iqos.
this continues to be one of the key concern from investors. i know you've touched on this, but any more color you can provide or share with us as to your goal to kind of hit the smoke-free future or transform your business in the next, i guess, decade would be helpful. i mean i know with your agreement with juul now that the fair value is below the agreement, i think you have the ability to compete in the e-vapor market. so is that an option you're exploring? and then just maybe color -- a little more color on the timing as it relates to your heat-not-burn.
you mentioned it's in final design by the end of the year, and then you're going to begin regulatory preparations. but how long before you have a product that you can bring to the market, do you think? is that two years out, three years out? just trying to get a sense of some parameters as to how you're going to achieve your goal? thank you.
billy gifford -- chief executive officer
yeah. thanks for the question, bonnie. i think it's really important to step back, and i said it in my remarks, but let me add some color to it. the entire harm-reduction opportunity is in front of us in the u.s., and let me explain why i say that.
you remember in my remarks, i talked about the authorizations that have taken place in e-vapor thus far. and they represent 1% of the e-vapor category volume. so there's still 99% of authorizations that could go either way. and so that category will be in a bit of transition while we're waiting for the fda to make those authorizations, and then the outcome of those authorizations.
if you think about novel oral, yes, we're making progress and competitors are making progress, but we're still waiting for fda authorizations in that category. and so while we're making progress, there will be physicians from the fda regarding that category. and then heat-not-burn, while it's been gaining momentum internationally, it's nonexistent in the u.s. and so that's nonexistent.
so those are the three major growth categories. that's why i keep saying, i just wanted to add some color that the entire harm-reduction opportunity's in front of us. you're right to mention that we have development underway in two of those categories. we feel good about the pipeline.
i know you would love to see those products, and i would love to show them to you, and we will at the appropriate time. but we feel good about that. as i mentioned earlier, the co-development with the consumer in that space. i think with e-vapor, the color i would add there is -- and i mentioned it earlier, we've always monitored the marketplace to understand consumer satisfaction with the various products in the marketplace, both in the u.s.
and outside of the u.s. additionally, with this quarter with us going below, you're right, we have the option to get out of the noncompete. if we so elect to do so. and we really feel like in the process with the stay from the fda, and that decision's still looming, as well as the rights that i mentioned in my remarks, we believe are beneficial to us at this point in the process, but we'll continue to really gauge what our options are there and make decisions accordingly.
bonnie herzog -- goldman sachs -- analyst
all right. thank you.
billy gifford -- chief executive officer
thank you, bonnie.
operator
and we'll take our next question from priya ohri-gupta with barclays. please go ahead. your line is open.
unknown speaker
hi. this is [inaudible] on behalf of priya. and my question is, so based on your comments indicating that you plan to repay your upcoming maturity with available cash. how are you thinking about any subsequent need to access the market for refinancing? and i also have a follow-up after that.
sal mancuso -- chief financial officer
sure. and thank you for the question. i'm really not going to signal future capital allocation decisions. i'm happy to share how we think about capital allocation, which, of course, considers a number of factors in those decisions including marketplace dynamics.
we manage our balance sheet very carefully. we want to have a strong balance sheet. we want to continue to have investment-grade credit rating. so when we think about capital allocation, we take a balanced approach, and we've made the decision in august to use available cash to retire that debt, but future debt maturity towers, we'll analyze the marketplace at the time and make the appropriate decision.
unknown speaker
ok. that makes sense. thank you. and as a quick follow-up, where should we sort of expect you to manage your cash balance over the near term as this will likely bring it more in line with your prepandemic type ranges?
sal mancuso -- chief financial officer
yeah. look, we are very fortunate in that we have operating companies that generate a significant amount of growth in cash. in a typical year, after paying our dividend and making the necessary investments, we traditionally have had, let's call it $1 billion in excess cash. and at the time, we make various decisions.
there are times where we've gone to the board and ask for a share buyback program. there are times where we've done some liability management to manage our maturity towers going forward, and strengthen the balance sheet. and there are times where we've made some investments such as the investment we made for the poda technology recently. so that's how we think about cash going forward.
but again, our operating companies do a tremendous job of generating cash flow for the shareholder and other stakeholders.
unknown speaker
all right. thank you so much.
sal mancuso -- chief financial officer
sure.
operator
and our next question will come from gaurav jain with barclays. please go ahead. your line is open.
gaurav jain -- barclays -- analyst
billy, good morning, sal. a couple of questions from my side. so look, we have had some discussion around the harm-reduction opportunity in front of us, and how it is very early. but if we really look where harm-reduction is really developing, it is all international because it's very hard to introduce new products in the u.s.
market because of the pmta process. but do you think that really to explore the harm-reduction opportunity, you need to go international, much like philip morris is entering u.s.?
billy gifford -- chief executive officer
yeah. to your point, and i appreciate you recognizing that the pmta process and the entire harm-reduction opportunities in front of us in the u.s. it's something that we consider on a regular basis of how to get early consumer feedback outside of research in a live marketplace. and thus far, we've opted to go the route we are, which is with consumer research, but it's something that we consider on a regular basis.
gaurav jain -- barclays -- analyst
sure. and just also a follow-up on the questions around juul and potential end of exclusivity, and you also met -- referenced the synthetic nicotine market. and some of these companies have applied for pmtas, and can potentially get pmtas. so how do you think of synthetic nicotine as an ingredient? like is that a market you would like to explore? and if some of the companies get pmtas, that's an area you would like to enter?
billy gifford -- chief executive officer
yeah. certainly, we were pleased that with the support that took place, that synthetic nicotine is now under fda authority. we believe in the process as far as the fda being able to assess the science and evidence. again, we watch all products that are in the marketplace, both in the u.s.
and internationally, to understand how the consumer is interacting with them, what benefits they receive from them as far as satisfaction, enjoyment, the brand itself. and so it's something that stays on our radar.
gaurav jain -- barclays -- analyst
ok. thanks a lot.
operator
[operator instructions] we'll open it for the media. we'll go next to jennifer maloney with wall street journal. please go ahead. your line is open.
jennifer maloney -- wall street journal -- analyst
morning. i wanted to follow up on your statement, billy, that m&a is not off the table for reduced risk products. and i wanted to ask specifically about the e-vapor category. would you be open to the possibility of acquiring an e-cigarette brand, for example, that already has fda authorization?
billy gifford -- chief executive officer
yeah. while i don't speak to m&a in any regards. as i mentioned, look, we've always been monitoring the marketplace in the e-vapor space. we want to make sure we understand consumers' interactions with the various brands in the marketplace, whether they like those brands, whether they like the product -- satisfaction that those products give them.
now that we've written down this quarter below 10%, it affords us the opportunity to really explore those opportunities and make different decisions if we so choose. at this point in the process, we chose not to make any different decisions. we believe that where it's at in the process, as i mentioned earlier, with the fda today and relooking through the review process of the applications, as well as for -- some of our rights that we have as part of the agreement, we think those are beneficial. and we think, as we stated, the right decision currently is to stay under the non-compete.
jennifer maloney -- wall street journal -- analyst
for your smoke-free future goals, do you expect or plan to focus on one particular category, like is modern oral going to be the focus of your efforts there? or do you hope to play in all of the reduced-risk categories?
billy gifford -- chief executive officer
yeah. we highlight that we see three categories right now as the growth potential in the u.s. that's the heat-not-burn category, the e-vapor category and the novel oral. certainly, they will be shaped by regulatory decisions, federal legislative decisions on excise taxes and future innovation in those categories from the various manufacturers.
so that will shape how large they are, but we see those as the three potential growth areas, and we look to participate in those. i would remind you that's why we work with the portfolio approach because we see consumers going from cigarettes to those various categories, and we want to be there for the consumer, depending on what category they choose.
jennifer maloney -- wall street journal -- analyst
thanks.
billy gifford -- chief executive officer
thank you.
operator
and there appears to be no further questions at this time. i would like to turn the call back over to mac livingston, for any closing comments.
mac livingston -- vice president of investor relations
thanks, ashley, and thanks, everybody, for joining us. please contact the investor relations team if you have any further question. thanks a lot.
operator
[operator signoff]
duration: 0 minutes
call participants:
mac livingston -- vice president of investor relations
billy gifford -- chief executive officer
sal mancuso -- chief financial officer
chris growe -- stifel financial corp. -- analyst
pam kaufman -- morgan stanley -- analyst
vivien azer -- cowen and company -- analyst
bonnie herzog -- goldman sachs -- analyst
unknown speaker
gaurav jain -- barclays -- analyst
jennifer maloney -- wall street journal -- analyst
more mo analysis
all earnings call transcripts"
