q,ticker,dt,prep_remarks,QnA
2021-Q2,MO,2021-07-29 09:00:00,"prepared remarks:
operator
good day, and welcome to the altria group 2021 second earnings conference call. today's call is scheduled to last about one hour, including remarks by altria's management and a question-and-answer session. [operator instructions] representatives of the investment community and media on the call will be able to ask questions following the conclusion of the prepared remarks. i would now like to turn the call over to mac livingston, vice president of investor relations for altria client services.
please go ahead, sir.
mac livingston -- vice president of investor relations
thanks, christel. good morning, and thank you for joining us. this morning, billy gifford, altria's ceo; and sal mancuso, our cfo, will discuss altria's second-quarter and first-half business results. earlier today, we issued a press release providing our results.
the release, presentation and quarterly metrics are all available on our website at altria.com. during our call today, unless otherwise stated, we're comparing results to the same period in 2020. our remarks contain forward-looking and cautionary statements and projections of future results. please review the forward-looking and cautionary statements section at the end of today's earnings release for various factors that could cause actual results to differ materially from projections.
future dividend payments and share repurchases remain subject to the discretion of altria's board. altria reports its financial results in accordance with u.s. generally accepted accounting principles. today's call will contain various operating results on both a reported and adjusted basis.
adjusted results exclude special items that affect comparisons with reported results. descriptions of these non-gaap financial measures and reconciliations are included in today's earnings release and on our website at altria.com. finally, all references in today's remarks to tobacco consumers or consumers within a specific tobacco category or segment refer to existing adult tobacco consumers 21 years of age or older. with that, i'll turn the call over to billy. 
billy gifford -- chief executive officer
thanks, mac. good morning and thank you for joining us. altria delivered outstanding results in the second quarter, thanks to the continued strength of our tobacco businesses and the hard work of our highly talented employees. our teams have continued their commitment to moving beyond smoking by deepening their understanding of tobacco consumer preferences, expanding the awareness and availability of our smoke-free product portfolio and amplifying our voice on harm reduction within the scientific and public health communities.
their passion in pursuit of our vision gives me even greater confidence that we can responsibly lead the transition of adult smokers to a smoke-free future. let's now turn to our business results. altria grew its second-quarter adjusted diluted earnings per share of 12.8% to $1.23 primarily through the strength of our tobacco businesses. the smokeable products segment continued to deliver on its strategy of maximizing profitability in combustibles while appropriately balancing investments in marlboro with funding the growth of smoke-free products.
marlboro continued to lead the cigarette category while second-quarter adjusted operating company's income grew 11%. for the first half, the segment generated adjusted oci growth of 5.3%. in the oral tobacco products segment, copenhagen continued to lead the mst category and delivered strong profit performance. the oral tobacco products segment grew adjusted oci by 3.5% in the second quarter and by 3.3% for the first half as strength in mst more than offset investments in support of on! the oral nicotine pouch category continued to grow and helix remained focused on expanding capacity, broadening distribution and driving awareness and trial.
the team has successfully achieved unconstrained manufacturing capacity for the current u.s. market. and as the category grows, helix plans to further increase on capacity ahead of expected demand. additionally, helix and agdc broadened on! retail distribution to 105,000 retail stores, which represents approximately 80% of u.s.
oral tobacco volume and 70% of u.s. cigarette volume. in the second quarter, on! retail share of oral tobacco was 2 percentage points, up 0.03% sequentially. in a heightened competitive environment, we believe helix has made consistent progress against its 2021 goals, having achieved unconstrained manufacturing capacity, increased distribution and nearly doubling on retail share over the first half.
helix deploys a broad suite of marketing tools to continue to build on brand equity and transition smokers. at retail, helix uses disruptive point-of-sale and trial and awareness generating promotions. retail initiatives are complemented by one-to-one communications and digital marketing channels, which we believe provide a more immersive and educational on! experience. these communications are tailored based on consumer preferences and insights to better resonate with individual smokers and dippers.
turning to heated tobacco, pm usa expanded iqos and marlboro heatsticks to retail stores across georgia, virginia, north carolina and south carolina. this four-state expansion is helping pm usa garner key learnings about scaling new, innovative products. over two-thirds of u.s. cigarette volume is sold through the convenience store channel.
so we believe the ability to effectively educate smokers about the iqos system in c stores is critical to the long-term success of the product. although early, we're encouraged that nearly half of second-quarter iqos device sales came from convenience stores. this highlights the impact of our sales force and their strong relationships with key retail partners. in line with our strategy to build iqos in large metro markets, pm usa expanded iqos and marlboro heatsticks to northern virginia, its fourth metro market.
we believe our commercialization team continues to improve its execution as we move into new metro markets. in early northern virginia metro market results, device penetration as a percent of the smoker population has surpassed the performance of the atlanta and charlotte rollouts. we've discussed for some time the importance of bringing a strong commercialization package to smokers to help them on their journey. in the northern virginia market, we have deployed our full range of flexible marketing tools, such as kiosk, mobile units and experts.
we also opened an iqos boutique in the tysons corner mall, which is the center point for the area. we believe the favorable results in northern virginia reflect the strategic locations and enhanced execution within these marketing channels, the availability of the iqos 3 device and built up awareness from the richmond market. we previously stated the importance of responsibility and discipline in our iqos expansion approach. pm usa has been mindful of the pending international trade commission case, which may result in a ban on the importation of iqos and marlboro heatsticks into the united states.
due to this uncertainty, pm usa had delayed further expansion of iqos and marlboro heatsticks. each quarter, we make progress toward our vision. as we do so, we strengthen the capabilities that we believe are necessary to effectively transition smokers to our current and future innovative product portfolio. these capabilities include: a flexible manufacturing system, which allows us to quickly redeploy our highly skilled employees and existing footprint in support of smoke-free products; a robust consumer engagement system that includes enhanced data collection, a portfolio of a smoker engagement tools and our trade partner relationships; and strong regulatory capabilities, including the talent to develop compelling pmtas for smoke-free products; and the establishment of required post-market surveillance infrastructure.
tobacco harm reduction must be grounded in sound science, encouraged by reasonable regulation and executed responsibly. we believe it's critical to have transparent and constructive dialogue about the science and evidence supporting tobacco harm reduction with all stakeholders. so far this year, we published 10 articles and scientific journals, participated on four panels and presented 24 posters at scientific and policy conferences. unfortunately, not all stakeholders believe that industry participants should be part of these exchanges.
recently, a scientific organization decided to ban industry participation at its annual conference. we believe this is a mistake and that limiting the exchange of scientific research impedes tobacco harm reduction and hurt smokers looking for less harmful products. we will continue to advocate for open and inclusive dialogue among all stakeholders, which we believe is essential to addressing the significant public health opportunity in front of us. let's now turn to guidance.
with our strong financial performance in the first half, we've raised the lower end of our full-year 2021 adjusted diluted eps guidance to be in the range of $4.56 to $4.62. this range represents a growth rate of 4.5% to 6% from a $4.36 base in 2020. this updated guidance reflects continued confidence in our tobacco businesses, investment in smoke-free products and the expected impact of the recently announced agreement to sell our ste. michelle wine estates business.
i'll now turn it over to sal to provide more detail on the business environment and our results.
sal mancuso -- chief financial officer
thanks, billy. in the second quarter, the consumer behaviors we've observed over the past few quarters largely continued. although overall consumer mobility increased, workplace mobility appeared to be relatively unchanged, which we believe contributed to more tobacco usage occasions during the quarter as compared to prepandemic levels. additionally, disposable income remained elevated partially due to the residual effects of the third federal government stimulus package in march.
at retail, we estimate that compared to prepandemic levels, the number of tobacco consumer trips to the store continued to be depressed, but tobacco expenditures per trip remained elevated. we are keeping a close eye on tobacco consumer behaviors, and we will continue to provide our insights on the factors impacting those behaviors as the year progresses. moving to our businesses. the smokeable products segment expanded its adjusted oci margins by 0.6 percentage points to 58.4% for the second quarter and by 1.5 percentage points to 58% for the first half.
this performance was supported by pm usa's revenue growth management framework, which leverages advanced analytics to guide the strategic and efficient allocation of our promotional resources. as a result, pm usa achieved strong net price realization of 8.3% in the second quarter and 8.1% for the first half. smokeable segment reported domestic cigarette volumes increased by 1.4% in the second quarter. for the first half, reported domestic cigarette volumes declined by 5.3%.
when adjusted for calendar differences, trade inventory movements and other factors, second-quarter and first-half domestic cigarette volumes declined by an estimated 4.5% and 4%, respectively. at the industry level, we estimate that adjusted domestic cigarette volumes declined by 5% in the second quarter and by 4% in the first half. marlboro sustained a strong retail performance demonstrated in recent quarters and benefited from the overall strength of the premium segment in the second quarter. marlboro's second-quarter retail share of the total cigarette category was up one-tenth sequentially to 43.2% and up five-tenths versus the year-ago period.
in discount, total segment retail share in the second quarter increased one-tenth year over year but declined three-tenths sequentially to 25%. sequential share losses in both branded and deep discount products drove the contraction as consumers benefited from the federal government's third stimulus package and continued heightened promotional spending among competitive premium brands. we continue to observe some elevated promotional activity within the branded discount segment during the second quarter. and as a result, marlboro's price gap to the lowest effective price cigarette remained elevated at 37%.
in cigars, middleton continues to perform well and black & mild maintained its leadership position within the profitable tipped cigar segment. reported cigar shipment volume increased by 9.6% in the first half. turning to the oral tobacco products segment. segment adjusted oci margins decreased to 71.7% for the second quarter and to 71.9% for the first half.
we expect oral tobacco products margins to be impacted by increased investments behind on! and shifting mix between mst and oral nicotine pouches. we remain extremely pleased with the strong overall margins for the segment. total reported oral tobacco products segment volume increased by 1.8% and by 1.2% for the second quarter and first half, respectively. the segment's volume growth was driven by on!, which more than offset a moderate decline in mst volumes.
when adjusted for trade inventory movements and calendar differences, segment volume increased by an estimated 1% for the second quarter and 0.5% for the first half. oral tobacco products segment retail share for the second quarter declined 2.2 percentage points versus the prior year and three-tenths sequentially to 47.8% due to the continued growth of the oral nicotine pouch category. as billy stated, copenhagen maintained its leadership position in the mst category. and we continue to work diligently to execute our plans to transition smokers to on! in e-vapor, total estimated volumes in the second quarter increased 15% versus a year ago and 2% sequentially as a result of heightened competitive activity.
the category continues to undergo a transition period as fda prepares to make market determinations on the millions of pmtas filed by the september 2020 statutory deadline. we continue to believe that e-vapor products can play an important role in tobacco harm reduction and that a sustainable e-vapor category will be one that consists solely of fda-authorized products. we expect the category's long-term trajectory to be determined by regulatory decisions, legislative and tax policy and innovation that best addresses smoker and vapor preferences. in alcohol, we recorded $113 million of pre-tax adjusted equity earnings from abi in the second quarter.
this was an increase of approximately 15% from the year-ago period and represents altria's share of abi's first-quarter 2021 results. in wine, ste. michelle's second-quarter adjusted oci increased approximately 80% to $27 million. ste.
michelle's adjusted oci growth was primarily due to higher volumes, including from the flagship chateau ste. michelle brand and luxury brand stag's leap, as wine consumer preferences trended to more premium products. three weeks ago, we announced the definitive agreement to sell our ste. michelle wine estates business in an all-cash transaction for a purchase price of approximately $1.2 billion and the assumption of certain ste.
michelle liabilities. we expect the transaction to close in the second half of this year, and we expect to use the net proceeds for additional share repurchases, subject to approval by our board. we believe this transaction demonstrates altria's continued commitment to value creation for shareholders and to our vision as it allows our management team to maintain its focus on responsibly transitioning adult smokers to a smoke-free future. ste.
michelle and its talented employees have built an outstanding portfolio of premium wine brands, and we wish them future success. and in our all other operating category, we continue to make progress on our wind-down of philip morris capital corporation. as of june 30, the net finance assets balance was $261 million, down $59 million since the end of last year due to rents received and asset sales in the first and second quarters. we expect to continue reducing this balance in 2021 and expect to complete the pmcc wind-down by the end of 2022.
turning to our equity investment in cronos. we recorded a pre-tax loss of $21 million, representing altria's share of cronos' first-quarter results. in the second quarter, cronos announced that it had purchased an option to acquire an ownership stake in pharmacann of approximately 10.5% on a fully diluted basis. pharmacann is one of the largest vertically integrated cannabis companies in the united states.
the option exercise will be based upon various factors, including the status of u.s. federal cannabis legalization and regulatory approvals. in our -- in support of our investment in cronos, we continue to advocate for a federally legal, regulated and responsible u.s. cannabis market.
and we're encouraged by the current momentum toward federal legalization. next, let's discuss capital allocation. the highly cash-generative nature of our tobacco businesses continues -- contributes to our strong balance sheet. we believe this, in turn, allows us to invest in our vision while rewarding shareholders with cash returns.
we were active in the capital markets during the second quarter as we repaid $1.5 billion of notes upon maturity, paid approximately $1.6 billion in dividends and repurchased 6.6 million shares totaling $325 million. we have $1.35 billion remaining under the current authorized $2 billion share repurchase program, which we expect to complete by june 30, 2022. because the current program is limited to $2 billion, additional share buybacks in connection with the sale of ste. michelle are subject to board approval.
moving to corporate responsibility. we disclosed several updates in the esg section of our release this morning. these updates included following through on our commitment to transparency around altria's workforce data and publishing our esg data tables and a report on value chain responsibility. as a reminder, additional corporate responsibility information can be found on altria.com.
with that, we'll wrap up, and billy and i will be happy to take your questions. while the calls are being compiled, i'll remind you that today's earnings release and our non-gaap reconciliations are available on altria.com. we've also posted our usual quarterly metrics, which include pricing, inventory and other items. let's open the question-and-answer period.
operator, do we have any questions?
",":
operator
thank you. [operator instructions] we will take questions from the investment community first. our first question comes from the line of pamela kaufman with morgan stanley.
pamela kaufman -- morgan stanley -- analyst
hi. good morning.
billy gifford -- chief executive officer
good morning, pamela.
pamela kaufman -- morgan stanley -- analyst
so i wanted to ask about your plans to delay iqos expansion in the u.s. until you have more clarity from the itc. i guess what are -- it's understandable that you would delay expanding it once you -- until you have more visibility. but i guess i wanted to understand what your plans are in existing markets because it seems like you're still operating as usual there.
and then can you give more detail on what your options will be if there's ultimately an adverse decision from the itc?
billy gifford -- chief executive officer
yeah. thanks for the question, pamela. yeah, i want you to interpret the delay correctly. so the expansion markets that we are in.
so the four states, the existing markets, including northern virginia, we're staying in, and we'll complete the state expansions. it was just beyond that where we had previously announced by the end of the year, we'd be in geographies representing 25% of cigarette volume. we wanted to let you guys know and our investors know that we're delaying that until we get some certainty around that. as far as plans if it should ultimately go against us, and you know the process, i'm sure you're well aware of the process that we will step through related to the actual case.
but we're working closely with pmi on contingency plans. i think it's a bit too early to share the details of what those contingency plans are or could be. and so we'll share those when it's appropriate.
pamela kaufman -- morgan stanley -- analyst
great. thank you.
billy gifford -- chief executive officer
thank you.
pamela kaufman -- morgan stanley -- analyst
and then i wanted to ask about how you're thinking about industry growth in the second half of the year and kind of discuss the puts and takes that might influence the category relative to the performance in the first half. and in relation to that, we're seeing an inflationary pricing environment with companies across the cpg space intending on raising prices. i guess what are the implications for cigarette volumes as you think about price elasticity relative to other categories? and separately, does that, in any way, influence the ability to raise cigarette prices when you see higher prices elsewhere?
billy gifford -- chief executive officer
yeah. there was a lot in that question, pamela, so i'll try to dissect it and make sure i get all the pieces. i think when you think about -- and i refer to cigarette volume, i know you said industry volume, so i'm assuming that's what you're talking about. i mean i appreciate the fact that you recognize that we had a strong first half.
i think when you think about the puts and takes or the headwinds, tailwinds, and these could go either way. i think the major factors that we're going to be watching for impact to volume are really the stay-at-home practices of our consumer. do they decide that -- are they required by their employee to go back to the work site or do they still have stay-at-home practices? i think you've seen various news on unemployment rates and any associated stimulus. how does that play out for the remainder of the year? i think it's important to keep an eye across category movement.
we know that the fda has a lot of applications in front of them for pmtas. so we'll see what their decisions are and how they could impact it. but most importantly, it's the consumer purchasing behavior. as you know, we believe they're adding nicotine occasions to their day.
and so how do they think about that in this, whether it's a resurgent or vaccination rates or how the vaccine gets rolled out, how does that impact consumer purchasing behavior? your question related to pricing is -- and first, i'll talk about the input side. as far as -- we really haven't seen any material inflation impact the input side of our business. as far as decisions that we take into consideration when we make pricing decisions, it's really the economic health of our consumer. how are they feeling? right now, they still have elevated discretionary income.
it's the brand strength, and you can see marlboro's been performing extremely well, and we are very pleased with its -- the strength of that brand. and i think last and utmost is company objectives and how are we thinking about investing in our innovative product portfolios and expanding that. and we mentioned some of the investment areas earlier. so those are really the factors that go into our pricing decisions.
pamela kaufman -- morgan stanley -- analyst
great. thank you.
billy gifford -- chief executive officer
thank you.
operator
your next question comes from the line of bonnie herzog with goldman sachs.
bonnie herzog -- goldman sachs -- analyst
thank you. good morning.
billy gifford -- chief executive officer
good morning, bonnie.
bonnie herzog -- goldman sachs -- analyst
hi, billy. i actually wanted to circle back on the decision to delay the expansion of iqos and maybe come at it from a different angle. i guess, first, i assume your plan stepped up spending this year will also be lowered. if so, i guess i'm surprised you weren't able to take up the high end of your eps growth guidance range this year.
so could you maybe touch on that? and then finally, i'd like to understand how you think the delay in rolling out iqos might impact your ability to deliver and execute on your 10-year vision to accelerate the transition of smokers to a noncombustible future.
billy gifford -- chief executive officer
yeah, bonnie. so let's deal with the guidance first. as we say all along, we run a range of scenarios when we established guidance at the beginning of the year. it's no different as we progress through the year, we run a range of scenarios.
so as far as any individual category, there are always puts and takes. and so that's all incorporated in our guidance. as far as the delay, i want -- just to be clear on the delay and your question about the 10-year vision. i think when you think about the 10-year vision, it's important to step back and remember it's 10 years out.
and so that's a long time. if you just take in -- where we are today and look back 10 years, whether you think about the industry or altria itself, there's been significant change in 10 years. and so we thought it prudent to finish the expansions we were in the midst of, but to delay those and knowing that we have 10 years, and we know the consumer wants to move and we want to have the products that they want to move to. and so certainly, there could be bumps in the road, but we think we have a great plan and feel confident about achieving our 10-year vision.
bonnie herzog -- goldman sachs -- analyst
ok. that's helpful and all fair. but just thinking about what you just mentioned and thinking about the beginning of the year, there -- as we look forward this year, there was going to be a level of stepped-up spending to kind of pivot your business. and how do we reconcile that now? i mean i guess i'd just like to understand that.
should i assume that the planned spending has been pulled back this year as you've delayed the rollout of iqos? or are you still continuing to spend aggressively behind it, and just based [inaudible] markets?
billy gifford -- chief executive officer
i -- sorry, bonnie, i didn't mean to cut you off. yeah. so when you think about it, i appreciate the fact that you are recognizing that we can be agile in our investments. we run a range of scenarios.
we're prepared for what takes place in any of our categories to be able to adjust and redeploy. and so we feel good about it. yeah, certainly, there was a level of investment in our base plan, but we run a range of scenarios around that base plan at the beginning of the year so that we're able to adjust. we have areas of the business we've mentioned previously that we were investing in.
and so we feel very good about the guidance we provided today and being able to bring up the bottom end of that guidance with more certainty.
bonnie herzog -- goldman sachs -- analyst
ok. that makes sense. and then just wanted to clarify something else on iqos. i know you have this agreement, of course, with philip morris and you shared some of those details.
i think it was actually a year ago. so i'm curious, can you share with us if you've reached 50 bps of dollar share in any of the markets where iqos is sold, which was defined in the agreement with pm? and the reason i'm asking, because i think that was one of the areas that you needed to maintain or to get to, to maintain your exclusive distribution agreement for iqos.
billy gifford -- chief executive officer
yes, bonnie. the answer is yes. we believe we have achieved it related to the exclusivity. we've shared that data with pmi, and that's why you saw us moving to other expansion areas.
bonnie herzog -- goldman sachs -- analyst
perfect. and then final question, if i may, just on switching gears to oral tobacco. just any color you could share with us on your strategy with promos in your oral tobacco business. i'm asking as i look at your price realization, which has stepped down, i guess, a fair amount.
so i'm wondering how big of a concern this could be in terms of sustaining any future top-line growth for this business. in other words, i guess i'm wondering, are you finding that you need to promote more than anticipated to possibly drive any volume growth and/or trial? thanks.
billy gifford -- chief executive officer
yeah. it's a great question, bonnie. i think when you think about our approach in novel oral, we have been behind a manufacturing capacity constraints and we've been somewhat limited. now that that's behind us and we'll keep it behind us as best we can, it allows us to turn our marketing and brand colleagues loose, and they can really be disruptive in the marketplace to disrupt the consumer as they're making their purchasing decisions.
they can fully engage with consumers with one-to-one in digital channels. and so we look forward to being able to turn them loose, which they are now, and have them disrupting the marketplace. i think whenever you think about a new category, you have to think about there is going to be competitive activity, and we've seen it in this space. and so you're going to want to dislodge those consumers.
but at some point in time, that typically settles down, even if you take it outside of tobacco. and so we feel very good about being able to achieve tobacco-like margins in the future. right now, we're focused on consumer engagement and making them aware of our on! product in the marketplace.
bonnie herzog -- goldman sachs -- analyst
ok. thank you so much for that.
billy gifford -- chief executive officer
thank you.
operator
your next question comes from the line of vivien azer with cowen.
vivien azer -- cowen and company -- analyst
hi. good morning.
billy gifford -- chief executive officer
good morning, vivien.
vivien azer -- cowen and company -- analyst
so just one last housekeeping item on iqos. sorry to belabor the issue, but can you give us a sense of the anticipated timing of any kind of decision from the itc, please?
billy gifford -- chief executive officer
yeah. so when you think about the itc -- just to level set on where we're at in that process. so you think about that in may, we had the administrative law judge found in favor of the two of the plaintiff's patent challenges. and so they recommended that the administrative law judge recommended the importation for ban on the iqos system.
but you saw earlier this week that the itc accepted review of the alj findings and recommendations on certain issues, and that included the patent infringement claims and the scope of remedies, and they will review the benefit to public health. and so it's a bit different with the itc. if you think about the factors around iqos, it's the only inhalable, smoke-free product authorized by the fda. and in authorizing iqos, the fda found that the product would benefit the public health.
and so we would expect to have a final itc decision in september or october. and then you remember the process after is it can be -- it goes to presidential review and that can take up to a period of 60 days after the itc decision is final. and then any decision from the itc can be appealed in the u.s. court of appeals for the federal circuit.
and so that will be the process that plays out depending on how things progress.
vivien azer -- cowen and company -- analyst
that's really helpful. thank you for that. moving on to your smokeable segment. you called out heightened competitive activity as being a contributor to the expanding marlboro price gap.
seemingly, you should be fine with that given that marlboro gained year-over-year share. but how are you thinking about kind of the durability of that to the extent that you see heightened competitive activity persist given that you do have some incremental resources at your disposal with pared back investments on iqos? would you be willing to reinvest?
billy gifford -- chief executive officer
yeah. we think of those decisions somewhat independently, vivien. but as far as your question specifically to smokeable and marlboro specifically, we're greatly pleased with the performance we've seen in marlboro over the last four to five quarters. and when you look at the price realization that was realized in the smokeable segment and then you look at the performance of marlboro in that segment, we're very pleased with where we're at.
and so it's something, to your point, we always monitor, but we feel good about how the strategy is playing out thus far.
vivien azer -- cowen and company -- analyst
perfect. thanks very much.
billy gifford -- chief executive officer
thank you.
operator
your next question comes from the line of chris growe with stifel.
chris growe -- stifel financial corp. -- analyst
hi. good morning.
billy gifford -- chief executive officer
good morning, chris.
chris growe -- stifel financial corp. -- analyst
good morning. i just had a question for you, just a very quick one on inventory, and it was a positive this quarter. and i know you don't like to talk about kind of future inventory moves. but as you just -- if you could characterize where inventories are this quarter and any -- how that would -- you believe that that sets in relation to where inventories have been historically?
billy gifford -- chief executive officer
yeah. i think it's a great question, chris. and when you look at where we're at the end of the second quarter and you look back through history, maybe it's slightly elevated for the second quarter, but it's certainly not elevated to positions we've seen wholesalers carry. it -- with the pandemic and the way it's evolved up and down, we've seen it bounce around a lot.
you'll remember through time, we typically see it level out. but certainly, the pandemic has had it bounce around a bit more than what is typical.
chris growe -- stifel financial corp. -- analyst
and i missed it bouncing around -- during the pandemic, inventory rates have been higher overall. is that fair to say than where you would expect them to be?
billy gifford -- chief executive officer
i would say maybe slightly higher. i wouldn't call it out as something significant, but maybe slightly higher. i think also, wholesalers in the beginning of the pandemic, as well as retailers maybe got caught short a bit on inventory because they were nervous about what the pandemic was going to do to them. i think they saw consumers, as sal mentioned in his remarks, making larger purchases.
so i think they're taking a position to have a bit more inventory just to meet consumer demand.
chris growe -- stifel financial corp. -- analyst
ok. and i had a second question just thinking on what your thought there. it couldn't be any more questions on iqos. i had one more.
and that just was to understand, there were a couple of markets, especially the earlier markets like atlanta and i think you said north carolina, where sequential share was down a little bit. you talked about moving resources to northern virginia. i just want to understand that concept. meaning that in this early stage, i would expected -- have expected more overall dollars being committed and therefore, not just moving resources around.
but i want to understand kind of how you looked at that and then how you redeployed resources in northern virginia from some of those initial markets.
billy gifford -- chief executive officer
yeah. i appreciate the question, chris. and let me take a couple of things that went into that consideration. i think first and foremost, you remember, we had flexible marketing tools at our disposal, whether you consider it kiosks or mobile units.
and so you move those from launch market to launch market. i think the other thing that's important to remember is we've always said we wanted to put our best commercialization foot forward. and as we got through to charlotte, remember when we first launched charlotte, we had the 2.4 device that did not have an mrtp authorization nor did we have authorization on 3.0. and so as you move into a market, you're going to put your best foot forward, we feel like that is the right package.
and i think you've seen the results from the learnings, as well as those -- both version three and the mrtp authorization in northern virginia. and so it doesn't mean we won't go back and relaunch in some of those markets with those added benefits to the consumer and consumer engagement, but we thought it was prudent to move that. and then the last note is as you move from densely populated areas to a fully expanded across the state, you evolve your commercialization practice. and we know to launch across the total u.s., we're going to have to have that c-store experience.
and so it's perfecting that. and we feel good about -- as you saw in the -- you heard in the remarks, the amount of device sales that we had through the c-store channel. if you step back and just look in the second quarter, volume -- consumer takeaway overall volume was up 40%. and so i would consider that a great achievement.
chris growe -- stifel financial corp. -- analyst
yeah. so really, in that regard, billy, the most recent market, at least in this case, where you stand today, is the best representation of your selling model and we don't need to necessarily look back at other markets because of this -- you're kind of changing as you move into these new markets. is that fair to say?
billy gifford -- chief executive officer
i think that's fair to say. i don't know if i would characterize it as -- certainly, we feel like that's the best commercialization package we've had to date. i think it's too early to read and to say, ok, this is exactly what we're going to do as we go forward. we're going to continue to get learnings and evolve.
but yes, the best commercialization package we've had to date is that we put in northern virginia.
chris growe -- stifel financial corp. -- analyst
ok. and i did have one other quick follow-up, which is on! in oral tobacco. and just to think there -- at what point -- i think you've talked about before getting -- being -- having on! available in more stores that sell oral tobacco products being whether it's 90% or 100%. so should we expect that to just to kind of continue to kind of build through the second half of the year now that you're unconstrained on manufacturing capacity?
billy gifford -- chief executive officer
yeah. i think right now, you can consider us focused on really disrupting the consumer and making them aware of the qualities of on! in the marketplace, engaging with them through the one on one in digital channels. we feel good about where we're at, but we always assess the amount of stores we're in, and you'll see adjustments through time.
chris growe -- stifel financial corp. -- analyst
ok. thanks so much for your time.
billy gifford -- chief executive officer
thank you.
operator
your next question comes from the line of gaurav jain with barclays.
gaurav jain -- barclays investment bank -- analyst
hi. good morning, billy.
billy gifford -- chief executive officer
good morning.
gaurav jain -- barclays investment bank -- analyst
hi. so i have a couple of questions. so one is on the cigarette industry volume decomposition -- the table which is in your quarterly metrics. so the additional cost category movement is only minus 0.3% over the last 12 months.
and we know that oral nicotine pouches have gained about 1 percentage point of share. and then based on the data you have on slide 23 of your presentation, it seems e-cigarettes have also gained 1 percentage point of share. so that would imply that the cross-category movement has like -- it has significantly reduced versus what we saw in 2018, 2019. is that a correct way of looking at this data?
billy gifford -- chief executive officer
yeah. that is correct, gaurav. when you think about it, remember, in secular decline, to your point, about 1% was cross category. and then anything above that 1% outside of secular decline of that cross category is what we call out in that decomp.
and so you can see in the chart that as of 6/30/21, on a 12 months ended, it was 0.3% above that. and so that is really what is the impact to the cigarette industry from cross-category movement and it includes novel oral, it includes e-vapor. i think when you think about e-vapor, if i understand the gist of your question, really what's going to impact how e-vapor progresses in the u.s., and we believe it can play a significant role in harm reduction, is really three things. it's regulatory decisions.
and you'll recall, all of the products are with the fda for their review. it's the legislative and tax policy, how will excise taxes evolve in that space. and to sal's earlier remarks, innovation, how will companies think about innovating in the future and applying for authorization from the fda. so those will be the three major factors that play.
but yes, it is less than what we experienced in 2019.
gaurav jain -- barclays investment bank -- analyst
but then i guess that leads to the question that is it leading to additional consumption in nicotine and are there additional consumers coming in and where are these consumers coming from, which leads to a lot of other questions as well. so [inaudible].
billy gifford -- chief executive officer
yeah. i think when you look at the factors underneath, whether you think about total -- the total nicotine space, and you've seen us before volume equivalized and stacked that up, historically, if you look over the past five years, down about 1%. so that would say overall consumption is still coming down, not increasing. certainly, during the pandemic, and we've highlighted to you guys and investors is that we saw consumers add nicotine occasions to their day, which we believe was stay-at-home practices and some of those factors.
and so certainly, there has been some short-term nicotine occasions added to the day. but overall, total volume when you stack up nicotine on an equivalent volume basis has still been declining.
gaurav jain -- barclays investment bank -- analyst
sure. and if i could ask one quick follow-up on pricing. so your key competitor is clearly pricing quite aggressively right now, which is helping you and everybody else. and your pricing realization is also quite strong, not as much as your key competitor.
but i would have thought that you will be taking this benefit and investing more on the discount side of your business and stabilizing some of the volume share losses there. so could you just help us understand how you're thinking on the discount side of things?
billy gifford -- chief executive officer
yeah. and i appreciate the question. i think when you step back and think about the strategy we deploy in that category, it's to maximize profitability through time while balancing investments in marlboro and funding the future growth categories. and so that's what guides us.
as far as competitive pricing and worries about what they took or who went first, those are not the factors. i really gave the factors earlier to pamela. it's economic health of our consumer, its brand strength and company objectives. and so that's the way we think about our pricing decisions in the marketplace.
competitive actions don't factor into that. i think when you think about our pricing and look, i would say eight point -- over 8% both in the quarter and for the first half is pretty nice based on the results we've seen across the entire company here. we're pleased with that. remember, we have two factors that come into our price realization.
one is list price, which you're referring to. the other is as we implement -- and some people refer to it as revenue growth management, it's how do we become more efficient with the retail promotional dollars we have in the marketplace. and so i think you see those two factors play into our price realization.
gaurav jain -- barclays investment bank -- analyst
well, thanks a lot, billy.
billy gifford -- chief executive officer
thank you.
operator
your next question comes from the line of michael lavery with piper sandler.
michael lavery -- piper sandler -- analyst
thank you. good morning.
billy gifford -- chief executive officer
good morning, michael.
michael lavery -- piper sandler -- analyst
so i actually still have an iqos question, too. can you just start by confirming for the itc decision, would that apply to the device only? and then related to that, if it does, is there any potential for production in the u.s.? or is that just really not -- is there not the ecosystem for that because it would be just an import ban, correct?
billy gifford -- chief executive officer
that is correct. the itc deals with importation of products. and so you're correct in that assessment. as far as -- if you read the details around the administrative law judge's decision, they made decisions on both the device and heatsticks.
and so it would apply to both. as far as contingency plans, michael, as i stated earlier, it's a bit too early to get into the details of the contingency plans, and we'll be sure to come back to you as those are ready to be unveiled.
michael lavery -- piper sandler -- analyst
ok. sure. and just on the device sales in c-store, obviously, just a huge jump this quarter. can you just give a sense of some of the drivers there? because i know for the other two quarters, they were available at least on a limited basis or at least in some areas.
what's -- it's the kind of device you don't really impulse buy most likely and it's a high price point, at least in isolation. is there -- is it driven primarily by digital engagement that sends the consumer in? is it direct mail, paper mail? or how do you really see this boost taking shape?
billy gifford -- chief executive officer
yeah. it's a great question, michael, and it's something that we are very proud about. i think it speaks to the strength of our agdc, our sales force and the relationships they build at retail. so when you think about it, it includes those other channels, one-to-one, digital, regular paper mail, it includes all of those.
our team is doing a great job of engaging with the adult smoker. but i think when you think about what agdc has been able to do is really look at our retailers think about how to display the product at retail. to your point, our consumers are more of a 10- to 15-second decision. how do you disrupt them at retail where they're making that purchase decision and really give them the guided trial.
for instance, they built relationships with retail clerks that were smokers previously and walked them through this transition from smoking cigarettes to using the heated tobacco product. and so i think when you think about that, now you have the retail clerk can speak from personal experience to smokers to also disrupt their purchasing decisions. and so it's really still about the guided trial. it is about engagement through those channels, but it's disrupting them right at the point of purchase.
michael lavery -- piper sandler -- analyst
ok. they're really interesting. thanks. and just one more on on! can you give a sense of usage rates? and specifically, what i'm curious about is how much a smoker who switches maintains a similar usage rate? does it go up or down? and i assume, obviously, there's people who completely switch and some dual usage and sort of a progression there.
but do you have a sense of some of the consumer dynamics around that?
billy gifford -- chief executive officer
it's certainly something that we're monitoring and we're trying to monitor it as close as we can on an individual-by-individual basis. because to your point, people are at different places in their journey. and so i think it's too early to get into here is exactly the usage rate of somebody that comes from cigarette versus somebody that comes from dipping, but it's certainly something we're tracking and understanding because you've got to meet the consumer where they're at in their journey and help them to continue that transition over. and so again, i completely understand your question, but i think it's just too early to get into the details.
michael lavery -- piper sandler -- analyst
ok. great. thanks so much.
billy gifford -- chief executive officer
thank you.
operator
thank you. and your last question comes from the line of priya ohri-gupta with barclays.
tiffany au -- barclays -- analyst
hi, this is tiffany au for priya. thanks for taking our questions. we're wondering, given the recent movement in the rate backdrop, how are you thinking about the opportunities to practically address and refinance some of your maturities over the next two to three years?
sal mancuso -- chief financial officer
i'm sorry, i missed the end of that question. could you repeat it? i apologize.
tiffany au -- barclays -- analyst
definitely, yes. given the recent movement in the rate backdrop, how are you guys thinking about opportunities to proactively address and refinance some of your maturities over the next two to three years?
billy gifford -- chief executive officer
yeah. i think -- i was able to hear it. i think when you think about it, we're going to assess those market conditions. we're certainly not going to give guidance exactly what we're going to do with any maturities.
but we look at the market conditions when we see maturities. and sal would tell you that with our cash-generative businesses, it gives us flexibility when we have maturities upcoming based on what the market conditions are and how we would assess those.
tiffany au -- barclays -- analyst
thank you.
sal mancuso -- chief financial officer
yeah. i agree with billy and i would point out that we have taken a very balanced approach to capital allocation when you look at 2021, including we did execute an opportunistic liability management transaction earlier in the year that allowed us to extend maturities on low-interest debt while managing our maturity towers.
tiffany au -- barclays -- analyst
thank you very much.
billy gifford -- chief executive officer
thank you.
operator
at this time, i would like to turn the call back to mac livingston for closing comments.
mac livingston -- vice president of investor relations
thank you all for joining us. please contact the investor relations team if you have further questions. have a great day.
operator
[operator signoff]
duration: 55 minutes
call participants:
mac livingston -- vice president of investor relations
billy gifford -- chief executive officer
sal mancuso -- chief financial officer
pamela kaufman -- morgan stanley -- analyst
bonnie herzog -- goldman sachs -- analyst
vivien azer -- cowen and company -- analyst
chris growe -- stifel financial corp. -- analyst
gaurav jain -- barclays investment bank -- analyst
michael lavery -- piper sandler -- analyst
tiffany au -- barclays -- analyst
more mo analysis
all earnings call transcripts"
