q,ticker,dt,prep_remarks,QnA
2021-Q4,MO,2022-01-27 09:00:00,"prepared remarks:
operator
good day, and welcome to the altria group 2021 fourth quarter earnings conference call. today's call is scheduled to last about one hour, including remarks by altria's management and a question-and-answer session. representatives of the investment community and media on the call will be able to ask questions following the conclusion of the prepared remarks. i would now like to turn the call over to mac livingston, vice president of investor relations for altria client services.
please go ahead, sir.
mac livingston -- vice president of investor relations
thanks, leo. good morning and thank you for joining us. this morning, billy gifford, altria's ceo; and sal mancuso, our cfo, will discuss altria's fourth quarter and full year business results. earlier today, we issued a press release providing our results.
the release, presentation, quarterly metrics and our latest corporate responsibility reports are all available at altria.com. during our call today, unless otherwise stated, we're comparing results to the same period in 2020. our remarks contain forward-looking and cautionary statements and projections of future results. please review the forward-looking and cautionary statements section at the end of today's earnings release for various factors that could cause actual results to differ materially from projections.
future dividend payments and share repurchases remain subject to the discretion of altria's board. altria reports its financial results in accordance with u.s. generally accepted accounting principles. today's call will contain various operating results on both a reported and adjusted basis.
adjusted results exclude special items that affect comparisons with reported results. descriptions of these non-gaap financial measures and reconciliations are included in today's earnings release and on our website at altria.com. finally, all references in today's remarks to tobacco consumers or consumers within a specific tobacco category or segment refer to existing adult tobacco consumers 21 years of age or older. with that, i'll turn the call over to billy. 
billy gifford -- chief executive officer
thanks, mac. good morning and thank you for joining us. altria delivered outstanding results in 2021 across our businesses, including strong financial performance, progress toward our vision and advancements in our esg efforts. this morning, we'll highlight our accomplishment in each of these areas.
first, altria grew its 2021 adjusted diluted earnings per share by 5.7% driven in part by the resiliency of our cigarette, cigar and moist smokeless tobacco businesses. additionally, we returned more than $8.1 billion in cash to shareholders through dividends and share repurchases. this total represents the third largest single year cash return in altria's history and the largest annual return since 2002. we have continued to make progress toward our vision of responsibly leading the transition of adult smokers to a smoke-free future.
our teams took several steps forward in 2021, including accelerating the retail share growth of on! and further enhancing the capabilities to expand heated tobacco and other new u.s. tobacco products. advancing the science, research and development behind our smoke-free products, advocating for tobacco harm reduction by encouraging the fda and other stakeholders to address the widely held nicotine misperceptions in society and we made excellent strides in establishing a best-in-class consumer engagement system to support smoker transition to smoke-free products. our system leverages robust transactional data and our advanced analytic capabilities to engage with consumers at the point of purchase.
finally, some of our achievements across our responsibility focus areas,included publishing six corporate responsibility reports, summarizing our progress in critical areas, such as harm reduction and underage prevention and publishing our inaugural task force on climate-related financial disclosures report. we were recognized for the second consecutive year with a aa rating from cdp for climate and water stewardship. and we advanced our internal talent and cultural goals, embraced workplace flexibility and embedded inclusion and diversity considerations within our performance review process to hold our leaders accountable. we're excited to share more about our responsibility efforts and our consumer engagement system next month at cagny.
2021 was a dynamic year for the u.s. tobacco industry and total industry volumes were influenced by several factors, including pandemic-induced shifts in consumer purchasing behavior and tobacco usage occasions, a continued trend toward smoke-free alternatives and an evolving regulatory and legislative landscape. despite year-over-year volatility due to pandemic-related factors, total tobacco volume trends remained stable. in fact, we estimate that overall tobacco space volumes have decreased by 0.3% annualized for the past two years and by 0.8% over the last five years on a compounded annual basis.
diving deeper, total estimated equivalized volumes for smoke-free products in the u.s. grew to 3.8 billion equivalized units in 2021 and represented approximately 24% of the total tobacco space. we estimate the year-over-year increases in smoke-free volumes were driven by the e-vapor category, which result -- resumed its growth after a temporary pause in 2020 and on! nicotine pouches, which continue to grow rapidly from a small base. 2021 smoke-free volumes also benefited from the geographic expansion of iqos in the heated tobacco category, but we're pressured by modest declines in the mst category due to shifts in consumer purchasing behavior and movement to other smoke-free categories.
and in combustibles, volume declined to approximately 11.8 billion equivalized units driven by several factors, which sal will discuss later in his remarks. turning to our smoke-free product portfolio. we're excited by the exceptional performance of on! and on! nicotine pouches. on! retail share of oral tobacco increased by nearly a full share point sequentially, reaching 3.9 share points for the fourth quarter and nearly doubling its share over the past six months.
these strong results were primarily driven by an increase in multi can purchases. as of the end of the year, on! was available for sale in approximately 117,000 u.s. retail stores. the on! nicotine pouch category reached a total oral tobacco retail share of 17.9 percentage points in the fourth quarter, growing 7.4 share points year over year.
we're encouraged that on! represented more than one-third of this growth and the brand is proving to be a highly competitive product in the space. our premarket tobacco applications for the entire on! portfolio remained pending with the fda and we believe that the fda should determine that the marketing of these products is appropriate for the protection of public health. we are actively working on modified risk tobacco product applications for on! and expect to submit these applications to the fda by the end of this year. we believe an mrtp claim would be an impactful point of differentiation for the brand and an important tool in educating and ultimately transitioning smokers to less harmful products.
in heated tobacco, our teams made excellent progress with iqos in the northern virginia market, with marlboro heatsticks achieving a 1.9% retail share of the cigarette category in stores with distribution for the month of october. unfortunately, pm usa had to remove iqos from the market in november due to the international trade commission's importation ban and cease and desist orders. pmi is responsible for iqos manufacturing and we have been in contact regarding product availability. at the present time, we do not expect to have access to iqos devices or marlboro heatsticks in 2022.
however, we remain focused on returning iqos to the market as soon as possible. our teams are actively working on reentry plans and we expect to be ready to bring iqos back to u.s. consumers when available. our agreement with pmi contemplates disruptions, such as those caused by the itc orders and requires the parties to negotiate in good faith to amend the agreement appropriately.
in the second quarter of 2020, we disclosed two milestones in our iqos agreement with pmi necessary for pm usa to maintain its exclusive license and distribution rights for iqos in the u.s. and to earn the renewal option for an additional five-year term. the initial five-year term does not expire until april of 2024, but we believe that pm usa has already met these milestones based on the strong performance of iqos in the charlotte and northern virginia markets. pmi has communicated that it disagrees with our position.
we expect to continue discussing these matters with pmi. we firmly believe that heated tobacco products can play an important role in u.s. harm reduction and we are continuing our efforts to support the category's growth. we have gained significant knowledge from our iqos commercialization efforts, which we expect to use going forward.
our teams learned how to educate u.s. smokers on a brand-new tobacco category and how to effectively support their transition journey to smoke-free alternatives. we demonstrated improved performance in each successive market and gained valuable knowledge on leveraging mrtp claims to transition smokers. additionally, we have built a robust post-market surveillance system, all of which we believe will position us to successfully achieve our objective of moving beyond smoking.
moving to the e-vapor category. the 2021 monitoring the future study was recently released and the data showed positive improvements in underage usage trends. both underage use of nicotine vaping products and juul specifically show continued signs of decline. the latest data shows that juul underage usage is down by 70% from 2019, with total underage nicotine vaping down 27% over the same period.
we are encouraged by the progress, but more still needs to be done and we remain committed to continuing our work to reduce underage use of all tobacco products. turning to the regulatory environment. the fda is currently weighing several decisions that we believe will shape the future of harm reduction in the u.s. in the e-vapor category, the fda has issued marketing denial orders for many e-vapor pmtas, predominantly, applications for open systems and flavored e-liquids.
these denial orders have resulted in significant litigation across the country. in the meantime, pmtas for most leading e-vapor products, including juul, are still on an fda review. the fda granted its first e-vapor market order last year for the tobacco variant of a cigar-like product. the fda has not reached a final decision for that manufacturer's menthol variant, but did deny its submissions for its other flavored cartridges.
in oral tobacco, pmtas for the leading oral nicotine pouch products including on!, remain pending with the fda. last year, the fda granted the first market authorizations among innovative oral tobacco products for our verve discs and chews in the flavors of green mint and blue mint. these were also the first flavored product authorizations for newly deemed tobacco products. additionally, mrtp applications previously submitted for copenhagen snuff and competitive snus products remain in fda review.
finally, in combustibles, the fda has stated that they are on track to issue proposed product standards by april 2022 regarding menthol in cigarettes and characterizing flavors in cigars. as a reminder, the fda rule-making process for these and all potential product standards has multiple steps and provide several opportunities for stakeholders to provide input. there are formal requirements related to public notice and comment and steps requiring the office of management and budget to assess economic consequences at several points in the process. importantly, if the fda chooses to move forward with their final rules, they must address all comments received throughout the rule-making process.
of course, any final rule must take into account the potential for unintended consequences and would be subject to legal challenges. we plan to review the proposed rules in detail and intend to engage with the fda throughout the rule-making process on each of these issues. we remain optimistic about the future of harm reduction in the u.s. we believe we have an unprecedented opportunity to lead the way in shifting millions of smokers away from cigarettes, if we follow the science and foster innovation with the support of reasonable regulation.
we are encouraged that the fda has authorized a product in each of the three major smoke-free categories. going forward, this year, we expect the fda to carefully consider the scientific merits of each remaining application and we're hopeful for significant progress in product marketing and claim authorizations. i would like to end my commentary regarding 2021 with the message to altria's employees. thank you for your dedication, passion and creativity through a difficult period.
we experienced several challenges last year in both our professional and personal lives and i admire your resiliency and fortitude. you are a driving force in moving beyond smoking and we are very appreciative of your efforts and commitment. let's now move to our financial outlook for 2022. our plans for the year ahead include a continuation of our strategy to balance earnings growth and shareholder returns, with investments toward our vision.
for 2022, our planned investment areas include digital consumer engagement, smoke-free product research, development and regulatory preparations and marketplace activities in support of our smoke-free products. the external environment remains dynamic, however and we're monitoring various factors such as the economy, including the impact of increased inflation; the impact of current and potential future covid-19 variants and mitigation strategies; tobacco consumer dynamics, including tobacco usage occasions and available disposable income and regulatory and legislative developments. taking these factors into consideration, we expect to deliver 2022 full year adjusted diluted eps in a range of $4.79 to $4.93. this range represents an adjusted diluted eps growth rate of 4% to 7% from a $4.61 base in 2021.
we expect 2022 adjusted diluted eps growth to be weighted toward the second half of the year. our guidance includes anticipated inflationary increases in master settlement agreement expenses and direct materials expenses and our current expectation that we will not have access to the iqos system in 2022. i'll now turn it over to sal to provide more detail on the business environment and our results.
sal mancuso -- chief financial officer
thanks, billy. i'd like to begin with an update on consumer disposable income, mobility and retail store traffic. we believe rising gas prices, inflation and the reduction of covid-19 relief programs led to a decrease in disposable income on a sequential and year-over-year basis. in addition, increased consumer mobility versus the prior-year offered consumers more options for their discretionary spending and led to fewer tobacco usage occasions.
at retail, fourth quarter trends were unchanged sequentially. we estimate that compared to pre-pandemic levels, the number of tobacco consumer trips to the store continued to be depressed, but tobacco expenditures per trip remained elevated. moving to our businesses. the smokeable product segment delivered excellent financial performance once again.
our strategy for this segment continues to be maximizing profitability, while balancing investments in marlboro, with funding the growth of our smoke-free portfolio. we believe our teams are successfully executing this strategy and the segment has delivered strong profit growth and stable marlboro marketplace performance throughout the pandemic period. in the fourth quarter, the segment grew its adjusted oci by 4.9% and expanded its adjusted oci margins to 56.2%. the segment also reported strong net price realization of 8.8%.
fourth quarter smokeable segment reported domestic cigarette volumes decline by 5.9%. when adjusted for trade inventory movements and other factors, we estimate that segment domestic cigarette volumes for the fourth quarter declined by 8% and that industry volumes declined by 6.5% over the same period. as a reminder, adjusted cigarette volumes were strong in the fourth quarter of 2020, with our smokeable segment adjusted cigarette volumes declining by just 1% and industry volumes growing by one half percent. for the full year, smokeable segment adjusted oci grew 3.1% to $10.4 billion.
adjusted oci margins expanded by 1.2 percentage points to 57.6%. these strong full year results were supported by robust net price realization up 9.1%. full year smokable segment reported domestic cigarette volumes declined 7.5% due to the strong comparison period and the continuation of pandemic driven changes in the consumer behavior. when adjusted for trade inventory movement, calendar differences and other factors, we estimate that smokable segment cigarette volumes declined by 6% and that the full industry declined by 5.5%.
we believe it's important to analyze cigarette volume trends over the longer term as decline rates in any one year can be influenced by various factors. the covid-19 pandemic has certainly been one of these distorting factors and we believe the best way to assess cigarette volumes during this period is looking at 2020 and 2021 volumes combined. in fact, the two-year average decline rates for adjusted smokable segment and industry cigarette volume declines were 4% and 3%, respectively, well within the range of historic norms. turning to marketplace performance.
marlboro remains strong and has demonstrated resilience. the cigarette category remains very competitive. after market share gains in the first half of 2021, marlboro did see share in the fourth quarter. we believe the sequential share decline occurred due to macroeconomic pressures on consumer disposable income.
while the vast majority of marlboro consumers are highly brand loyal, we do know that cigarette brand selection for a subset of smokers is dependent on economic conditions. these consumers are more likely to select premium brands during economic upswings, as demonstrated by marlboro share gains in the first half of 2021, but they are also more likely to trade down in tougher economic situations. we remain focused on the long-term strength of marlboro and we are very pleased that its full year share grew 0.2 to 43.1% and that the brand remained stable since the beginning of the pandemic. in discount, total segment retail share in the fourth quarter continued to fluctuate, increasing 0.7 sequentially to 26% driven primarily by deep discount products.
we believe the share increases observed in the discount segment are due to the previously mentioned macroeconomic factors that pressured the consumer in the fourth quarter. for the full year, discount segment share increased five-tenths to 25.4%, which was at the high end of its historical ranges. we expect fluctuation in discount segment shares to continue as the cohort of price sensitive consumers react to their short-term economic conditions. and in cigars, middleton provided strong contributions to smokable segment financial results.
reported cigar shipment volume was essentially unchanged for the year, as middleton maintained the strength of the iconic black & mild brand and successfully managed the supply chain during a challenging year. turning to the oral tobacco product segment. adjusted oci and adjusted oci margins contracted for the full year primarily due to increased investments behind on!. total segment reported shipment volume was unchanged for the year.
when adjusted for trade inventory movements and calendar differences, we estimate that total oral tobacco segment volumes declined by 0.5%. we remain pleased with the overall performance of the segment as copenhagen continues to generate significant income in the high-margin mst category and we're excited about the growth demonstrated by on!. oral tobacco product segment retail share for the fourth quarter was down slightly sequentially as strong share gains from on! nearly offset declines in mst. the segment declined 1.6 percentage points versus the fourth quarter last year due to the continued growth of the oral nicotine pouch category.
turning to our investment in abi. we recorded $172 million of adjusted equity earnings in the fourth quarter, representing altria's share of abi's third quarter results. for the full year, we recorded $639 million in adjusted equity earnings, up 18.3% versus 2020. as we shared in our previous earnings call, we view our abi stake as a financial investment and our goal is to maximize the long-term value of the investment for our shareholders.
in our all other operating category, we continue to make progress on our wind down of philip morris capital corporation. at year-end, the net finance assets balance was $114 million, down more than $200 million since the end of 2020 due to rents received and asset sales. as previously announced, we expect to complete the pmcc wind down by the end of 2022. turning to capital allocation.
we remain committed to creating long-term shareholder value through the pursuit of our vision and our significant capital returns. as billy mentioned in his opening remarks, we returned more than $8.1 billion in cash last year to shareholders through dividends and share repurchases. these record cash returns included paying $6.4 billion in dividends, raising the dividend for the 56th time in 52 years and repurchasing nearly 36 million shares during the year totaling $1.7 billion. we also sold ste.
michelle wine estates and expanded our share repurchase program from $2 billion to $3.5 billion. we have approximately $1.8 billion remaining under this expanded program, which we expect to complete by december 31, 2022. we continue to have a strong balance sheet and our goal is to maintain an investment-grade credit rating. as of year-end, our debt to ebitda ratio was 2.3 times and our weighted average coupon was 4%.
with that, we'll wrap up and billy and i will be happy to take your questions. while the calls are being compiled, i'll remind you that today's earnings release and our non-gaap reconciliations are available on altria.com. we've also posted our usual quarterly metrics, which include pricing, inventory and other items. let's open the question-and-answer period.
operator, do we have any questions?
",":
operator
[operator instructions] we will take questions from the investment community first. our first question comes from pamela kaufman from morgan stanley.
pamela kaufman -- monness -- analyst
hi, good morning.
mac livingston -- vice president of investor relations
pam, this is mac. just one quick second before your question. we understand that there were some technical issues associated with the webcast, so i want to apologize for the disruption to those listening there. we will work to get our recorded remarks up on the website as soon as possible.
thanks and go ahead, pam.
pamela kaufman -- monness -- analyst
thanks. so how would you characterize the current competitive environment within the cigarette category. the deep discount segment continues to invest in price and is gaining share. given the headwinds that you highlighted that are impacting the tobacco consumer, how are you thinking about managing price gaps versus the discount segment? and are you prioritizing stabilizing marlboro market share? thanks.
billy gifford -- chief executive officer
good morning, pamela and thanks for your question. i think i would start with marlboro's share. i mean, when you look at marlboro's share performance over the past eight quarters, it has been stable. so you can look at kind of this period in the pandemic to pre-pandemic levels and you see marlboro has remained strong throughout that period.
i think when we went through the pandemic, though, there were several macroeconomic tailwinds, and we've mentioned them before. there was lower consumer mobility. there was higher government stimulus payments and, what we believe, led to increased smoking occasions. and when you think about that, that led to increased or higher discretionary income for competitive adult smokers who then traded up to marlboro.
and i think that really showed the continued appeal of premium brands. now, as we start seeing some of those pressures you're referring to put pressure or decrease the discretionary spend of some of our consumers, you see the more price-sensitive adult smokers moving back to discount brands and i think that would be expected. look, we believe that the current discount share, to your point, is at the high end of historical norms, but we do expect quarterly fluctuations in share to continue until the economy begins to stabilize from the pandemic. i think, overall, from a pricing standpoint and i'll be careful not to talk about future pricing, you recall the four factors that we look at to make pricing decisions, strength of the brand, the economic health of our consumers, the demographics or relevancy of the brands across the various age cohorts and corporate objectives.
and i think when you think about the strength of the brand, i would remind you that like marlboro has over 90% loyalty and that i think has shown through the eight quarters of stability.
pamela kaufman -- monness -- analyst
that's helpful. and then just a question on smokeless segment. profitability and margins have been under pressure in smokeless over the last several quarters. can you elaborate on the investments you're making there? and how are you thinking about smokeless investments and profitability in 2022?
billy gifford -- chief executive officer
yeah, it's a great question. i appreciate you raising it. i think when you think about it, pamela, we had talked, as we progressed through 2020 that we were really focused on getting past the manufacturing capacity constraints and that would allow us to really start engaging with the consumer. so now being in the 117,000 stores, you want to have a nice look at retail.
you're going to want to engage with smokers with equity messages that go to the consumer, whether through direct mail or through digital. and then because you're introducing a new category and is growing, you want to have some disruption at retail, both with the look and with some price off and so you have price promotions that take place in the marketplace. so those are the major factors that, as we're investing in on! and it's growing, impact the overall oral tobacco category from a margin standpoint. i know you would like me to say this is the exact date we expect to end that, but i think as you think about a growing category and on! certainly participated in that growth, we're going to invest appropriately as that category continues to grow.
pamela kaufman -- monness -- analyst
thank you.
billy gifford -- chief executive officer
thank you.
operator
we'll take our next question from bonnie herzog of goldman sachs.
bonnie herzog -- goldman sachs -- analyst
hi. thank you. good morning, everyone.
billy gifford -- chief executive officer
good morning, bonnie.
bonnie herzog -- goldman sachs -- analyst
hi. i have a question on your '22 eps guidance. you mentioned you plan to balance earnings growth and shareholder returns with investments toward your vision, which includes increased smoke-free product r&d. but at the same time, you don't expect to have iqos in the market.
so two questions. one, can you give us a sense of your investment spend in r&d.? for instance, will your investments in this effort be elevated above '21 levels? and then two, can you share maybe just a little bit more with us about your 2030 vision and how the development of an additional smoke-free product could fit into your portfolio? i'd be curious to hear what that product might look like, when it might be right to test, just be curious to hear if it's closed or is this still a year or two out.
billy gifford -- chief executive officer
yeah, thanks for the question, bonnie. and it was pretty packed up, so i'll try to unpack it. but if i miss any point, please follow up. i think when you think about guidance overall, right, we run a range of scenarios across all the categories we participate in and there are always puts and takes in those various scenarios.
and it's important to remember when mindful that we're still in a pandemic environment and that we want to ensure we have the flexibility to adapt to our adult consumers as we progress through the year and they're making different choices. as far as the investment areas, i know you would like us to say this is exactly when we're going to bring this product and here's what it looks like. i think it's important to step back and think about where we're investing and it really is marketplace activities for support of the products we have in the marketplace. it's also investing in the digital consumer engagement, being able to get closer to the consumer on a one-on-one basis and we'll share more details of that at cagny.
and then it's not just research and development. it's also the regulatory preparations that take place. so for instance, in 2022, we're preparing the mrtp application for the on! portfolio. so there's a vast array of investments.
it does include product development in r&d. and so that's kind of how we look at 2022 and how we're moving forward. i think when you look at the vision, even if you look overseas where they're able to innovate much quicker, you see the consumer constantly moving from a technology standpoint through the various options that are available to them. and so we want to make sure that we're investing appropriately to stay paced or actually be ahead of where the consumer is going to be as we progress through time.
and so that's how we think about product development in the -- from a fitting into the portfolio to address that point of your question.
bonnie herzog -- goldman sachs -- analyst
ok, that's helpful. and then just speaking or thinking about your 2030 vision. could you give us maybe an update on that? and i just keep thinking about any guidepost you guys could share with us that you expect to hit for this business or your business, i should say, in the next three to five years. what ultimately is a realistic target in terms of converting your business to noncombustible products? and then in the context of that and executing on this vision, curious to hear if you're open to m&a to accelerate this or are you going to continue to remain focused on things that you develop in-house?
billy gifford -- chief executive officer
yeah, i think from a guidepost standpoint and we get this question often, is i think it's a bit different in the u.s. where we're predominantly based versus overseas. remember, everything has to go through the fda authorization process and really, the entire harm reduction opportunities in front of us in the u.s. and so i think as we progress and we start seeing some of the fda authorizations come through, we'll be sure to share some guideposts on how we're thinking about measuring going forward.
i know that's what you and the investors want. it's just that we need to get through the fda authorization process and understand how they're going to think about and authorize these products going forward. and then we can provide some guideposts to be measured against in that regard. i think, overall, though and we've shared this before, call it, roughly half to slightly over half of adult consumer -- cigarette consumers in the u.s.
prefer or would desire an alternative product that satisfies them and has the potential to reduce the risk associated with using nicotine through time. so we want to consistently provide those consumers the products and transition them to the smoke-free products. from a standpoint of the 2030 vision, i mentioned that the entire rrp opportunities in front of us and what we feel like we have is we have the infrastructure to support that, whether you think about government affairs or regulatory affairs, a top-notch sales force. we have product development.
we engage with the largest number of u.s. adult tobacco consumers through our brand -- premium brands and our digital capabilities. and if you step back and we have strong core businesses that produce lots of cash that allow us to fund our investments. and i believe if you ask consumers, we have credibility with the adult tobacco consumer.
so your last question, if i recall them all correctly, was m&a versus internal. look, we monitor what's taking place around the world and we're extremely focused on our organic development, staying close to the consumer as we continue with that process.
bonnie herzog -- goldman sachs -- analyst
all right. thank you. i'll get back in queue.
billy gifford -- chief executive officer
thank you.
operator
our next question is from owen bennett of jefferies.
owen bennett -- jefferies -- analyst
good morning, gents. hope you're well. i just had a question around some of the details on the automatic renewal of the iqos agreement. and firstly, did you need to hit certain market share levels by april 24? and then two, it sounds like from what you're saying, you believe you already hit these levels in 2020.
and would that be right? it just sounds like if that's the case, the share targets were set really low. and then three, if you believe you've already hit the share targets, what exactly is being renegotiated with pmi currently? thank you, guys.
billy gifford -- chief executive officer
yeah, i appreciate it. i want to appreciate your question. look, we disclosed what we felt like we could from a standpoint. remember, we have cross confidentiality in place with pmi and we disclosed that in 2020 because we thought it was important for you guys and the investors to know that there were performance objectives in the contract.
we feel like we have hit those as far as the extension or renegotiation that's taken place. look, we described that we feel like we hit on pmi in disagreement with that and their mechanisms in the contract to be able to settle any disputes that take place. you can see with any two parties that have an agreement, there can be disputes or disagreements and that was all contemplated in the agreement.
owen bennett -- jefferies -- analyst
ok, thanks a lot. very helpful.
billy gifford -- chief executive officer
thank you.
operator
we'll take our next question from vivien azer of cowen.
vivien azer -- cowen and company -- analyst
hi, thanks very much. i really appreciate the commentary on the health of the consumer and some of the normalization in terms of down trading behavior. billy, as i kind of think back to the evolution of the marlboro franchise over the last decade, there was a big push, if i recall correctly, coming out of the last recession to balance out the price points that were available for marlboro. so can you just remind us kind of where special blend fits into the total marlboro franchise? and i recognize your revenue growth management tools have gotten a lot more sophisticated over the last decade, but the role that you envision special blend playing to the extent that we see sustained down trading.
thank you.
billy gifford -- chief executive officer
yeah, thanks for the question, vivien. i think when you think about the entire marlboro portfolio, remember, that services four out of every 10 consumers that go to the marketplace. you have consumers that the marlboro brand appeals to them. and i mentioned it earlier, those price-sensitive consumers, it still appeal to them.
and when they have extra discretionary income, they want to trade up. across the portfolio with the tools that you mentioned, we can provide the consumer a safe landing, with various parts of the portfolio where they can stay in the marlboro franchise. and we see that's better for them than actually losing them or having them trade up and try to win them back later. and so we have the advanced analytics.
we have this robust data coming in from retail. and now with those tools, we're trying to provide it closer and closer to the individual consumer. and we feel like we have the tools that allow us to navigate this type of pressure that the consumer is under. i think it's important, though, to remember that our goal is not to grow marlboro share through time.
it's to stabilize it, so that we can grow profitability through time. and so that's where our overall goal is specific to the marlboro franchise and then we use the tools in the portfolio to be able to do that.
vivien azer -- cowen and company -- analyst
that's really helpful. and then as my follow-up question is on the on! franchise. clearly, the promotional investments that you guys are making are translating to market share gains, which is great to see. i was wondering if you could offer any color on where you see on! promotional spending relative to the broader competitive backdrop.
billy gifford -- chief executive officer
sure. i think when you think about the promotional spending there, look, we had to get past manufacturing capacity constraints. so we certainly had a competitor get out there much earlier than us. and so we want to be a bit disruptive in the marketplace to disrupt the consumers from their normal purchasing behavior in the category or if they're thinking about the category.
the same tools that you think agree with that we have in the cigarette category, we're using those tools in this space as well. so we're constantly using those tools with the data we're getting from retail, with the feedback we're getting from consumers and understanding what's effective and what's not effective. and so we'll be continually adjusting those as we move through time to improve the share growth and through -- once we get past the investment period to get increased margins and profitability.
vivien azer -- cowen and company -- analyst
understood. thank you.
billy gifford -- chief executive officer
thank you.
operator
our next question is from chris growe of stifel.
chris growe -- stifel financial corp. -- analyst
hi, good morning.
billy gifford -- chief executive officer
good morning, chris.
chris growe -- stifel financial corp. -- analyst
good morning. i had a question, first of all and this is not even in the situation in the last kind of year and a half or two, but you did not provide a volume outlook for the year, for example, for your cigarette business or smokeless business overall. and i'm just curious, not maybe getting to a number, but just to understand, is that volatility in volume, maybe the uncertainty around that, kind of the main factor that could push your eps around within that range? is the worst volume conclusion for the year what likely drives the lower end of your eps range and a better volume performance or at the higher end? is that one of the main driving factors of your guidance range for the year as you see it?
billy gifford -- chief executive officer
i think when you think about cigarette volume, it's certainly an important factor in that, but there are always puts and takes that take place in the p&l. and so as i mentioned, chris, we run a range of scenarios. and in those scenarios, we have puts and takes that take place across the various categories. certainly, cigarette volume is one of the factors, but it's not the only factor.
chris growe -- stifel financial corp. -- analyst
ok, and then i just had a question in relation to marlboro and share. there's been a few questions on that front. but just one thing i was curious about is that in some of your price increases over the last year, year and a half, maybe last year, you've set aside some funds that you were going to put toward investing behind marlboro. i guess, i just want to get a sense of, based on the performance and largely flat performance in share, even though it's been up and down, i guess, are those funds being utilized as you expected behind marlboro? do you see the need based on some of the growth in deep discount share, for example, to continue to increase that rate of spending behind marlboro?
billy gifford -- chief executive officer
it's something we'll certainly monitor chris going through time. and we talked about look, we're mindful of keeping pace and understanding how we need to adapt to our consumers across all of our categories. i think i go back to the comment i made to vivien. our goal with marlboro is not to grow share through time.
it's to have stable share and be able to grow profitability. and i think you see we were very successful with that in 2020.
yes, ok. thank you for your time.
thank you, chris.
operator
we'll take our next question from callum elliott of bernstein.
callum elliott -- sanford c. bernstein -- analyst
thanks for the question. look, billy, i appreciate the color on the dispute resolution process with pm. my question is, do you guys have contingency plans in place in heated tobacco in the event that, that dispute resolution process goes against you and the licensing agreement isn't extended beyond 2024?
billy gifford -- chief executive officer
yeah. i'm not going to go into the hypothetical there, callum. i think you can appreciate that we feel like we can resolve it. it was pretty thought out with the agreement that the mechanism is in place to settle disputes and so we'll go through that process.
but we're in continued discussions with pmi.
callum elliott -- sanford c. bernstein -- analyst
ok, thanks. and just a quick follow-up on vivien's question about sort of promotional environment in nicotine pouches. i guess, my question is, are you concerned at all that, that heavy promotional environment for on! might damage the brand equity? and selling today at a huge discount to the market leader, as you mentioned, are you not at all concerned that, that might impact the long-term brand perception here?
billy gifford -- chief executive officer
we are not. if you think about -- even if you go back to the cigarette category, when we launch chews and whether it be on marlboro or any of our other brands, you always had introductory price promotions. it's important to remember when our consumer is going to and c-stores is one of the primary locations they go to, they're making that decision in 10 to 15 seconds. it's the snap of an eye almost.
and so when you think about that, you want to disrupt them at retail, not only with price promotions, but with a great look at retail or disrupt them either in their mailbox or their email box with -- through digital. and so we're going to use all of those tools available to us, but we feel like we have strong equity and building strong equity with on!.
callum elliott -- sanford c. bernstein -- analyst
ok, thank you.
billy gifford -- chief executive officer
thank you.
operator
at this time, we'd be happy to open up the queue for our media representatives. we'll take a question from jennifer maloney of the wall street journal.
jennifer maloney -- the wall street journal -- reporter
hi, good morning. i wanted to follow up on bonnie's questions about your r&d and your 2030 vision. can you speak specifically to your -- how e-vapor fits into your 2030 vision and rrp portfolio?
billy gifford -- chief executive officer
yeah. i think from an r&d portfolio -- i'll take that first. you'll remember our agreement with juul precludes us from being able to do any organic development in e-vapor. so that's one category that we do not have any organic development going on.
if you think about the 2030 vision, the way we think about the e-vapor category, certainly as the entire category is going through the fda authorization process as they make decisions, the e-vapor category will be in a bit of transition. but we believe the e-vapor category and juul included in that can play an important role in the u.s. in harm reduction and the future of harm reduction. so when you think about that, e-vapor can play an important role, but it's going to be in a bit of a transition as it goes through the fda authorization process.
jennifer maloney -- the wall street journal -- reporter
you only have a minority stake in juul, so do you -- i mean, what's your strategy there for this 2030 vision in the e-vapor category? it's just you'll only be able to participate in the e-vapor category through your minority stake in juul. or do you have some other strategy there?
billy gifford -- chief executive officer
there -- our only participation in the e-vapor category would be through our minority investment in juul. and i think if you step back and see the success juul had in the marketplace with converting adult smokers to the e-vapor category, you'll see that it still has the lead in market share in the u.s. with adult tobacco consumers.
jennifer maloney -- the wall street journal -- reporter
ok, thanks.
billy gifford -- chief executive officer
thank you.
operator
thank you. at this time, i would like to turn the call back to mac livingston for closing comments.
mac livingston -- vice president of investor relations
thanks, leo and thank you all for joining us. i'll remind you once again, we're going to work quickly to get the recording of the remarks back up on the webcast for those who were disrupted there. so apologies for that again. if you have any other further questions, please contact the investor relations team.
thanks.
operator
[operator signoff]
duration: 51 minutes
call participants:
mac livingston -- vice president of investor relations
billy gifford -- chief executive officer
sal mancuso -- chief financial officer
pamela kaufman -- monness -- analyst
bonnie herzog -- goldman sachs -- analyst
owen bennett -- jefferies -- analyst
vivien azer -- cowen and company -- analyst
chris growe -- stifel financial corp. -- analyst
callum elliott -- sanford c. bernstein -- analyst
jennifer maloney -- the wall street journal -- reporter
more mo analysis
all earnings call transcripts"
