q,ticker,dt,prep_remarks,QnA
2021-Q2,NTCO,2021-08-13 10:00:00,"prepared remarks:
operator
good morning, ladies and gentlemen, thank you for waiting. at this time, we would like to welcome everyone to natura & co second quarter 2021 results. this event is being recorded. [operator instructions].
this presentation may contain forward-looking statements. such statements are not statements of historical fact and reflect the beliefs and expectations of natura & co's management. forward-looking statements speak only as of the date they are made and the company does not undertake any obligation to update them in light of new information or future developments. this presentation also includes adjusted information prepared by the company for information and reference purposes only, which have not been audited.
now, i will turn the conference over to mrs. viviane behar, investor relations officer of natura &co. ms. behar, the floor is yours.
viviane behar de castro -- investor relations officer
good morning or good afternoon to everyone. i am viviane behar, natura & co's investor relations officer. thank you for joining us today for this call to present natura &co's second quarter 2021 earnings.
i'm joined today by roberto marques, executive chairman and chief executive officer of natura &co guilherme castellan, who took over as chief financial officer last month and whom we are very pleased to welcome; and joao paulo ferreira, chief executive officer of natura & co latin america, who will join us for the q&a session. the natura &co investor relations team is also with us.
the presentation we will be referring to, during this call, is available on the natura &co investor relations website. roberto will start today with an overview of our performance; guilherme will detail our financials for natura &co after that, roberto will make concluding remarks and we will open the floor to your questions.
for the sake of timing, in order for us to accommodate questions from all of you, we'd like to ask you to please limit yourselves to one or two questions each in the q&a session. thanks for your understanding on this and cooperation.
let me now hand over to roberto. roberto, please.
roberto de oliveira marques -- executive chairman and chief executive officer
thank you, viviane, and hello to everyone. thank you again for joining us. i hope all of you are continuing to be safe and well in this still challenging times.
let me begin on slide 3 with an overview of our second quarter highlights. natura & co turned in another strong performance in the second quarter of 2021. our group sales grew more than 36%, outperforming once again the global cft market and we posted a significant increase in net income. adjusted ebitda was also up strongly, while margin was impacted by a base effect that guilherme will explain in more detail as q2 last year benefited from exceptional circumstances of some government support in a strict cost containment at the height of the pandemic last year. but it's important to point out that without this impact, adjusted ebitda margin would have been up by 210 basis points in the period. for the first half of the year, we achieved over 9% adjusted ebitda margin, a healthy 120 basis points higher than same period last year. this strong performance was achieved while we continue to operate in a challenging healthy environment with lockdowns and restrictions in certain key markets. this reflects, once again the relevance and resilience of our omnichannel business model, the power appeal of our brands, products in our unparalleled direct to customer reach. we saw double-digit sales growth across our businesses and a very good performance in our key markets. natura &co latam saw growth by both, the natura and avon brands with a very strong performance in hispanic latam.
avon international also posted strong growth and market share gains in some key markets. and the body shop and aesop also were up significantly even while continue to face challenges from covid-19. digital enable represented over 51% of our total sales, four times above pre-pandemic levels. another digital highlight was the strong growth of our [indecipherable] payment platform, which we are piloting at natura brazil. we had a 50% gain in new accounts, totaling 220,000 in six months, and almost brl2 billion in total payment volume. we are particularly pleased with the performance of avon in both latam and international. the sales growth we saw coupled with market share gains in key markets and categories are a demonstration that avon's turnaround is underway.
pilots of the new commercial model, both in the nordics and in south africa show positive initial results and representative satisfaction has increased. the synergies are in line with the plan at $76.5 million in the first half with $41 million in cost to achieve. avon international's transformational plan is also progressing and it's ebitda margin remained broadly stable even while investing more in digital, it and marketing to drive future growth. and we have a very solid balance sheet. we ended up the quarter with a robust cash position of brl8 billion and we made further headway on deleveraging with our net debt to ebitda ratio at 1.43 times at the end of the quarter compared to 3.63 times in q2 last year.
natura &co posted strong growth in net income, which reached brl235 million in the quarter, an increase over brl600 million versus the same quarter last year and almost brl1 billion improvement year-to-date compared to last year. the gain this quarter was driven by a new benefit from the avon integration related to our corporate structure optimization. so overall, i think we can be very proud of our performance in a context that remains very challenging due to the uncertainty, restrictions and lockdowns still very present in many markets in which we operate. it is a demonstration of the strength of our business model, which aims to make positive impact while delivering sustainable growth in value creation.
on the following slide, we show that we made continued advances in esg as we celebrated in june the first anniversary of our commitment to life our 2030 sustainability vision. the slide shows a number of actions, but let me mention just a couple of highlights per pillar. to address the climate crisis and protect the amazon, natura &co begun building the plenamata portal, a platform designed to engage different stakeholders to achieve zero deforestation, conservation and regeneration of the amazon by disclosing scientific data. as part of our aim to protect human rights and to be human kind, we have reached 96% of our workforce receiving a living wage on track to reach 100% in 2023. natura &co also setup ambitions to be the first multinational to ensure our workforce reflect the demographic composition of the societies in which it operates.
and to help embrace circularity and regeneration, as an example, the body shop is rolling out review stations in 400 stores and we will ensure that all of its company market participate in the return, recycle, repeat project having rollout almost 300 to date. overall, we are also on track to achieve 95% or more on biodegradable formulas by 2013.
with that i will now hand over to guilherme for a closer look at our financial performance. as you all know, guilherme took over as a group cfo last month after completing a very smooth transition. guilherme welcome again and over to you.
guilherme castellan -- chief financial officer
thank you very much, roberto and hello to everyone. i'm delighted to be on this call and very much looking forward to meeting all of you.
on slide 6, you see that we posted very strong consolidated net sales growth in the quarter of 36.2% in reais and 31.7% in constant currency, reaching brl9.5 billion. this reflects double-digit growth in reais in all of our brands, as you see on the right hand side of this slide, despite lingering effects of covid. i will detail performance by brand shortly.
it's important to highlight that as you recall we face a cyber incident at avon last year in q2, that shifted brl454 million in sales from q2 to q3. without that effect, net revenue will have been up by 27.9% in reais and 24.4% at constant currency, which is still ahead of the global cft market.
in h1, net revenue reached brl19 billion up 30.8% in reais and 18.9% in constant currency.
on slide 7, we focus on our digital performance. as roberto mentioned, digitally enabled sales, which include online sales from e-commerce, social selling as well as relationship selling using our main digital apps represented 51.1% of our total sales, up from 48% in q1 and compared to 55% in q2 last year when most stores were closed. we are significantly above pre-pandemic levels at all our brands as you see on this slide. total online sales for all brands are between 2 and 4 times pre-pandemic levels.
slide 8 shows that we posted a reported ebitda of brl603 million in the quarter with margin of 6.6%. adjusted ebitda, which excludes the brl181 million in transformational costs, cost selective synergies, avon related acquisition effects and non-recurring effects was brl811 million. this represents a very strong increase of 31.9% driven by synergies, pricing and sales leverage, which help us to offset inflationary pressures and higher prices of raw materials.
adjusted ebitda margin was 8.5%, down 30 bps year-on-year. this margin reflects one-offs as a result of the pandemic as last year's q2 benefited from government support and cost containment actions. excluding these one-offs, adjusted ebitda margin will have improved by 210 bps, all the businesses would have shown margin expansion, despite investments to drive growth.
in h1, reported ebitda is up by a very strong 83% to brl1.5 billion. adjusted ebitda was up by 49.5% to brl1.8 billion with margin up 120 bps at 9.4%, which puts us on track to achieve on our full year target.
now turning to slide 9, we see the natura &co posted a strong improvement in underlying net income in the second quarter, reaching brl482 million, reversing the negative brl191 million in q2 last year. underlying net income excludes avon acquisition related effects and ppa amortization. we benefit in the quarter from a favorable net tax effect of brl474 million, which includes brl823 million in new gains recognized as deferred income tax resulting from the avon integration and corporate restructuring enabled by the prepayment of the avon 2022 bonds. this effect was partially offset by a 6 percentage point increase in u.k. income tax of 25%. net income was brl235 million reversing a loss of brl388 million in the same quarter last year. the swing of more than brl600 million is driven by lower financial expenses and new gains from the avon integration-related to the corporate restructuring.
in h1, net income reached at brl80 million, an improvement of almost brl1.3 billion compared to h1 in the previous year. on slide 10, we look at our cash and balance sheet position. we are in the quarter with a strong cash position of brl8 billion in line with projections and well above our minimum thresholds. we continue to deleverage our balance sheet and at the end of the quarter consolidated net debt to ebitda was 1.4 times, significantly lower from 3.6 times in the year ago period.
we improved our indebtedness profile with a $1 billion sustainability linked bond issued in may by natura cosmeticos guaranteed by natura &co. the funds were used to prepay the $750 million bond maturing in 2023 as well as refinancing other existing debt in line with the group's liability management plan, while at the same time demonstrating our commitment to achieving our esg targets. the second graph provides with demonstration schedule and shows that we have cash in excess of maturities up to 2024.
let's turn now to our performance by business unit beginning with natura &co latam on slide 12. total net sales were up 39% in reais and 37% at constant currency in q2. this strong performance was driven by double-digit growth at both natura and avon brands, both in reais and in constant currency with significant growth in hispanic latam at both brands. excluding the previously mentioned cyber incident, growth would have been 26.7%. the natura brand was up 25% in reais in 26% in constant currency, while the avon brand also reported very encouraging growth of 28% in reais and 26% in constant currency.
in h1, net sales were up 31.7% in reais and 26% in constant currency, with double-digit growth at both the natura and avon brands. we stated for the cyber incident growth would have been 25.6%. another highlight of the quarter was a strong growth of &co pay, our digital payments platform, which supports the growth of digital social selling. we saw expansion of over 50% in new accounts to reach more than 220,000 and total payment volume in h1 was nearly brl2 billion.
now on slide 13. we look at natura brands. sales at the natura brand in brazil rose 8% in q2 on top of tough comps with the market share gains driven by core categories supported by successful mother's day and valentine's day campaigns and a significant increase in brand preference. growth was also driven by higher volume, continue advances in digital social selling and the 14% increase in the average number of consultants versus q2 2020 and the loyalty index was up by 700 bps versus q2 last year. in hispanic latam, the natura brand recorded a growth of 68% [phonetic] and 78% in constant currency, supported by all markets, notably, argentina, chile and mexico.
natura saw productivity increase and expansion the consultant base of 19% and a significantly higher consultant index in the region. a particular highlight was mexico which became natura's largest marketing sales after brazil. after launching, natura's e-commerce in mexico in q1, we opened our first flagship store in mexico city as we continue to rollout our omnichannel strategy. natura's performance in h1 was also strong with sales growth of 10% in brazil and 64% in hispanic latam.
now turning to the avon brand on slide 14. avon integration in latam is on track and we are seeing signs of recovery similar to those we witnessed at natura at the start of its turnaround in 2017. in brazil, the avon brand's revenue grew by 26% in q2. excluding the cyber incident, sales would have been broadly flat. we successfully rollout the new commercial model in late q1 and are seeing positive initial signs supported by several indicators, such as higher representative productivity, a double-digit increase in representative satisfaction score and stronger brand preference and brand power. this translated into market share gains supported by marketing investments made earlier in the year.
the rollout of the new commercial model led to an expected drop of 4.7% in representatives compared to q2 2020. in hispanic latam, we saw very strong growth of 83% in reais and 72% in constant currency. excluding the cyber incident growth would have been at strong 49%. growth came from all markets and categories and was supported by a 10% increase in the number of representatives and higher representative productivity.
in h1, growth was 10% in brazil or minus 1.6% excluding the cyber effect and 55% in hispanic latam or 47% ex-cyber. on slide 15, adjusted ebitda for natura &co latam grew by more than 60% in the quarter, reaching brl598 million driven by strong revenue growth and synergies from the integration with avon, which more than offset raw material inflation pressure and foreign currency headwinds. adjusted ebitda margin was up 140 bps to 10.8%. excluding one-off effects as a result of the pandemic that boosted the q2 2020 ebitda, such as cost containment actions, adjusted ebitda margin this quarter would have improved by 270 bps.
in h1, adjusted ebitda was brl1.2 billion with margin of 11.5%, up 340 bps.
let's now move to avon international on slide 17. like for avon latam, we saw a strong growth at avon international in the quarter both in sales and in adjusted ebitda. net revenues was up 34% in q2 in reais or 29% ex-cyber and up 27% in constant currency, although some markets continue to be affected by the pandemic, especially in central and eastern europe. we recorded market share gains in key markets, such as the philippines, south africa, romania and italy.
all beauty categories reported growth and increasing market share, notably fragrances and color. the average number of representatives in the quarter was flat compared to q2 last year, and we ended the quarter with 7.4% more representatives than in q2 2020. overall representative satisfaction show positive momentum. pilots of the new commercial model in the nordics and south africa have shown initial positive results in productivity, sales growth and number of representatives. adjusted ebitda grew 30% to brl94 million with margin of 4.3%, down 10 bps as strong sales leverage and transformational savings offset the impact of higher inflation and increased investments in digital and it to drive market share an accelerated future growth.
ebitda margins is in line with its transformational plan targets. excluding one-offs effects as a result of the pandemic, adjusted ebitda margin this quarter would have been improved by 260 bps. in h1, net revenue was up 21% in reais and 4.6% in constant currency, while adjusted ebitda margin was 4.2%.
on slide 19, we now move on to the body shop, the sales were up 24.3% in reais and 14.2% in constant currency with growth in all of its regions. stores reopen in the u.k., the body shop's biggest market. while in other countries, we had continue restrictions or even lockdowns, such as in australia and canada. this resulted in approximately 18% lost store days in the quarter. nevertheless, own store performance grew 140% compared to q2 last year and accounted for 42% of total sales in q2, more than double the same quarter last year. this was partially offset by the expected slowdown in e-commerce and at home reflecting a rebalancing of channels. still e-commerce sales are currently double pre-pandemic levels and the body shop at home sales are three times what they were in q2 '19. the body shop's ebitda in q2 grew 9.2% to brl159 million, margin at 13% was down 180 bps as q2 2020 benefited from approximately 600 bps from effects as a result of the pandemic. excluding these effects, ebitda margin would have increased by 450 bps in spite of a channel rebalancing effect and the impact of last october's japan buyback, driven by strong operational leverage.
in h1, sales were up 35.5% in reais and 12.4% in constant currency, while ebitda rose 26.6%. on slide 21, aesop again recorded an outstanding performance with net revenue growth of 47% in q2 in reais and 41% in constant currency. all regions showed growth, particular the americas and asia. even with the continuous challenges brought by covid, we saw about 11% of lost store days. retail accounted for 78% of sales in the quarter with store sales up 129% in constant currency versus q2 2020. online sales at 23% of the total were down from their peak as expected as the stores reopen, but are still twice their pre-pandemic levels. ebitda in q2 '21, reached brl118 million with margin of 21%, it was down 580 bps as q2 2020 benefited from approximately 650 bps from one-off effects as a result of the pandemic. excluding this effect, ebitda margin would have increased by 90 bps despite increased investments in expansion, three launches in fragrances and channel rebalancing effect.
in h1, sales were up by a very strong 58.7% in reais and 35.5% in constant currency, while ebitda rose 51.9%.
let me now hand back to roberto. over to you roberto.
roberto de oliveira marques -- executive chairman and chief executive officer
thank you, guilherme and let me now conclude on slide 23 with the key takeaways. so we are on a sustainable growth path. we posted another strong quarter continuing to out outperform the global cft market with double-digit growth across the board and the strong growth in net income. supported among other factors by new gains from avon integration.
second, the avon integration is on track. while we are seeing at avon in latam and international, kind of replicates what we saw in natura when it initiated its turnaround, which is new business model, commercial model back in 2017. this quarter we saw a strong growth both in latam and international for avon with market share gains in key markets. the transformation is going according to plan and we are seeing encouraging results from the new commercial model where it has been rollout or still in pilot.
third, we are making further advances on esg with progresses on all the pillars of our 2030 sustainability vision. let me highlight that we continue to make significant donations to causes that are important to us, especially right now to fight still covid-19.
and fourth, we continue to see increasing traction of our omnichannel model with digital sales significantly above their pre-pandemic level even as stores reopen. i went on slide 24 by reiterating that we are on track to achieve our 2021 targets and the 2023 guidance represent our investor day back in april of high single-digit top line growth on a compound annual growth basis and mid-teens ebitda margin at the end of the period.
let me flag also that we do expect the third quarter to face a demanding comparable base since q3 last year benefited from the phasing effect of the cyber incident and pandemic related one-off effect of cost containment and some government support as well as a strong pickup in business after a very strict lockdown on a onset of the global pandemic that compared to q2. but again this does not affect our short and medium-term objectives. so, while the covid pandemic is far from over and we continue to be vigilant, we continue to grow and progress on our strategic initiatives.
thank you so very much for your attention. we are now going to open the q&a session and guilherme, jp and i are happy to take your questions. so now the floor is yours.
",":
operator
ladies and gentlemen we will now begin the question-and-answer session. [operator instructions]. the first question comes from thiago macruz of itau. please go ahead.
thiago macruz -- itau unibanco -- analyst
hi, guys, good morning. you've now spent some time exporting up with direct selling commercial model to the international operations of the avon. so i would like to understand first, how far you guys feel you are from completing this process? which major market is not yet using that model? and second, it would be great if you could share with us some more information on the results of that initiative so far? thank you, guys.
roberto de oliveira marques -- executive chairman and chief executive officer
hi, thiago, roberto here. so here's the good news. we haven't seen yet the benefits of the new commercial model on the key markets of avon international. we are going to be rolling out the new commercial model with actually for the representatives who will include the segmentation and the lifetime value approach that we have in natura, rolling out on the top eight markets -- eight of the 10 markets by q4 of this year. so that's encouraging because that's yet to come and the good news is that we are really using a lot of the learnings from natura about establishing the segmentation model, and we're going to do actually in two phases. the first phase is going to be for the representatives and then the second phase, including the leaders, right.
but here's also the other good news. we have two pilots right now in avon international. one in south africa and the other one in the nordics, the countries. and in both of them, we are seeing increasing productivity. we are seeing retention getting to all-time high, like in south africa, we are seeing in existing brand, a retention about 66%, which is a number that we haven't seen in the past, so we are encouraged by the early results on the two pilots, both in south africa and also in the nordics.
i'll turn to jp that also can comment a little bit on the rollout of this new commercial model, brazil actually, avon brazil is a little more advanced than avon international, so he can comment that as well. so jp, please
joao paulo brotto goncalves ferreira -- chief executive officer and investor relations officer
thank you, roberto. thank you, thiago. actually as regards to avon brazil, we are very happy with the lead indicator so far. the brand has strengthened significantly. the productivity of the reps has increased. their satisfaction has reached all-time high levels and the market share is going up as they are selling out their products at a higher price. so everything that we had experienced at natura couple of years ago, and moreover, we are building the required experience and sensitivity on those levers to smoothen its implementation in other geographies. so, very happy with that. we are actually -- we have already started rolling that out in ecuador in latin america and we are planning other markets still this year. so excellent learnings and very, very promising, lead indicator so far.
thiago macruz -- itau unibanco -- analyst
fantastic, guys. fantastic. thank you very much for the answers.
operator
the next question comes from luiz guanais of btg pactual. please go ahead.
luiz guanais -- btg pactual -- analyst
hi, guys, good morning. so two questions here on my side. the first one, if you could comment about the competitive outlook in latam in this space to increase prices in the next two quarters. it would be good to hear about that. and the second question also regarding social selling platform. how do you think that the customer acquisition cost is going to evolve in the next few quarters as you guide [indecipherable] this platform not only here in latam, but also to the global operations on natura? thank you.
joao paulo brotto goncalves ferreira -- chief executive officer and investor relations officer
hi, jp here. as regards to the competitive environment in latin america, well, we see is relatively slow down in consumption, growing inflation, as you all know. nevertheless, we have been managing revenues very actively, not only price, but also product mix and promotional investments to make sure that we remain competitive in terms of our gross margins and ebitda margins. as regards, the cost of acquisition of social selling, actually as our reps and consultants master their skills in terms of the usage of the social selling tools, they are acquiring digitally, the clients they had formerly, so that's not increasing at this point in time.
luiz guanais -- btg pactual -- analyst
okay, thank you very much, jp.
operator
the next question comes from steph wissink of jefferies. please go ahead.
steph wissink -- jefferies -- analyst
thank you. good day, everyone. i have two questions. the first, maybe, roberto, for you, just as an observation is to see the strength of both avon and natura in brazil and the ability for your reps to co-sell those two brands, both prestige and mass. talk a little bit about what you're learning early on from the brazil market and what that might mean for some of the international markets?
roberto de oliveira marques -- executive chairman and chief executive officer
hi, steph. good hearing from you. listen, we are excited about some of the opportunities or we call cross-sell and up-sell between avon and natura, not only in brazil, in latin america. we think that there is tremendous potential and the data is very encouraging about the opportunity there and we are progressing and i'll ask jp to elaborate a little bit more about it. on the international side, again we are very pleased to see not only some of the leading indicators in the fundamentals of avon strengthening, but i would highlight the market share gain that we are seeing on avon international in key markets in two very important categories, which is color cosmetics and fragrance. this is actually is something very encouraging. again, we are still facing in some markets strict lockdowns and pandemic that impacting the overall growth of those categories. but the fact that we are seeing market share gain on those key markets are also very encouraged. i'll ask jp to elaborate in more detail about this opportunity of the cross-sell and up-sell between avon and natura in brazil. please, jp.
joao paulo brotto goncalves ferreira -- chief executive officer and investor relations officer
thanks. we are at a very early stage of proactively managing the cross-selling opportunities, but we have already started those using big data analytics crm. so we are probing various promotional and cross-selling mechanics and that is proving effectively. it's not yet rolled out at a larger scale, but it will toward the end of this year, beginning of next year. having said that, we have also experienced both brands gaining share in latin america in q2, which again proves the complementarity of those portfolios, so very excited with that growth avenue.
steph wissink -- jefferies -- analyst
that's great. and then my second question is just on apac. there wasn't a lot of commentary, but just curious where you are in casting a vision for the asia-pacific market and china in particular? how you're thinking about entering that market? i think body shop and aesop may be a bit ahead of the others, but maybe share a little bit about when we could start to see china and broadly more the apac region contributing to the business?
roberto de oliveira marques -- executive chairman and chief executive officer
yeah. so, great question. so one, i think we mentioned a lot of this outstanding result of aesop again is driven by asia pacific. so aesop is really hitting all cylinders. i would say, especially in the north asia, which is very encouraging. it gives us the confidence again about entering china. the situation in china is as follow. we welcomed some of the change in the regulatory space in china that will allow us to produce and import products to china without compromising our non-animal testing and we are progressing now their registration. that requires that we obtain a gmp certification of our manufacturing sites in the countries that we actually produce and that's ongoing both for aesop and the body shop and in parallel, we are registering our skus both for aesop and body shop. you are correct, the priority will be actually number one aesop, and then followed by the body shop and we are on track to potentially have a physical presence with aesop in probably beginning, first, i would say, first half of next year. so very encouraged by that.
besides china, as you know, we also made an important investment acquiring the head franchisee of the body shop in japan, which is an strategic market for us. early indicators about us taking over the business with our local team in a more direct contact that as a company market is also promising. of course, japan is also facing the pandemic in some -- back and forth in terms of lockdown, but we're encouraged by that. aesop continues to perform extremely well. japan, it is now the largest market for aesop. and korea is also performing very well.
my last point on asia pacific, avon in philippines, which is a very important market for avon, also posted important market share gains in the philippines. but i would also caveat, the philippines right now is facing one of the most strict lockdowns with the resurge of the pandemic. so it is something that we are monitoring very closely.
steph wissink -- jefferies -- analyst
very helpful. thank you so much.
operator
the next question comes from bob ford of bank of america. please go ahead.
bob ford -- bank of america -- analyst
thank you. good morning and congratulations on the various sources of traction. can you talk a little bit about your balance sheet tax assets and the path to monetizing those? and with respect to the tranches being recognized in the june quarter, what's the realistic timeframe for monetization? i think the press release makes mention of a 20-year period, but that seems a bit conservative. and then you call out tukuma. it's great. it's doing very well within ekos. how innovative is it and how protected is the ip? and is there a possibility of maybe adding tukuma to other brands?
roberto de oliveira marques -- executive chairman and chief executive officer
thanks, bob. i'll ask guilherme to answer the first one and jp can talk about the -- new ingredient, tukuma. so please, guilherme.
guilherme castellan -- chief financial officer
thank you, roberto, and bob. it's a pleasure to meet you and looking forward to meeting you soon. yeah, as you mentioned, basically, this quarter we recorded more than $800 million -- sorry, brl800 million in deferred tax assets, as we continue to optimize our subsidiaries structure, right, which is caused by the avon integration, right. as you probably remember as well, this was enabled by the prepayment of the avon 2022 bonds. they had some restrictive covenants that allow us to execute those restructurings. so it's important to highlight here that this gain was not factored in the guidance that we gave, $350 million to and $450 million in synergies from the avon integration. so it's an upside to that, right. and as you mentioned, there are definitely more opportunities to be captured which is good -- which is very good about capturing those opportunities and we are working hard on that though. of course, we cannot comment on whether and when we will report additional deferred tax assets. to your question on the 20 years, yeah, i mean, this is what we disclosed at this point and basically, this is what we are comfortable and the valuation allowance were recognizing the timeframe this quarter is appropriate at this time. with that, i'll pass to jp.
joao paulo brotto goncalves ferreira -- chief executive officer and investor relations officer
hi, bob. thanks for asking. we are very excited with tukuma. actually, it highlights one of our strengths -- one of the strengths of the group; bioscience understanding the richness of bioingredients and the ability to transform those ingredients into active agents of -- in the cosmetics industry, which ties to one of your questions. if anyone just squeezes that fruit, one get that property. so there is significant science behind the transformation of tukuma into this active ingredient which is protected by patent. and it has regenerative properties which translates to your skin, which is then probed to generate its own hyaluronic acid. so we are very excited with that and is now the second best-selling variant under the ekos line. thanks.
bob ford -- bank of america -- analyst
and is there a role for tukuma in brands where natura does not overlap? i mean, would you, is there a role for this in -- within aesop or the body shop in other markets outside of brazil and latin america?
joao paulo brotto goncalves ferreira -- chief executive officer and investor relations officer
so as an explicit claim, that's a lots to do with the ekos line. now, as an active ingredient, this is one of the areas where the group now is discussing how to translate those active ingredients into various formulations of the various brands, even though it's not explicitly claimed.
bob ford -- bank of america -- analyst
and could you just discuss, you mentioned the patent. how long do you have the rights or how long is the duration of the patent?
joao paulo brotto goncalves ferreira -- chief executive officer and investor relations officer
i wouldn't know the details at this point, bob, but i'll be glad to share those with you later on.
bob ford -- bank of america -- analyst
thank you very much, and again, congratulations on all the traction.
operator
the next question comes from felipe cassimiro of hsbc. please go ahead.
felipe cassimiro -- hsbc -- analyst
hello, thanks for taking my questions. first, i would like to [indecipherable] natura & co in mexico. could you give us more color on the updates, an update on the recent initiatives in mexico that have helped the country to step up as the second largest market in latam? and also on the operational side in mexico, do you see additional synergies to be gaining with the integration of the brands in the country? and second one, i would like to explore a bit more on apac, follow-up on what roberto said. thank you for the colored explanation on all the initiatives there. i just wanted to follow-up maybe on avon in philippines that the plant is doing so well. is there any perspectives of interests of avon in new market in southeast asia in the next 12 months, maybe? anything on this? thanks.
joao paulo brotto goncalves ferreira -- chief executive officer and investor relations officer
hi, thanks. jp speaking. as regards, mexico, sure. i mean, we -- couple of things happening recently there. heavy and growing investments behind the brand, that's number one, then, the development of the omnichannel solutions with the opening of the e-commerce and various stores. as regards to synergies, operational synergies, there are many being explored at this point, but the main one i would like to highlight is the usage of avon's manufacturing plant in mexico to manufacture some of the natura's skus.
roberto de oliveira marques -- executive chairman and chief executive officer
yeah. and regarding to avon in asia, our priority is really to continue to focus on the new commercial model, the rejuvenation of the brand, and digitalization. so right now, i would say we are not planning to entering new markets. but really strengthening our presence through to the commercial model, digitalization and the brand rejuvenation and let's not forget that avon is also present in china. and with this new effort of the group, we also want to make sure that we can strengthen our position at avon in china.
felipe cassimiro -- hsbc -- analyst
okay. thank you very much.
operator
the next question comes from andrew ruben of morgan stanley. please go ahead.
andrew ruben -- morgan stanley -- analyst
hi, thanks very much for the question. so hoping to pivot back to natura brazil. i was wondering if you could talk a bit more about the balance between consultant growth and productivity? any color on how you think productivity trends will progress into the second half? and bigger picture, any update on how you think about the right consultant count for the business? thank you.
roberto de oliveira marques -- executive chairman and chief executive officer
thank you for the question. as you know, i mean, the events of q2, q3 last year were exceptional and they distort somehow the way we report productivity -- consultants productivity at this point. there was huge increase in the number of reps -- of consultants in q3, right. very abruptly, they are younger with us. they are less productive. in addition to that, in q3, last year, there was a shift of channels from in-store to out of store channels and a shift of portfolio toward the essential items. so those numbers will be distorted for a period and should return to normality -- sorry, toward q4 this year. thanks. thanks for the question.
andrew ruben -- morgan stanley -- analyst
thank you.
operator
the next question comes from richard cathcart of bradesco. please go ahead.
richard cathcart -- bradesco -- analyst
hi, guys, good morning. thanks for taking my question. a couple here, just firstly on the body shop. you mentioned i think 20 stores have been renovated into the new format during the quarter. so just wanted to hear a little bit about kind of the performance there and the plan to continue rolling out that new concept to other stores across the body shop portfolio? and then the second question, i think for guilherme, just on debt, just wondering if you've got any additional potential renegotiations on the horizon, and what are, kind of, let's say, the next steps for debt over the next six months to 12 months to 18 months? thanks.
roberto de oliveira marques -- executive chairman and chief executive officer
hey, richard. i will start and then i'll pass to guilherme. so on the new store design for the body shop, the good news is, right now we have approximately 50 already in place and they are showing double-digit gains versus, call it, the previous design. so that's very encouraging. we are planning to potentially get to a 100 by year-end.
and as you know and i would that -- as part of that, as you know, we are also driving the refill stations within the body shop stores, which is also very much in line with our commitment to like, but it's also very much tied to the values and the strategy of the body shop. and on those refills, we are planning actually to get to 300 refill stations in the stores by end of this year.
so, it's progressing well. of course, we continue to monitor it. the retail reopening in some of the key markets and again, a lot of markets going back to lockdown, so -- and we are still very much paying attention to that, but all the indicators that we have -- the early indicators on the new store design are pretty encouraging. so i'll pass to guilherme to talk about the debt strategy here.
guilherme castellan -- chief financial officer
thank you, roberto. yeah, on the capital structure side, i think, as you probably saw, we ended the quarter with a very strong liquidity position, right, of brl8 billion in cash and equivalents. we continue of course, to deleverage our balance sheet with net debt to ebitda of 1.4 times. and i think the highlight of the second quarter, as we already disclosed in the q1 results, was the issuance of the $1 billion sustainability linked bond, right. we're quite comfortable right now with our capital structure. i mean, when you look at the liquidity in hand, then when you look at it that tower [phonetic], the monetization schedules, we have covered basically all the way into 2024. when you look at our exposures by currency, we're extremely well-matched as well. so we are comfortable where we are. of course, we're always assessing opportunity in the market. but at this point, i think that, again, especially after the follow-on in the second half of last year, we're quite glad on where we landed.
richard cathcart -- bradesco -- analyst
okay. thanks very much.
operator
the next question comes from joao soares of citibank. please go ahead.
joao soares -- citibank -- analyst
hi, thanks. two points on my side. first one on apac, and i think, i appreciate the follow on the physical strategy there on aesop. but wanted to get more color on the digital strategy. could you give us an update in terms of how your e-commerce operation is right now in apac? what types of opportunities do you think you can explore in short term, maybe through partnerships, maybe some m&a? so anything, if you give us on that, would be very interesting.
and the second point regarding avon international. we saw a pickup in digital investments. the penetration is clearly moving very well. so just, give us some idea in terms of how those investments are progressing going forward, maybe calling back to your guidance on the low to mid-teens margins for avon international by 2024. how does the digital penetration play out into those margins, that we will be very interesting to hear? thanks.
roberto de oliveira marques -- executive chairman and chief executive officer
yeah, joao, thank you for the question. roberto, here. so, in regarding to asia-pacific and i'll focus a little bit on china, right now, our presence is to the cross-border and it's all e-commerce and is actually progressing very well. we are doing some partnerships. in fact, this quarter, we just launched a cross-border wechat, a mini program that are allowing users to purchase, ease of products directly within the app. and the good news is because to some extent we are late entering china, we're going to really optimize the e-commerce and social selling and not needed to actually invest heavily in brick and mortar.
yes, we're going to have retail when it will be important, but maybe the only good news of us being a little late in entering china is that our omnichannel approach and the focus much more on the e-commerce and social selling and use of key opinion leaders will help us to penetrate probably to less capital investment compared to some of the other early entry in china.
what's again the second question?
joao soares -- citibank -- analyst
yes, yes, roberto, thanks for this one...
roberto de oliveira marques -- executive chairman and chief executive officer
the digital, yeah, the digital, sorry...
joao soares -- citibank -- analyst
yes, yes.
roberto de oliveira marques -- executive chairman and chief executive officer
the digital piece at avon international is progressing well, joao. i mean, we are really moving to similar to natura one app for the representatives to actually do all the business, having all the information, content being able to share. it's called avon on, and there's been a lot of investment to the point that you made that we are actually putting a lot of investment in digital for avon as a whole. this is actually going to facilitate a lot for the representatives to moving to social selling. so, more to come on that, we still think that we have a lot to catch up on that, but the good news is, the team is investing, the reps will be able to access in one platform, in one app, and similar to what we have within natura and that should be a pretty excitement, improvement for the reps within avon international.
joao soares -- citibank -- analyst
great, great. thanks for the answers.
operator
the next question comes from irma sgarz of goldman sachs. please go ahead.
irma sgarz -- goldman sachs -- analyst
yes, hi, good morning. thanks for taking my question. i was just curious to come back to brazil for a second and you do cite and i think it's certainly evident in the number of different sectors, the raw material, input cost pressures, and i was just curious how you think about that for price increases into the back half or maybe you're already taking prices up at the outgoing cycles of the second quarter and how we should think about gross margin for the operation. i guess this applies to -- i'm specifically interested in brazil, for both the avon and the natura brand. thank you.
joao paulo brotto goncalves ferreira -- chief executive officer and investor relations officer
hi, irma. jp speaking. so indeed, the cost pressures are present and we have been managing actively revenues. we did increase prices. we have others scheduled, but that's not the only source of value. as i mentioned, we have been improving and shifting the mix of products in both naturas and avons as well as promotions to maintain, keep and ideally, even improve gross margin going forward. thanks.
roberto de oliveira marques -- executive chairman and chief executive officer
yeah, and one thing, irma, that i also add on top of what jp said, which i would just call attention for all of you, right. if you look at it year-to-date, as a group, we are actually up in gross margin, which i would say in this environment, it's very unique. and even in latin america, year-to-date our gross margin is up versus prior year. and that is because not only i think the team is doing a great job on revenue management, we are leveraging our volume increase, but also the synergies, which is very somehow unique to this combination in this group. the synergies are kicking in and we have on the quarter over $40 million, in the year-to-date almost $80 million of synergies that are helping us navigate some of this pressure in terms of cost inflationary and currency. so that's just one additional comment here on the gross margin.
irma sgarz -- goldman sachs -- analyst
thank you, again.
operator
this concludes today's question-and-answer session. i would like to invite mr. roberto marques to proceed with his closing statements. please go ahead, mr. marques.
roberto de oliveira marques -- executive chairman and chief executive officer
before i close, it seems that we have one additional question and just i would hate not to answer, joseph. so joseph, please, if you have your question, we're happy to answer and then i'll do the closing. please go ahead, joseph.
joseph giordano -- jp morgan -- analyst
right. thank you, roberto. so that should be a quick one. so, on the digital front, right, you're really doing like major advancements in connecting directly to customers. so my question to you is, like how the fulfillment has been working on this front? i recall that you guys are delivering more to the clients. so how are you moving on this front, both on natura and avon front? thank you.
roberto de oliveira marques -- executive chairman and chief executive officer
yeah. so thank you for the question, joseph. so we are progressing well. our fulfillment, our supply chain are really showing tremendous resilience and being able to again, since the pandemic, to really be very responsive and not only in natura and avon but also i would say the body shop and aesop with the surge and the growth. again, our e-commerce and our social channels are three times, four times, higher than the pre-pandemic. and that to your point, it is changing our fulfillment in the way we are serving both our reps and also our customers directly. so we feel good about that. we are also investing on that, but it is something that at this point, we don't envision any major disruption.
jp, you want to add something, please.
joao paulo brotto goncalves ferreira -- chief executive officer and investor relations officer
yeah, joseph. just want to add, recent information is one, both avon's representatives and customers here in brazil are scoring service level very high, the best nps ever actually to be honest. and as you may have seen, natura's e-commerce has just received the blue diamond award, which is granted by end customers that have rated our e-commerce as the best in the country recently, which i think speaks somehow to our fulfillment capabilities.
roberto de oliveira marques -- executive chairman and chief executive officer
great. that's a great way actually to end the call. so i just again, thank everybody. we are very pleased with our strong q2 results, which once again demonstrate the strength of our omnichannel model, the power of our brand products and most important, our people, our organization, our network, who continues to really focus on our direct-to-customer reach and really as a group, continue to progress in our strategic ambitions. i want to thank everybody for being with us today. i wish you all a good day and on behalf of us, stay well, stay safe. thank you very much.
operator
[operator closing remarks]
duration: 64 minutes
call participants:
viviane behar de castro -- investor relations officer
roberto de oliveira marques -- executive chairman and chief executive officer
guilherme castellan -- chief financial officer
joao paulo brotto goncalves ferreira -- chief executive officer and investor relations officer
thiago macruz -- itau unibanco -- analyst
luiz guanais -- btg pactual -- analyst
steph wissink -- jefferies -- analyst
bob ford -- bank of america -- analyst
felipe cassimiro -- hsbc -- analyst
andrew ruben -- morgan stanley -- analyst
richard cathcart -- bradesco -- analyst
joao soares -- citibank -- analyst
irma sgarz -- goldman sachs -- analyst
joseph giordano -- jp morgan -- analyst
more ntco analysis
all earnings call transcripts




"
