q,ticker,dt,prep_remarks,QnA
2021-Q1,NTCO,2021-05-13 09:00:00,"prepared remarks:
operator
good morning, ladies and gentlemen, thank you for waiting. at this time, we would like to welcome everyone to natura & co first quarter 2021 results. [operator instructions] this presentation may contain forward-looking statements. such statements are not statements of historical fact and reflect the beliefs and expectations of natura & co's management.
forward-looking statements speak only as of the date they are made and the company does not undertake any obligation to update them in light of new information or future developments. this presentation also includes adjusted information prepared by the company for information and reference purposes only, which have not been audited.
now, i will turn the conference over to mrs. viviane behar, investor relations officer of natura &co. ms. behar, the floor is yours.
viviane behar -- investor relations officer
good morning or good afternoon to everyone. i am viviane behar, natura & co's investor relations officer. thank you for joining us today for this call to present natura &co's first quarter 2021 earnings. we're delighted to be with you again at our investor day last month.
i'm joined today by roberto marques, executive chairman and ceo of natura &co joseph filippo, cfo of natura &co, as well as guilherme castellan, deputy cfo; and joao paulo ferreira, ceo of natura & co latin america, who will join us for the q&a session. our investor relations team of natura & co is also with us.
the presentation we will be referring to during this call is available on the natura &co investor relations website. roberto will start today with an overview of our performance. filippo will detail our financials for natura &co. after that, roberto will make concluding remarks and we will open the floor to you for questions.
for the sake of timing, in order for us to accommodate questions from all of you, we would like to ask you to please limit yourselves to one or two questions each in the q&a session. thank you very much for your understanding and cooperation on this. let me now hand over to roberto. roberto, please.
roberto de oliveira marques -- chairman
thank you, viviane, and hello to everyone. thank you for joining us. i hope all of you are keeping safe and well in these still challenging times.
let me begin on slide 3 with an overview of our first quarter highlights. natura & co turned in another strong performance in the first quarter of 2021. our group sales were up nearly 26% outperforming the global cft market, and we posted a significant increase in ebitda and margin with our report ebitda margin up almost 700 basis points.
this outstanding performance was achieved while we continued to operate in a challenging healthy environment with lockdowns and restrictions in certain key markets. this attests once again to the resilience of our omni-channel business model with a further ramp-up in online sales and to our unparalleled direct-to-consumer reach.
we saw double-digit growth in brazilian reais across our brands and a very good performance in our key markets. natura & co, in turn, had an outstanding performance with both the natura and avon brands contributing. avon international improved its performance in western europe and asia pacific.
the body shop continued to offset store closures with very strong growth in online and at-home channels and aesop had another remarkable quarter of growth, driven by asia and online. digital sales continued to grow. digital enable sales accounted for 48% of our total, up from 33% in the same quarter last year. and total online sales were up 166% in the quarter compared to the same quarter last year.
the avon transformation journey continues to show progress. the rollout of the new commercial model is under way and we are seeing reshoots such as positive advance in market shares and representative-based even though key geographies and categories like makeup and fragrance are still heavily impacted by the pandemic.
the transformation plan we presented at our recent investor day, supporting initiatives to drive growth and optimize cost, is progressing. and let me remind you that we also raised our target synergies for the avon integration to now a range of between $350 million and $450 million, an increase of $50 million over the period.
another recent highlight i would like to mention here is the successful completion earlier this month of a $1 billion [phonetic] esg bond issue that is linked to sustainability targets on greenhouse gas emission and use of post-consumer recycled plastic in plastic product packaging. this is falling in line with our commitment to life, 2030 sustainability vision and it shows again how we are aligning and connecting financial and environmental targets. the bond issue improves our indebtedness profile in our capital structure. we ended the quarter with a robust cash position of brl6.6 billion, and we made further headway on deleveraging with our net debt to ebitda ratio at 1.18 times at the end of the quarter, a significant improvement over 3.93 times at the end of q1 last year.
so overall, i think we can be very proud of the performance of the entire organization has produced in a very challenging context. it is another demonstration of the strength of our business model, which aims to make positive impact while delivering sustainable growth and value creation.
with that, i'll hand over to filippo for a closer look at our financial performance.
jose antonio de almeida filippo -- chief financial officer
on slide 6, we focus on our online performance, which includes both e-commerce and digital social selling. as roberto mentioned, digital sales largely offset the impact of covid-19 in our retail activity, which continued to be impacted in the quarter, mainly in europe. the group's consolidated e-commerce and digital social selling grew by a very strong 166% in q1, reaching 12% of the total sales, supported by strong growth in our brands. at natura, digital sales were up a spectacular 253% in the quarter. at avon international, digital sales also grew by 132% in q1. at the body shop, online and at-home sales combined 51% of total sales. and at aesop, online accounted for 29% of total sales in q1. overall, our digitally enabled sales accounted for 48% of our total sales.
slide 7 shows that we posted an impressive increase of 470% [phonetic] in reported ebitda, which reached over brl829 million in q1 with margin of 8.8%, up 690 basis points versus the same quarter last year. adjusted ebitda, which excludes transformation costs in both years, as well as avon-related acquisition costs and non-recurring purchase price allocation effects in 2020, was brl963.2 million. this represents a very strong increase of 68.5% with margin of 10.2%, up 260 basis points.
the strong increase in adjusted ebitda and margin resulted from higher sales and operational leverage at natura & co latam and isa. turning to slide 8, we see that natura & co reached brl60.2 million in underlying net income in the first quarter, reversing the negative brl64.1 million [phonetic] we posted in q1 last year. the sharp 122.8% improvement in q1 was driven mainly by the strong increase in ebitda and the line net income excludes avon acquisition-related effects of brl215.3 million. this include transformation and integration costs of brl134.1 million in the purchase price allocation amortization effect for brl111.3 million. this was partially offset by positive discontinued operations expense of brl28.7 million and positive non-controlling interest of brl1.4 million.
i think it is important to take into account, natura & co posted a reported net loss in q1 of brl155.2 million. this marks a very significant improvement over the net loss of brl820.8 million in q1 of 2020, driven by higher ebitda and lower income tax expense, partially offset by higher depreciation of brl47 million and higher financial expenses of brl19 million.
slide 9, on slide 9, we look on our cash and balance sheet. we ended the quarter with a strong cash position of brl6.6 billion, in line with projections and well above our minimum thresholds. we continued to deleverage our balance sheet and at the end of the quarter, natura &co holding's consolidated net debt to ebitda ratio stood at 1.18 times, significantly, down from 3.93 times in q1 last year, including the effects of ifrs 16.
as roberto mentioned, we improved our indebtedness profile with a $1 billion sustainability linked bond issued by natura cosmetics with a guarantee by natura &co. the funds will be used to refinance existing debt, in line with the group's liability management plan to improve its capital structure. the seven-year note mature on may 2028, and carry an interest coupon of 4.1% to 5% per year. the second graph provides you with our amortization schedule and shows that even before the bond proceeds, we have cash far in excess of brl3.2 billion in debt maturing this year.
let's turn now to our performance by business unit, beginning with natura & co latam on slide 11. total net sales were up 24.6% in reais and 15.9% at constant currency in q1. this excellent performance was driven by growth in reais at both in natura and avon brands.
natura brand was up 29.6% in reais and 24.6% at constant-currency, supported by a strong performance across the board, both in brazil and hispanic latam, attesting to the strength of our digital social selling model and the robust innovation pipeline.
the avon brand reported another consecutive quarter of growth of 20% in reais and 8.1% in constant currency, briefing by key markets in hispanic latam. natura &co.'s clear leadership in the cft market in latin america was confirmed but euromonitor. the group recorded market share gains of 0.7 percentage points in 2020, reaching 12.5%. brazil was even stronger with market share of 17%, up a 4 [phonetic] percentage points over the prior year.
on slide 12, sales of the natura brand in brazil rose 12.6% in q1 with market share gains. growth was driven by continued digital social selling penetration and increasing the average number of consultants of 14.2% versus q1 2020 and higher volumes of most categories.
natura brazil's online sales, including e-commerce and social selling, were up 150% versus q1 2020, notably driven by consultants and online stores. at the end of q1, we surpassed 1.1 million [phonetic] natura consultant online stores with a significant year-on-year increase in the number of orders and visits.
the natura consultant loyalty index in brazil remained strong and business leaders' loyalty was also significantly higher versus last year. [indecipherable] consultant was down 3.5% in the quarter after 17 consecutive quarters of growth since the successful implementation of our segmented relationship selling module in mid-2017. this is a result of an increase in our consultant base since q3. this temporary [phonetic] dilutes productivity as new consultants are in early stages of building up their activity. over time, we expect this consultants to progressing higher productivity segments on our commercial module.
in spanish latam, the natura brand recorded spectacular growth of 60.4%, supported by all markets, notably, argentina, chile, and peru. natura saw productivity increase and an expansion in the consultant base of 19.4%. the quarter ended with a significantly higher consultant loyalty index in the region, up 530 basis points versus q1 2020. we also launched natura's e-commerce in mexico, completing the brand's e-commerce platform in the region.
turning to avon brand on slide 13. avon's integration in latam is on track with important progress in procurement, customer service, financial services distribution and digital. in brazil, the avon brand's revenue was down 2.8% in q1 2021, versus q1 2020. this decrease is largely is in effect of the preparation for the new segmented commercial model implementation. as we saw in 2017 at the natura brand, the structural change caused the drop in the number of representatives. with once the [phonetic] representative base stabilizes and the representatives' progress toward higher segment levels based on higher sales, we expect productivity growth to resume. volume was slightly up in the quarter, picking up in march.
a highlight of the period was the avon brand sponsorship in the reality show big brother brazil. this helped avon connect with younger consumer, strengthening the brand's power and improving consumer perception. the brand engagement with the show's audience in various online and offline platforms and we saw e-commerce sales nearly triple with record-breaking number of impressions in social media channels.
in hispanic latam, avon's net revenue grew by a strong 35.1%, supported by a higher activity level and high representative productivity, which helped offset the 5.5% [phonetic] decline in average number of representatives. growth was driven by fashion and home, and most beauty categories such as body care, fragrances, and face care. white-collar continued to be impacted by the pandemic effects.
on slide 14, adjusted ebitda for natura & co latam more than doubled in the quarter, growing by 119% to brl630.3 million, driven by revenue performance and operational leverage in brazil at the natura brand and hispanic latam, both at natura and avon brands. adjusted ebitda margin expanded by 530 basis points to 12.2%.
let's now move to avon international on slide 16. net revenue was up 11.4% in q1 in reais and was down 10.7% at constant currency. sales were impacted by the second wave of covid in certain markets, notable in central and eastern europe, and also by key categories like fragrances and cosmetics, which were more affected by the pandemic. avon gained market share in q1 2021 versus q1 2020 in western europe, driven by uk and in asia pacific. all regions improved share month-after-month, including avon stock countries. avon uk's market share increased for the fourth consecutive quarter and it became the third brand in the beauty market over the last 12 months, up from 10th one year earlier.
avon international's adjusted ebitda was brl97.4 million with margin of 4.1%, down 70 basis points due to the impact of lower revenue and higher strategic investments in digital and commercial areas to accelerate future growth.
on slide 18, we now move to the body shop, with sales up 47.7% in reais and 10.7% at constant currency, driven mainly by the uk and north america. we saw particularly strong performance of the at-home channel, up 121% [phonetic] and e-commerce, which was up 119% versus last year.
together, both channels represented slightly more than half of the total sales. and this growth more than offset the impact of the pandemic second wave in retail. about two-thirds of retail stores were open at the end of the quarter, while the uk and other markets in europe were under lockdown in q1.
ebitda rose by 45.4% to brl184.2 million, while ebitda margin was 14.7%, down 30 basis points year-on-year. this largely reflected the impact of the buyback of the japan head franchisee. excluding this effect, ebitda margin would have been up 110 basis points versus last year to 15.4% despite the pandemic's impacts or with daily sales and channel mix.
on slide 20, aesop again recorded an outstanding performance. net revenue was up by exceptional 71.9% in reais and 30.6% at constant currency in the quarter. aesop growth in all regions. performance was particularly strong in asia, with sales up 67% at constant currency. revenue grew by 6% globally, supported by strong positive like-for-like growth in asia. although stores remained closed across europe, in canada and parts of australia, online again offset the retail impact with impressive growth of 102%. online sales accounted for 29% of total revenue. q1 2021 ebitda more than doubled to brl156.6 million with ebitda margin of 26.7%, up 390 basis points, driven by top line sales growth, higher ebitda, notably in asia and cost efficiency.
let me now handle back to roberto.
roberto de oliveira marques -- chairman
thank you, filippo. let me now conclude on slide 23 with the key takeaways. first of all, we are on a sustainable growth path. the natura brand continues to post double-digit growth, both in brazil and latin america, while the avon brand is growing in hispanic latam.
the body shop and aesop continue their strong growth, even with retail being impacted by the pandemic. second, natura & co omni-channel model has shown its strength throughout the covid-19 crisis, helping to offset the impact of the pandemic. all of our businesses are increasingly omni-channel and digitalization of consultants and reps continues to gather momentum. digital social selling and e-commerce have been key to our strong market outperformance in the quarter.
let me now conclude on slide 23 with the key takeaways. first of all, we are on a sustainable growth path. the natura brand continues to post double-digit growth, both in brazil and latin america, while the avon brand is growing in hispanic latam. the body shop and aesop continue their strong growth even with retail being impacted by the [indecipherable] completed the issue of our $1 billion es&g bond. so, while the covid pandemic is far from over and we continue to be vigilant, we continue to grow and progress on our strategic initiatives.
thank you very much for your attention and we are now going to open the q&a session and filippo, jp, and i are happy to take your questions. so, the floor is now yours.
",":
operator
ladies and gentlemen, we will now begin the question-and-answer session. [operator instructions] richard cathcart with bradesco is online with a question. please, go ahead.
richard cathcart -- bradesco
hi, good morning everyone. two questions for me. the first one on the natura & co latam business, very big increase in margin there and even when we compare to pre-covid levels in the 1q19 pro forma numbers. so i just wanted to -- if you could give us a little bit more color on the various drivers of margin improvement, natura versus avon and also brazil, latin america and perhaps what we can expect through the rest of the year? and then the second one, just a quick one, if you could give us any color on mother's day, obviously an important day for you guys for the sector as a whole, we get positive feedback from other retailers. so it would be interesting to hear your feedback as well? thanks very much.
roberto de oliveira marques -- chairman
hi, richard. roberto here. thanks for the question. i'll kick off here and then i'll turn to jp. so on the margins, we are very pleased with the margin progression. but, i would also remind everybody that we have some of the synergies kicking in, which is very encouraging to see that they are materializing, it's helping us navigating some of the pressures that we're seeing in some of our raw materials, etc. so we'll continue to monitor that, but we're very pleased with the efficiency that we are seeing in distribution and manufacturing and really materializing in margins.
i'll turn to jp to talk a little bit about hispanic latam that we're very happy with also the progress in margin and also a little bit of mother's day.
so jp, please.
joao paulo ferreira -- chief executive officer
hello richard. so the market in latin america has been seeing a very modest growth, slightly better in hispanic latin america than in brazil in the beginning of the year. natura has been riding on significant advances in brand power and brand preference, and amazing market share gains, as throughout last year. so that gave us a base of continued growth. i remind you that the share of the natura brand in many of the hispanic latin american countries is still below our fair share, particularly in the northern part of the region, colombia and mexico. so on that base, you saw that amazing growth and there is our reasons to think that that's going to continue.
similarly with avon, now we are benefiting from the quick wins, the harmonization of various commercial practices, i've talked about in previous occasions, also the much sharper selection within our portfolio there, of categories cross country [phonetic], hero brands, and we could use the mix of different categories in our favor.
so, we're pretty happy to see avon growing again in hispanic latin america with a very smaller dispersion as well in terms of the various markets. so all-in-all, that volume increase also helped us with margins, of course, plus the synergies that roberto referred to.
richard cathcart -- bradesco
that's perfect. thank you very much. perhaps just quickly on mother's day. if you could?
joao paulo ferreira -- chief executive officer
here in latin america, we are pretty pleased with the performance of our mother's day campaigns throughout the channels and the brands.
richard cathcart -- bradesco
okay, thanks so much.
operator
robert ford with bank of america is online with a question. please, go ahead.
robert e.ford -- bank of america
hey, thank you, and good morning everybody. and congratulations on the quarter. yes, i was hoping maybe you could discuss some of the changes that accompany the new rep compensation model in brazil at avon. clearly there is, there appear to be some changes in terms of the profile of network leaders and there is certainly a cultural change and the new kpis. i mean i was hoping you could expand on that to the extent it's not strategic. and given your prior experiences and learnings, and now greater scale, how long do you think it will take to stabilize the network in brazil and then begin to grow reps and productivity rates?
joao paulo ferreira -- chief executive officer
hello rob. jp here. so the nature of the change of course. well, first of all, the rollout happened toward the end of the first quarter. so, a significant part of the quarter was dedicated to preparing the ground for that, which include changes in the sales structure, significant changes in the sales structure.
now, as regards with the representatives, they are now on a model that values lifetime value and progression and segmentation which has to be communicated again and again to cascade down that huge network. and as with regards to sales leaders, they are now required to dedicate time to developing those reps, so that -- teaching them more about the products and how to get to develop their client base and by large -- rather than just acquiring new reps.
so the changes are important. based on natura's previous experience, we expect the system to stabilize within one to two quarters. so the second half of this year, it should be stable again.
roberto de oliveira marques -- chairman
rob, the other thing that i would add, which is also important in this change on the commercial model, it's not just happening in brazilian latin america for avon. i mean, brazil, as jp said, already implemented that and we are encouraged by the early results, but we are doing the same thing at avon international. and in fact, we already have two pilots with a new segmentation model implemented, one in south africa and the other one in the nordics. and the results are pretty encouraging from increase retention productivity and the goal for avon internationally to expand to four key markets in the second half of this year and then really for all markets in the first half of next year. so, again, applying all the learnings, all the kpis, all the lifetime value approach that natura has taken very successfully, it's now being implemented at avon, both in latin america and avon international.
joao paulo ferreira -- chief executive officer
and i guess, i should have said, roberto, that the results in brazil for avon are above our expectations.
roberto de oliveira marques -- chairman
correct, right.
joao paulo ferreira -- chief executive officer
[speech overlap] very pleased, bob.
robert e.ford -- bank of america
and then just one, my second question is as you integrate avon into the natura systems platform, what functionality does that enable across administrative and commercial considerations?
roberto de oliveira marques -- chairman
so, i will start, i mean on the administrative thing, i mean especially in latin america, we are integrating more. but i would say, even there are some now integration that goes beyond north america. so hr platform now, it's been integrated. so we now have all associates in latin america under one platform from compensation, benefits and those things were not small undertakings and that's done.
we now are doing the same thing in some of the other areas, of course, the whole supply chain in procurement, distribution, manufacturing, it's coming and that's producing some of the synergies already that are helping us with gross margin. in terms of the commercial one, i'll invite jp to talk a little bit about the platform, especially with social selling and some of the plans for integration here.
joao paulo ferreira -- chief executive officer
yes, i think it's worth mentioning. for instance, the credit card [phonetic] collection engine, which is now been fully integrated improving the way we assign credit and also reducing delinquency rates. the other one i think it's worth mentioning is the crm. so the way we now can track with those transactions, the representatives and use the same crm algorithms that we use for not natura now adjusted for avon which is already helping to drive additional revenues.
and, of course, on the social selling tools that we keep spreading across all the various countries, you're aware of, producing sharing content and linking it back to their online stores.
robert e.ford -- bank of america
great, that's very helpful. thank you very much.
operator
helena villares with itau is in line with the question. please, go ahead.
helena villares -- itau bba
hi guys, good morning. thank you for taking my question. so my question goes to bs [phonetic]. we are very interested in the growth, the company, the brand has been showing in the last quarters, it's much above the historical level that we had seen. so what we are trying to understand here, if this new channel, the online and the at-home channels, if they are able to reach new clients, new type of clients, and if so, what kind of new public are you able to reach, are you able to skill that the brand is being, it's achieving their purpose in these new channels? that's the first question. and in this sense, what kind of growth we are already seeing coming from asia for this brand or it's very early stage yet and we can see much more growth coming from asia? that's our question. thank you.
roberto de oliveira marques -- chairman
hi, helena. roberto here. thanks for the question. you're right and we are seeing, in fact, this increase in e-commerce and at home through social selling and really bringing also different profiles of customers to the body shop, interesting -- this is not just in isolation.
while we are seeing a tremendous job by the body shop team is really -- we igniting the brand to its purpose. right? a more activist, a brand that has no clarity in terms of its position in the marketplace. i mean we just launched a couple of products, some iconic brands and like the white mask, [indecipherable] and those things are really resonating with existing customers, but also attracting new customers, which also gets enhanced by this expansion of the e-commerce and the at-home.
so we are very encouraged by those results, and i think as we also started to reopen stores, some of the new store designs that is somehow we stopped some of the rollout last year, as we also progress and expand some of those new layouts, which we feel stations and everything else, we also think that this will create more momentum. on asia, i still think that it's early for the body shop. we are seeing spectacular results on aesop. i think there is a lot of upside in asia for the body shop as we know. we acquired the head franchisee in japan, there is some early good indicators, but there is a lot of opportunity and upside for the body shop in asia, particularly in japan.
helena villares -- itau bba
thank you.
operator
ruben couto from santander is on with the question. please, go ahead.
ruben couto -- santander
good morning, everyone. can you share more color on avon performance in international markets, particularly in the uk. we were surprised with the jump to the third spot in the uk, specifically which is good news. in the earnings release you mentioned contribution from [indecipherable] behind this performance. but what is behind all of these, i mean, now thinking specifically about the categories, is there something related to new product launches? maybe to the relaunch of the brand globally or even related to improvements in sales channel. can you elaborate a little bit further on this performance and a second question actually a follow-up to richard's question on mother's day? i mean you have been highlighting over the best couple of views on how the natura brand manage to gain give and we noticed that avon had some developments in the same direction. i still understood that you guys were pleased, you think it's a pharmacy matters there.
yeah. can you hear me?
roberto de oliveira marques -- chairman
yeah, we can.
ruben couto -- santander
thank you.
roberto de oliveira marques -- chairman
yes, we can hear. can you hear us?
ruben couto -- santander
yeah, i can. sorry about that.
roberto de oliveira marques -- chairman
okay. okay. no, no worries. thank you for the question, ruben. so on avon international and in particular uk, we are seeing really significant improvement in many fronts. one, we made already some changes on the earnings model for the reps in uk, which again we simplify and has been applied now in many other markets at avon and that is creating more traction with the channel. we are seeing productivity increase in uk.
the channel is growing, which is very encouraged. so that's one factor. the second is digitalization. uk has been the market that we've been applying more the social selling, the e-brochure, and we are seeing quarter-after-quarter strong increase in adoption of the digital platforms and very strong increase in terms of sales through e-brochures, so that's point number two. and point number three, we are seeing traction in some of the new products. our protanal [phonetic] is really working very well under a new and creating some good momentum specifically for the uk market.
so i think it's a combination, but if i were to tell you one thing is probably, again the commercial model, the simplification of the model and getting more traction with the reps combined with the digitalization.
joao paulo ferreira -- chief executive officer
also, he also asked about gifting for avon. so yes, gifting became one of the areas of opportunity for avon. we are developing that offering based on our learnings here in latin america, still isn't as important on relative terms as it is for natura, but it is growing.
ruben couto -- santander
got it. thank you, guys.
operator
andrew ruben from morgan stanley is online with the question. please go ahead.
andrew ruben -- morgan stanley
hi, thanks very much for the question. i was curious for a bit more detail on the rep count debt natura brazil. i'm curious with the newer consultants. if there is any color you can provide on how long a consultant takes to ramp and any sense on what you think now might be the right number of consultants if you're looking to increase the base versus, say, 1 to 1.1 million [phonetic]. any color there would be very helpful. thank you.
joao paulo ferreira -- chief executive officer
thanks for the question. so normally we look at consultants like beginners when they have less than one year in the activity and mature when we cross that line. productivity increases over time. that is well known. by the way, this is one of the reasons why you saw consultant's productivity coming down this quarter on an aggregate basis, due to a much higher number of beginners, which joined the network bid last year. and the very, very good news is that they were retained. it's not that they entered during the pandemic, the crisis, and went away, they were retained, thanks to the strength of that value proposition.
so that productivity should grow continuously right now in the coming quarters. now, our strategy has been for many years to try and get modest growth in brazil in the number of consultants, right, and a much more aggressive growth in hispanic latin america where there is still more room to increase that consultant base.
roberto de oliveira marques -- chairman
yeah, andrew, and again just to complement jp said, the very exciting thing is that the digitalization is attracting a different profile of consultants wrap in [phonetic] applying the same lifetime value segmentation. we expect that -- also is going to translate in higher productivity down the road, but it's exciting to see the channel expanding with a different profile because of the now enrollment in all the process being done through social selling.
andrew ruben -- morgan stanley
great, that's very helpful. thank you.
operator
tobias stingelin with citi bank is online with a question. please, go ahead.
tobias stingelin -- citibank
good morning, everybody. thank you for taking the question and congratulations on the strong quarter. i have two quick ones on my side. and just for going back to your team, already talked about, so going back to avon brand in brazil. it was very interesting discussion, a very helpful color on the rate base. but i wanted to explore more productivity. and you mentioned in the release that wants to the base stabilizes you expect incremental productivity? so if could give us any color on how that, how should we expect that productivity to evolve going forward would be very interesting and very helpful. and the second point, in the hispanic latam, you talked about -- productivity is very, very strong and you remained so -- but looking into the e-commerce impact and you mentioned that you launched the e-commerce platform in mexico. so, how do you expect these dynamics to going forward? right. how do you expect the e-commerce platform to impact the productivity in the region. it would be very, very helpful as well. thanks.
joao paulo ferreira -- chief executive officer
thanks for the question. so as regard with avon's representative productivity in brazil. the commercial model that has been introduced is to foster productivity increase similar to what happened in natura. so if you go back to early 2017 and see how the productivity went up, productivity went up quarter after quarter.
so this is what we are aiming at for avon, right. so that's number one. as regards to introduction of e-commerce in some other geographies across the region, well, first of all, that allows us to achieve new customers, new shoppers in different shopping occasions. we increased the base of customers we have. and as consultants learn how to operate their online stores, that also increases their productivities as they can reach new clients, which they wouldn't be able to do otherwise.
tobias stingelin -- citibank
thanks, jp.
operator
irma sgarz with goldman sachs is online with the question. please, go ahead.
irma sgarz -- goldman sachs
yes, hi, thanks for taking my question. i was curious, we're hearing a lot about the different input price pressures that companies across globally -- but also specifically in brazil are experiencing. so i was just curious about how you're thinking about price increases across your brands, specifically in brazil, but maybe also in some of the other markets where specifically where you are experiencing pricing pressures and how you're thinking about the ability to raise prices versus the ability toward the consumer to absorb any potential price increases? thank you.
roberto de oliveira marques -- chairman
hi, irma. i was started and then maybe, filippo if you want to complement. so listen, we are seeing and we continue to be monitoring that carefully i across all geographies. but as you saw, actually our gross margin across all business went up this quarter. and the reason for that is twofold, one, as we mentioned, we are seeing some of the synergies, the efficiencies kicking in and any most part is also impacting the gross margin. so that's helping us on one hand. on the other hand, we are also doing revenue management across all business in terms of portfolio promotion and make sure that we are managing that through. as you know, i mean, taking the body shop over the last two years, we were able to reduce discount by a magnitude of about 30% to about 15% on average.
so, managing the portfolio promotion schemes, some categories is probably the first line of defense against this on top of the synergies and the efficiencies that we are having across our network. and again, i would also remind all of you that we now as we updated our synergies, we included some synergies that are coming outside of latin america. and one example of that is moving the production of body butters to avon poland manufacturing and that is creating a lot of efficiencies also for the body shop, for example.
so we'll continue to monitor the situation. we think the team has done incredibly well in being able to offset thus far, resulting in increase in gross margin, but it is one area of attention and that will continue to be monitored.
filippo, do you want to add something?
jose antonio de almeida filippo -- chief financial officer
yes, hi, irma. yes, we will be facing pressures definitely as all of the industry in terms of commodity prices inflation some effects as well. this is not something that's not new for us. we've been dealing with this for a long time. i think that's important to recall about our relationship with the supply chain that we take -- it's very differentiated than we managed that very well. but also like roberto said, there is a lot of opportunities and we are already executing in terms of synergies and efficiency gains on this, like merging distribution centers, planning logistics [phonetic], a lot of opportunities there also we will take into account, and using that can kind of help us on addressing those challenges in terms of the cost.
irma sgarz -- goldman sachs
thanks.
operator
[operator instructions] joseph giordano from jp morgan is on the line with a question. please, go ahead.
joseph giordano -- jp morgan
hi, good morning everyone. thanks for taking my question. so there is actually a couple. and so the first one is on the cash flow generation. so the company is like quite [indecipherable] at this point very close to its target. so my question here is if we should be seeing you guys getting more active on the m&a front and buying like some niche brands like aesop and accelerate them on the new global platform. so that's the first one. and the second one is, like if you guys could provide some updates on the development of natura brand in asia, and here like particularly in malaysia? thank you.
roberto de oliveira marques -- chairman
hi jo. roberto here. thank you for the question. listen, we're very pleased with the deleverage and again how we continue to be -- progress in our capital structure. and again, very pleased with the successful bond issue that we did this quarter. but again, the plans that we share with the market and the guidance, was all based on organic growth, and that's the focus that we have right now.
of course, we have the responsibility to continue to monitor the market and we'll continue to do so in terms of opportunities, but i would say right now the focus is again on the integration, the turnaround of avon continue the momentum of digitalization across all of our business, great momentum of natura, body shop, aesop. so we still think that we have a runaway that is very exciting for the business with the organic growth.
regarding asia for natura as you know, we have a pilot in malaysia. i would say that it's still early. last year was of course a year there were so many variables and etc. that is difficult to really read.
so we continued to focus on getting the right portfolio, the right go-to-market, the right positioning. once we have more confidence about the model that we are testing with natura malaysia, then the goal is to expand to some of the markets. so hopefully, we'll get a better reading by the end of this year, and then we'll come up with the right plan.
joseph giordano -- jp morgan
perfect, thank you.
operator
this concludes today's question-and-answer session. i would like to invite mr. roberto marques to proceed with his closing comments. please, go ahead.
roberto de oliveira marques -- chairman
okay, thank you all for joining us and participating for the question. i want to just finish with two comments. one is, this week, we also heard that our brands were well recognized in terms of strengths through the brand financed by brand director ranking natura in fact was elected the strongest brand in cosmetic globally, which is really something that we are very proud of.
at the same time, the body shop, the first time came as part of the top 50 in the ranking which also shows the progress that the team has been doing and even continues to be within the ranking. so very, very encouraged by that. i want to also send a shot out to our entire teams, associates network for what we believe was a remarkable quarter under this still very challenging set of circumstances. so thank you all very much for that.
and thank you all very much for your attention and i hope you all stay well, taking care of yourselves and your families and loved ones in this very challenging pandemic. hopefully with the vaccines, we will be able to turn the corner. we are seeing some green shoots in some countries and that's encouraging, but there are a long way to go in some of the other markets. so, stay well, stay safe. thank you very much, everybody.
operator
[operator closing remarks]
duration: 56 minutes
call participants:
viviane behar -- investor relations officer
roberto de oliveira marques -- chairman
jose antonio de almeida filippo -- chief financial officer
joao paulo ferreira -- chief executive officer
richard cathcart -- bradesco
robert e.ford -- bank of america
helena villares -- itau bba
ruben couto -- santander
andrew ruben -- morgan stanley
tobias stingelin -- citibank
irma sgarz -- goldman sachs
joseph giordano -- jp morgan
more ntco analysis
all earnings call transcripts




"
