q,ticker,dt,prep_remarks,QnA
2020-Q3,NTCO,2020-11-13 09:00:00,"prepared remarks:
operator
good morning, ladies and gentlemen, thank you for waiting. at this time, we would like to welcome everyone to natura &co third quarter 2020 results. this event is being recorded and all participants will be in listen-only mode during the company's presentation. after natura's remarks are completed, there will be a question-and-answer session. at that time, further instructions will be given.
we have simultaneous translation into portuguese and questions may be asked normally by participants connecting from abroad either in english or portuguese. [operator instructions] this presentation may contain forward-looking statements. such statements are not statements of historical fact and reflect the beliefs and expectations of natura & co's management.
forward-looking statements speak only as of the date that they are made and the company does not undertake any obligation to update them in light of new information or future developments. this presentation also includes adjusted information prepared by the company for information and reference purposes only, which have not yet been audited.
i will now turn the conference over to mrs. viviane behar, investor relations officer of natura &co. ms. behar, you may -- the floor is yours.
viviane behar de castro -- investor relations officer
good morning or good afternoon to everyone. i'm viviane behar, natura &co's investor relations officer. thank you for joining us today for this call to present natura &co's third quarter 2020 earnings. i'm joined today by roberto marques, executive chairman and ceo of natura &co joseph filippo, cfo of natura &co, as well as joao paulo ferreira, ceo of natura &co latin america, who will join us for the q&a session. our investor relations team of natura &co is also with us.
the presentation we will be referring to during the call is available on the natura &co investor relations website. roberto will start with an overview of our performance. filippo will detail our financials for natura &co. after that, roberto will make concluding remarks and we will open the floor to your questions.
for the sake of timing, in order for us to accommodate questions from all of you, we would like to ask you to please limit yourselves to one or two questions each at the most in the q&a session. thanks for your understanding and cooperation on this. let me now hand over to roberto. roberto, please.
roberto de oliveira marques -- chairman
thank you, viviane, and hello to everyone. thank you for joining us. i hope you're all safe and well in this still challenging times.
let me begin on slide 3 with our q3 highlights. overall, we posted a very strong performance in q3 amid the continuing pandemic with a robust 32% sales growth, significantly outperforming the global cft market and with a strong ebitda and margin improvement as well. we saw growth in all of our businesses driven by natura &co in latam with strong growth in natura and avon in brazil, showing continued productivity improvement and the strength of our digital social selling model.
the body shop and aesop saw further acceleration in digital and e-commerce even as retail gradually reopened. avon international's fundamentals show improvement with early positive sign in some key markets. digital social selling continued its strong acceleration with group e-commerce sales doubling in the quarter. i'm also pleased to announce a new step in our digital journey with the launch of &co pay, our proprietary financial services platform. &co pay will help drive productivity for our consultants and representatives by allowing them access to key financials, while promoting digital and financial inclusion.
&co pay launches first in brazil, will be rollout in latin america and then globally within the next couple of years.
second major highlight, the continued progress we made on the integration of avon, which is proceeding according to plan. synergies are on track with $18 million captured in q3 and we made further progress in working together, including cross-company manufacturing, distribution, storage and combined logistics contracts. we also initiated a pilot of avon's new commercial model in brazil, then will be mexico early next year and also in south africa, capitalizing on learnings from natura.
at avon international, we move to monthly campaign cycles from two to three-week cycles in five markets, including the uk, which will simplify the business model and reduce costs. the avon brand relaunch begun with the rollout of the watch me now campaign in mid-september through online and digital channels in over 30 countries.
third key highlight, our esg agenda. we are very pleased to announce that aesop was certified as a b corp, joining now natura and the body shop. also, in line with our 2030 sustainability commitments, we are partnering with the united nations on two key initiatives, ambition's 1.5 degrees celsius and target gender equality, both a test to our determination to tackle issues of climate change and diversity and inclusion. we also participated in amazonia day with natura, and in breast cancer awareness month led by avon with education programs for millions of women around the world.
and four major highlight. we strengthened our financial structure in october with the successful completion of a $1 billion capital raise. that was the largest ever in the latin america consumer space. we do appreciate the strong vote of confidence from the market and the credit rating agencies, which attest to the attractiveness of our group and validates our strategy. the capital raise was done to optimize our capital structure by accelerating deleveraging through the prepayment of the avon 2022 bonds. and it allow us also to make investments, accelerate strategic priorities, including the avon integration, group digitalization, geographic expansions and the 2030 sustainability commitments.
let me end here by saying that while we have seen a very strong quarter and a return to some normalization in our retail operations, the covid-19 pandemic is far from over. we are closely monitoring its evolution worldwide, particularly the recent lockdowns or restriction measures adapted in parts of europe. in this context, i would like to thank our teams across the group and across the world. our excellent performance in this challenging times that we face is the result of their efforts, purpose-driven, resilience and dedication.
let me now hand over to filippo to go into our financials in greater detail.
jose antonio de almeida filippo -- chief financial officer
thank you.
operator
thank you, roberto. and hello to everyone. on slide 5, you see that we posted very strong consolidated sales growth in the quarter of 31.7% in reais and 11.6% in constant currency. excluding the phasing effect of the q2 cyber incident, sales were up 26% in reais and 6.7% at constant currency, significantly outperforming the global cft market.
natura &co latam's revenue increased by 29.5% in reais and 20.1% at constant currency. the natura brand performed particularly well growing by 41.2% while the avon brand grew 19.3%. the body shop and aesop also had very strong performances with sales in reais up 51.9% at the body shop and 8.2% in constant currency and aesop revenue up 67.2% in reais and 19.9% at constant currency. avon international's revenue increased 22.5% in reais, down 7.3% at constant currency. in the nine-month, consolidated net revenue increased by 7% in reais and was down 5.8% at constant currency. as roberto mentioned, we managed to largely offset the impact of the covid-19 pandemic in our business with a rapid pivot to online, complemented by the gradual reopening of retail stores throughout the quarter.
on slide 6, the group's online sales grew 115% in the quarter, supported by 83% at the natura and avon brands to 164% at aesop and 102% at the body shop. at the natura brand, content sharing grew by 170% since q1, online orders grew by 45% year-on-year and consultant online stores increased by 75% versus the same quarter of last year and touched the 1 million mark. at avon international, sales via representatives sharing e-brochures more than doubled. the number of consumers accessing the e-brochure was up 70% and e-brochure sales in the uk grew by 300%.
slide 7 shows that we posted very strong 71% increase in consolidated adjusted ebitda reaching more than brl1.5 billion, excluding transformation costs. adjusted ebitda margin in the quarter was 14.8%, up 330 basis points. the strong growth in adjusted ebitda was supported by cost discipline across all businesses and was notably driven by solid ebitda at natura &co latam and followed by the body shop and aesop. in the nine months, adjusted ebitda reached more than brl2.7 million with adjusted ebitda margin of 11%, down 60 basis points.
turning to slide 8, we look at natura &co's underlying net income. in q3, it stood at brl587.1 million, up 2.6%, excluding avon acquisition effects and transformation costs. the growth in underlying net income was driven by higher ebitda and lower income tax expense, partially offset by higher depreciation and financial expenses. reported net income was brl381.7 million in the quarter, up 1.3%. in the nine months, underlying net income reached brl88.5 million with reported net loss of brl827.6 million.
on slide 9, we show that we have strengthened our balance sheet by the $1 billion capital raise that we successfully completed last month. in the quarter, we had strong cash generation of brl793 million, which allow us to end the quarter with brl8 billion in cash before the capital raise. we used the proceeds from the capital raise to prepay avon's $900 million bonds due in 2022 in the beginning of this month. this would allow us to accelerate deleveraging, reduce us denominated debt, currency volatility and high interest costs.
as you see on the graph, our net debt-to-ebitda ratio was 3 times at the end of q3, down from 3.63 times at the end of q2 and it drops to 1.38 times post the prepayment of avon bonds. attesting to the strengthening of our balance sheet and improved credit profile, we were upgraded by s&p and fitch in october and early november respectively. the rating outlook by both agencies has also been revised to stable from negative. the second graph provides you with our amortization schedule and shows that we have limited debt maturities this year of brl100 billion with an average maturity of 3.4 years.
let's turn now to our performance by business unit on slide 11 beginning with natura &co latam. total net sales were up 29.5% in reais and 20.1% at constant currency. ex cyber incident, net sales were up 21.2% in reais and 12.6% at constant currency, driven by the natura brand whose sales were up 41.2%. the brand strongly outperformed the cft market in brazil and posted solid growth in hispanic latam. avon showed early positive signs with 19.3% growth in reais and 9.9% in constant currency. ex cyber incident, sales were up 3.3% in the quarter in reais and up 6.1% in brazil. this was driven by increased representative numbers and higher activity.
on slide 12, we look at the natura brands. sales at the natura brand in brazil rose 30.5% in q3, which represents an exceptional performance with continued brand preference and market share gains. this demonstrates the success of our social selling model, which led to the 16th consecutive quarter of higher productivity in brazil, up 13.8% even with the higher consultant base, which increased by 12.8% year-on-year to nearly brl1.2 million. in hispanic latam, net revenue grew by an impressive 65.7% in reais and 32.7% at constant currency in the quarter. we saw growth across all markets, notably argentina, chile and mexico. the average number of consultants increased by 13.3% versus q3 2019 to 759,000.
turning to avon on slide 13. the avon brand's revenue in brazil grew by 24.9%. ex cyber incident, avon's growth was 6.2% in q3, the first growth since q4 2018 supported by higher activity level and number of representatives. in hispanic latam, the avon brand posted revenue growth of 15.7% in reais and was down 3.3% in constant currency. ex cyber incident revenue increased 1.4% in reais and was down 14.9% at constant currency. the region saw improving trends toward the end of the quarter with key markets such as argentina, mexico and chile posting growth in september in constant currency.
on slide 14, adjusted ebitda for natura &co latam nearly doubled in the quarter reaching brl1 billion, driven by strong revenue growth and operational leverage at both natura and avon. adjusted ebitda margin was up 560 basis points to 16.5% with improvement at both natura brazil and hispanic latam. avon brazil also contributed to this increase helped by operational leverage and the positive impact of sales from the cyber incident.
let's now move to avon international on slide 16. net revenue grew 22.5% in q3 in reais and was down 7.3% at constant currency. ex cyber incident, sales were up 19.5% in reais and down 9.6% at constant currency. most markets showed signs of recovery from the impact of covid-19 notably in western and central europe. key markets such as russia and turkey reported growth versus q3 2019, offset by markets still impacted by strict lookdowns such as south africa and the philippines. adjusted ebitda was brl183 million with margin of 7.4%, down 200 basis points as a result of the impact of lower constant currency revenue, foreign currency impacts, higher sales leaders and field investments accelerate to recover revenues and also ifrs conversion adjustments in g&a.
we now move on to the body shop on slide 18. net revenue increased by a very strong 51.9% in reais in q3 and by 8.2% at constant currency, driven by growth in the uk and australia as well as the direct sales and online channels. the direct sales at-home grew 333%, supported by 261% growth in consultants and online sales increased 103%, helping offset slower retail sales as a result of the pandemic. owned stores like-for-like sales decreased 16.5%, but by the end of the quarter, 97% of retail stores had reopened. adjusted ebitda in q3 increased 81.1% to brl308.3 million with margin of 22.3%, up 360 basis points, driven by revenue growth, lower discounts, reduced discretionary spend and covid-19-related government support.
on slide 20, aesop posted outstanding net revenue growth of 67.2% in reais and 19.9% in constant currency. this performance was driven by strong growth in digital sales, offsetting partial retail closures related to covid-19 in markets such as the us and australia. while retail like-for-like sales were down 16%, online sales were up 264%. q3 ebitda stood at brl154.4 million, up an impressive 121.6% with ebitda margin of 31.3%, up 770 basis points, driven by top line sales growth, target cost reduction and utilization of government support programs to mitigate the impacts of covid-19.
let me now hand back to roberto.
roberto de oliveira marques -- chairman
thank you, filippo. let me now conclude on slide 22 with the key takeaways. first of all, natura &co's omnichannel model has shown its strengths in the past quarter and, more generally, throughout the covid-19 crisis. all of our business and brands are showing resilience and increasingly becoming omnichannel. e-commerce and digital social selling drove also strong results this quarter. we are planning increased investments in those areas to further build on this momentum.
we posted a strong performance in latin america, driven by natura and avon in brazil. the integration and digitalization of avon is progressing well with some early positive signs in our q3 numbers. our digital journey took another step forward with the launch of &co pay. our esg agenda is advancing as demonstrated by aesop becoming a b corp and our active involvement at un climate week.
lastly, we have optimized our capital structure. with the successful $1 billion capital raise, we continue to deleverage our balance sheet. and we have further resources to boost investments in key areas to accelerate growth. that position natura &co very well for the future.
so this has been a rewarding quarter despite challenging circumstances. and i'd like to conclude by expressing, once again, my gratitude to the teams across our group who enabled this performance. thank you very much for your attention. we are now going to open the q&a session with filippo, jp and i and are happy to take your questions. so, the floor is now yours.
",":
operator
[operator instructions] we have a question from helena villares from itau bba.
helena villares -- itau bba -- analyst
hi, guys. good morning. thank you taking my question and congratulation for the results. my first question is actually for jp. we wanted to expand a little bit more about natura brand dynamic. we saw very strong results in terms of top-line and profitability this quarter. and what we are trying to understand here is about the market share gain that you showed. so we are just trying to understand if you have any kind of kpi figures that you could share with us to understand how much of these market share gains is going to be sustainable for the next -- for the coming quarters and next year. so that's our first question. maybe something about clients -- new clients, the profile of new clients could help us a little bit.
and the second question is about the body shop. this is actually about direct sales for the body shop, so it's a complete new channel and what we are trying to understand here -- and what we are trying to understand here is about the consultant profile. so, how -- who is this consultant? why do you think that's going so well? and how you are seeing this channel for the future? thank you.
roberto de oliveira marques -- chairman
hi, helena. roberto here. how are you? we're going to start -- i'll ask jp to talk about natura brand and the market share. and then i'll take the body shop. so, jp, please.
joao paulo brotto goncalves ferreira -- chief executive officer, latin america
hi, helena. thank you for the question. so, indeed we are experiencing market share gains in the natura brand in brazil. the market year-to-date has grown modest single-digits. however, in q3, the market is stumped [phonetic] by all the momentum centered [phonetic], the market has grown high single digits in q3. nevertheless, when you compare that to natura's performance, yes indeed we have gained significant market shares.
as has been the case of the natura brand in the last four years, so we have succeeded in gaining and sustaining market share continuously over the last four years. for this period, there are some new elements as we sort of indicated. we saw an increase in new consultants, which were recruited fundamentally through digital channels. these consultants are tech-savvy, they are younger -- some 10 years younger than the average of the network, and they already bring new customers, which are also more used to online or digital shopping, if you will. that has also come together with a strengthening of the brand. the way the company and the brand expressed themselves during the pandemic was completely in tune with the society's concerns. and that reflected in brand preference and brand desire, following from also a continued launch of new products didn't stop through the pandemic.
and just to finalize, we saw consultant's loyalty increasing to levels that we have not experienced in the last years. so with all that combined, the ability to acquire new consultants, acquire new shoppers and the omnichannel solutions for the shoppers and consumers and the strengthening of the brand, we are well positioned to retain that acquired market share. to a lesser extent, that's also what we've witnessed with the avon brand in that period and i can give you more details later. roberto?
roberto de oliveira marques -- chairman
thank you, jp. helena, on the body shop at-home, there is some similarity to what jp just said in brazil. what we are seeing on at-home is an exponential growth, right. so we are seeing this quarter over 300% growth in the two markets that we have at-home, primarily uk and australia. as you know, we are expanding now at-home into the us. we are already present in a very short period of time in 50 states, recruiting about 4,000 consultants. the profile of those consultants tends also to be more tech savvy, therefore, more native in digital, social selling. but one thing that is very important, which i think jp alluded to, is the very symbiotic connection with the brand identity, right.
and the strength of the body shop brand now, especially in the uk, is also driving the recruitment of new consultants into the brand. so, the whole effort of the brand rejuvenation, the activists, positioning of the body shop, it's helping bringing a profile of a younger, more digital savvy consultants into the profile of the at-home business. and that is helping accelerating the social selling at the body shop at-home business.
helena villares -- itau bba -- analyst
great. and just a follow-up about this subject because you just talked about this for natura and the body shop. so, we think here that maybe this (technical issues).
joao paulo brotto goncalves ferreira -- chief executive officer, latin america
absolutely. and that's why -- yeah, so helena, that's why one of the key priorities for avon is the rejuvenation of the brand because we think that is also -- there is a very strong link on our ability as we strengthen the brand and we make the brand more relevant to also attract new consultants with a more social selling profile. and that's one of the things that we're very excited about it as we roll out this quarter over 30 countries the new positioning of avon brand, watch me now campaign, which exactly try to make that connection even stronger.
operator
thank you. our next question comes from robert ford from bank of america.
robert ford -- bank of america -- analyst
hey, everybody and congratulations on the quarter. jp, in addition to the changes from the commercial model, what makes you optimistic in terms or most optimistic in terms of the broader turnaround of the avon international based on what you're seeing in the latam network when it comes to brand or consultant digitalization or the synergies in brazil? and how is that being transferred and prioritized for avon international?
roberto de oliveira marques -- chairman
hey, bob. so let me start on the avon international and then i'll ask jp to comment on brazil. of course, avon international to your statement, we are taking a lot of learnings from natura on the commercial model on the segmentation. those things, to be honest, hasn't been implemented yet, ok. so that's still to come, right. so we are planning a pilot with south africa using the kind of the same framework of segmentation from natura actually planned to be implemented in q4 this year.
jp will comment on some pilots as well in latin america. but while we are already seeing at avon. i would call some quick wins at avon international, is we are seeing increase on the channel additions, especially on four key markets growing double-digit and the retention is also increasing. so we are seeing a lower churn. and again, those are things that were ready then, call it quick wins, on the earnings strategy of avon international and we are starting to see market share gains. so we saw market share gain for the first time in uk, russia, poland, which is encouraging.
but i want to be clear, there is still a lot to be done. the true change on the commercial model and segmentation yet to be implemented, but we are seeing some positive wins, especially in terms of making the channel a little easier for new consultants to come in, driving digital tool adoption to a much higher level than what it used to be before. so all those things are contributing to some increase in productivity as well and number of actives reps, especially in some of these key markets.
so turn to jp to comment specifically about brazil and some of the things in latam.
joao paulo brotto goncalves ferreira -- chief executive officer, latin america
hi, bob. so we are indeed positive about the more recent results of avon across latin america and in brazil, in particular. and they are -- based on quick wins, they are not yet the structural changes, as roberto pointed out. but they -- it suggests what the path that is ahead of us. starting with the brand, we resumed investing behind the avon brand. so, for instance, in brazil, avon advanced 10 positions in the merco reputation ranking. we also resumed communication advertising the new power stay in line couple of weeks ago. and only two days ago, we launched the new black skin line with outstanding technology very relevant for our market and still associated with social causes related to inclusion. so that is pointing toward the relaunch of the avon brand that is to be seen here in latin america early next year but already started in other geographies.
we also talked about strengthening the relationship with the representatives. and in this period, avon in brazil as well as avon in mexico reported highest satisfaction indices -- representative satisfaction indices of the last many years, which is showing that the proximity with the field, some of the incentives that are being put in place are also in the right direction. so with that combination, we are starting to be able to sell the sort of tailwinds that we have been living through in these markets. now that gives us the confidence that when the structural changes come early next year based on the pilots that are already going on, we will be able to sustain the positive momentum that is growing through avon brand across the entire latin america.
robert ford -- bank of america -- analyst
thank you very much. and just one follow-up. and that is, there is a big step up in the sg&a in avon international. and i was hoping you could give some additional color on how you're channeling those resources.
joao paulo brotto goncalves ferreira -- chief executive officer, latin america
yeah. hi, bob. how are you? i think that what we saw is more on less dilution on some of those expenses. i don't think this is a trend. i wouldn't consider that. i think they're very specific that you see here. but i believe there is -- and as i said, there is a lot of programs that were put in place and it shouldn't be efficiency. also in terms of avon international, we have to see there were investments also in the channel. so it helped us a lot and that impact. so i don't think that is something that could be considered as a trend. it's just a situation that we had, specifically in the quarter. and then, i don't think this is a standard i can see going forward.
operator
thank you. our next question comes from richard cathcart from bradesco.
richard cathcart -- bradesco -- analyst
hi, guys. good morning and thanks very much for taking my question. just wanted to ask a little bit more about the performance of avon in the uk. i know it's a market that you're doing lots of testing and piloting. and so, just in addition to the implementation of the digital tools in the channel, could you just talk a little bit more about what the drivers of the market share gains are in the uk over the last couple of quarters.
and then, the second question was just whether you could give us an update on your plans for building out a bigger presence in china. thanks.
roberto de oliveira marques -- chairman
hi, richard; roberto here. so, you're right, i mean, we are putting a lot of focus in uk on social selling and really we are seeing is an incredible increase in the adoption of social selling tool in uk. one data point is, the e-brochure sales were up in uk almost 300% this quarter. so really this is a key driver of the market share gain. i also would say that we are putting more focus on the simplification of the portfolio of avon on the catalogs and the campaign uk moved now also to a monthly cycle. so all those simplification focus on the key categories and the key brands and the adoption -- a heavy adoption of digital tools, e-brochures are really the key drivers of the market share gain in uk.
uk for us is a market that we'll continue to invest and continue to drive a lot of the social selling tools, new campaign, the watch me now campaign. it's just online campaign. uk will benefit also from that. so still a lot to be done, but we are seeing some early wins, early signs, positive signs that are very encouraging in uk.
regarding china. china, it's early stage for us, but we are now very committed to make a more robust entry in china, especially with aesop and the body shop. we already established our natura &co legal entity and the body shop and aesop. we are now starting the process of product registration that will take probably about the first half of next year. of course, we have been very careful in working with the right provinces to make sure that the way we do it will continue to align with our values of not -- no testing in animals. so we are potentially planning to have a first physical store likely to be aesop in shanghai in the fourth quarter of next year and then as we enter 2022 expanding that also with the body shop.
richard cathcart -- bradesco -- analyst
perfect. thanks very much, roberto.
operator
we have a question from ruben couto from santander.
ruben couto -- santander -- analyst
hi, everyone. can you talk a little bit more about &co pay. this seems to be a very interesting new initiative. so i wanted to understand what is the difference compared to the previous financial solution that you already offered to consultants in partnership with banks. and i also wanted to understand what to expect in terms of resources, is this kind of a initiative aimed chiefly to improve consultant's productivity and benefits that will give to the channel or could we expect incremental features that eventually could be monetized in bringing direct contribution through fee revenues or other source of revenues. thank you.
roberto de oliveira marques -- chairman
hi, ruben. roberto here. i would just start saying that &co pay, it is something that we're going to treat as a business unit incubated initially in latam to really validate and we have then go to scale that up in other countries [phonetic], latin america and then worldwide in a couple of years. we are going to also dedicate it part of the proceeds that came from the capitalization to accelerate the development of &co pay.
and i'll ask jp now to give some details about your questions on the productivity and the benefits. we are very excited about this. so, please, jp.
joao paulo brotto goncalves ferreira -- chief executive officer, latin america
thank you, roberto. ruben -- so as roberto pointed out, it is a new business unit. hence it has its own p&l, it generates new -- it's a new revenue stream. however, it is meant to strengthen our core business, precisely for the reason that you pointed out, the better payment solutions and financial solutions drive higher consultant productivity. and we know that from our previous experiences. so this is an initiative that has a double benefit. it enhances the core and captures new revenue streams. it is different from our previous experiences because it's now all integrated, orchestrated within natura through partners and completely embedded in the consultant's experience, right. also all the information that is captured is used to improve the knowledge we have about that relationship -- that commercial relationship that is building. so that is all new -- completely embedded into the beauty consulting journey.
ruben couto -- santander -- analyst
thank you.
operator
thank you. our next question comes from gustavo oliveira from ubs.
gustavo oliveira -- ubs -- analyst
good morning, everyone. thank you for taking my question. i would like to understand, roberto, you mentioned that you're basing the avon new commercial model out of what you're doing in brazil to roll it out to avon in other countries. what are the key features that you think that can travel well across several countries and if there will be a lot of adaptation or if the plan is to follow a more standardized approach? and then if i may, a second question would be, there was a very nice increase in the number of new consultants in brazil in natura brand. if you could comment on what would be the drivers that led this increase in new consultants and what are the characteristics of the new consultants that are joining the base? thank you.
roberto de oliveira marques -- chairman
hi, gustavo, roberto here. thank you for the question. what -- really the key elements of what we believe are transferable and, again, avon international team is working very closely with the team here in latam and in brazil to really understand is the notion of a lifetime value approach and the segmentation where the retention, driving productivity, sometimes it's going forth and then just the transaction -- the first transactions and just growing the channel. so there is a lot of simplification that is already being implemented by the avon international organization, as i mentioned, monthly cycle focus on earnings model that is simpler than what it used to be. all those things are already ongoing. but i would say the segmentation approach of lifetime value of the reps are probably something that, again, we want to validate it, we want -- again, through some prototypes and pilots, we want to make sure that also it works well. we know that even as we did it here in brazil and latam, it's not a simple execution because you need to adjust in each segment, great p&ls for each one of those segments to make sure that it works well as a whole. but we are excited about it. i think as a nation, we are preparing a pilot in south africa. and then the idea, once we validate that, is starting a rollout sometime next year. but it's really based on this notion of lifetime value and segmentation approach. so i'll turn to jp. jp, i don't know if you want to comment on anything else in terms of the model that will be transferred to avon international, and then you can comment on the specific question.
joao paulo brotto goncalves ferreira -- chief executive officer, latin america
no, i'll just highlight that avon international, angela and her team have been in continuous contact with our team here in latin america so we can exchange all the learnings we've had over the last many years. and so, that gives us the confidence that the acquired know-how will be transferred with the necessary adjustments.
and to your other question, gustavo, on new consultants, the number of new consultants in brazil, i think there are two main drivers for that increase. one is all the investment and know-how that we've developed on digital recruitment that became really seamless and facilitating those newcomers to learn about the activity and the products and how to reach their customers. that's one of the drivers. the other one, of course, is the fact that people spend more time at home, unemployment, trying to find new alternatives, and guess what, that combination allowed us to attract a higher number of new -- of consultants, new consultants, and they are on average 10 years younger than the average of the network. they are tech savvy. they join our network already through digital environment, and because of that, they are being able to reach customers that love the brand but didn't find a good shopping experience so far. so they are coming back to the brands through this new recruits. so, thank you for the question.
operator
thank you. the next question comes from tobias stingelin from citi.
tobias stingelin -- citi -- analyst
yes, thank you. good morning and congratulations on the results. i think that the question is to some extent a follow-up to the question that gustavo just posed. in regards to this increase in the number of consultants in brazil, do you think that this trend will continue? and you mentioned that they are kind of, what, tech savvy, that they already are more native to the environment. do you have kind of productivity indicators of these consultants already? this is the first question. the second question is just in regards to avon brazil. you mentioned that consultant satisfaction is very high. can you let us know why the satisfaction increased so much? what are you doing that is increasing the satisfaction of the avon consultant, please?
operator
please standby, we will resume momentarily.
roberto de oliveira marques -- chairman
hello, are we back?
operator
you may proceed.
roberto de oliveira marques -- chairman
thank you. sorry, we had a problem with our connections here. so let me resume from where i think we stopped, tobias. we talked about the new recruits and i was saying that it's too early to talk about their lifetime productivity. however, i can tell you that they started with the performance that is ahead of our historical records in terms of new consultants. and you also asked about avon's representative satisfaction, a combination of new sales incentives, the elimination of burdens in the operation and the proximity of our sales team with them during the pandemic, helping them to navigate through all sorts of difficulties they faced in that period. thank you.
operator
thank you. we have a question from irma sgarz from goldman sachs.
irma sgarz -- goldman sachs -- analyst
yes, hi, good afternoon -- good morning, sorry, and thank you very much -- or good afternoon to those in europe, but thank you very much for taking my question. i was curious, in the same-store sales growth in reopened stores, were you able -- or are you able to provide a little bit of how that's been trending for both aesop and the body shop? it was very useful to have that number for the third quarter, but i'm just curious, specifically when you just look at the stores that have been reopened, how those have been trending? and maybe connected to that about how you're thinking about the store footprint for aesop and the body shop in 2021 and beyond? i know you've made [indecipherable] already a large chunk of the adjustment at the body shop. but i'd just be curious for both franchises, where you sort of see the growth trajectory from here? and then the second question. just really minor question, government support for aesop and the body shop, i know it helped to some extent, the ebitda margin this quarter. but if you just sort of indicate to us maybe the magnitude or sort of how we should think about this impacting margins in the next quarter? thank you.
roberto de oliveira marques -- chairman
yeah, hi, roberto here. thank you for the question. regarding the store reopening, this quarter at the end, we saw approximately 95% of the stores open. what we are seeing again, and that explain a little bit a very strong quarter, is even with the reopening of the store, we still continue to see very strong momentum of our e-commerce at the body shop and aesop. so of course, the e-commerce came down a little bit versus what used to be in q2 which, as you might remember, was about 30 plus percent, almost 40% of the revenue. it came down, but it came down still almost more than double than what used to be before the pandemic. so even with the reopening of the store, we still see very strong performance of the e-commerce. the store in itself, we are seeing traffic still way down versus prior to the pandemic about 40%, but we are seeing higher ticket, average ticket per person in general. of course, we will continue to monitor now as we enter into q4, which is our most important quarter in which [phonetic] some of the lockdowns in some markets, especially in europe. but one of the things that we are seeing is that we also got a lot of learnings in terms of being able to adjust, so things like click and collect, curbside delivery, all those things are still in place. so in the combination of e-commerce, we still think that we're going to be able to manage the christmas season well. but of course, we will be monitoring that.
in regards to margin, what i can say is that in our calculation, i would say, it's probably about 100 basis points to 150 basis points in terms of the -- call it the subsidies or the government incentives that we think that are non-recurring, that at some point will disappear, but even if we exclude that, we are still showing margin improvement on a recurring base, which is -- again, which shows the strength of our fundamentals. thank you for the question. thank you. our next question comes from andrew ruben from morgan stanley.
andrew ruben -- morgan stanley -- analyst
hey, great, thanks very much for the question. i guess just following up on the margin point, so more broadly, you showed some strong leverage in latam, body shop, aesop. so if you could just provide some color on the bigger margin drivers and if there is anything in addition to the government support that might be more temporary or any spending shifts in general we should be aware of as we think about modeling into 4q and 2021? and then just if you could clarify the 100 basis points to 150 basis points, is that just for body shop and aesop or is that on a consolidated basis, that would be very helpful. thank you.
jose antonio de almeida filippo -- chief financial officer
hi, andrew. yes, i think that just to have -- for the question, the 100 basis points to 150 basis points is consolidated basis. it's not specific. also, there are pieces of that that is related to the cyber phasing that we already mentioned before. so we consider like half will be cyber and half would be the stimulus. so again, like we said, with that -- it's taken that even if we do this, we still have an expansion in margin compared to the previous year. so i believe that we can see, of course, this quarter we had this increase, but i think the trend is to really -- to see that going forward on adjusted basis like we said. that's how we expect to see.
operator
our next question comes from joseph giordano from j.p. morgan.
joseph giordano -- j.p. morgan -- analyst
hi, good morning, everyone. thanks for taking my question. they are actually couple ones. the first one is on the avon integration. so if you could shed some light on how you are deploying the technology you have in natura to avon? so what can be done now, particularly in the context that you prepaid your most restrictive bond? so that's my first question. and second question is, how do you guys feel about the outlook for christmas? so, particularly in brazil, we saw like an outstanding growth. we had some emergency aids probably helping the sales, so -- and you mentioned that you saw that mostly perfumes and fragrances. so how do you feel about it? and what's the strategy in terms of like packaging and bundling like you have been doing over the past calendar events? thank you.
roberto de oliveira marques -- chairman
hi. joseph, roberto here. so in terms of the restricted aspects or the covenants of the prepaid bond, this will allow us again to continue to optimize our structure as a group, especially in terms of subsidiary, and better combine some of those at a global scale and some of the opportunities that we have as we now have avon, body shop and aesop overlapping some of those geographies. so, that will give us some more flexibility for optimization on that. in terms of the synergies, they are on track. i would say, that is also explain part of the improvement in margins because we are already capturing about $17 [phonetic] million of synergies this quarter. so that's on track based on our communication and guidance that we talked about it back in q1. so we are excited about it. we are already seeing very material examples up distribution centers, manufacturing sites, especially in latin america, working in a combined way between natura and avon, and that's very promising in terms of not only driving cost down, but improving services through our reps and our consultants. so that's also pretty exciting. and i think that -- did i miss anything on your question? i think that was it, right?
joao paulo brotto goncalves ferreira -- chief executive officer, latin america
christmas.
roberto de oliveira marques -- chairman
do you want to comment on that?
joao paulo brotto goncalves ferreira -- chief executive officer, latin america
yeah. so joseph, jp here. as regards christmas, you know that for aesop, the body shop, natura, all these celebratory dates are quite important. and all the businesses around the world are well prepared to fulfill the demand of christmas. and actually, we do think that in spite of the pandemic, people will be willing to see each other, touch each other, send a token of gratitude. and so, we think that the demand will be here. and we learn how to serve those customers in different ways. that's what you've heard so far. perhaps what might be new and relevant is that avon didn't look at those dates with the same intensity as the other business do. so i can tell you that we are upgrading avon's effort for those celebratory dates and for christmas in particular. so i think, avon will see a positive performance out of -- relative performance from the christmas campaign.
operator
thank you. our next question comes from daniela bretthauer from eleven financial.
daniela bretthauer -- eleven financial -- analyst
hi, good morning, everyone. congratulations on the results. thank you for taking my questions. most of them have already been answered, but i just wanted to follow up on the channel growth at avon. you mentioned lower churn. and actually a twofold topic there. one is, it was very impressive that not only productivity growth, but the channel growth in brazil. but then on avon, you mentioned in the release that it's still decreasing. so do you think, number one, the productivity and channel growth in brazil will remain at this fast pace because it clearly doubled on a sequential basis, and second on avon, the reduction, has it flatten or when do we see a change? and then, i'll ask my second question.
roberto de oliveira marques -- chairman
so in terms of the -- overall for avon, what i would say is, again, some of the structural things we haven't implemented yet, while we are seeing, again, some of the actions that we took to simplify the model to make it easy for consultants to join, of course, all the efforts on social selling and adoption, it's part of that. and while we are seeing also as we make a couple of changes on the earnings model that is also helping the reps sustain longer, and that's what's translates in the reduction of the churn that we mentioned. regarding brazil, i'll invite jp to comment some more specific. please, jp.
joao paulo brotto goncalves ferreira -- chief executive officer, latin america
hi, daniela, good to hear from you. so we're going to push for productivity gains. that's the nature of our approach to direct selling [indecipherable] selling. in brazil, both natura and avon grew the number of representatives and consultants. across latin america, though, we didn't see avon growing yet the number of consultants. but i'd like to highlight that many of latin american [technical issues]. so i just want to go to conclude saying that many of the spanish speaking countries face more strict -- much more strict lockdowns. so we're going to see improving numbers as of now. thank you.
operator
thank you. we have reached the end of the question-and-answer session. i would like to invite mr. roberto marques to proceed with his closing statements. please go ahead, mr. marques.
roberto de oliveira marques -- chairman
thank you, everybody. so let me first apologize. i don't know what happened, somebody entered in the line. so apologies for that on behalf of natura & co. listen, we are very excited about this quarter and how we really performed. it's really an outstanding result in any stretch or any angle that we look at it from a top line growth, from a margin expansion, from a very solid performance in each one of our businesses, which is really testament of our teams, our four amazing iconic brands and our really approach on the direct to consumer omnichannel when you see retail, e-commerce working in a synergistic way. when e see our more direct selling both physical and now, through social selling, also compounding the performance of our business. so really very excited with the quarter. having said that, we are also monitoring, cautiously optimistic about the future. we believe, we'll continue to outperform the market, but we will continue to monitor some of those recent events on the lockdown in parts of europe. we are still not past this global pandemic. and we, of course, will continue to monitor and adjust in response to those challenges. but anyway. thank you so very much for joining us. hope, you all stay well, stay safe, and i hope to talk to you guys soon. thank you.
operator
[operator closing remarks]
duration: 69 minutes
call participants:
viviane behar de castro -- investor relations officer
roberto de oliveira marques -- chairman
jose antonio de almeida filippo -- chief financial officer
joao paulo brotto goncalves ferreira -- chief executive officer, latin america
helena villares -- itau bba -- analyst
robert ford -- bank of america -- analyst
richard cathcart -- bradesco -- analyst
ruben couto -- santander -- analyst
gustavo oliveira -- ubs -- analyst
tobias stingelin -- citi -- analyst
irma sgarz -- goldman sachs -- analyst
andrew ruben -- morgan stanley -- analyst
joseph giordano -- j.p. morgan -- analyst
daniela bretthauer -- eleven financial -- analyst
more ntco analysis
all earnings call transcripts




"
