Environmental_prep_remarks,Governance_prep_remarks,QnA,Social_prep_remarks,dt,prep_remarks,q,ticker
0.8735999999999999,,,0.9995,2021-11-09 17:00:00,"prepared remarks:
alice lopatto
good afternoon, everyone, and welcome to toast third quarter 2021 earnings conference call. i'm alice lopatto, vice president of investor relations. today, our ceo, chris comparato, and cfo, elena gomez, will join us and discuss our third-quarter results. after their prepared remarks, we will take questions.
before we start, i'd like to draw your attention to the safe harbor statement included in today's press release. during this call, we'll make statements related to our business that may be considered forward-looking within the meaning of section 27a of the securities exchange act of 1933 as amended and section 21e of the securities exchange act of 1934 as amended. all statements other than statements of historical fact are forward-looking statements, including those regarding management's expectations of future financial and operational performance and operational expenditures, expected growth, and business outlook, including our financial guidance for the fourth quarter and full-year 2021. forward-looking statements reflect our views only as of today and, except as required by law, we undertake no obligation to update or revise these forward-looking statements. please refer to the cautionary language in today's press release and our form 10-q, which will be filed with the sec this afternoon for a discussion of the risks and uncertainties that may cause actual results to differ materially from expectations. during this call, we may present both gaap and non-gaap financial measures. these non-gaap measures are not intended to be a substitute for gaap results.
the reconciliation of gaap to non-gaap measures is intended in today's -- is included in today's earnings press release. both the press release and a replay of this call including the accompanying investor presentation will be available on our investor relations website. with that, i would like to turn it over to chris. 
chris comparato -- chief executive officer
thanks, alice. welcome, everyone, to our first earnings call as a public company. i am chris comparato, ceo of toast. i'm excited to be with you today to share my thoughts on our company, our opportunity, and our q3 performance. given that it's our very first earnings call, i'd like to start by zooming out a bit and providing you an overview of our business, the restaurant industry, and our opportunity.
toast provides restaurants with an all-in-one technology platform that combines point of sale, front of house, back of house, and guest-facing technology integrated with financial technology and payments all built with the restaurant's success in mind. toast works for all restaurants regardless of size, concept, or cuisine; from independent cafes to enterprise brands. at toast, our mission is to empower the restaurant community to delight their guests, do what they love, and thrive. when we say restaurant community, we mean every stakeholder; from the guest to the gm or owner, to the waitstaff, to the chef, to the suppliers, and the entire ecosystem.
together, we believe we can delight guests with fast and seamless service; make employees happier with higher wages, tips, and a better work experience; and help restaurants be more successful with increased sales, deeper customer relationships, and lower employee turnover. our success is tied to our customer's success, and working with them to be better together, underpins everything that we do. at no time was that commitment tested more than during the onset of the covid-19 pandemic. we responded by accelerating certain product releases, which empowered restaurants to provide a contactless dining experience, fulfill online takeout and delivery orders, and communicate with their customers as we all navigated constantly changing public health business and consumer pressures. in addition, we supported grassroots campaigns and lobbied congress directly on behalf of restaurants.
we are proud to see that these efforts have resulted in overall same-store sales of toast customers, exceeding pre-covid levels, and continuing to improve. market research suggests that there are approximately 860,000 restaurants in the u.s. alone. collectively, the industry is one of the largest employers, providing jobs to more than 11 million people and generating nearly $700 billion of sales each year, around 3% of the u.s. gpv.
yet, it has one of the lowest levels of tech spend as a %age of sales of any sector. if you've worked in a restaurant, you know it's a complex business with a lot of moving parts. they operate with low margins, high employee turnover, highly perishable products, and complex regulations. yet, many restaurants continue to run on legacy systems, pen and paper, or disconnected horizontal and point solutions; each with their own costs and barriers to scalability. so, we believe there is a massive opportunity for us to support this industry as it grows and evolves, and as its tech spend closes the gap with that of other sectors. we're conservatively estimating our current serviceable addressable market or sam at approximately $15 billion.
we see an approximately $55 billion total addressable market or tam in the u.s. for restaurant technology spend by 2024. this tam at least doubles if we look globally. as we continue to grow and add more products to our portfolio, we believe we have the right strategy to go after this massive opportunity. this strategy starts with our relentless focus on product innovation, our powerful platform integrates software with our payment processing system supporting over 15 products.
because our platform is all in one, covering every aspect of a restaurant's operation, toast restaurants are empowered to use that data to unlock new insights and further optimize their businesses, which has led to higher sales and margins, more seamless operations, and lower employee turnover. our customers provide us tremendous insight into our product roadmap. a major example of this is our recent acquisition of xtrachef in june. we heard from customers how challenging it has been to manage their supply chain, especially during the last year and a half. in a survey, over half of our customer community told us that high operating costs and food costs were a top challenge.
by simply snapping photos of supplier invoices, coding, and categorizing, our customers will have access to digitized line-item details that are accurate and available to their team from anywhere and can unlock insights into purchasing behavior, supplier optimization, financial performance, and ultimately savings. our unique go-to-market strategy serves as a competitive differentiator for us. knowing that the restaurant market is hyperlocal, we've invested in a sales force and a customer success team of localized, field-based industry experts trusted by these local communities. our employees live in these communities and dine in these restaurants night in and night out and are true partners to our customers. when we create raving fans, they spread the word throughout our region.
this is why approximately two-thirds of our new locations come from inbound channels and one-fifth from customer or partner referrals. this creates further efficiency in our go-to-market motion, and our sales productivity typically increases as our positive reputation spreads within a local restaurant community. our ongoing expansion is supported by our customer success team, who brings vast technical and industry knowledge to the restaurants we work with quickly accessible through a single point of contact, 24 hours a day, seven days a week, 365 days a year; critical to avoiding downtime in an industry that is always on and does so much of their business on weekends and holidays. we also have a robust ecosystem of over 150 suppliers tech and local partners. these relationships enable us to deliver more value to customers while providing significant visibility into customer adaption. this data can lead to valuable insights into selectively pursuing m&a opportunities, which was the case in our acquisition of straex for payroll management and xtrachef for invoice and accounts payable solutions.
now, i'd like to go into the details for the quarter. in q3, we delivered strong results across the board. we grew revenue 105% year over year to 486 million, an annual recurring run rate or arr growth, 77% year over year to 544 million. this was driven by strong gross payment volume or gpv growth of 123% year over year, landing at 16.5 billion, and strong customer adaption of our products. as of q3, 56% of our toast locations used four or more products on top of our integrated pos and payments solution, compared to 44% a year ago. we continue to see a consistent trend of guests returning to restaurants, as well as off-premise trends such as online ordering, delivery, and takeout sustain, which demonstrates that these consumer behaviors are here to here to stay for the long term. let me now share with you some customer wins in the quarter.
we signed a new deal with fat tuesday, a national chain known for its frozen drinks. fat tuesday is rolling out toast at 40 locations nationwide and will build its entire technology stack on toast; starting with our point of sale, order & pay at the table, kitchen display screens, and multi-location management products. organic juice bar, clean juice, has franchise locations in 28 states and is making ordering, payments, and delivery more seamless with toast. in q3, clean juice expanded with toast, renewing its agreement for 121 locations, and adding a commitment to bring toast to 15 that new locations.
clean juice uses toast point of sale, toast go devices, toast flex terminals, toast kitchen display systems, and kiosks, along with our gift card software, multichannel location management, and api ecosystem integrations. we also expanded our relationship with eggs up grill, a rapidly growing breakfast, brunch, and lunch brand. eggs up grill currently uses toast point of sale, toast flexes, toast go devices, and toast printers. this quarter, they signed an agreement to expand toast to an additional 30 locations. with new revenue channels developed during the pandemic, eggs up grill saw a 13% increase in 2021 sales compared to 2019, and 60% ahead of 2020.
next week, on november 16, we'll host spark, our inaugural restaurant innovation event. at spark, we will share major new product releases and provide a sneak peek into our innovation roadmap. the name for our event is a reference to the spark that lights a stove or an oven to make the magic of a restaurant happen. it also alludes to the spark of imagination that leads to innovation and transformative change. this all-virtual, two-hour event will consist of keynotes, product updates, and guest speakers, including world-renowned chef, restaurateur humanitarian, and toast's customer, jose andres.
you'll hear about how we're moving the restaurant industry forward with innovative new products that empower the restaurant, the guest, and employees. if you'd like more information on attending the event, please contact our investor relations team at ir@toasttab.com or visit our website for more information and to sign up. as part of our continued efforts to support the restaurant community, we recently signed a public letter from the independent restaurant coalition advocating for replenishment of the restaurant revitalization fund. we've also joined the pledge 1% movement to donate our capital to fund social impact programs through our philanthropic group, toast.org. before i turn the call over to elena to walk you through the financials, i wanted to thank our employees, our customers, our partners, and our shareholders for their support in helping us achieve a major milestone in becoming a public company. restaurants are resilient, and they make up the social fabric of our community.
and we believe our commitment to aligning our success with the success of the restaurant community will lead to a stronger and exciting future ahead. now, i'd like to hand it over to our cfo, elena gomez.
elena gomez -- chief financial officer
thanks, chris. before i begin, i want to take a moment to recognize the entire toast team on their efforts to become a public company. and a special callout to my own toast finance team. it's because of the collective efforts of this team that we are where we are today.
i also want to thank our existing and new shareholders. we are excited to be on this journey with you as a public company. while we are proud of this milestone, we are just getting started. as chris mentioned, we believe we have a total addressable market of 55 billion in the u.s., and we estimate the global tam to be twice as large. as a leader in one of the world's largest industries, we've built a unique business model to address this opportunity and support rapid growth at scale. before i go into the results of the quarter, let me share with you why we have a powerful business model.
first, we have proven we can achieve high growth at scale. second, we have an integrated software and payments model. thus, we benefit from not only the predictability of saas but also from the increase in transaction volumes as our customers grow. third, our all-in-one platform combined with our boots-on-the-ground, go-to-market strategy keeps our customers happy and drives strong retention. finally, as our customers continue to expand with us, we've been able to maintain strong unit economics.
now, let me walk you through how we generate revenue. we generate revenue in four ways: subscription services, financial technology solutions, hardware, and professional services. we consider subscription services and financial technology solutions as our recurring revenue streams. subscription services revenue is generated from our saas products such as digital ordering, delivery, and team management to name a few.
financial technology solutions revenue is generated primarily from facilitating payment transactions and also includes fees earned for loans we offer through our toast capital program. we recognize our financial technology solutions revenue on a gross basis. we consider other two revenue streams, hardware and professional services revenue, as one time and effectively part of our customer acquisition costs. we price them competitively to minimize barriers to entry. since the majority of our revenue comes from financial technology solutions, we believe annual recurring run rate or arr, which excludes transaction-based costs is the operational metric that best reflects the scale and growth of our business.
you can find the full definition of arr in our earnings press release and our form 10-q for the third quarter. the key drivers of arr include growth of restaurant locations on our platform, the adaption of our saas products, and the total gpv processed. before i turn to the results for the quarter, please note again we will refer to both gaap and non-gaap financial measures. please refer to today's press release for the reconciliation of gaap to non-gaap financial performance and additional disclosures regarding these measures.
i'll now turn to the results for the third quarter. we delivered strong performance in the first quarter as a public company. in q3, we continue to see growth from both new locations, as well as an increase in gpv on our platform as a restaurant the industry continues to recover. additionally, customers continue to adapt more toast products. as a result, in q3, we delivered revenue of 486 million, up 105% year over year; and arr of 544 million, up 77% year over year.
our subscription services grew 67% year over year to 46 million in the third quarter, driven by the increase in customers adapting more of our saas products. in q3, 56% of our toast locations use four or more products on top of integrated pos and payment solutions as compared to 44% a year ago. our financial technology solutions revenue grew 115% year over year to 404 million in the third quarter, driven by our strong gpv of 16.5 billion in q3, up 123% year over year. we anticipate our financial technology solutions revenue to normalize as gpv per location returns to normal patterns. for the third quarter, non-gaap gross profit, which excludes stock-based compensation expense came in at 89 million, up 75% year over year, driven by growth in our customer base and higher revenue per location, driven by an increase in saas arpu and elevated gpv.
as we shared with you previously, our freight costs are elevated in q3 due to supply chain dynamics. while they're not as high as anticipated, we do believe they will remain elevated through the near term. despite increased costs, we continue to be very confident in our ability to deliver hardware for our customers. now, let's turn to our operating expenses, which i will review on an adjusted non-gaap basis, which excludes stock-based compensation expense for each line item. before i do, i do want to remind you that we use customer acquisition cost and payback metrics to measure the performance of our business and guide our investment decisions. with this in mind, in q3, we continue to invest in sales and market -- sales and marketing and research and development to capture our tam and build out our platform.
general and administrative expenses were elevated due -- to our transition to a public company and rebuilding the foundation to scale our business. adjusted ebitda for the third quarter was negative 10 million compared to roughly breakeven a year ago. in q3, we had free cash flow negative of 21 million compared to roughly breakeven a year ago, and positive 53 million in q2. our q2 free cash flow result was primarily impacted by a one-time benefit related to interchange billing terms. now, let me turn to guidance.
for the fourth quarter, we expect revenue to be in the range of 465 million to 495 million, which represents 98% growth at the midpoint. we expect adjusted ebitda to be in the range of negative 50 million to negative 40 million. for the full year 2021, we expect revenue to be in the range of 1.655 million to 1.685 million, which represents 103% year-over-year growth at the midpoint, and adjusted ebitda to be in the range of negative 46 million to negative 36 million. while i'm not providing 2022 guidance, i want to remind you that financial technology solutions revenue is benefiting from elevated gpv per location, which we anticipate will normalize as we exit 2021 into 2022. in closing, our strong q3 performance demonstrates our success and continued to execute and capture market share as the industry continues rapid digital transformation. built to serve a large and growing addressable market, we've shown we can execute at scale with healthy unit economics.
with this foundation in place, we believe we are uniquely positioned to drive durable growth for ourselves and for the restaurants using our platform. now, i'd like to turn the call back over to the moderator for our q&a session.
alice lopatto
right. thanks, chris and elena. we'll go ahead and start our q&a session. our first question comes from will nance of goldman sachs. will, please go ahead.
will nance -- goldman sachs -- analyst
hi, everyone. good afternoon and congrats on a strong quarter. you highlighted the strength in the same-store sales at toast customers and, you know, i think you also called out the potential for volume per live location to normalize over the course of 2022. can you maybe just expand a bit on kind of what you're seeing on a per location, and how elevated are we relative to trend? and then, if i think about some of the things going on today, you know, maybe a little bit higher inflation, and just the fact that your customers, relative to the -- you know, prior to pandemic, are using so much more technology, you call that the higher attach rates.
you know, is there a potential that we could run rate at a higher level of sales per live location on the other side, just given the investments that your client base has in the technology? 
elena gomez -- chief financial officer
yeah, it's a fair question. let me try to characterize that. so, we're definitely seeing elevated gpv per location, but as we continue to go into the deeper part of the tam, we also expect that to get closer to the average. so, i would just consider that as you think about your long-term modeling.
will nance -- goldman sachs -- analyst
that's helpful. and then maybe just on the attached rate that you're saying, you know, the nice momentum and increased adaption of these four more products. i mean, can you talk about, you know, where you think the biggest opportunity is from your existing product lineup is? what's kind of resonating the most in the market?
elena gomez -- chief financial officer
yeah, no, definitely. i mean, i think, obviously, our toast go devices and our digital products are clearly things that we're encouraged by, but we're also really encouraged by the adaption of our payroll product. and we're seeing a significant amount of our new restaurant openings attached as we continue. and so, we're continuing to see that from a lot of, like i said, our new customers, and equally starting to see a little bit of that even from our existing customer base. so, one thing i talk about often is for our total arpu, and you can see that -- you know, i use an example just to give you perspective of what's possible.
we have a customer, a donut shop, that can do in our platform 23k of arpu. so, just kind of speaks to, you know, what's possible with arpu. 
will nance -- goldman sachs -- analyst
got it. super helpful. appreciate you taking on my questions, and congrats again on the first quarter at the gate.
elena gomez -- chief financial officer
thanks.
alice lopatto
our next question comes from josh baer of morgan stanley. josh, please go ahead.
josh baer -- morgan stanley -- analyst
great. thanks for the question. i wanted to ask about tam and the opportunity ahead from a couple of different angles. so, one, within the u.s., like where specifically are you investing and focusing on? is there a greenfield in the u.s?
chris comparato -- chief executive officer
thanks for the question, josh. i mean, listen, in the u.s., as of the end of q2, we were only 6% market penetration for the tam in the u.s. so, we see a broad-based opportunity to go after the majority of tam. you know, if you serve 860,000 restaurants, we believe at least two-thirds of that are accessible to toast today, both in smb and mid-market, and i'd say, the lower end of enterprise. so, we think there's a very long runway for tam adaption and location acquisition, and we've seen broad-based momentum across the u.s.
there's no specific geographic differences. we've just been penetrating multiple markets in parallel.
josh baer -- morgan stanley -- analyst
great. and then on the maybe lower end of enterprise or upmarket, are there products or features that are needed to more fully address that? i don't know if fast food or just upmarket enterprise, like how should investors think about that opportunity within your tam? thank you.
chris comparato -- chief executive officer
sure. we continue to innovate on the platform. for example, on multi-location management, the ability to manage menus and pricing across locations, the ability to publish across multiple locations. so, those innovations are organic and continue.
i would say the other area i would point you to is our strong partner ecosystem. it's super important to have strong apis and an ecosystem of partners that you can cultivate so that you can offer to an enterprise brand a best-of-breed architecture. so, i'd say those are the two areas that jump out at us in terms of levels of investment and what we need to do to support larger customers.
josh baer -- morgan stanley -- analyst
thanks, chris. congrats.
chris comparato -- chief executive officer
thanks.
alice lopatto
right. our next question comes from josh beck of keybanc. josh, are you there?
josh beck -- keybanc capital markets -- analyst
yes, i am. can you hear me?
chris comparato -- chief executive officer
we can.
alice lopatto
yes, we can.
elena gomez -- chief financial officer
we can hear you, yes.
josh beck -- keybanc capital markets -- analyst
excellent. well, i thank your team for the question here. i wanted to go back to xtrachef. obviously, the supply chain has, you know, unfortunately really been rattled and a lot of different ways in the last year and a half.
and certainly, you know, it's been felt in the restaurant industry. so, maybe just help us understand where you are with that acquisition, what type of strategic discussions it's enabling, and really where you'd like to take that in the next few years?
chris comparato -- chief executive officer
sure. great question, josh. our progress with xtrachef is going extremely well. the integration process has gone well.
the team is continuing to execute well in terms of performance, and we're investing pretty heavily in backing innovation in and around what i would call accounts payable automation, as well as food cost optimization. we think there's a unique opportunity to automate even more of the back office. if you think about monetizing things like bill pay and other activities on the back end of restaurants that are critical to their success to interface with suppliers, but then also optimize their costs and optimize their inventory. you know, running a restaurant is really difficult. and if you think about razor-thin margins and the focus on operational efficiency, we think xtrachef really is that the cornerstone of back-office automation. so, we're super excited about investing in that roadmap.
but, you know, first steps first, we need to make sure that we execute the integration well and continue to gain adaption, and you'll see more of that in 2022, and i'll talk a little bit about this next week at spark. 
josh beck -- keybanc capital markets -- analyst
fantastic. and maybe just a follow-up question around the sales and marketing efficiency. obviously, you are starting to rightfully invest in this opportunity. we can look at some external metrics like incremental revenue, recurring revenue per sales, and marketing dollars.
and all these metrics look very healthy. so, maybe just provide us some qualitative context with the efficiency, how that's trending, and where you'd like to see that ahead of the future?
elena gomez -- chief financial officer
yeah, i'm glad you asked a question, josh. we are relentless in our focus on payback periods and just our efficiency overall, and we continue to see customers adapting in a soft directed mode as an example. so, there's many ways that we can continue to monitor efficiency. so, i would say i feel very confident with what our payback periods are today, and we'll continue to monitor them over the next, you know, several quarters ongoing.
josh beck -- keybanc capital markets -- analyst
very helpful. thank you.
alice lopatto
right. our next question comes from stephen sheldon of william blair.
stephen sheldon -- william blair -- analyst
hi, chris. hi, elena. thanks for taking my questions.
chris comparato -- chief executive officer
hi, stephen.
stephen sheldon -- william blair -- analyst
i wanted to ask about the labor shortages and the hiring challenges that are facing the restaurant. and i guess it's kind of two-part or -- one, is it influence the urgency of restaurants to sign up for your platform or increased demand for the uptake of specific modules like handhelds and order & pay at the table? and then two, has the issue changed any priorities from a product development standpoint to bring to market solutions that could help the restaurant, you know, especially if there's going to be a persistent issue? i know maybe we need a way for spark for that but just thought i'd ask.
chris comparato -- chief executive officer
yeah, i'll take it. great question, stephen. so, yeah, your premises is dead on. you know, restaurants are being forced to adapt and derive as much operational efficiency as they can with minimal staff. and, you know, much of our product around team management and handhelds allows them to sort of adapt and engage their employees and allow them to offer a better service to consumers.
so, if you think about order & pay at the table and toast go devices, for example, that allows the staff to be that much more efficient to handle not just existing guests but even increase the number of tables within the restaurant that they can serve. we've seen examples of restaurants that have increased their tables while maintaining or lowering their staff but becoming as efficient as they were in the past. so, we think order & pay at the table and digit -- what we call digital dining, as well as the toast go device, allowing you to build new service models within the restaurant itself are critically important. and restaurants recognize that and they recognize that these innovations really benefit them and create better employee engagement, as well as better consumer experiences to be honest with you. so, i think that's going to continue to hold true even past the covid pandemic. as far as where we're investing, you know, we're investing i'd say broadly across many of these tools.
if you look at sort of the digital dining experience, we're continuing to invest heavily in scan and pay at the table,  order & pay at the table. we're continuing to make sure that it works in conjunction with the toast go device. so, if the consumers and the waitstaff need to complement each other, there's this continued service model where it's not one or the other but it's both. that way a waitstaff can manage many more tables but consumers can also have the delightful experience of order & pay at the table. but then we're also broadly investing in other areas of team management in and around payroll. for example, the ability to manage tips.
so, tune in next week and you'll hear a little bit more about some of these products. but i'd say it's broad-based investments across the board.
stephen sheldon -- william blair -- analyst
great. thank you. congrats.
alice lopatto
our next question comes from brent bracelin of piper sandler. please go ahead.
brent bracelin -- piper sandler -- analyst
thanks for taking the question here. i want to build on the narrative of the talent shortage in the restaurant industry. anecdotally, we're seeing and using the digital dining options that you guys are enabling here more often. what is the penetration rate? what's the adaption? as you look at the broader customer base, do or half of the customers now kind of empowering a naval of digital kind of ordering at the table, or is there a broader opportunity across all those? just give us the starting point kind of where we're at today, and then the potential to help some of those smaller restaurants address these issues. and one quick follow-up for elena. 
chris comparato -- chief executive officer
yeah, brent, great question. i think we're in the early days of this adaption. i mean, we're talking about new service models within the restaurant itself. so, you see employees adapting to these new service models, but then you also see in parallel consumers adapting to how to use these products and consumers starting to get used to it. so, i'd say we're in the early days of adaption.
but i think we're super excited about the growth ahead because then the methodology within the restaurant starts to change and the restaurants that are really embracing these technologies are doing much better than non-toast restaurants that aren't adapting a similar set of technology. so, we're seeing the proof points, but i'd argue much of the runway is ahead of us, and much of that opportunity is ahead of us.
brent bracelin -- piper sandler -- analyst
helpful color there. and then, elena, as we just think about the subscription services revenue, it looks like growth accelerated year over year slightly versus kind of the year growth last quarter. is that just driven by lands with new customers that are taking more products and modules? is that driven by cross-selling? what kind of drove some of the strength in subscription services growth this quarter?
elena gomez -- chief financial officer
yeah, it's all the above. i think the metric i'd point you to, brent, is the percentage of customers with more than four modules. you see that steady increase over time, and we're really encouraged by that. and when you look at initial implementation, we still have most customers adapting more than four products at one time.
and so, at initial launch, so i think all of that is really driving that sas revenue. it's multiple dimensions. 
brent bracelin -- piper sandler -- analyst
at a higher cross lands and expands. thank you.
elena gomez -- chief financial officer
yep.
alice lopatto
our next question comes from dj hynes of canaccord. please go ahead.
dj hynes -- canaccord genuity -- analyst
hey, chris and elena, congrats on a good start here. chris, i want to ask -- look, i think some of the drivers for new restaurants to onboard toast during the pandemic were a little bit unique, right? you got things like online ordering and curbside pickup, and delivery all became really important. i'm wondering if you're seeing any change or maybe normalization, the drivers of new customer acquisition today? and maybe could touch on some of the cohort dynamics of that covid group, you know, expansion, growth, that sort of thing would be helpful.
chris comparato -- chief executive officer
you know, the first thing, dj, is we -- i mean, we've seen broad momentum. if you zoom out, we've seen broad momentum of growth of our platform within restaurants in and outside of covid, right? and i think there's three things that really drive restaurants to leverage our platform. number one, the depth and breadth of the platform and the restaurant specificity to the functions and features that the restaurants need to operate. so, we feel like we've got the broadest and deepest restaurant-specific platform in the market. number two, you know, we're obsessed with customers' happiness and building trust on the platform.
and that starts in the go-to-market motion and carries through all the elements of toast downstream. so making sure that restaurants have a great experience when they use our platform is critically important. and then number three, it's really the engine of innovation. i mean, we've been innovating on this platform for nine years. i mean, we launched integrated online ordering back in 2014.
so, many of the products that restaurants are adopting were pre-covid products that are now built into the platform, simple and easy to use, and we're expanding upon those products. but then also looking for other control points that make the lives of restaurants difficult. and what can we do to collapse those control points into this unified operating system to make their life easier? so, i'd argue that restaurants are starting to see the benefits of this type of platform to their future. and, you know, toast restaurants are proving that they can perform and perform quite well. they've been incredibly resilient and we're proud of that. so --
dj hynes -- canaccord genuity -- analyst
yeah, super helpful color. and maybe just a follow-up for elena. you had a comment on your prepared remarks around, you know, confidence to procure hardware to serve your customers. i just want to double check there and make sure that, you know, we're not going to have any supply chain issues sneak up on us, and -- that you'll have what you need to kind of onboard all your new customers in q4 and, i guess, into next year.
elena gomez -- chief financial officer
yeah, no, i feel actually confident in this, dj. as you know, during covid, obviously, that was a real battlefield tested in terms of supply chain and we felt it was really important to make sure we did not disrupt our customer's onboarding and making sure they had what they needed to get going. and so, it's no different now. i think we're paying attention, of course, to the elevated freight costs and being thoughtful about that. but we're confident we are focused on not disrupting our customers and not disrupting our growth rate either as a result of supply chain issues.
dj hynes -- canaccord genuity -- analyst
yeah, good stuff. thanks, guys.
alice lopatto
thank you. our next question comes from tien-tsin huang of jpmorgan. please go ahead.
tien-tsin huang -- jpmorgan chase and company -- analyst
hi. thanks. congrats on the listing and the great results at the gate here. just on the supply chain stuff, i want to make sure on the hardware side if there's anything surprising there? do you have a good read on what's happening there? looks like hardware came in quite strong in the quarter.
i'm assuming that's more tied to new locations versus refreshes?  just curious what trend you're seeing on the hardware side.
elena gomez -- chief financial officer
yeah, no, it's definitely tied to new locations. and we feel really good like i mentioned with dj about our confidence and making sure we get the hardware in the customer's hands that need it. and we've been able to prove -- navigate that fairly well. i'm actually proud of our hardware team for navigating so well during the pandemic.
tien-tsin huang -- jpmorgan chase and company -- analyst
good. the -- and just to zoom in on the fourth quarter, revenue got a little bit -- i guess the midpoint is a little bit below, the third quarter sequentially. i'm just trying to think about the factors as we think about seasonality and weather and other factors. any callouts there?
elena gomez -- chief financial officer
yeah, i mean, i think you hit it on the head. it's really the seasonality that we typically see on the payment front that is reflected in our guidance, but we'll continue to see growth and in our sas revenue et. so, the guidance reflects that seasonality.
tien-tsin huang -- jpmorgan chase and company -- analyst
good stuff. thanks.
alice lopatto
our next question comes from mayank tandon of needham. please go ahead.
mayank tandon -- needham and company -- analyst
thanks, alice. good evening, chris and elena, congrats on the quarter. i was going to ask you if a topical question. can you share any metrics around win rates, competitive takeaways to give us a feel for how a tool is faring versus some of your competition like, let's say, touchbistro, square, clover, etc? maybe just some any metrics that would be helpful to put your share gains in perspective that'll be very helpful.
thank you so much.
chris comparato -- chief executive officer
yeah, no, it's a good question. i mean, we're not going to comment specifically on win rates, you know, versus any one competitor. you know, we've seen a lot of success across the board. like i mentioned, it's mostly due to the depth and breadth of the platform and our obsession with customer happiness, and then the innovation behind that.
but in general, we compete against legacy players, cloud 1.0 players, and point solutions. but we feel like we're in a good position to compete well and differentiate ourselves, and sort of win the hearts and minds of restaurants moving forward.
mayank tandon -- needham and company -- analyst
elena, a quick follow-up for you. could you provide any perspective on the payments margin? any noticeable shift in terms of debit, credit, and card present versus not present just so when you think about our models into 2022?
elena gomez -- chief financial officer
yeah, it's a fair question. so, you know, card not present has been stabilizing, but i would say it's elevated a little bit above, you know, pre-covid levels. and we think that's in part because we've been investing in a lot of our digital products. so, there is a little dynamic there.
but take rate, obviously, in q3 came down a bit, and that's on its way to normalization. and then debit-credit mix is also trending back to pre-covid levels and i would expect that over time to normalize.
mayank tandon -- needham and company -- analyst
great. thank you so much. 
elena gomez -- chief financial officer
sure.
alice lopatto
thank you. our next question comes from dan dolev of mizuho. please go ahead. might not really seeing -- 
elena gomez -- chief financial officer
dan, you're on mute.
chris comparato -- chief executive officer
yeah, dan, you're on mute.
dan dolev -- mizuho securities -- analyst
am i better now? can you hear me now?
elena gomez -- chief financial officer
yeah, we can hear you. 
chris comparato -- chief executive officer
yeah, we got you.
dan dolev -- mizuho securities -- analyst
ok. sorry about that. congrats on the first quarter out. so, on the s-1, you gave a lot of detail on locations, and correct me if i'm wrong, i didn't see that in the press release. and sorry, i jumped on late because we were on another earnings.
i just want to know if -- did i miss that metric or is it not available or --
elena gomez -- chief financial officer
yeah. dan. so, it's a fair question. we're going to be disclosing locations more likely on an annualized basis.
but -- the primary reason is because we're focused on --  you know, as we talk about our powerful business model, we talk about both integrated payments, so saas and payments together. and so, arr is a metric we believe is most reflective of the growth of our business and really how we manage the business internally. so, i would tell you both locations were in line with expectations even though we're not going to disclose our number, and arpu was slightly ahead of our expectations for the third quarter.
dan dolev -- mizuho securities -- analyst
understood. and then my follow up is on just close payment volume, and you might have covered it and i apologize because i did jump on late. but kind of the sequential deceleration in our -- in gpv growth, q3 versus q2, and then that big jump, q2 versus q1. is there any -- are there any data points you can provide, some color on what's causing that, or maybe that q2 was abnormally high? that kind of -- 
elena gomez -- chief financial officer
well, typically summer months have some seasonality in their so you should consider that in your models. q2 and q3 are typically elevated but we're seeing -- you know, as i noted in the script, some elevated gpv per location and we expect that over time to normalize.
dan dolev -- mizuho securities -- analyst
understood. thank you, and congrats again on the first quarter.
elena gomez -- chief financial officer
thanks, dan.
chris comparato -- chief executive officer
thanks, dan.
alice lopatto
and our last question comes from andrew bauch of smbc. please go ahead.
andrew bauch -- smbc nikko securities -- analyst
hey, guys. thanks for squeezing me in here. just wanted to touch upon the ebitda guide here. i mean, i know that you're investing pretty heavily against the big market opportunity. but, you know, thinking about this business in the long run, you know, how should we think about what ebitda margins would look like under, you know, certain levels of growth, and maybe a sense of the, you know, long-run kind of profile this business? 
elena gomez -- chief financial officer
yeah. you know, the -- so, for the near term, we view this opportunity as massive and we're going to invest for growth. and that's what we've been talking about for some time. obviously, over -- we will continue to focus on payback period and unit economics. so, just to appreciate that behind the scenes, we have that good hygiene internally to make sure we're managing how we invest, where we invest, focus on investment to drive growth. and so, as we get further into the public markets, i'll share more about our long-term profitability.
but for the near term, we should focus on the fact that we will be investing for growth.
andrew bauch -- smbc nikko securities -- analyst
great. thank you. and looking forward to spark.
chris comparato -- chief executive officer
thank you.
alice lopatto
all right, everyone, well, that concludes our call. thank you so much for joining us today, and we look forward to speaking with you next quarter. have a good one.
duration: 47 minutes
call participants:
alice lopatto
chris comparato -- chief executive officer
elena gomez -- chief financial officer
will nance -- goldman sachs -- analyst
josh baer -- morgan stanley -- analyst
josh beck -- keybanc capital markets -- analyst
stephen sheldon -- william blair -- analyst
brent bracelin -- piper sandler -- analyst
dj hynes -- canaccord genuity -- analyst
tien-tsin huang -- jpmorgan chase and company -- analyst
mayank tandon -- needham and company -- analyst
dan dolev -- mizuho securities -- analyst
andrew bauch -- smbc nikko securities -- analyst
more tost analysis
all earnings call transcripts",2021-Q3,TOST
