Environmental_prep_remarks,Governance_prep_remarks,QnA,Social_prep_remarks,dt,prep_remarks,q,ticker
0.5373,1.0,,1.0,2022-02-15 17:00:00,"prepared remarks:
edward parker
good afternoon, everyone, and welcome to toast's fourth quarter 2021 earnings conference call. i'm edward parker, investor relations. today, our ceo, chris comparato, and cfo, elena gomez, will join us and discuss our fourth-quarter and full-year results. after their prepared remarks, we'll take questions.
before we start, i'd like to draw your attention to the safe harbor statement included in today's press release. during this call, we'll make statements related to our business that may be considered forward-looking within the meaning of section 27a of the securities exchange act of 1933, as amended, and section 21e of the securities exchange act of 1934, as amended. all statements other than statements of historical fact are forward-looking statements, including those regarding management's expectations of future financial and operational performance and operational expenditures, expected growth, and business outlook, including our financial guidance for the first quarter and full year 2022. forward-looking statements reflect our views only as of today, and except as required by law, we undertake no obligation to update or revise these forward-looking statements.
please refer to the cautionary language in today's press release and our sec filings for a discussion of the risks and uncertainty that could cause actual results to differ materially from our expectations. during this call, we will present both gaap and non-gaap financial measures. these non-gaap measures are not intended to be a substitute for our gaap results. please refer to our press release, which lays out the detailed reconciliation of gaap to non-gaap measures, including some new adjustments we made this quarter.
both the press releases and the replay of this call, including the accompanying investor presentation, will be available on our investor relations website. with that, i'd like to turn the call over to chris. 
chris comparato -- chief executive officer
thanks, edward, and thank you all for taking the time to join us today. toast delivered a strong fourth quarter in fiscal year 2021 as restaurants' need for an all-in-one platform to help them thrive has only become more important. before i jump into our results for the fourth quarter and fiscal year, i want to provide you with an overview of our business. first, let me remind you about our big ambitions.
we have an amazing opportunity to empower the restaurant community around the world to delight their guests, do what they love, and thrive. that is our mission. toast provides restaurants with an all-in-one digital technology platform that combines point-of-sale, front-of-house, back-of-house, and guest-facing technology integrated with financial technology and payments all built with the restaurant's success in mind. toast works for all restaurants, regardless of size, concept, or cuisine, from independent cafes to enterprise brands.
we serve every stakeholder, from the guest to the gm or owner, to the waitstaff, to the chef, suppliers, and the entire ecosystem. this past year was transformational for toast as we executed on our plan and became a publicly traded company. our initial public offering in september was a big milestone for our company and our customer community, and the momentum continued through the end of the year, resulting in a very strong q4. our community grew rapidly as we added more restaurants to our platform and as the percentage of live customers on our platform using four or more modules continue to increase.
this is a result of our strong focus on execution. let me share a few financial highlights. during the quarter, revenue increased 111% year over year to $512 million. and annualized recurring run rate, or arr, increased 74% year over year to $568 million.
this was driven by continued strength in gross payment volume, or gpv, the addition of new locations to our platform as we capture market share, and continued customer adoption of our growing portfolio of products. the industry continues to rebound from the impact of covid-19, and gpv on our platform increased to $17 billion in q4, a 125% increase year over year. we ended the quarter with approximately 57,000 live locations on our platform, up from approximately 40,000 locations in q4 of 2020, representing a 41% increase year over year. as our customer community grew, we also saw accelerated adoption of our platform as the percentage of customers using four or more core modules beyond point-of-sale and payments increased from 48% in q4 of 2020 to 59% in q4 of 2021.
as a result, our software-as-a-service arpu increased year over year by 30% from q4 of 2020. finally, as customers rely on toast to run their businesses, our net retention continues to be strong and was 135% for 2021, as elena will discuss in a few minutes. now, i'd like to take a moment and provide some context on the industry as a whole. throughout 2021, the operating environment remained challenging for restaurant operators as they faced the dual challenges of shifting workforce dynamics and a sustained labor shortage alongside rising input prices due to supply chain disruption and accompanying inflation.
as you can imagine, it is challenging to run a restaurant in this environment, and we are committed now more than ever to being the true partner to the restaurant industry, just as we've been since the onset of the pandemic and for the last 10 years. with this backdrop, what we have learned in our history serving the industry is that restaurant operators are incredibly resilient. even before covid-19, the industry was transforming. dining itself was changing from mobile order and pay at the table to delivery and online ordering.
the pandemic accelerated these changes. when looking at the performance of restaurants on the toast platform, we have been impressed by their ability to take full advantage of the platform's capabilities to reinvent their business and navigate the impact of covid-19. later this month, we will publish the first edition of our quarterly restaurant trends report, which gives visibility into the overall state of the restaurant industry through sales data from restaurants on the toast platform. let me share a few highlights today.
as the industry rebounded from the impact of covid-19 in 2021, restaurant sales, as measured by same-store gmv, or gross merchandise volume, on the toast platform increased by 41% year over year from 2020 to 2021. overall same-store sales of toast customers continue to exceed pre-covid levels, as evidenced by gmv per location increasing nearly 6% from q4 2019 to q4 2021. these are just a few strong signs that the restaurant industry, while continually battle-tested, is resilient. we will continue to lobby congress to replenish the restaurant revitalization fund, but we are also glad to see toast adoption contributing to restaurant success and helping restaurants navigate through this difficult time.
to better support our customers in the restaurant industry at large as they reimagine their businesses, we hosted thousands of restaurant operators for a virtual edition of spark, our restaurant innovation event, where we previewed the newest toast technology. during the course of the day, we unveiled an entire suite of new products designed to help restaurants take control of their finances, navigate the labor shortage, regain control of third-party delivery, and better manage their p&ls. the response from our customer community was overwhelmingly positive. so, let me share two examples.
as many of you know, there is substantial demand for faster access to capital in the restaurant industry as both their point-of-sale and payments processor for restaurants, we have unprecedented visibility into the health of their business. nearly two years ago, we introduced toast capital, which allows restaurants to borrow money and pay that money back as a percentage of daily sales. restaurants absolutely love this product as they pay back more on busy days and less on slow days. at spark, we introduced a new longer-duration loan product, and the demand for this new product has been robust.
during calendar year 2021, we originated over $100 million in total toast capital loans. a second highlight from spark was the introduction of an enhanced suite of products designed to help restaurants maintain control of takeout and delivery. with orders hub, toast has helped more than 20,000 restaurants manage both takeout and delivery orders from first-party toast ordering channels and third-party providers. toast is the first restaurant technology platform to deliver direct integrations with the five largest third-party delivery brands: doordash, caviar, grubhub, postmates, and uber eats.
and our performance center provides unique visibility into the profitability of each channel. when used together, this new suite of products enables our customer community to truly take control of their takeout and delivery business. we're excited about how our customers are using these new products announced at spark and how they further our position as the leading all-in-one platform for restaurants. throughout the quarter, we experienced robust demand in the market for the toast platform.
in 2021, we added around 17,000 new restaurant locations on the platform. throughout q4, we saw incredible demand across all segments, from single-location smb restaurants to regional mid-market and large enterprise brands. this quarter, we signed a new deal with sinelli concepts, the holding company for multiple national restaurant and retail brands, including which wich superior sandwiches, paciugo gelato caffe, birdguesa tenders & tots, supernova, and earth burger. sinelli concepts is looking to improve efficiency by moving its business to a digital platform.
it will be rolling out toast to 250 locations nationwide for point-of-sale, kitchen display systems, and kiosks. we also signed a new deal with cohn restaurant group, which is rolling out toast for front of house with toast go and order & pay at the table and back of house with our kitchen display system. cohn restaurant group will use toast at 35 locations, both in california and hawaii, and will continue its efforts in converting its entire technology stack to a best-in-class cloud-based platform. pavement coffeehouse, an independent and locally owned coffee house with eight shops in boston and cambridge, purchased toast pos and payroll in q4.
toast is replacing multiple vendors for loyalty, payroll, gift cards, and online ordering. by consolidating on toast, customers like pavement coffeehouse can see lower total cost and experience the benefits of an integrated platform, common ui, shared data, and a single-partner relationship to manage. in addition to the exciting growth across our customer community, we also welcomed a new board member to our board of directors in q4. hilarie koplow-mcadams joined the toast board of directors on november 30.
if you're not familiar with hilarie, she has spent more than three decades in operating and leadership roles devoted to accelerating high-growth software companies through sales, business development, customer success, and more. currently, she is a venture partner with new enterprise associates, nea, a venture capital firm. prior to nea, hilarie served as the president of new relic, president of global sales at salesforce, and also held executive roles at intuit inc. and oracle corporation.
we are really excited about having hilarie on our board. welcome to the team, hilarie. before i wrap up and pass the call to elena, i thought it would also be helpful to tee up our primary focus areas that we look forward to updating you on in 2022. the first is our focus on being the trusted platform of choice for the restaurant industry.
there are approximately 860,000 restaurant locations across the u.s., and we see an enormous opportunity ahead within this large addressable market. as evidenced by our growth in q4, there is tremendous demand for the toast platform as restaurant operators navigate the new normal. toast is the all-in-one technology platform built exclusively for restaurants by people who understand their specific needs. second, our industry has been through a massive transition during the past two years.
to help our customer community navigate this transition, we will continue to invest in their success through our commitment to customer success and support. third, given our momentum in mid-market and enterprise, we are confident in our ability to serve restaurants of all types and sizes. i shared earlier just a few examples of mid-market and enterprise wins this past quarter, and we will continue to invest in our capability here. finally, we have a substantial opportunity to provide our platform to international locations.
as discussed earlier, we estimate our total addressable market at least doubles the u.s. opportunity if we look globally. in late 2021, we started our initial investment to seed our international expansion. with that, i will close by saying i am honored and humbled to be part of supporting the restaurant industry through this past year.
i'm also equally excited about 2022. restaurants are resilient. they make up the social fabric of our community, and we believe our commitment to aligning our success with restaurant success will lead to a stronger and exciting future ahead. i'd like to thank our customers, our partners, and our toast employees for their hard work and support in 2021.
the financial results we're sharing today wouldn't be possible without your confidence in our platform, commitment to the industry, and unwavering support for our vision. now i'd like to hand it over to our cfo, elena gomez.
elena gomez -- chief financial officer
thanks, chris, and i just want to echo the thank you to our employees and to our customers. 2021 has been an unforgettable year, and i appreciate your commitment and dedication to our company. so, i'm going to remind you as i get into results that we will refer to gaap and non-gaap measures. refer to today's press release for a reconciliation of gaap to non-gaap financial performance and additional disclosures regarding these measures.
as chris mentioned, we had a strong q4 to exit 2021, and to cap off the year, we became a public company. with continued momentum in q4, we outperformed all key metrics, which is a testament to the strong execution of our collective team. we are proud of the new locations we added to our platform through 2021, which reflect the value of our all-in-one digital platform. in q4, we generated revenue of $512 million, up 111% year over year and $1.705 million for the full year 2021, a 107% increase year over year.
we closed the year at $568 million in arr, up 74% year over year. we continue to believe arr is our north star metric. as chris said, we ended the year with approximately 57,000 live locations on our platform, compared to 40,000 in q4 2020, representing a 41% year-over-year growth. in addition, we are also proud to report that our net retention rate, also referred to as nrr, which we reported in our s-1 to be greater than 110% for the last five years, was 135% in 2021.
nrr comprises both saas and fintech solutions revenue, both of which had a retention rate above 110%. saas nrr was strong through the expansion of locations from our existing customers, as well as customers adding more products. from a fintech perspective, we have shared with you that in 2021, we benefited from higher debit and credit mix, as well as higher card-not-present volume. in 2022, we anticipate these trends will have largely stabilized, and as such, we expect nrr going forward to trend closer to 110%, as we shared in the s-1.
our subscription services revenue grew 86% year over year to $54 million in the fourth quarter, driven by an increase in customers adopting more of our saas products. as of the end of 2021, 59% of our toast locations use four or more core products on top of our integrated pos and payment solution as compared to 48% a year ago. our financial technology solutions revenue grew 117% year over year to $421 million in the fourth quarter, driven by gpv of $17 billion, which had an increase of 124% year over year. gpv is driven by transactions processed on our platform.
since early 2021, annualized gpv per processing location continues to remain strong at an average of $1.3 million per location. as a reminder, our gpv per location dropped by 45% at the onset of covid but has steadily returned to above pre-covid levels. as we have stated before, there's quarterly seasonality with our financial technology solutions revenue as restaurants, on average, generally perform better in the second and third quarters. given that we continue to anticipate seasonal fluctuations in the annualized gpv per location from quarter to quarter, however, on an annualized basis, our gpv per location is consistent and remains durable.
for the fourth quarter, non-gaap gross profit, which excludes stock-based compensation and depreciation and amortization expense, that was a mouthful, came in at $82 million, up 54% year over year. in addition to the growth in our customer base, this growth was driven by higher revenue per location, which in turn has been driven by continued growth in average revenue per unit, known as arpu, for both saas and financial technology solutions. we are pleased with our arpu performance as a driver to non-gaap gross profit, and we believe that such performance can be sustainable. drilling down into our arpu performance, we've seen our saas arpu increase as a result of continued adoption of our platform by both new and existing customers.
we continue to invest in our technology and remain highly focused on driving innovation across our product portfolio. our fintech solutions arpu is up more than 50% from q4 2019 or pre-covid levels, primarily as a result of gpv per location and card-not-present volume. as a reminder, two factors that influence fintech solutions arpu are the mix of card-not-present volume and the debit-credit mix. consumers continue to utilize digital channels, and as such, we believe the card-not-present volumes will remain elevated.
the debit-credit mix has returned to pre-covid levels. turning to hardware cost of revenue. as shared in the last earnings call, our freight costs remain elevated due to supply chain dynamics. we continue to believe they will remain elevated through the near term.
despite increased hardware costs, however, we remain confident in our ability to deliver hardware for our customers. before i turn to operating expenses, i want to remind you that we use customer acquisition cost and payback metrics to measure the performance of our business and guide our investment decisions. we are proud to share that our payback period for the full year 2021 was approximately 12 months. our healthy unit economics and strong payback periods continue to make us feel confident in our ability to invest for durable growth.
now, let's turn to our operating expenses, which i will review on a non-gaap basis. in q4, we continued to invest in sales and marketing and research and development to capture tam and build out our platform. additionally, general, and administrative costs increased as a result of operating as a public company. this includes costs from the adoption of the new credit loss -- of the new credit losses accounting standard in q4 and increased investment to support the growth of our business.
as a result of these investments, adjusted ebitda for the fourth quarter was negative $45 million for q4 and negative $42 million for the full year 2021. now, let me turn to guidance. for the first quarter, we expect revenue to be in the range of $469 million to $499 million, which represents 72% year-over-year growth at the midpoint. we expect adjusted ebitda to be in the range of negative $65 million to negative $55 million.
for the full year 2022, we expect revenue to be in the range of $2.349 million to $2.409 million, which represents 40% year-over-year growth at the midpoint, and adjusted ebitda to be in the range of negative $240 million to negative $200 million. as you can see, we are deliberately investing to drive long-term growth. the stakes have never been higher for restaurants. the restaurant industry is going through massive change, driven by undeniable trends in the world across labor, supply chain, and guest adoption of technology.
our investments in 2022 are reflective of this opportunity we have ahead of us. with only approximately 7% market share here in the united states, we continue to believe we are in the early innings of this opportunity. as such, we will continue to invest in research and development, as well as in sales and marketing to cost-effectively capture our market share. our primary focus is on being the trusted platform of choice for the restaurant industry.
our business is performing well, and there's enormous demand for the toast platform as restaurants need to streamline their operations, increase revenue, and retain great employees. our ambition continues to be to serve restaurants all around the world. and with that, we will be making foundational investments in 2022 to drive growth internationally. we look forward to updating you on this multiyear journey in future quarters.
in closing, our strong 2021 performance demonstrates our success in capturing market share. we are built to serve large -- built to serve a large and growing addressable market, and we've shown we can execute at scale with healthy unit economics. we continue to believe we are uniquely positioned to drive durable growth for ourselves and for restaurants using our platform. now, i'd like to turn the call back to the moderator for our q&a session.
edward parker
all right. thank you very much, chris and elena. let's go ahead and start our q&a session. please use the raise the hand function in zoom to ask your question.
and our first question comes from josh baer at morgan stanley. josh, please go ahead.
josh baer -- morgan stanley -- analyst
great. thank you for the question. so, i wanted to get some context on the pace of location additions in '22. if you could provide any insight into kind of how you're thinking about that and maybe tying into the ramp of sales reps and capacity.
like where are you today or in '22 versus 2019 from that perspective?
elena gomez -- chief financial officer
yeah, i can start. at the highest level, without me guiding for locations, we've intentionally invested, josh, in adding to our sales force. and we've often said that tam is our no. 1 priority and then arpu will follow.
we're actually balancing both, but we're pretty excited about the locations we added on our platform in 2021. and we see no reason why we wouldn't continue to have success adding locations, frankly, very efficiently, too, with the 12-month payback period that we experienced in 2021. we feel confident to make this investment, and we'll continue to see growth on our platform.
josh baer -- morgan stanley -- analyst
great. and related, as far as the location additions that you've been seeing, any way to break down where you're having the most success or where you're strategically focused as far as competitive wins, new geographies in the u.s. that are underpenetrated? and if it is competitive, is it from legacy vendors? or are you going after cloud replacements? and then i guess, lastly, new restaurant formations and if that's a strategic priority, just winning an outsized share of the new restaurant formations. thank you.
chris comparato -- chief executive officer
i can jump in. 
elena gomez -- chief financial officer
yeah. i can -- yeah. go ahead.
chris comparato -- chief executive officer
either way. josh, we've seen broad momentum across multiple sectors of our business in multiple geos. i wouldn't say there's any one geo or sector that has grown faster. we're seeing really good traction in smb, really good momentum in mid-market and enterprise, as i referenced with those examples.
and we have teams across the u.s. embedded in local communities going after their market. so, we feel good about our position. i'd say we believe that we have the capability to serve restaurants of different types, formats, and sizes than any of our competition.
so, we feel good about our position, and we're seeing steady demand on that front.
edward parker
thanks, josh. let's go to tien-tsin huang at jpmorgan, please.
tien-tsin huang -- jpmorgan chase & co. -- analyst
hey, thanks so much. good to see all of you all here today. thanks for the time. just -- i hear you loud and clear on the investing.
i think it makes a lot of sense. the time is now to do it. so, with the investments across developing new products, i know you're working really hard to build new products and, of course, customer acquisitions. just trying to better understand how you're prioritizing those two.
has it changed versus maybe 90 days ago? and is your ltv-to-cac thinking still the same versus 90 days ago? just trying to better understand the opex given the wider ebitda loss for the year.
elena gomez -- chief financial officer
yeah. no, it's a good question. let me just start by saying we have a ton of confidence and conviction about our opportunity, and that has not changed at all, actually. in fact, i would say after our performance in 2021, we have even more conviction.
and so, our prioritization has always been let's focus on capturing the opportunity ahead with the tam. and we know we're in the early innings, as you know. and we also have seen some data points, proof points. demand continues to be strong and customers engaging on our platform, whether that's nrr, as you saw that we talked about, or just consistent addition of locations to our platform.
and so, we're going to remain very disciplined and have a lot of rigor about our investments and point investments to things that will drive growth. and then, of course, back to your timing point, the pandemic really amplified the need that customers have for technology and to make their operations more efficient. and we believe when you put all that data together, we're well-positioned to capture that opportunity. so, it's really important that we're intentional about this investment.
i would tell you it doesn't mean we're not thinking about profitability, so i don't want you to take that from this at all. in fact, in our executive alignment -- in our comp plans, we've aligned on the fact that we do, at the right time, need to drive operating leverage, right? we're going to drive and orient to durable growth today. but of course, over time, we will drive operating leverage.
tien-tsin huang -- jpmorgan chase & co. -- analyst
yeah. that makes great sense. if you don't mind, just a quick follow-up. just thinking about the first quarter, elena.
just any puts and takes there with revenue. and i know seasonality is always something to think about. i know we're coming out of it, hopefully. and i don't know if there's anything to call out with gmv or locations, return, or growth in the first quarter versus the fourth.
thank you.
elena gomez -- chief financial officer
yeah. that's a great question. so, i would just point to a couple of things. as a reminder, last year at this time, vaccines were -- we're coming back, and people were coming back, right? so just don't forget that as -- you guys, i know a lot of you look at sequential moves.
so, pay attention to that because we had a big surge last year. we didn't expect that to repeat this year, right, because we've now been unfortunately used to this kind of quasi environment we're operating in. but even without that dynamic from last year, there's always seasonality in our payments, as you know. so, q1 tends to be a quarter where the seasonality is such that we have lower gpv than, say, q2 and q3.
so, that was not much -- that's not what -- that did not surprise us. i would tell you we had a little bit of omicron in the early part -- late days of december and early part of january, but we believe that's transitory and, frankly, behind us at this point. the other thing i'll point to that you may not see in the guidance is we anticipate saas will continue to increase. so, you will see that sequential increase q4 to q1.
so, i hope that gives you enough color to kind of give you the backdrop for q1.
tien-tsin huang -- jpmorgan chase & co. -- analyst
it does. thank you.
elena gomez -- chief financial officer
great.
edward parker
thanks very much. let's go to josh beck at keybanc. josh?
josh beck -- keybanc capital markets -- analyst
thank you so much for taking the question. i wanted to maybe start with a higher-level question. i think one that is surfacing a lot is really what's the impact of a full reopening, hopefully, as we progress through the year. there's obviously puts and takes against your model.
so, just kind of curious how you're trying to embed that into the outlook. and what are some of the more important factors we should be keying in on there?
chris comparato -- chief executive officer
yeah. i mean, i could jump in at a high level, and elena, feel free to support it. but i mean, listen, we're excited about 2022. we're seeing really strong demand.
we're executing well. so, our mindset is sort of a growth-oriented mindset to go after locations in the tam and support the restaurant community as it starts to recover. if you zoom out, this is an industry that's largely been underserved by great technology. and in the past two years, they've gone from crisis to survival to recovery and now to a time frame that i think it's time to thrive.
so, personally, as a team and as a management team and a company and a board, we're excited about 2022 because we think it's going to be a little bit of a renaissance coming back to the restaurant industry. though it's been difficult for the past two years, we're certainly excited about what lies ahead and some of the momentum that we may see across the entire business.
elena gomez -- chief financial officer
yeah. i mean, i think in our guidance, as we entered into the year, there's a few trends that, really, we pay attention to that you guys are familiar with. card-not-present is one of those, debit and credit mix, all those impact our fintech arpu. so, for card-not-present, as i said in my script, we do believe consumer behavior has largely changed.
i think all of us are probably using online ordering more than we did in the past. and so, we believe some of that behavior is going to persist. and therefore, we believe cnp will remain somewhat elevated. debit and credit mix has largely come back to pre-covid levels.
so, we factored that into our thinking. and then i would just call out on the cogs side, as i mentioned in the script, we have elevated freight costs, and we believe that's going to persist for the near term. we're keeping an eye on it, of course. but those are the things that come to mind when you ask a little bit about what do we think about recovery.
i think we've seen omicron come and go, which is great. i think it shows restaurants are resilient. and so, we're considering that in our calculus as well.
josh beck -- keybanc capital markets -- analyst
very helpful. just a follow-up. the payback period, i believe you said, was 12 months, which is well below the pre-covid level. so, i imagine there's perhaps some positive surprise there.
as you think about the future, what range are you comfortable that trending toward? maybe over what time? just curious if you could give us any thoughts on how we should be thinking about the payback period from here.
elena gomez -- chief financial officer
yeah. no, i mean, we're proud of our payback. i wouldn't say it was a surprise. i think my finance team would get really mad at me if we said it was a surprise because, actually, it wasn't a surprise.
like i think we are so focused on unit economics and payback periods. but we did benefit from -- in the first part of the year, we had -- if i say the puts and takes in the first part of the year, we had higher card-not-present and just higher take rates, obviously. but then you counter that with freight costs being elevated, so all those puts and takes really come into play there. but as i think about the future, and as we said in our s-1, as long as our payback period is in the mid-teens, i'm happy with that.
obviously, we're always going to do better. we're always going to try to make our operation more efficient. but i'm happy with that. so, i would think about that as more of a longer-term trend than what we had in 2021.
josh beck -- keybanc capital markets -- analyst
excellent. thank you.
edward parker
great. thanks, josh. why don't we go to brent bracelin at piper sandler? brent, you there?
brent bracelin -- piper sandler -- analyst
guys, good afternoon. thanks for letting me on here. two questions if i could. maybe, chris, we'll start with you.
i'd love to hear early feedback on the toast restaurant card, pay card, pay now features. what have you learned so far? i know we're really early but can be a pretty exciting and incremental lever for you over time. so, i'd love to hear any sort of early feedback there on those cards. and then one quick follow-up for elena.
i can't hear you, sorry.
chris comparato -- chief executive officer
sorry about that. yeah, brent, good question. i think it's still early. i mean, we launched them in november.
it's been a couple of months, not even a full quarter. but we remain really excited. we're putting a lot of investment behind those teams to make sure that those cards have a good product-market fit. listen, we believe in faster payments to restaurants.
we believe in faster early wage access for employees. we believe those two fundamental dynamics help the restaurant industry succeed and for each restaurant operator to have better control of their financials. so, they make a ton of sense, but it's early days. we're excited about the products, and we're continuing to test and iterate and gain customer feedback and listen to our customer base about what we need to tweak to make them better and better.
so, stay tuned.
brent bracelin -- piper sandler -- analyst
perfect. and then, elena, i saved a tough one for you. if i go back and look at quarterly seasonality, we only have post-covid quarterly seasonality. and so, in some regards, we have a big sequential drop in q2 in one year.
another year, we have a big sequential rise in q2. i'm just -- as we kind of think about going forward toward a normal environment, do you have any general sense for us how we should think about like quarter-to-quarter seasonality of the business given it's been so dynamic in the last couple of years?
elena gomez -- chief financial officer
yeah. no, brent, that's a really good question. i had to go back myself for the reason you described, and it was before my time. but i think the thing we'll call out is q2 and q3 summer months tend to be our high gpv per location quarters.
q1 tends to be the lower quarter. and same with q4 with the holidays and whatnot. so, warm weather gets people out, and that's why you see a lot of increase in our gpv going in q2 and q3. so, you should expect that more, hopefully, more normal this year going into 2022.
and that's how we think about it, too. that's how we planned.
brent bracelin -- piper sandler -- analyst
perfect. helpful color there, and look forward to seeing it.
edward parker
thanks, brent. next question, let's go to mayank tandon from needham.
mayank tandon -- needham & company -- analyst
thank you. chris, you mentioned the investments in international and enterprise. could you talk about what are the unique challenges you expect to face as you penetrate these opportunities? in other words, what are the keys to success based on your experience so far with toast?
chris comparato -- chief executive officer
sure. now, let's start with enterprise. so, we've been in the enterprise space for years and collaborating with our largest customers. it's really making sure that, number one, the platform is as scalable and reliable as possible to support their needs on expansion.
so, that includes a lot of above-store reporting, multilevel analysis of their business. so, it just needs -- we need to make sure that the platform is a core centerpiece of their architecture as they scale their businesses. so, that's number one. number two, it's important to make sure that we've got strong apis.
as i mentioned back in the ipo, we've got 150-plus technology partners that stitch into our platform on a daily basis. and large enterprises require more complexity around architecture. so, they love the fact that we've got a strong partner ecosystem and strong apis that go along with it. i'd say the third dimension is making sure that the enterprise has strong reporting.
so, just the data elements and the data sharing capabilities of the platform are critically important. so, we continue to invest in those pieces of the road map so that the enterprises have the right analytics and insights that they need to properly run their business. but we're confident about our position in the mid-market and enterprise space. and as i referenced, the win with sinelli, it allows us to really accomplish enterprises that are different.
they could be an fsr. it could be a qsr. but the strength of the platform to support multiple segments of the restaurant industry is pretty strong. on international, it's going to be early days.
i mean, this is more about building the proper foundation to go to market in key markets with the product-market fit that helps every restaurant be successful in the early days of those international markets. so, i'm going to temper expectations that it's going to be a foundational year and a building year for international as we put the team in place, the products in place, and our execution in place to make sure that customers have a fantastic experience. and elena, you may want to add to that. but it's just a reminder that international is going to be the early days.
so, in terms of location count and driving arr, it's going to be lower than perhaps, obviously, what we've seen in the u.s. for years.
elena gomez -- chief financial officer
yeah. i think the only thing i would add is just making sure that we get the product localized for -- if there's any languages that we need to consider, of course, that's important and making sure that we invest in that over the long term but also being measured about our investment and just making sure we learn in 2022 is really important to us.
mayank tandon -- needham & company -- analyst
and then as a quick follow-up, just given the war for talent, are you able to hire the salespeople and the engineers and other key people to be able to hit those demand targets that you've set for yourself?
chris comparato -- chief executive officer
yeah. no, i mean, big shout-out to our people team and our talent acquisition team. they've stayed on goal. so, when we look at 2021 and the momentum going into 2022, that team's done a fantastic job to find the best talent in key markets and help us scale and execute.
so, yeah, we've been able to keep pace.
mayank tandon -- needham & company -- analyst
thank you.
edward parker
thank you. our next question is from stephen sheldon of william blair. stephen, please go ahead.
stephen sheldon -- william blair & company -- analyst
hey, thanks. really nice job on top-line results, and great to hear that you're starting to focus more on the international opportunity. wondering if you could just talk some about the trends you're seeing when you first win new customers. what trends are you seeing in terms of the size of initial packages? and what are some of the main products that newer customers are frequently, i guess, including when they're first signing up for toast?
elena gomez -- chief financial officer
yeah. i mean, i can tell you, stephen, so when we looked a couple of years ago, our initial -- our customers would typically add about two products. that's well over four now. and we talked about 50% of our customers more than four products.
the typical products are online ordering, toast co. devices, gift cards. those are all really -- loyalty, all really popular products. and also with our new customers, a lot of them are adopting the payroll product.
we see the majority of our new customers adopting the payroll product. so, we're excited about that. and of course, there's an opportunity to sell that to our existing installed base as well.
stephen sheldon -- william blair & company -- analyst
got it. that's helpful. and then i guess just when i think about the -- as we think about the sales capacity investments, i guess, where are you focusing incremental sales resources at this time? has there been any shift toward maybe focusing more on gaining market share in existing markets versus expanding into new markets? i mean, i would just love an update on what you're seeing in terms of sales efficiency, especially some of the markets where you've been operating maybe the longest.
chris comparato -- chief executive officer
that's a good question. i mean, it's a little bit of both, making sure that we're broadening our presence in newer markets and adding reps into those markets. again, we're constantly testing and iterating how many reps it takes to accomplish our tam goals within a market. so, i'd say on one front, it's, again, broadening that base of reps in new markets.
but then similar to markets like new england, we continue to put reps into new england to go after deeper sections of tam and then really just make sure that we've got broad brand awareness within those older legacy markets where toast has been executing, but we can actually put more reps into it and even be more successful. so, i think it comes back to the fact that we're still in the early days or early innings, as elena mentioned, of our tam penetration. today, we're 7% of the u.s. tam.
so, that gives us strong belief that there's enough demand to continue to ramp that go-to-market engine.
stephen sheldon -- william blair & company -- analyst
great. thank you.
edward parker
thanks, stephen. our next question is from dan dolev at mizuho. dan, please go ahead.
dan dolev -- mizuho securities -- analyst
hey, thank you. appreciate taking the questions. two quick ones. i saw the take rate.
i think, elena, you mentioned that the debit-credit mix stabilized to pre-covid. i may have misunderstood you, but it looks like the take rate has been stable sequentially. can you maybe give us some more detail on what's driving the stabilization in the take rate sequentially despite kind of the movement, the shift from debit to credit? thank you.
elena gomez -- chief financial officer
yeah. so, actually, our take rate, i think, is slightly down in q4, and that's primarily because we're getting back to normal on debit and credit. cnp is remaining elevated, and so i feel comfortable with where we are. and stable is probably a pretty solid term in terms of how we think about 2022.
but i would just remind you, the beauty of the model, right, is both take rate but then we also have an opportunity to monetize through saas. so, i would just encourage you as you think about our growth, consider both the take rate but also the saas arpu as well.
dan dolev -- mizuho securities -- analyst
got it. thank you. and then just a quick follow-up, more from a strategic perspective. i believe ncr made an announcement last week that they're considering alternatives.
obviously, they're a huge player with aloha. obviously, you're not going to discuss any specific m&a, but is the strategy now still pretty much organic? or will you be willing to look at maybe opportunities to opportunistically bolster your portfolio? thank you.
chris comparato -- chief executive officer
yeah. it's a good question. i mean, dan, listen, i mean, our organic growth engine continues to be really strong. and the team's executing at an extremely high level.
so, i think that motion and that growth lever is going to continue. will we assess strategic opportunities when we see them on the landscape, whether it's within a line of business or more broadly? perhaps, like i think those opportunities will exist as a growth lever in our future. we've proven that with our acquisition of xtrachef and then also our acquisition of stratex two years ago. so, we feel confident in our m&a stance, but i'll remind everybody that the organic growth engine continues to execute extremely well, and we're going to continue to prioritize that.
dan dolev -- mizuho securities -- analyst
got it. really appreciate the color. thanks again.
edward parker
thanks, dan. our next question is from andrew bauch of smbc nikko. andrew, please go ahead.
andrew bauch -- smbc nikko securities -- analyst
hey, guys. thanks for taking my question. nice set of results considering the covid challenges that you're facing in the quarter. i wanted to speak to the capital business.
you mentioned the $100 million originated in 2021, which is pretty promising. and you also said that the long-duration loans that you introduced at spark were a key variable in that accelerating growth. i mean, how much of that contributed to the $100 million, if you could contextualize it? and maybe higher level, what percentage would you -- or kind of how should we think about what's addressable within your base for that product?
chris comparato -- chief executive officer
yeah. it's a good question. i think if you step back into the shoes of a restaurant, restaurants desire capital to run their business. they want to have working capital.
they want to grow, whether it's new locations or renovate or add a patio. they want to purchase equipment, or they may need emergency funding. so, we actually think capital is deeply strategic to help the restaurant industry thrive moving forward. having multiple products within lending is key because it's not one-size-fits-all.
so, you're going to see us continue to innovate and test different types of products within toast capital. it's still the early days of what toast capital could be as a percentage of our entire business. so, we're not going to give you sort of the splits between products, but we know that we are on the right path with what we're seeing. and we feel like we've got a significant advantage because we have all the data that flows through the restaurant.
so, that allows us to effectively underwrite restaurants and really have visibility into the effectiveness and then the payback on those loans. so, we feel like we're in a strong position. we're going to continue to invest in this aspect of the business. but i'll remind you, it's still a small portion of the business today.
andrew bauch -- smbc nikko securities -- analyst
definitely understood. then my follow-up would be the four-plus module adoption rising 10 points from last year is obviously super impressive. i mean, how should we think about where that metric goes, be it in 2022 and maybe in the long term?
elena gomez -- chief financial officer
yeah. i mean, i think that's a really good question. i would say our arpu growth will be steady, but having a steep growth is probably not the way i would model it. i would just plan for steady improvement in our arpu over time.
and that's with the innovation we have today, not to mention the innovation that's coming. so, that's how i would think about it, andrew. and then on toast capital, the only thing i would add is the growth we've seen is -- obviously, we're very encouraged by it. chris is right, it's early days.
the impact to our financials is not material today. but what we love about that program is we're testing and learning, right? we're testing and learning each time. so, we started out with 90-day loans. now we're testing longer-duration loans.
and that's a motion that we're going to continue to try to do as we expand what's possible with toast capital.
andrew bauch -- smbc nikko securities -- analyst
got it. thank you for the color, guys.
edward parker
thanks, andrew. our final question comes from kartik mehta of northcoast research. kartik, please go ahead.
kartik mehta -- northcoast research -- analyst
thank you. i'm wondering for you, as you've had so much success, what the competition has done and if they've done anything different in the last six months.
chris comparato -- chief executive officer
yeah. i can take that. i mean, listen, as i mentioned earlier, the restaurant industry has been underserved by great technology, so it's no surprise that there's been competition for the past 10 years. i mean, it's a competitive space.
but what i like about our position is, number one, we're seeing really strong demand for the platform, and that's a very good signal for us to continue to execute. number two, we're seeing healthy win rates. and you're seeing strong payback periods, healthy win rates, so that gives us even more confidence in our execution. so, while there's competition, we feel like we are the leading platform to help the restaurant industry grow.
and it comes back to the platform. being an end-to-end restaurant-specific platform that's not multiproduct but is a true platform across the board from front-of-house to back-of-house, that's a key success factor, and we're going to continue to execute on that path. so, we feel good about our position within the competitive landscape. and while there's been announcements over time -- i mean, there's been announcements for the past few years on the competitive landscape of restaurants.
but we just continue to execute and raise the bar and support our customers. at the end of the day, we want to make sure that every customer has a fantastic experience when they run toast.
kartik mehta -- northcoast research -- analyst
perfect. thank you very much. i appreciate it.
edward parker
well, all right, everyone, thank you very much. that concludes our call. we look forward to speaking with you all next quarter, and have a great afternoon.
chris comparato -- chief executive officer
thank you all.
duration: 55 minutes
call participants:
edward parker
chris comparato -- chief executive officer
elena gomez -- chief financial officer
josh baer -- morgan stanley -- analyst
tien-tsin huang -- jpmorgan chase & co. -- analyst
josh beck -- keybanc capital markets -- analyst
brent bracelin -- piper sandler -- analyst
mayank tandon -- needham & company -- analyst
stephen sheldon -- william blair & company -- analyst
dan dolev -- mizuho securities -- analyst
andrew bauch -- smbc nikko securities -- analyst
kartik mehta -- northcoast research -- analyst
more tost analysis
all earnings call transcripts",2021-Q4,TOST
